Name,Stars,Ratings,Reviews,Specifications,Price
"OPPO F15 (Unicorn White, 128 GB)  (8 GB RAM)",4.4,"4,430 Ratings",460 Reviews,"{'In The Box': 'Handset, Headset, USB Cable, Adapter, SIM Card Pin, Protective Case, Quick Guide, Warranty Card', 'Model Number': 'CPH2001', 'Model Name': 'F15', 'Color': 'Unicorn White', 'Browse Type': 'Smartphones', 'SIM Type': 'Dual Sim', 'Hybrid Sim Slot': 'No', 'Touchscreen': 'Yes', 'OTG Compatible': 'Yes', 'Sound Enhancements': 'Dirac Audio, Dual Mic Noise Suppression', 'SAR Value': 'Head: 1.20 W/kg, Body: 0.55 W/kg', 'Display Size': '16.26 cm (6.4 inch)', 'Resolution': '2400 x 1080 Pixels', 'Resolution Type': 'Full HD+', 'GPU': 'ARM Mali G72 MP3 900 MHz', 'Display Type': 'AMOLED', 'Other Display Features': 'Screen Proportion: 20:9, Upper Frame: 2.32mm, Left and Right Frame: 1.67mm, Lower Frame: 5.2mm, Screen Ratio: 90.8%, Color Gamut: 100% NTSC, 104% NTSC DCI - P3, Color Contrast: 1000000:1, Color Saturation: Typical Value 100%, Maximum Screen Brightness: Typical Value 430nit, Corning Gorilla Glass 5, Multi-touch: 10, Oleophobic Layer, Oleophobic Layer on Film, Screen Refresh Rate: 60Hz, Touch Sampling Rate: 135Hz, TUV Rheinland Eye Comfort Certification, No Stroboscopic Eye Protection', 'Operating System': 'Android Pie 9', 'Processor Type': 'Helio P70', 'Processor Core': 'Octa Core', 'Primary Clock Speed': '2.1 GHz', 'Secondary Clock Speed': '2 GHz', 'Operating Frequency': 'GSM: 850/900/1800/1900 MHz, WCDMA: B1/B5/B8, FDD-LTE: B1/B3/B5/B8, TD-LTE: B38/B40/B41', 'Internal Storage': '128 GB', 'RAM': '8 GB', 'Expandable Storage': '256 GB', 'Supported Memory Card Type': 'microSD', 'Memory Card Slot Type': 'Dedicated Slot', 'Primary Camera Available': 'Yes', 'Primary Camera': '48MP + 8MP + 2MP + 2MP', 'Primary Camera Features': '48MP AI Quad Cam, Sensor Sizes/Pixel Size: Main 1/2.25inch, 0.8micrometer, Secondary Wide Angle: 1/4inch, 1.12 micrometer, 2M 1/5inch, 1.75micrometer, Sensor Type: CMOS, Zoom Mode: Main - 10X Digital Zoom, Wide Angle - 2X Digital Zoom, Aperture: Main - f/1.79, Wide Angle - f/2.25, Portrait and Mono - f/2.4, Focal Length: Main - 4.71mm, Wide Angle - 1.66mm, Portrait and Mono - 1.77mm, Wide Angle: Main - 79Degree, Wide Angle - 119 Degree, Portrait and Mono - 88.8Degree, Consecutive Shooting: Yes (20 Photos), Macro Lens: Back 3CM Macro Camera, EIS Stabilization, Lens Glass Material: GG5, Corning Gorilla Glass 5, Photo Size: 8000 x 6000 (FHD+ Mode), 4000 x 3000 (Standard Mode), Ultra Clear Mode 48MP, Photo, Video, Professional Mode, Panorama, Portrait, Night Scene, Time-lapse Photography, Slow Motion, Macro, Video Stabilization, AI Scene Recognition, Full Light for Shooting Video, MP4 Video Format, Anti-shake Video, Ultra Night Mode 2.0', 'Secondary Camera Available': 'Yes', 'Secondary Camera': '16MP Front Camera', 'Secondary Camera Features': 'Camera Structure: Water-drop, Sensor Type: CMOS (4-in-1 Pixel Technology), Sensor Size/Pixel Size: 1/3.1inch, 1.0micrometer, Focal Length: 3.54mm, Wide Angle of Front Lens: 77Degree, Flashlight Aperture: f/2.0, Lens Structure: 5P, Focusing Type: Focus, Lens Glass Material: GG5, Corning Gorilla Glass 5, Photo Size: 4608 x 3456, MP4 Video Format', 'Frame Rate': 'Rear Camera: Slow-motion Video - 1080p at 120fps, 720p at 240fps, Rear Camera: 1080P at 30fps, 720P at 30fps, Front Camera: 1080P/720P at 30fps, Rear Camera Default: 1080P at 30fps, Front Camera Default: 720P at 30fps fps', 'Dual Camera Lens': 'Primary Camera', 'Video Call Support': 'Yes', 'Call Records': 'Yes', 'Network Type': '4G VOLTE, 4G, 3G, 2G', 'Supported Networks': '4G VoLTE, 4G LTE, UMTS, WCDMA, CDMA, GSM', 'Internet Connectivity': '4G, 3G, Wi-Fi, EDGE, GPRS', '3G Speed': 'HSPA+', 'GPRS': 'Yes', 'Bluetooth Support': 'Yes', 'Bluetooth Version': 'v4.2', 'Wi-Fi': 'Yes', 'Wi-Fi Version': '802.11a/b/g/n/ac', 'Wi-Fi Hotspot': 'Yes', 'EDGE': 'Yes', 'Audio Jack': '3.5mm', 'Map Support': 'Google Maps', 'GPS Support': 'Yes', 'Touchscreen Type': 'Multi-touch Capacitive Screen', 'SIM Size': 'Dual Nano SIM', 'User Interface': 'ColorOS 6.1.2', 'Graphics PPI': '408 PPI', 'Sensors': 'In-screen Fingerprint, Magnetic Induction Sensor, Light Sensor, Proximity Sensor, G - Sensor/Acceleration Sensor, Gyroscope, Pedometer', 'Ringtones Format': 'MP3, AMR, APE, OGG, FLAC, WAV, MIDI, WMA', 'Other Features': ""Split Screen,Apps with Game Boost (Popular Games), Google Lens, Data Backup, Oshare (Indian Phone Number's Recognition), Apps Lock, Office Tools: Office Suite, Firewall: Support Call/Message Firewall, Files Zip/Unzip, File Encryption, 64bit Processor, Baseband Structure: 4 (Cortex A73) + 4 (Cortex A53), 12nm Processor, ROM Technology: UFS2.1, VoLTE, 4G Data Rate: 75Mbps (Carrier Model 150mbps), Downlink: 150Mbps (Carrrier Model 300Mbps), WLAN: 2.4G, 5.1G, 5.8G WLAN Display, USB 2.0, VOOC Flash Charge 3.0, Reverse Charging, Standard Charge Power: 20W, Type-C USB Jack, Pin Number (USB): 14, Face Recognition, Single Channel,Eye Protection Mode, Clone App, Banner Call, Game Boost, Kids Space, Text Input, Support HD, Webpage Video Play, World Time, Lock Screen Clock, OPPO Share, E-compass, E-book, Screen Recording, Background Freeze, Caller Avatar, Call Background, Contact Grouping, Group Customization, Import/Export Messages, Number of Ram Channels: 2, Fingerprint Reset password, Sleek Design, Flashlight"", 'Important Apps': 'Bulit-in Browser: Chrome, Opera, OPPO Browsers', 'GPS Type': 'A-GPS, GLONASS, BeiDou', 'FM Radio': 'No', 'Audio Formats': 'AAC, APE, FLAC, AMR, MID, MP3, OGG, WAV, WMA, MKA', 'Video Formats': 'MP4, 3GP, ASF, AVI, FLV, M2TS, MKV, MPG, TS, WEBM, WMV', 'Battery Capacity': '4000 mAh', 'Width': '73.3 mm', 'Height': '160.2 mm', 'Depth': '7.9 mm', 'Weight': '172 g', 'Warranty Summary': 'Brand Warranty of 1 Year Available for Mobile Including Battery and 6 Months for Accessories'}",19990
"InFocus A3 (Jet Black, 16 GB)  (2 GB RAM)",3.9,"1,115 Ratings",187 Reviews,"{'In The Box': 'Handset, Battery, Charger, Earphone', 'Model Number': 'IF9007', 'Model Name': 'A3', 'Color': 'Jet Black', 'Browse Type': 'Smartphones', 'SIM Type': 'Dual Sim', 'Hybrid Sim Slot': 'Yes', 'Touchscreen': 'Yes', 'OTG Compatible': 'Yes', 'Display Size': '13.21 cm (5.2 inch)', 'Resolution': '720 x 1280 Pixels', 'Resolution Type': 'HD', 'Operating System': 'Android Nougat 7', 'Processor Core': 'Quad Core', 'Primary Clock Speed': '1.3 GHz', 'Internal Storage': '16 GB', 'RAM': '2 GB', 'Expandable Storage': '128 GB', 'Memory Card Slot Type': 'Hybrid Slot', 'Primary Camera Available': 'Yes', 'Primary Camera': '13MP + 2MP', 'Secondary Camera Available': 'Yes', 'Secondary Camera': '8MP Front Camera', 'Dual Camera Lens': 'Primary Camera', 'Call Wait/Hold': 'Yes', 'Conference Call': 'Yes', 'Hands Free': 'Yes', 'Video Call Support': 'Yes', 'Call Divert': 'Yes', 'Phone Book': 'Yes', 'Call Timer': 'Yes', 'Speaker Phone': 'Yes', 'Speed Dialing': 'Yes', 'Call Records': 'Yes', 'Logs': 'Yes', 'Network Type': '3G, 4G, 2G', 'Supported Networks': 'GSM, 4G LTE', 'WAP': 'Yes', 'Bluetooth Support': 'Yes', 'Wi-Fi': 'Yes', 'Wi-Fi Hotspot': 'Yes', 'USB Connectivity': 'Yes', 'Audio Jack': '3.5 mm', 'Map Support': 'Yes', 'Smartphone': 'Yes', 'Keypad Type': 'QWERTY', 'Social Networking Phone': 'Yes', 'Instant Message': 'Yes', 'Business Phone': 'Yes', 'Removable Battery': 'No', 'MMS': 'Yes', 'SMS': 'Yes', 'Voice Input': 'Yes', 'Sensors': 'Fingerprint Sensor', 'Audio Formats': 'Mp3', 'Battery Capacity': '3000 mAh', 'Dual Battery': 'No', 'Warranty Summary': '1 Year', 'Covered in Warranty': 'Manufacturer Warranty', 'Domestic Warranty': '1 Year'}",4438
"Tecno Camon I Twin (Midnight Black, 32 GB)  (3 GB RAM)",4.4,120 Ratings,9 Reviews,"{'In The Box': 'Handset, Headset, Charger, User Manual', 'Model Number': 'IA5', 'Model Name': 'Camon I Twin', 'Color': 'Midnight Black', 'Browse Type': 'Smartphones', 'SIM Type': 'Dual Sim', 'Hybrid Sim Slot': 'No', 'Touchscreen': 'Yes', 'OTG Compatible': 'Yes', 'Display Size': '15.24 cm (6 inch)', 'Resolution': '1440x720 Pixels', 'Operating System': 'Android Oreo 8.1', 'Processor Core': 'Quad Core', 'Primary Clock Speed': '1.4 GHz', 'Internal Storage': '32 GB', 'RAM': '3 GB', 'Memory Card Slot Type': 'Dedicated Slot', 'Primary Camera Available': 'Yes', 'Primary Camera': '13MP Rear Camera', 'Primary Camera Features': 'Dual Rear Camera, Quad Flash, Bokeh Camera', 'Dual Camera Lens': 'Primary Camera', 'Network Type': '3G, 4G VOLTE, 2G', 'Supported Networks': 'GSM, 4G VoLTE', 'Battery Capacity': '4000 mAh', 'Warranty Summary': '1 Year Brand Warranty', 'Domestic Warranty': '1 Year'}",8899
"Tecno I5 (Champagne Gold, 16 GB)  (2 GB RAM)",4.4,16 Ratings,2 Reviews,"{'In The Box': '1 Unit of Handset with inbuilt Battery, AC Adaptor, USB 2.0 Cable, Handsfree, Screen Guard, Silicon Back cover, SIM Ejection Tool, User Manual, Warranty Card', 'Model Number': 'i5', 'Model Name': 'I5', 'Color': 'Champagne Gold', 'Browse Type': 'Smartphones', 'SIM Type': 'Dual Sim', 'Hybrid Sim Slot': 'No', 'Touchscreen': 'Yes', 'OTG Compatible': 'Yes', 'Quick Charging': 'Yes', 'Display Size': '13.97 cm (5.5 inch)', 'Resolution': '720 x 1280 Pixels', 'Resolution Type': 'HD', 'Operating System': 'Android Nougat 7', 'Processor Core': 'Quad Core', 'Primary Clock Speed': '1.5 GHz', 'Internal Storage': '16 GB', 'RAM': '2 GB', 'Memory Card Slot Type': 'Dedicated Slot', 'Primary Camera Available': 'Yes', 'Primary Camera': '13MP Rear Camera', 'Secondary Camera Available': 'Yes', 'Secondary Camera': '8MP Front Camera', 'HD Recording': 'Yes', 'Video Recording': 'Yes', 'Dual Camera Lens': 'Primary & Secondary Camera', 'Call Wait/Hold': 'Yes', 'Conference Call': 'Yes', 'Video Call Support': 'Yes', 'Call Divert': 'Yes', 'Phone Book': 'Yes', 'Call Timer': 'Yes', 'Speaker Phone': 'Yes', 'Speed Dialing': 'Yes', 'Call Records': 'Yes', 'Network Type': '3G, 4G VOLTE, 4G, 2G', 'Supported Networks': 'GSM, 4G LTE, UMTS', 'Smartphone': 'Yes', 'SIM Size': 'Nano SIM', 'Keypad Type': 'QWERTY', 'Social Networking Phone': 'Yes', 'Instant Message': 'Yes', 'Business Phone': 'Yes', 'Removable Battery': 'No', 'MMS': 'Yes', 'SMS': 'Yes', 'Keypad': 'No', 'Voice Input': 'Yes', 'Predictive Text Input': 'Yes', 'Battery Capacity': '4000 mAh', 'Warranty Summary': '12 Month +1 Month extended Warranty', 'Warranty Service Type': '1 Year Brand Warranty'}",5450
"OPPO A9 2020 (Space Purple, 128 GB)  (8 GB RAM)",4.3,"4,235 Ratings",360 Reviews,"{'In The Box': 'Handset, Adapter, Headset, Micro USB Cable, Important Info. Booklet with Warranty Card, Quick Start Guide, Sim Card Tool, Protective Film, Pre-applied, Case', 'Model Number': 'CPH1937', 'Model Name': 'A9 2020', 'Color': 'Space Purple', 'Browse Type': 'Smartphones', 'SIM Type': 'Dual Sim', 'Hybrid Sim Slot': 'No', 'Touchscreen': 'Yes', 'OTG Compatible': 'Yes', 'Sound Enhancements': 'Dolby Atmos and Dual Stereo Speakers', 'Display Size': '16.51 cm (6.5 inch)', 'Resolution': '1600 x 720 Pixels', 'GPU': 'Adreno 610', 'Display Type': 'TFT-LCD', 'Display Colors': '16M', 'Other Display Features': 'Touch Panel Technology: In-cell, Narrow Frame - Upper Border: 2.44mm, Left and Right Border: 1.98mm, Lower Border: 6.6mm, Screen Ratio: 89.0%, Screen Contrast: 1500:1, Color Saturation: Typical 71%, Maximum Brightness: 480nits, Touch Panel Glass Type: GG3+, TYPE-C USB 2.0', 'Operating System': 'Android Pie 9', 'Processor Type': 'Qualcomm SM6125', 'Processor Core': 'Octa Core', 'Primary Clock Speed': '1.8 GHz', 'Secondary Clock Speed': '2 GHz', 'Internal Storage': '128 GB', 'RAM': '8 GB', 'Memory Card Slot Type': 'Dedicated Slot', 'Primary Camera Available': 'Yes', 'Primary Camera': '48MP + 8MP + 2MP + 2MP', 'Primary Camera Features': 'Ultra Wide Quad Camera, Sensor Type: 48MP CMOS/S5KGM1SP/OV48B, 8MP COMS/Hi846/OV8856, 2MP CMOS/OV02A1B/GC02M0, 2MP CMOS/GC02M0/OV02A1B, Maximum Zoom Multiples: 10X, Aperture: 48MP (f/1.8) + 8MP (f/2.25) + 2MP (f/2.4) + 2MP (f/2.4), Focal Length: 48MP (4.71mm) + 8MP (1.66mm) + 2MP (1.77mm) + 2MP (f1.77mm), Lens Number: 48MP (6P) + 8MP (5P) + 2MP (3P) + 2MP (3P)', 'Secondary Camera Available': 'Yes', 'Secondary Camera': '16MP Front Camera', 'Secondary Camera Features': 'Sensor Sizes/Pixel Data - 1/3.1inch, 1.0micrometer, Sensor Type: S5K3P9SP04, Wide Angle of Front: 79Degree, Aperture: F2.0, Focal Length: 3.42mm, Lens Number: 5P', 'Flash': 'Rear LED Flash', 'Frame Rate': 'Front Camera Video: 1080P/720P at 30 fps', 'Dual Camera Lens': 'Primary Camera', 'Network Type': '4G VOLTE, 4G, 3G, 2G', 'Supported Networks': '4G VoLTE, UMTS, GSM, 4G LTE, WCDMA, CDMA', 'Internet Connectivity': '4G, 3G, Wi-Fi, EDGE, GPRS', '3G Speed': 'HSPA+', 'GPRS': 'Yes', 'Micro USB Port': 'Yes', 'Micro USB Version': '2', 'Bluetooth Support': 'Yes', 'Bluetooth Version': 'v5.0', 'Wi-Fi': 'Yes', 'Wi-Fi Version': '802.11a/b/g/n/ac', 'USB Connectivity': 'Yes', 'EDGE': 'Yes', 'Audio Jack': '3.5mm', 'Smartphone': 'Yes', 'Touchscreen Type': 'Capacitive Screen, Multi-touch', 'SIM Size': 'Dual Nano SIM', 'User Interface': 'ColorOS 6.0.1', 'Removable Battery': 'No', 'Graphics PPI': '269 PPI', 'Ringtones Format': 'MP3/AMR/APE/OGG/FLAC/WAV/MIDI/WMA', 'Other Features': 'Face Recognition, Split Screen (Specific Apps), Clone Apps, Night Shield, Sensor Hub, Game Acceleration (Specific Apps), CPU Technology - 11nm, ROM Technology: UFS 2.1, Energy Density - 696 Wh/L, Charge Speed/Power - 5V 2A, 10W, WLAN 2.4G, WLAN 5.1G, WLAN 5.8G, WLAN Display, Game Boost 2.0, 4G+, 64 bits Processor, Video Stability, Ultra Night Mode 2.0, Reverse Charging', 'FM Radio': 'Yes', 'Audio Formats': 'MP3/AAC/APE/AMR/WAV/MID/OGG/FLAC/WMA', 'Video Formats': 'AVI/3GP/MP4/WMV/MKV/MOV/ASF/FLV', 'Battery Capacity': '5000 mAh', 'Width': '75.6 mm', 'Height': '163.6 mm', 'Depth': '9.1 mm', 'Weight': '195 g', 'Warranty Summary': 'Brand Warranty of 1 Year Available for Mobile and 6 Months for Accessories'}",17490
"Tecno Camon I Ace (Midnight Black, Black, 16 GB)  (2 GB RAM)",4.2,400 Ratings,43 Reviews,"{'In The Box': 'User Guide, Charger, Data Cable, Handset', 'Model Number': 'IN1', 'Model Name': 'Camon I Ace', 'Color': 'Midnight Black, Black', 'Browse Type': 'Smartphones', 'SIM Type': 'Dual Sim', 'Hybrid Sim Slot': 'No', 'Touchscreen': 'Yes', 'OTG Compatible': 'Yes', 'Display Size': '13.84 cm (5.45 inch)', 'Resolution': '1440x720 Pixels', 'Resolution Type': 'HD+', 'Display Type': 'IPS', 'HD Game Support': 'Yes', 'Operating System': 'Android Oreo 8.1', 'Processor Core': 'Quad Core', 'Primary Clock Speed': '1.5 GHz', 'Internal Storage': '16 GB', 'RAM': '2 GB', 'Memory Card Slot Type': 'Dedicated Slot', 'Primary Camera Available': 'Yes', 'Primary Camera': '13MP Rear Camera', 'Primary Camera Features': 'Bokeh Mode', 'Secondary Camera Available': 'Yes', 'Secondary Camera': '8MP Front Camera', 'Secondary Camera Features': 'Bokeh Mode', 'Flash': 'Back & Front Flash', 'HD Recording': 'Yes', 'Image Editor': 'Yes', 'Call Wait/Hold': 'Yes', 'Conference Call': 'Yes', 'Hands Free': 'Yes', 'Video Call Support': 'Yes', 'Call Divert': 'Yes', 'Call Timer': 'Yes', 'Speaker Phone': 'Yes', 'Speed Dialing': 'Yes', 'Network Type': '3G, 4G VOLTE, 2G', 'Supported Networks': 'GSM, 4G VoLTE', 'Bluetooth Support': 'Yes', 'Wi-Fi': 'Yes', 'Wi-Fi Hotspot': 'Yes', 'USB Tethering': 'Yes', 'Audio Jack': '3.5 mm', 'Smartphone': 'Yes', 'Touchscreen Type': 'Capactive', 'SIM Size': 'Nano', 'Social Networking Phone': 'Yes', 'Instant Message': 'Yes', 'Business Phone': 'Yes', 'Removable Battery': 'No', 'MMS': 'Yes', 'SMS': 'Yes', 'Keypad': 'No', 'Voice Input': 'Yes', 'Predictive Text Input': 'Yes', 'Sensors': 'Gravity Sensor, Accelerometer, Proximity Sensor', 'Series': 'Camon', 'Battery Capacity': '3050 mAh', 'Warranty Summary': '13 Months Warranty'}",5150
"Apple iPhone 7 (PRODUCT) (Red, 256 GB)",4.7,28 Ratings,1 Reviews,"{'In The Box': 'iPhone with iOS 12, EarPods with Lightning Connector, Lightning to USB Cable, USB Power Adapter, Documentation', 'Model Number': 'MPRM2HN/A', 'Model Name': 'iPhone 7 (PRODUCT)', 'Color': 'Red', 'Browse Type': 'Smartphones', 'SIM Type': 'Single Sim', 'Hybrid Sim Slot': 'No', 'Touchscreen': 'Yes', 'SAR Value': '1.6 W/kg (over 1 g) SAR Limit, Head: 1.19, Body: 1.20', 'Display Size': '11.94 cm (4.7 inch)', 'Resolution': '1334 x 750 Pixels', 'Resolution Type': 'Retina HD Display', 'Display Type': 'LED-backlit IPS', 'Other Display Features': 'Multi-touch Display, 1400:1 Contrast Ratio, Wide Color Display (P3), 625 cd/m2 Maximum Brightness, Dual Domain Pixels for Wide Viewing Angles, Fingerprint Resistant Oleophobic Coating, Display of Multiple Languages and Characters Simultaneously, Display Zoom, Reachability', 'Operating System': 'iOS 12', 'Processor Type': 'A10 Fusion Chip with 64-bit Architecture and Embedded M10 Motion Co-processor', 'Internal Storage': '256 GB', 'Phone Book Memory': 'Yes', 'Call Log Memory': 'Yes', 'SMS Memory': 'Yes', 'Primary Camera Available': 'Yes', 'Primary Camera': '12MP Rear Camera', 'Primary Camera Features': 'f/1.8 Aperture, Optical Image Stabilization, Six Element Lens, Panorama (Upto 63 MP), Sapphire Crystal Lens Cover, Backside Illumination Sensor, Hybrid IR Filter, Autofocus with Focus Pixels, Tap to Focus with Focus Pixels, Live Photos with Stabilization, Wide Color Capture for Photos and Live Photos, Improved Local Tone Mapping, Body and Face Detection, Exposure Control, Noise Reduction, Auto HDR for Photos, Auto Image Stabilization, Burst Mode, Timer Mode, Photo Geotagging, Time Lapse Video with Stabilization, Cinematic Video Stabilization (1080p and 720p), Continuous Auto Focus Video, Take 8 MP Still Photos While Recording 4K Video, Playback Zoom, Video Geotagging', 'Secondary Camera Available': 'Yes', 'Secondary Camera': '7MP Front Camera', 'Secondary Camera Features': '1080p HD Video Recording, Retina Flash, f/2.2 Aperture, Wide Color Capture for Photos and Live Photos, Auto HDR, Backside Illumination Sensor, Body and Face Detection, Auto Image Stabilization, Burst Mode, Exposure Control, Timer Mode, FaceTime Video Calling Over Wi-Fi or Cellular', 'Flash': 'Quad LED True Tone Flash', 'HD Recording': 'Yes', 'Full HD Recording': 'Yes', 'Video Recording': 'Yes', 'Video Recording Resolution': '3840 x 2160', 'Digital Zoom': 'Digital Zoom - Upto 5x', 'Frame Rate': '1080p@30fps,1080p@60fps, 720p@30fps, Slow Motion Video Support for 1080p@120 fps and 720p@240fps fps', 'Video Call Support': 'Yes', 'Phone Book': 'Yes', 'Network Type': '3G, 4G VOLTE, 2G', 'Supported Networks': '4G LTE', 'Internet Connectivity': '4G, 3G, Wi-Fi, GPRS, EDGE', '3G': 'Yes', '3G Speed': 'HSPA+', 'GPRS': 'Yes', 'Pre-installed Browser': 'Safari', 'Bluetooth Support': 'Yes', 'Bluetooth Version': '4.2', 'Wi-Fi': 'Yes', 'Wi-Fi Version': '802.11 a/b/g/n/ac', 'NFC': 'Yes', 'USB Connectivity': 'Yes', 'EDGE': 'Yes', 'GPS Support': 'Yes', 'Smartphone': 'Yes', 'SIM Size': 'Nano Sim', 'Removable Battery': 'No', 'SMS': 'Yes', 'Voice Input': 'Yes', 'Graphics PPI': '326 PPI', 'Predictive Text Input': 'Yes', 'Sensors': 'Touch ID Fingerprint Sensor, Barometer, Three-axis Gyro Sensor, Accelerometer, Proximity Sensor, Ambient Light Sensor, Backside Illumination Sensor, Digital Compass', 'Supported Languages': 'Multi-language Support', 'Other Features': 'Rated IP67 Under IEC Standard 60529, Audio Calling: FaceTime Audio, Voice Over LTE (VoLTE), Wi-Fi Calling, TV and Video: AirPlay Mirroring, Photos, Audio, Video-out to Apple TV (2nd Generation or Later), Apple Pay', 'Important Apps': 'Siri, Air Drop, Air Play, Air Print, Control Center, Hand Off, Home Kit, iCloud, iCloud Keychain, Multitasking, Night Shift, Notification Center, Spotlight Search, iMovie, Pages, Keynote, Numbers, iTunes U, GarageBand, Apple Store, Trailers, Apple TV Remote, iTunes Remote, Music Memos, Find My iPhone, iCloud Drive, Find My Friends, Stocks, Watch, Maps', 'GPS Type': 'A-GPS, GLONASS', 'Audio Formats': 'AAC, MP3, HE-AAC, MP3 VBR, AAX, AAX+, AIFF, WAV', 'Video Formats': 'H.264, AAC-LC, M4V, MP4, MOV, MPEG4, AVI, PCM', 'Battery Type': 'Li-Ion', 'Width': '67.1 mm', 'Height': '138.3 mm', 'Depth': '7.1 mm', 'Weight': '138 g', 'Warranty Summary': 'Brand Warranty of 1 Year'}",63999
"Panasonic Eluga A4 (Marine Blue, 32 GB)  (3 GB RAM)",3.8,"8,559 Ratings","1,268 Reviews","{'In The Box': 'Handset (Inclusive of Battery), Charger, USB Cable, Protective Screen Guard, Quick Start Guide, Earphones, Waranty Card, SIM Insert Pin', 'Model Number': 'EB-90S52EA4B', 'Model Name': 'Eluga A4', 'Color': 'Marine Blue', 'Browse Type': 'Smartphones', 'SIM Type': 'Dual Sim', 'Hybrid Sim Slot': 'Yes', 'Touchscreen': 'Yes', 'OTG Compatible': 'Yes', 'Display Size': '13.21 cm (5.2 inch)', 'Resolution': '1280 x 720 Pixels', 'Resolution Type': 'HD', 'Display Type': 'IPS On Cell', 'Other Display Features': '2.5D Curved Display', 'Operating System': 'Android Nougat 7', 'Processor Type': 'MT6737', 'Processor Core': 'Quad Core', 'Primary Clock Speed': '1.25 GHz', 'Operating Frequency': 'GSM - 850, 900, 1800, 1900 MHz,WCDMA - 900, 2100 MHz, 4G LTE - Bands (3, 5, 40)', 'Internal Storage': '32 GB', 'RAM': '3 GB', 'Expandable Storage': '128 GB', 'Supported Memory Card Type': 'microSD', 'Memory Card Slot Type': 'Hybrid Slot', 'Call Log Memory': 'Yes', 'Primary Camera Available': 'Yes', 'Primary Camera': '13MP Rear Camera', 'Primary Camera Features': '5P Lens Element, F2.2 Aperture, Modes: HDR, Face Beauty, Panoramic', 'Secondary Camera Available': 'Yes', 'Secondary Camera': '5MP Front Camera', 'Secondary Camera Features': 'Element Lens 3P, Aperture 2.2, Modes: Beauty Mode, HDR', 'Video Recording': 'Yes', 'Digital Zoom': 'Yes', 'Phone Book': 'Yes', 'Network Type': '3G, 4G VOLTE, 4G, 2G', 'Supported Networks': 'GSM, WCDMA, 4G VoLTE, UMTS, 4G LTE', 'Internet Connectivity': '4G, 3G, EDGE, GPRS, Wi-Fi', '3G': 'Yes', 'GPRS': 'Yes', 'Pre-installed Browser': 'Google Chrome', 'Bluetooth Support': 'Yes', 'Bluetooth Version': '4', 'Wi-Fi': 'Yes', 'Wi-Fi Version': '802.11b/g/n', 'Wi-Fi Hotspot': 'Yes', 'USB Connectivity': 'Yes', 'EDGE': 'Yes', 'Map Support': 'Google Maps', 'GPS Support': 'Yes', 'Smartphone': 'Yes', 'SIM Size': 'Nano SIM and Nano SIM', 'Removable Battery': 'No', 'SMS': 'Yes', 'Sensors': 'Accelerometer, Proximity Sensor, Ambient Light, Fingerprint Sensor', 'Other Features': 'Wi-Fi Direct, Notification LED', 'GPS Type': 'A-GPS', 'DLNA Support': 'No', 'Audio Formats': 'WAV, MP3, MP2, AAC, AMR-NB, MIDI, Vorbis, APE, AAC-plus v1, FLAC, WMA, ADPCM', 'Video Formats': '3GP, MP4, AVI, FLV, MOV, WMV', 'Battery Capacity': '5000 mAh', 'Width': '74 mm', 'Height': '149.5 mm', 'Depth': '8.95 mm', 'Weight': '162 g', 'Warranty Summary': 'Brand Warranty of 1 Year Available for Mobile and 6 Months for Accessories'}",12990
"Lenovo A5 (Black, 32 GB)  (3 GB RAM)",4,"9,119 Ratings",932 Reviews,"{'In The Box': 'Handset, Travel Charger (10W), USB Cable, Quick Start Guide, SIM Ejector Tool', 'Model Number': 'PADJ0040CN/PADJ0056IN', 'Model Name': 'A5', 'Color': 'Black', 'Browse Type': 'Smartphones', 'SIM Type': 'Dual Sim', 'Hybrid Sim Slot': 'No', 'Touchscreen': 'Yes', 'OTG Compatible': 'Yes', 'Quick Charging': 'Yes', 'Sound Enhancements': 'Dirac Audio, Front 2 in 1 Speaker, 2 Microphones', 'Display Size': '13.84 cm (5.45 inch)', 'Resolution': '720 x 1440 pixels', 'Resolution Type': 'HD+', 'GPU': 'IMG 8XE 1PPC at 420 MHz', 'Operating System': 'Android Oreo 8.1', 'Processor Type': 'MediaTek MT6739', 'Processor Core': 'Quad Core', 'Primary Clock Speed': '1.3 GHz', 'Operating Frequency': '2G: GSM Band 2/3/5/8, 3G: WCDMA Band 1/2/5/8, 4G: LTE Band 1/3/5/7/8/20/38/40/41', 'Internal Storage': '32 GB', 'RAM': '3 GB', 'Expandable Storage': '256 GB', 'Supported Memory Card Type': 'microSD', 'Memory Card Slot Type': 'Dedicated Slot', 'Primary Camera Available': 'Yes', 'Primary Camera': '13MP Rear Camera', 'Primary Camera Features': 'f2.2 Aperture, 1.12 micrometer, PDAF', 'Secondary Camera Available': 'Yes', 'Secondary Camera': '8MP Front Camera', 'Secondary Camera Features': 'f2.2 Aperture, Front Focus, 1.12 micrometer, Selfie Light', 'Flash': 'Rear LED Flash', 'Frame Rate': 'FHD at 30 fps, FHD at 60 fps, VGA at 30 fps', 'Network Type': '3G, 4G, 2G', 'Supported Networks': 'GSM, WCDMA, 4G LTE, UMTS', 'Internet Connectivity': '4G, 3G, Wi-Fi, EDGE', '3G': 'Yes', '3G Speed': 'HSPA+', 'Micro USB Port': 'Yes', 'Bluetooth Support': 'Yes', 'Bluetooth Version': '4.2', 'Wi-Fi': 'Yes', 'Wi-Fi Version': '802.11b/g/n (2.4 GHz)', 'Wi-Fi Hotspot': 'Yes', 'NFC': 'No', 'USB Connectivity': 'Yes', 'EDGE': 'Yes', 'GPS Support': 'Yes', 'Smartphone': 'Yes', 'SIM Size': 'Dual Nano SIM', 'Removable Battery': 'No', 'Graphics PPI': '295 PPI', 'Sensors': 'Fingerprint Sensor, Proximity Sensor, Accelerometer, Ambient Light Sensor', 'Other Features': 'Connectivity: Micro-USB with 10W Quick Charge Support, 4G LTE (Cat 4), Charging: 10W (5V/2A)', 'GPS Type': 'A-GPS, GLONASS', 'FM Radio': 'Yes', 'Battery Capacity': '4000 mAh', 'Width': '70.86 mm', 'Height': '146.2 mm', 'Depth': '9.8 mm', 'Weight': '160 g', 'Warranty Summary': 'Brand Warranty of 1 Year Available for Mobile and 6 Months for Accessories'}",7999
