Name,Stars,Ratings,Reviews,Specifications,Price
"Jivi Prime P444 (White & Gold, 16 GB)  (2 GB RAM)",3.6,34 Ratings,1 Reviews,"{'In The Box': 'Hands Free, User Manual, Tempered Glass, Flip Cover, Data Cable, Handset, Free Case, Adapter', 'Model Number': 'P444', 'Model Name': 'Prime P444', 'Color': 'White & Gold', 'Browse Type': 'Smartphones', 'SIM Type': 'Dual Sim', 'Hybrid Sim Slot': 'No', 'Touchscreen': 'Yes', 'OTG Compatible': 'Yes', 'Quick Charging': 'No', 'Additional Content': 'Finger Print Sensor, Big Battery, Big Display', 'Display Size': '12.7 cm (5 inch)', 'Resolution': '480x854', 'Resolution Type': 'HD', 'Display Type': 'FWVGA', 'HD Game Support': 'Yes', 'Display Colors': '1.6', 'Operating System': 'Android Nougat 7', 'Processor Type': '32 bit Quad Core', 'Processor Core': 'Quad Core', 'Primary Clock Speed': '1.3 GHz', 'Secondary Clock Speed': '1.3 GHz', 'Operating Frequency': 'GSM 900, 1800, 1900, 2100', 'Internal Storage': '16 GB', 'RAM': '2 GB', 'Total Memory': '16 GB', 'Expandable Storage': '64 GB', 'Supported Memory Card Type': 'microSD', 'Memory Card Slot Type': 'Dedicated Slot', 'Phone Book Memory': 'Unlimited', 'Hot SWAP Support': 'Yes', 'Call Log Memory': 'Yes', 'SMS Memory': 'Yes', 'Primary Camera Available': 'Yes', 'Primary Camera': '8MP + 8MP', 'Primary Camera Features': 'Fixed Focus, Zoom Level, Night Mode', 'Optical Zoom': 'Yes', 'Secondary Camera Available': 'Yes', 'Secondary Camera': '5MP + 5MP Dual Front Camera', 'Secondary Camera Features': 'Fixed Focus, Zoom Level, Night Mode', 'Flash': 'Yes', 'HD Recording': 'Yes', 'Full HD Recording': 'Yes', 'Video Recording': 'Yes', 'Video Recording Resolution': '1280 x 720', 'Digital Zoom': 'Yes', 'Image Editor': 'Yes', 'Call Wait/Hold': 'Yes', 'Conference Call': 'Yes', 'Hands Free': 'Yes', 'Video Call Support': 'Yes', 'Call Divert': 'Yes', 'Phone Book': 'Yes', 'Call Timer': 'Yes', 'Speaker Phone': 'Yes', 'Speed Dialing': 'Yes', 'Call Records': 'Yes', 'Logs': 'Yes', 'Network Type': '3G, 4G VOLTE, 2G', 'Supported Networks': 'GSM, 4G VoLTE', 'Internet Connectivity': 'Yes', '3G': 'Yes', '3G Speed': '7.2', 'GPRS': 'Yes', 'WAP': 'Yes', 'Pre-installed Browser': 'WAP', 'Micro USB Port': 'Yes', 'Micro USB Version': '2', 'Mini USB Port': 'Yes', 'Mini USB Version': '2', 'Bluetooth Support': 'Yes', 'Bluetooth Version': '4', 'Wi-Fi': 'Yes', 'Wi-Fi Version': '802.11 b/g/n', 'Wi-Fi Hotspot': 'Yes', 'Mini HDMI Port': 'No', 'USB Tethering': 'Yes', 'TV Out': 'No', 'Infrared': 'No', 'USB Connectivity': 'Yes', 'EDGE': 'Yes', 'Audio Jack': '3.5 mm', 'EDGE Features': 'Class 12', 'Map Support': 'Yes', 'GPS Support': 'Yes', 'Smartphone': 'Yes', 'Touchscreen Type': 'Yes', 'SIM Size': 'nano', 'Mobile Tracker': 'Yes', 'Keypad Type': 'QWERTY', 'Social Networking Phone': 'Yes', 'Instant Message': 'Yes', 'Business Phone': 'Yes', 'Java Application': 'Yes', 'Removable Battery': 'No', 'JAVA Support': 'Yes', 'MMS': 'Yes', 'SMS': 'Yes', 'Keypad': 'No', 'Voice Input': 'Yes', 'Graphics PPI': '240 ppi', 'Predictive Text Input': 'Yes', 'User Memory': '11.5', 'SIM Access': 'Dual Standby', 'Sensors': 'proximity sensor, light sensor, Accelerometer', 'Upgradable Operating System': 'Yes', 'Supported Languages': '22', 'Games': 'Yes', 'Series': 'Touch', 'Browser': 'Yes', 'Ringtones Format': 'MP3, Wav., AAC', 'Other Features': 'Finger Print Sensor, Big Battery', 'FM Radio': 'Yes', 'FM Radio Recording': 'Yes', 'Audio Formats': 'MP3, AAC, WAV', 'Music Player': 'Yes', 'Video Formats': '3gp, MP4', 'Battery Capacity': '2400 mAh', 'Battery Type': 'Li-Poly', 'Talk Time': '6 Hours', 'Dual Battery': 'No', 'Width': '73.3 mm', 'Height': '146 mm', 'Depth': '9.3 mm', 'Weight': '168.5 g', 'Warranty Summary': '12 months manufacturer warranty, 6 months warranty for accessories.', 'Covered in Warranty': 'Manufacturing Defects', 'Not Covered in Warranty': 'Physical & Liquid Damage', 'Domestic Warranty': '1 Year', 'International Warranty': '0 Year'}",4099
"Redmi Y3 (Prime Black, 64 GB)  (4 GB RAM)",4.4,"2,774 Ratings",210 Reviews,"{'In The Box': 'Handset, Protective Cover, 5V/2A Charger, Charging Cable, SIM Eject Tool, Warranty Card, User Guide', 'Model Number': 'M1810F6I', 'Model Name': 'Redmi Y3', 'Color': 'Prime Black', 'Browse Type': 'Smartphones', 'SIM Type': 'Dual Sim', 'Hybrid Sim Slot': 'No', 'Touchscreen': 'Yes', 'OTG Compatible': 'Yes', 'Sound Enhancements': 'Front Mounted Receiver, Speaker (Bottom), 1 Top Microphone and 1 Bottom Microphone', 'Display Size': '15.9 cm (6.26 inch)', 'Resolution': '1520 x 720 pixels', 'Resolution Type': 'HD+', 'GPU': 'Adreno 506 Up to 725 MHz', 'Other Display Features': 'Dot Notch Display, 19:9 Aspect Ratio, 1500:1 Contrast Ratio, Screen to Body Ratio 86.83%, NTSC 84% (Typical), Brightness: 450 nits (Typical), Corning Gorilla Glass 5, Sunlight Mode, Reading Mode, Color Temperature Adjustment, Standard Mode', 'Operating System': 'Android Pie 9.0', 'Processor Type': 'Qualcomm Snapdragon 632', 'Processor Core': 'Octa Core', 'Primary Clock Speed': '1.8 GHz', 'Operating Frequency': 'GSM: B2, B3, B5, B8, WCDMA: B1, B2, B4, B5, B8, 4G TDD-LTE: B38, B40, 4G FDD-LTE: B1, B2, B3, B4, B5, B7, B8, B20, B28', 'Internal Storage': '64 GB', 'RAM': '4 GB', 'Expandable Storage': '512 GB', 'Supported Memory Card Type': 'microSD', 'Memory Card Slot Type': 'Dedicated Slot', 'Primary Camera Available': 'Yes', 'Primary Camera': '12MP + 2MP', 'Primary Camera Features': 'Panorama Mode, Auto Focus, Low Light Enhancement (Built-in), f/2.2 Aperture Lens, AI Portrait Mode, HDR, AI Beautify 4.0, 1.25 micrometer Large pixels, 12MP + 2MP AI Dual Rear Camera, AI Scene Detection, Face Recognition', 'Secondary Camera Available': 'Yes', 'Secondary Camera': '32MP Front Camera', 'Secondary Camera Features': '4-in-1 Remosaic, Selfie Timer, EIS, AI Portrait Mode, AI Beautify 4.0, HDR, Ultra Wide 80Degree FOV, Aperture Lens: f/2.25, Palm Shutter, Face Recognition', 'Flash': 'Front Screen Flash with Auto Adjust Color Temperature', 'HD Recording': 'Yes', 'Full HD Recording': 'Yes', 'Video Recording': 'Yes', 'Video Recording Resolution': '1080p, 720p', 'Frame Rate': '1080p at 60 fps, 1080p at 30 fps, 720p at 30 fps, High Frame-rate Video: 720p at 120 fps', 'Dual Camera Lens': 'Primary Camera', 'Network Type': '3G, 4G, 2G', 'Supported Networks': 'GSM, WCDMA, 4G LTE', 'Internet Connectivity': '4G, 3G, Wi-Fi', 'Micro USB Port': 'Yes', 'Bluetooth Support': 'Yes', 'Bluetooth Version': '4.2', 'Wi-Fi': 'Yes', 'Wi-Fi Version': '802.11b/g/n', 'USB Connectivity': 'Yes', 'Audio Jack': '3.5mm', 'Map Support': 'Google Maps', 'GPS Support': 'Yes', 'Smartphone': 'Yes', 'Removable Battery': 'No', 'Graphics PPI': '269 PPI', 'Sensors': 'Fingerprint Sensor (Stainless Steel, Coated Using PVD)', 'Other Features': 'HD Recording: 6hrs 10min, CPU: 14nm FinFET Up to 1.8 GHz, Octa-core, 8x Kryo 250, 4 Kryo Gold Core + 4 Kryo Silver Core, Battery: Maximum - 10W (5V/2A), 5V/2A Charger, Wi-Fi Display, Gaming: Up to 9hrs 10mins, P2i Water Protection, Aura Prism Design: Glass Design, AI Face Unlock, ROM: eMMC 5.1, Volume Up/Down Button, Dual 4G, Power Button, 7 Layer Back: Ink Layer, Plating Layer, UV Texture Layer, Gradient Paint, PET Membrane, Polycarbonate, UV Coating, Video Playback: 10hrs 20mins, IR Blaster, Wi-Fi Direct, Battery: Adaptive Power-saving Technology, Music Playback: 41hrs 30mins, Two-day Battery Life, Wi-Fi Support 2.4 Ghz, FHD Recording: 5hrs 30mins, Multimedia: PCM, AAC/AAC+/eAAC+, MP3, AMR-NB, WB, FLAC, APE, MP4, M4V, MKV', 'GPS Type': 'GPS: L1, Galileo: E1, GLONASS: L1', 'Audio Formats': 'PCM, AAC/AAC+/eAAC+, MP3, AMR-NB and WB, FLAC, WAV', 'Video Formats': 'H.2654/HEVC (Main Profile), H.264 (Baseline/Main/High Profile), MPEG4 (Simple Profile/ASP), VC-1 (Simple/Main/Advanced Profile)', 'Battery Capacity': '4000 mAh', 'Talk Time': '51hrs 50mins', 'Width': '75.58 mm', 'Height': '158.73 mm', 'Depth': '8.47 mm', 'Weight': '180 g', 'Warranty Summary': 'Brand Warranty of 1 Year Available for Mobile and 6 Months for Battery and Accessories'}",10388
"Apple iPhone 8 Plus (Space Grey, 256 GB)",4.6,"3,299 Ratings",355 Reviews,"{'In The Box': 'iPhone with iOS 12, EarPods with Lightning Connector, Lightning to USB Cable, USB Power Adapter, Documentation', 'Model Number': 'MQ8G2HN/A', 'Model Name': 'iPhone 8 Plus', 'Color': 'Space Grey', 'Browse Type': 'Smartphones', 'SIM Type': 'Single Sim', 'Touchscreen': 'Yes', 'Sound Enhancements': 'Built-in Stereo Speaker, Built-in Microphone', 'Display Size': '13.97 cm (5.5 inch)', 'Resolution': '1920 x 1080 Pixels', 'Resolution Type': 'Retina HD Display', 'Display Type': 'Widescreen LCD Multi-touch Display with IPS Technology', 'Other Display Features': '1300:1 Contrast Ratio (Typical), True Tone Display, Wide Color Display (P3), 3D Touch, 625 cd/m2 Max Brightness (Typical), Dual-domain Pixels for Wide Viewing Angles, Fingerprint-resistant Oleophobic Coating, Support for Display of Multiple Languages and Characters Simultaneously, Display Zoom, Reachability', 'Operating System': 'iOS 12', 'Processor Type': 'A11 Bionic Chip with 64-bit Architecture, Neural Engine, Embedded M11 Motion Coprocessor', 'Operating Frequency': 'GSM/EDGE (850, 900, 1800, 1900 MHz), UMTS / HSPA+ / DC-HSDPA - (850, 900, 1700 / 2100, 1900, 2100 MHz), 4G TD-LTE (Bands 34, 38, 39, 40, 41)', 'Internal Storage': '256 GB', 'Primary Camera Available': 'Yes', 'Primary Camera': '12MP + 12MP', 'Primary Camera Features': 'Wide-angle and Telephoto Cameras, Wide-angle: f/1.8 Aperture, Telephoto: f/2.8 Aperture, Portrait Mode, Portrait Lighting (Beta), Optical Image Stabilization, Six Element Lens, Panorama (Upto 63MP), Sapphire Crystal Lens Cover, Backside Illumination Sensor, Hybrid IR Filter, Autofocus with Focus Pixels, Tap to Focus with Focus Pixels, Live Photos with Stabilization, Wide Color Capture for Photos and Live Photos, Improved Local Tone Mapping, Body and Face Detection, Exposure Control, Noise Reduction, Auto HDR for Photos, Auto Image Stabilization, Burst Mode, Timer Mode, Photo Geotagging, Image Formats Captured: HEIF And JPEG', 'Optical Zoom': 'Yes', 'Secondary Camera Available': 'Yes', 'Secondary Camera': '7MP Front Camera', 'Secondary Camera Features': '1080p HD Video Recording, f/2.2 Aperture, Wide Color Capture for Photos and Live Photos, Auto HDR, Backside Illumination Sensor, Body and Face Detection, Auto Image Stabilization, Burst Mode, Exposure Control, Timer Mode', 'Flash': 'Rear Quad LED True Tone Flash with Slow Sync and Front Retina Flash', 'HD Recording': 'Yes', 'Full HD Recording': 'Yes', 'Video Recording': 'Yes', 'Video Recording Resolution': '3840 x 2160 Pixels', 'Digital Zoom': 'Digital Zoom Upto 10x', 'Frame Rate': '4K Video Recording At 24 fps, 30 fps, or 60 fps, 1080P HD Video Recording at 30 fps or 60 fps, 720P HD Video Recording At 30 fps, Slo-Mo Video Support for 1080P at 120 fps or 240 fps fps', 'Dual Camera Lens': 'Primary Camera', 'Network Type': '3G, 4G, 2G', 'Supported Networks': 'GSM, WCDMA, 4G LTE, UMTS', 'Internet Connectivity': '4G, 3G, Wi-Fi, EDGE', '3G': 'Yes', '3G Speed': 'HSPA+', 'Pre-installed Browser': 'Safari', 'Bluetooth Support': 'Yes', 'Bluetooth Version': '5', 'Wi-Fi': 'Yes', 'Wi-Fi Version': '802.11 ac (Wi-Fi with MIMO)', 'EDGE': 'Yes', 'Map Support': 'Maps', 'GPS Support': 'Yes', 'Smartphone': 'Yes', 'SIM Size': 'Nano SIM', 'SMS': 'Yes', 'Graphics PPI': '401 PPI', 'Predictive Text Input': 'Yes', 'Sensors': 'Touch ID Fingerprint Sensor Built into the Home Button, Barometer, Three-axis Gyro, Accelerometer, Proximity Sensor, Ambient Light Sensor', 'Supported Languages': 'Multi-language Support', 'Other Features': 'Apple ID (Required for Some Features) - Syncing with iTunes on a Mac or PC Requires: Mac - OS X 10.9.5 or Later, PC - Windows 7 or Later, iTunes 12.7 or Later, Rating for Hearing Aids: M3, NFC with Reader Mode, Accessibility: VoiceOver, Siri and Dictation, AssistiveTouch, Zoom, Type to Siri, Speak Screen, Magnifier, Switch Control, Software TTY, Closed Captions, System Requirements, Video Recording: 4K Video Recording at 24 fps, 30 fps, or 60 fps, 1080P HD Video Recording at 30 fps or 60 fps, 720P HD Video Recording at 30 fps, Optical Image Stabilization for Video, Optical Zoom: 6x Digital Zoom (iphone 8 Plus Only), Quad LED True Tone Flash, Slo-Mo Video Support for 1080P at 120 fps or 240 fps, Time-lapse Video with Stabilization, Cinematic Video Stabilization (1080P and 720P), Continuous Autofocus Video, Body and Face Detection, Noise Reduction, Take 8MP Still Photos while Recording 4K Video, Playback Zoom, Video Geotagging, Video Formats Recorded: HEVC and H.264, Apple Pay, Location: Digital Compass, Wi-Fi, Cellular, iBeacon Microlocation, Lightning Connector', 'Important Apps': 'Camera, Photos, Health, Messages, Phone, FaceTime, Mail, Music, Wallet, Safari, Maps, Siri, Calendar, iTunes Store, App Store, Notes, News, Contacts, iBooks, Home, Weather, Reminders, Clock, TV, Stocks, Calculator, Voice Memos, Compass, Podcasts, Watch, Tips, iCloud Drive, Find My iPhone, Find My Friends, Settings, Files', 'GPS Type': 'Assisted GPS, GLONASS, Galileo, QZSS', 'Audio Formats': 'AAC-LC, HE-AAC, HE-AAC v2, Protected AAC, MP3, Linear PCM, Apple Lossless, FLAC, Dolby Digital (AC-3), Dolby Digital Plus (E-AC-3), Audible (Formats 2, 3, 4, Audible Enhanced Audio, AAX, and AAX+)', 'Video Formats': 'HEVC, H.264, MPEG-4 Part 2, Motion JPEG Supports Dolby Vision and HDR10 Content', 'Width': '78.1 mm', 'Height': '158.4 mm', 'Depth': '7.5 mm', 'Weight': '202 g', 'Warranty Summary': 'Brand Warranty of 1 Year'}",84900
"OPPO A9 2020 (Space Purple, 128 GB)  (8 GB RAM)",4.3,"4,235 Ratings",360 Reviews,"{'In The Box': 'Handset, Adapter, Headset, Micro USB Cable, Important Info. Booklet with Warranty Card, Quick Start Guide, Sim Card Tool, Protective Film, Pre-applied, Case', 'Model Number': 'CPH1937', 'Model Name': 'A9 2020', 'Color': 'Space Purple', 'Browse Type': 'Smartphones', 'SIM Type': 'Dual Sim', 'Hybrid Sim Slot': 'No', 'Touchscreen': 'Yes', 'OTG Compatible': 'Yes', 'Sound Enhancements': 'Dolby Atmos and Dual Stereo Speakers', 'Display Size': '16.51 cm (6.5 inch)', 'Resolution': '1600 x 720 Pixels', 'GPU': 'Adreno 610', 'Display Type': 'TFT-LCD', 'Display Colors': '16M', 'Other Display Features': 'Touch Panel Technology: In-cell, Narrow Frame - Upper Border: 2.44mm, Left and Right Border: 1.98mm, Lower Border: 6.6mm, Screen Ratio: 89.0%, Screen Contrast: 1500:1, Color Saturation: Typical 71%, Maximum Brightness: 480nits, Touch Panel Glass Type: GG3+, TYPE-C USB 2.0', 'Operating System': 'Android Pie 9', 'Processor Type': 'Qualcomm SM6125', 'Processor Core': 'Octa Core', 'Primary Clock Speed': '1.8 GHz', 'Secondary Clock Speed': '2 GHz', 'Internal Storage': '128 GB', 'RAM': '8 GB', 'Memory Card Slot Type': 'Dedicated Slot', 'Primary Camera Available': 'Yes', 'Primary Camera': '48MP + 8MP + 2MP + 2MP', 'Primary Camera Features': 'Ultra Wide Quad Camera, Sensor Type: 48MP CMOS/S5KGM1SP/OV48B, 8MP COMS/Hi846/OV8856, 2MP CMOS/OV02A1B/GC02M0, 2MP CMOS/GC02M0/OV02A1B, Maximum Zoom Multiples: 10X, Aperture: 48MP (f/1.8) + 8MP (f/2.25) + 2MP (f/2.4) + 2MP (f/2.4), Focal Length: 48MP (4.71mm) + 8MP (1.66mm) + 2MP (1.77mm) + 2MP (f1.77mm), Lens Number: 48MP (6P) + 8MP (5P) + 2MP (3P) + 2MP (3P)', 'Secondary Camera Available': 'Yes', 'Secondary Camera': '16MP Front Camera', 'Secondary Camera Features': 'Sensor Sizes/Pixel Data - 1/3.1inch, 1.0micrometer, Sensor Type: S5K3P9SP04, Wide Angle of Front: 79Degree, Aperture: F2.0, Focal Length: 3.42mm, Lens Number: 5P', 'Flash': 'Rear LED Flash', 'Frame Rate': 'Front Camera Video: 1080P/720P at 30 fps', 'Dual Camera Lens': 'Primary Camera', 'Network Type': '4G VOLTE, 4G, 3G, 2G', 'Supported Networks': '4G VoLTE, UMTS, GSM, 4G LTE, WCDMA, CDMA', 'Internet Connectivity': '4G, 3G, Wi-Fi, EDGE, GPRS', '3G Speed': 'HSPA+', 'GPRS': 'Yes', 'Micro USB Port': 'Yes', 'Micro USB Version': '2', 'Bluetooth Support': 'Yes', 'Bluetooth Version': 'v5.0', 'Wi-Fi': 'Yes', 'Wi-Fi Version': '802.11a/b/g/n/ac', 'USB Connectivity': 'Yes', 'EDGE': 'Yes', 'Audio Jack': '3.5mm', 'Smartphone': 'Yes', 'Touchscreen Type': 'Capacitive Screen, Multi-touch', 'SIM Size': 'Dual Nano SIM', 'User Interface': 'ColorOS 6.0.1', 'Removable Battery': 'No', 'Graphics PPI': '269 PPI', 'Ringtones Format': 'MP3/AMR/APE/OGG/FLAC/WAV/MIDI/WMA', 'Other Features': 'Face Recognition, Split Screen (Specific Apps), Clone Apps, Night Shield, Sensor Hub, Game Acceleration (Specific Apps), CPU Technology - 11nm, ROM Technology: UFS 2.1, Energy Density - 696 Wh/L, Charge Speed/Power - 5V 2A, 10W, WLAN 2.4G, WLAN 5.1G, WLAN 5.8G, WLAN Display, Game Boost 2.0, 4G+, 64 bits Processor, Video Stability, Ultra Night Mode 2.0, Reverse Charging', 'FM Radio': 'Yes', 'Audio Formats': 'MP3/AAC/APE/AMR/WAV/MID/OGG/FLAC/WMA', 'Video Formats': 'AVI/3GP/MP4/WMV/MKV/MOV/ASF/FLV', 'Battery Capacity': '5000 mAh', 'Width': '75.6 mm', 'Height': '163.6 mm', 'Depth': '9.1 mm', 'Weight': '195 g', 'Warranty Summary': 'Brand Warranty of 1 Year Available for Mobile and 6 Months for Accessories'}",17490
"POCO X2 Special Edition (Phoenix Red, 128 GB)  (6 GB RAM)",4.6,"3,874 Ratings",559 Reviews,"{'In The Box': 'Handset, USB Type C Data Cable, SIM Ejector Tool, User Guide, 27W Fast Charger', 'Model Number': 'MZB9231IN', 'Model Name': 'X2 Special Edition', 'Color': 'Phoenix Red', 'Browse Type': 'Smartphones', 'SIM Type': 'Dual Sim', 'Hybrid Sim Slot': 'Yes', 'Touchscreen': 'Yes', 'OTG Compatible': 'Yes', 'Quick Charging': 'Yes', 'Sound Enhancements': '1217 Super Linear Speaker, Dual Mic Microphone', 'SAR Value': 'Head - 1.080 W/kg, Body - 0.620 W/kg', 'Display Size': '16.94 cm (6.67 inch)', 'Resolution': '2400 x 1080 Pixels', 'Resolution Type': 'Full HD+', 'GPU': 'Adreno 618', 'Other Display Features': 'Corning Gorilla Glass 5, 120Hz Display Refresh Rate, 20:9 Aspect Ratio, Screen Mirror/cast', 'Operating System': 'Android 10', 'Processor Type': 'Qualcomm Snapdragon 730G', 'Processor Core': 'Octa Core', 'Primary Clock Speed': '2.2 GHz', 'Operating Frequency': '4G: FDD - B1/B3/B5/B8, TDD - B40/B41, 3G: B1/B2/B5/B8, 2G: B2/B3/B5/B8', 'Internal Storage': '128 GB', 'RAM': '6 GB', 'Expandable Storage': '512 GB', 'Supported Memory Card Type': 'microSD', 'Memory Card Slot Type': 'Hybrid Slot', 'Primary Camera Available': 'Yes', 'Primary Camera': '64MP + 8MP + 2MP + 2MP', 'Primary Camera Features': 'Quad Rear Camera, Wide 64MP + Macro 2MP + Ultra 8MP + Depth 2MP, 64MP Ultra Clear Mode, Super Night Mode, AI Scene Detection, Ultra Wide Angle, Distortion Correction, Pro Mode, Portrait Mode, Panorama Mode, Slow Motion Capture', 'Secondary Camera Available': 'Yes', 'Secondary Camera': '20MP + 2MP Dual Front Camera', 'Secondary Camera Features': 'Dual In-display Camera, 20MP: 0.8micrometer, 2MP: 1.75micrometer, Gesture Camera, Front HDR, Short Video', 'Flash': 'Rear Flash', 'Frame Rate': 'Front: 720p at 30 fps, 1080p at 30 fps, Rear: 1080p at 60 fps, 4k at 30 fps', 'Dual Camera Lens': 'Primary Camera', 'Network Type': '4G VOLTE, 4G, 3G, 2G', 'Supported Networks': '4G VoLTE, UMTS, GSM, 4G LTE, WCDMA', 'Internet Connectivity': '4G, 3G, Wi-Fi', 'Bluetooth Support': 'Yes', 'Bluetooth Version': 'v5.0', 'Wi-Fi': 'Yes', 'Wi-Fi Version': '802.11 a/b/g/n/ac', 'Wi-Fi Hotspot': 'Yes', 'USB Connectivity': 'Yes', 'Audio Jack': '3.5mm', 'Map Support': 'Google Maps', 'GPS Support': 'Yes', 'SIM Size': 'Nano SIM', 'User Interface': 'MIUI 11', 'Removable Battery': 'No', 'Graphics PPI': '395 PPI', 'Sensors': 'Fingerprint Scanner', 'Other Features': 'Face Unlock, Dual App Support, USB Type C, Kryo 4 Architecture, Fingerprint Scanner Position: Side, Quick Charging Version: Supports Upto 27W', 'Battery Capacity': '4500 mAh', 'Width': '76.6 mm', 'Height': '165.3 mm', 'Depth': '8.79 mm', 'Weight': '208 g', 'Warranty Summary': 'Brand Warranty of 1 Year Available for Mobile and 6 Months for Accessories'}",16999
Honor 8  (4 GB RAM),4.4,"2,847 Ratings",703 Reviews,"{'In The Box': 'Handset, Charger, USB Cable, Eject Tool, Quick Start Guide, Warranty Card', 'Model Number': 'FRD-L02', 'Model Name': 'Honor 8', 'Color': 'Pearl White', 'Browse Type': 'Smartphones', 'SIM Type': 'Single Sim', 'Hybrid Sim Slot': 'No', 'OTG Compatible': 'Yes', 'Sound Enhancements': 'DTS Sound, Dual Microphone Noise Reduction', 'SAR Value': '1.40 W/kg', 'Display Size': '13.21 cm (5.2 inch)', 'Resolution': '1920 x 1080', 'Resolution Type': 'Full HD', 'Display Colors': '16 M', 'Other Display Features': 'LTPS Display, Multiple-point Touch Sensitive Screen', 'Operating System': 'Android Marshmallow 6', 'Processor Type': 'ARM Hisilicon Kirin 950 - ARM Cortex A72 + ARM Cortex A53 Octa Core 2.3GHz', 'Processor Core': 'Octa Core', 'Primary Clock Speed': '2.3 GHz', 'Secondary Clock Speed': '1.8 GHz', 'Operating Frequency': 'GSM - 850, 900, 1800, 1900; WCDMA - Bands (1/2/4/5/6/8/19); 4G LTE (FDD) - Bands (1/2/3/4/5/7/8/12/17/19/20); LTE (TDD) - Bands (38/40)', 'Internal Storage': '32 GB', 'RAM': '4 GB', 'Expandable Storage': '128 GB', 'Supported Memory Card Type': 'microSD', 'Memory Card Slot Type': 'Dedicated Slot', 'Call Log Memory': 'Yes', 'Primary Camera Available': 'Yes', 'Primary Camera': '12MP + 12MP', 'Primary Camera Features': '3968 x 2976 Pixels, Quick Shooting, Panoramic Shooting, Goodfood Shooting, Beauty, Watermark, Audio Control, Touch to Capture, Capture Smiles, Burst Shoot, Wide Aperture', 'Secondary Camera Available': 'Yes', 'Secondary Camera': '8MP Front Camera', 'Secondary Camera Features': 'Fixed Focus, 3264 x 2448 Pixels', 'Flash': 'Dual Color Temperature Flash', 'HD Recording': 'Yes', 'Full HD Recording': 'Yes', 'Video Recording': 'Yes', 'Video Recording Resolution': '1920 x 1080', 'Dual Camera Lens': 'Primary Camera', 'Phone Book': 'Yes', 'Network Type': '4G', 'Supported Networks': '4G LTE', 'Internet Connectivity': '4G, 3G, Wi-Fi, GPRS, EDGE', '3G': 'Yes', '3G Speed': 'HSPA Category 24: 5.76 Mbit/s (UL), 42 Mbit/s (DL), WCDMA: 384 kbit/s (UL), 384 kbit/s (DL)', 'GPRS': 'Yes', 'Pre-installed Browser': 'Android', 'Bluetooth Support': 'Yes', 'Bluetooth Version': '4.2', 'Wi-Fi': 'Yes', 'Wi-Fi Version': '802.11 ac/a/b/g/n', 'NFC': 'Yes', 'USB Tethering': 'Yes', 'Infrared': 'Yes', 'USB Connectivity': 'Yes', 'EDGE': 'Yes', 'GPRS Features': '40 Kbit/s (UL), 60 Kbit/s (DL)', 'Audio Jack': '3.5 mm', 'EDGE Features': 'Class 12: 118.4 kbit/s (UL), 236.8 kbit/s (DL)', 'Map Support': 'Google Maps', 'GPS Support': 'Yes', 'Smartphone': 'Yes', 'Touchscreen Type': 'Capacitive', 'SIM Size': 'Nano SIM', 'User Interface': 'EMUI 4.1', 'Removable Battery': 'No', 'MMS': 'Yes', 'SMS': 'Yes', 'Voice Input': 'Yes', 'Graphics PPI': '423 PPI', 'Sensors': 'Accelerometer, Proximity Sensor, Ambient Light Sensor, Gyroscope, Compass, Hall Sensor, Fingerprint Sensor', 'Other Features': 'LTE FDD Category 6: 51 Mbit/s (UL), 301.5 Mbit/s (DL), TD-LTE Category 6: 10 Mbit/s (UL), 220 Mbit/s (DL), 6-pin SIM Card Interface, Standard USB Type-C, Operating temperature: 0DegreeC - 35DegreeC, Standby Time: 390 hours (4G), Charging Time: 100 mins from Supplied Charger, Relative Humidity: Working: 5% - 95%, Certification: CE, BQB, Wi-Fi, RoHS, REACH, Status Indicator, Smart Key, Infrared Remote Control, Android Keyboard, HUAWEI IME, Swype, Email - POP3, IMAP, Exchange, SMTP, Audio Codec: MP3, MIDI, AMR-NB, AAC, AAC+, eAAC+, Video Codec: H.265, H.263, H.264, MPEG-4, HOTA Online Update, Support STK/USAT, Digital Compass, Wi-Fi Direct, Wi-Fi WPS, Feature Applications: Backup, File Manager, Huawei IME, Weather, Huawei Music, Contacts Import, CSFB Only, Device Control: Illuminated Capacitive Soft Keys with Haptic Feedback, Physical Power Key, Physical Volume Key, Smart Key, Wi-Fi: 2.4 GHz / 5 GHz, Voice Codec: WCDMA - AMR-NB, GSM / GPRS - FR / EFR / HR / AMR-NB', 'Important Apps': 'Hangouts, Gmail, YouTube, Play Store', 'GPS Type': 'A-GPS, GLONASS', 'Audio Formats': 'MP3, MID, AMR, 3GP, MP4, M4A, AAC, WAV, OGG, FLAC, MKV', 'Video Formats': '3GP, MP4, WEBM, MKV', 'Battery Capacity': '3000 mAh', 'Battery Type': 'Li-Polymer', 'Width': '71 mm', 'Height': '145.5 mm', 'Depth': '7.45 mm', 'Weight': '153 g', 'Warranty Summary': 'Brand Warranty of 1 Year Available for Mobile, 6 Months for Battery and Charger, 3 Months for Data Cable', 'Warranty Service Type': 'Authorised Service Centre', 'Covered in Warranty': 'Manufacturing Defects', 'Not Covered in Warranty': 'Physical Damage'}",29999
