Name,Stars,Ratings,Reviews,Specifications,Price
"Gome C7 (Black, 16 GB)  (2 GB RAM)",4.1,56 Ratings,4 Reviews,"{'In The Box': 'Usb cable, User Manual, Handset, Earphone, Adapter', 'Model Number': 'C7', 'Model Name': 'C7', 'Color': 'Black', 'Browse Type': 'Smartphones', 'SIM Type': 'Dual Sim', 'Hybrid Sim Slot': 'No', 'Touchscreen': 'Yes', 'OTG Compatible': 'No', 'Additional Content': 'No', 'Display Size': '13.84 cm (5.45 inch)', 'Resolution': '1280 x 720$$Pixels', 'Resolution Type': 'HD+', 'Operating System': 'Android Oreo Android 8.1', 'Processor Core': 'Quad Core', 'Primary Clock Speed': '1.5 GHz', 'Internal Storage': '16 GB', 'RAM': '2 GB', 'Memory Card Slot Type': 'Dedicated Slot', 'Primary Camera': '13MP Rear Camera', 'Dual Camera Lens': 'Primary Camera', 'Network Type': '3G, 4G, 2G', 'Supported Networks': 'GSM, 4G LTE', 'Battery Capacity': '3000 mAh', 'Warranty Summary': '1 Year Warranty'}",4990
"Tecno Camon i 2x (Blue, 64 GB)  (4 GB RAM)",4.6,92 Ratings,7 Reviews,"{'In The Box': 'Hheadset, SIM ejector tool, Charger, protective Back cover, Data Cable, User Guide,', 'Model Number': 'Camon i 2x', 'Model Name': 'Camon i 2x', 'Color': 'Blue', 'Browse Type': 'Smartphones', 'SIM Type': 'Dual Sim', 'Hybrid Sim Slot': 'No', 'Touchscreen': 'Yes', 'OTG Compatible': 'Yes', 'Quick Charging': 'No', 'Display Size': '15.75 cm (6.2 inch)', 'Resolution': '720x1500 Pixels', 'Operating System': 'Android Oreo 8.1', 'Processor Core': 'Octa Core', 'Primary Clock Speed': '2 GHz', 'Internal Storage': '64 GB', 'RAM': '4 GB', 'Memory Card Slot Type': 'Dedicated Slot', 'Primary Camera Available': 'Yes', 'Primary Camera': '13MP + 5MP', 'Primary Camera Features': 'AI Beauty, Panorama, Bokeh mode', 'Secondary Camera Available': 'Yes', 'Secondary Camera': '16MP Front Camera', 'Secondary Camera Features': 'AI Beauty, Bokeh mode', 'Flash': 'Both side Flash', 'HD Recording': 'Yes', 'Dual Camera Lens': 'Primary Camera', 'Call Wait/Hold': 'Yes', 'Conference Call': 'Yes', 'Video Call Support': 'Yes', 'Call Divert': 'Yes', 'Phone Book': 'Yes', 'Call Timer': 'Yes', 'Speaker Phone': 'Yes', 'Speed Dialing': 'Yes', 'Network Type': '3G, 4G VOLTE, 2G', 'Supported Networks': 'GSM, 4G VoLTE', 'Micro USB Port': 'Yes', 'Mini USB Port': 'Yes', 'Wi-Fi': 'Yes', 'Wi-Fi Hotspot': 'Yes', 'USB Tethering': 'Yes', 'USB Connectivity': 'Yes', 'Audio Jack': '3.5 mm', 'Smartphone': 'No', 'Touchscreen Type': 'Yes', 'SIM Size': 'Nano', 'Java Application': 'Yes', 'Removable Battery': 'No', 'JAVA Support': 'Yes', 'SMS': 'Yes', 'Keypad': 'Yes', 'Voice Input': 'Yes', 'Graphics PPI': '269 PPI', 'Predictive Text Input': 'Yes', 'Sensors': 'L-Sensor, FINGERPRINT SENSOR, G-Sensor, Face unlock', 'Series': 'Camon', 'FM Radio': 'Yes', 'FM Radio Recording': 'Yes', 'Battery Capacity': '3750 mAh', 'Warranty Summary': '12+1 month warranty provided by the manufacturer'}",14074
"Redmi 6 Pro (Red, 64 GB)  (4 GB RAM)",4.3,"9,789 Ratings",683 Reviews,"{'In The Box': 'User Guide, SIM Insertion Tool, Back Cover, Warranty Card, USB Cable, Handset, Adapter', 'Model Number': 'M1805D1SI', 'Model Name': 'Redmi 6 Pro', 'Color': 'Red', 'Browse Type': 'Smartphones', 'SIM Type': 'Dual Sim', 'Hybrid Sim Slot': 'No', 'Touchscreen': 'Yes', 'OTG Compatible': 'Yes', 'SAR Value': 'Head - 0.964W/kg, Body - 0.780W/kg', 'Display Size': '14.83 cm (5.84 inch)', 'Resolution': '1080 x 2280 pixels', 'Resolution Type': 'Full HD+', 'Operating System': 'Android Oreo 8.1', 'Processor Type': 'Qualcomm Snapdragon 625', 'Processor Core': 'Octa Core', 'Primary Clock Speed': '2 GHz', 'Internal Storage': '64 GB', 'RAM': '4 GB', 'Expandable Storage': '256 GB', 'Supported Memory Card Type': 'microSD', 'Memory Card Slot Type': 'Dedicated Slot', 'Primary Camera Available': 'Yes', 'Primary Camera': '12MP + 5MP', 'Primary Camera Features': 'Burst Mode, Electronic Image Stabilization, PDAF Phase Focus, AI Portrait Mode, Auto HDR, Background Blurring, AI Dual Camera, Standard HDR, Nightscape Optimization, f/2.2 Aperture', 'Secondary Camera Available': 'Yes', 'Secondary Camera': '5MP Front Camera', 'Secondary Camera Features': 'Selfie Timer, AI Beautify, AI Portrait Mode, Single Camera Background Blurring, HDR', 'Flash': 'Rear LED Flash', 'Dual Camera Lens': 'Primary Camera', 'Network Type': '3G, 4G VOLTE, 4G, 2G', 'Supported Networks': 'GSM, WCDMA, 4G VoLTE, 4G LTE, UMTS', 'Internet Connectivity': '4G, 3G, Wi-Fi', '3G': 'Yes', 'Wi-Fi': 'Yes', 'Infrared': 'Yes', 'USB Connectivity': 'Yes', 'Smartphone': 'Yes', 'Sensors': 'Fingerprint Sensor, Gyroscope, Infrared, Proximity Sensor, Accelerometer, Ambient Light Sensor, E-compass', 'Other Features': 'Face Unlock, Stock Android Oreo 8.1, IR Blaster, 2.0 GHz Processor with 14nm Architecture', 'Battery Capacity': '4000 mAh', 'Width': '71.68 mm', 'Height': '149.33 mm', 'Depth': '8.75 mm', 'Weight': '178 g', 'Warranty Summary': 'Brand Warranty of 1 Year Available for Mobile and 6 Months for Battery and Accessories'}",10989
"OPPO A9 2020 (Space Purple, 128 GB)  (4 GB RAM)",4.4,"2,227 Ratings",212 Reviews,"{'In The Box': 'Handset, Adapter, Headset, Micro USB Cable, Important Info. Booklet with Warranty Card, Quick Start Guide, Sim Card Tool, Protective Film, Pre-applied, Case', 'Model Number': 'CPH1937', 'Model Name': 'A9 2020', 'Color': 'Space Purple', 'Browse Type': 'Smartphones', 'SIM Type': 'Dual Sim', 'Hybrid Sim Slot': 'No', 'Touchscreen': 'Yes', 'OTG Compatible': 'Yes', 'Sound Enhancements': 'Dolby Atmos and Dual Stereo Speakers', 'Display Size': '16.51 cm (6.5 inch)', 'Resolution': '1600 x 720 Pixels', 'GPU': 'Adreno 610', 'Display Type': 'TFT-LCD', 'Display Colors': '16M', 'Other Display Features': 'Touch Panel Technology: In-cell, Narrow Frame - Upper Border: 2.44mm, Left and Right Border: 1.98mm, Lower Border: 6.6mm, Screen Ratio: 89.0%, Screen Contrast: 1500:1, Color Saturation: Typical 71%, Maximum Brightness: 480nits, Touch Panel Glass Type: GG3+, TYPE-C USB 2.0', 'Operating System': 'Android Pie 9', 'Processor Type': 'Qualcomm SM6125', 'Processor Core': 'Octa Core', 'Primary Clock Speed': '1.8 GHz', 'Secondary Clock Speed': '2 GHz', 'Internal Storage': '128 GB', 'RAM': '4 GB', 'Memory Card Slot Type': 'Dedicated Slot', 'Primary Camera Available': 'Yes', 'Primary Camera': '48MP + 8MP + 2MP + 2MP', 'Primary Camera Features': 'Ultra Wide Quad Camera, Sensor Type: 48MP CMOS/S5KGM1SP/OV48B, 8MP COMS/Hi846/OV8856, 2MP CMOS/OV02A1B/GC02M0, 2MP CMOS/GC02M0/OV02A1B, Maximum Zoom Multiples: 10X, Aperture: 48MP (f/1.8) + 8MP (f/2.25) + 2MP (f/2.4) + 2MP (f/2.4), Focal Length: 48MP (4.71mm) + 8MP (1.66mm) + 2MP (1.77mm) + 2MP (f1.77mm), Lens Number: 48MP (6P) + 8MP (5P) + 2MP (3P) + 2MP (3P)', 'Secondary Camera Available': 'Yes', 'Secondary Camera': '16MP Front Camera', 'Secondary Camera Features': 'Sensor Sizes/Pixel Data - 1/3.1inch, 1.0micrometer, Sensor Type: S5K3P9SP04, Wide Angle of Front: 79Degree, Aperture: F2.0, Focal Length: 3.42mm, Lens Number: 5P', 'Flash': 'Rear LED Flash', 'Frame Rate': 'Front Camera Video: 1080P/720P at 30 fps', 'Dual Camera Lens': 'Primary Camera', 'Network Type': '4G VOLTE, 4G, 3G, 2G', 'Supported Networks': '4G VoLTE, UMTS, GSM, 4G LTE, WCDMA, CDMA', 'Internet Connectivity': '4G, 3G, Wi-Fi, EDGE, GPRS', '3G Speed': 'HSPA+', 'GPRS': 'Yes', 'Micro USB Port': 'Yes', 'Micro USB Version': '2', 'Bluetooth Support': 'Yes', 'Bluetooth Version': 'v5.0', 'Wi-Fi': 'Yes', 'Wi-Fi Version': '802.11a/b/g/n/ac', 'USB Connectivity': 'Yes', 'EDGE': 'Yes', 'Audio Jack': '3.5mm', 'Smartphone': 'Yes', 'Touchscreen Type': 'Capacitive Screen, Multi-touch', 'SIM Size': 'Dual Nano SIM', 'User Interface': 'ColorOS 6.0.1', 'Removable Battery': 'No', 'Graphics PPI': '269 PPI', 'Ringtones Format': 'MP3/AMR/APE/OGG/FLAC/WAV/MIDI/WMA', 'Other Features': 'Face Recognition, Split Screen (Specific Apps), Clone Apps, Night Shield, Sensor Hub, Game Acceleration (Specific Apps), CPU Technology - 11nm, ROM Technology: UFS 2.1, Energy Density - 696 Wh/L, Charge Speed/Power - 5V 2A, 10W, WLAN 2.4G, WLAN 5.1G, WLAN 5.8G, WLAN Display, Game Boost 2.0, 4G+, 64 bits Processor, Video Stability, Ultra Night Mode 2.0, Reverse Charging', 'FM Radio': 'Yes', 'Audio Formats': 'MP3/AAC/APE/AMR/WAV/MID/OGG/FLAC/WMA', 'Video Formats': 'AVI/3GP/MP4/WMV/MKV/MOV/ASF/FLV', 'Battery Capacity': '5000 mAh', 'Width': '75.6 mm', 'Height': '163.6 mm', 'Depth': '9.1 mm', 'Weight': '195 g', 'Warranty Summary': 'Brand Warranty of 1 Year Available for Mobile and 6 Months for Accessories'}",14990
"TECNO I5 (SPACE GREY, 16 GB)  (2 GB RAM)",4.4,16 Ratings,2 Reviews,"{'In The Box': '1 Unit (1 each of GSM HANDSET,BATTERY,AC ADAPTER,USB CABLE,HANDS FREE,USER MANUAL,WARRANTY CARD, Fingerprint Sensor', 'Model Number': 'I5', 'Model Name': 'I5', 'Color': 'SPACE GREY', 'Browse Type': 'Smartphones', 'SIM Type': 'Dual Sim', 'Hybrid Sim Slot': 'Yes', 'Touchscreen': 'Yes', 'OTG Compatible': 'YES', 'Display Size': '13.97 cm (5.5 inch)', 'Resolution': '1280 x 720$$Pixels', 'Operating System': 'Android Nougat 7.0', 'Primary Clock Speed': '1.44 GHz', 'Internal Storage': '16 GB', 'RAM': '2 GB', 'Memory Card Slot Type': 'Dedicated Slot', 'Primary Camera': '13MP Rear Camera', 'Network Type': '4G VOLTE', 'Supported Networks': 'GSM, 4G LTE, UMTS', 'Battery Capacity': '4000 mAh', 'Warranty Summary': '1 YEAR'}",5521
"I Kall K700 (Red, 32 GB)  (4 GB RAM)",3.5,283 Ratings,30 Reviews,"{'In The Box': 'Handset, Battery, Charger, User Manual', 'Model Number': 'K 700', 'Model Name': 'K700', 'Color': 'Red', 'Browse Type': 'Smartphones', 'SIM Type': 'Dual Sim', 'Hybrid Sim Slot': 'Yes', 'Touchscreen': 'Yes', 'OTG Compatible': 'true', 'Display Size': '15.9 cm (6.26 inch)', 'Resolution': '480 x 1014$$pixel', 'Operating System': 'Android Marshmallow 6.0', 'Processor Core': 'Quad Core', 'Primary Clock Speed': '1.3 GHz', 'Internal Storage': '32 GB', 'RAM': '4 GB', 'Memory Card Slot Type': 'Dedicated Slot', 'Primary Camera Available': 'Yes', 'Primary Camera': '5MP Rear Camera', 'Primary Camera Features': 'Auto focus, Low light sensor, Continuous shots', 'Secondary Camera Available': 'Yes', 'Secondary Camera Features': 'Filters, Low light capture, Night mode', 'Dual Camera Lens': 'Primary Camera', 'Call Wait/Hold': 'Yes', 'Conference Call': 'Yes', 'Video Call Support': 'Yes', 'Call Divert': 'Yes', 'Phone Book': 'Yes', 'Speaker Phone': 'Yes', 'Network Type': '4G VOLTE, 3G, 2G', 'Supported Networks': '4G VoLTE, GSM', 'Bluetooth Support': 'Yes', 'Wi-Fi': 'Yes', 'Wi-Fi Hotspot': 'Yes', 'Audio Jack': '3.5', 'Smartphone': 'Yes', 'SIM Size': 'Micro', 'Social Networking Phone': 'Yes', 'Instant Message': 'Yes', 'Business Phone': 'Yes', 'Removable Battery': 'Yes', 'SMS': 'Yes', 'Battery Capacity': '3000 mAh', 'Width': '17 mm', 'Height': '14 mm', 'Depth': '10 mm', 'Weight': '0.15 g', 'Warranty Summary': 'Brand Warranty of 1 Year Available for Mobile and 6 Months for Accessories'}",4999
"Redmi Y2 (Dark Grey, 64 GB)  (4 GB RAM)",4.4,"25,225 Ratings","1,824 Reviews","{'In The Box': 'Handset, Power adapter, USB Cable, SIM Eject tool, Warranty card, User guide, Clear soft case', 'Model Number': 'MZB6305IN/M1803E61', 'Model Name': 'Redmi Y2', 'Color': 'Dark Grey', 'Browse Type': 'Smartphones', 'SIM Type': 'Dual Sim', 'Hybrid Sim Slot': 'No', 'Touchscreen': 'Yes', 'OTG Compatible': 'Yes', 'Sound Enhancements': 'Speaker: Single (Bottom Opening), 2 Microphones (For Noise Cancellation)', 'SAR Value': 'Head - 1.115W/kg, Body - 1.238W/kg', 'Display Size': '15.21 cm (5.99 inch)', 'Resolution': '1440 x 720 pixels', 'Resolution Type': 'HD+', 'GPU': 'Adreno 506', 'Display Type': 'IPS (In-cell)', 'Other Display Features': 'Contrast Ratio: 1000:1', 'Operating System': 'Android Oreo 8.0', 'Processor Type': 'Qualcomm Snapdragon 625', 'Processor Core': 'Octa Core', 'Primary Clock Speed': '2 GHz', 'Operating Frequency': 'GSM: B2, B3, B5, B8, WCDMA: B1, B2, B5, B8, LTE TDD: B40, B41, LTE FDD: B1, B3, B5', 'Internal Storage': '64 GB', 'RAM': '4 GB', 'Expandable Storage': '256 GB', 'Supported Memory Card Type': 'microSD', 'Memory Card Slot Type': 'Dedicated Slot', 'Primary Camera Available': 'Yes', 'Primary Camera': '12MP + 5MP', 'Primary Camera Features': 'Microns Pixel Size: 1.25 (12MP) + 1.12 (5MP), Primary 5P Lens, Secondary 3P Lens, PDAF, Aperture: f/2.2 (12MP) + f/2.2 (5MP)', 'Secondary Camera Available': 'Yes', 'Secondary Camera': '16MP Front Camera', 'Secondary Camera Features': 'Front Light, Front Camera Pixel Size: 1.0 Microns, Aperture: f2.0', 'Flash': 'Rear Flash', 'Dual Camera Lens': 'Primary Camera', 'Conference Call': 'Yes', 'Phone Book': 'Yes', 'Speaker Phone': 'Yes', 'Network Type': '3G, 4G, 2G', 'Supported Networks': 'GSM, WCDMA, 4G LTE', 'Micro USB Port': 'Yes', 'Bluetooth Support': 'Yes', 'Bluetooth Version': '4.2', 'Wi-Fi': 'Yes', 'Wi-Fi Version': '802.11b/g/n', 'Wi-Fi Hotspot': 'Yes', 'USB Tethering': 'Yes', 'USB Connectivity': 'Yes', 'Audio Jack': '3.5mm', 'Map Support': 'Google Maps', 'GPS Support': 'Yes', 'Smartphone': 'Yes', 'SIM Size': 'Nano SIM + Nano SIM', 'Social Networking Phone': 'Yes', 'Instant Message': 'Yes', 'MMS': 'Yes', 'SMS': 'Yes', 'Keypad': 'No', 'Graphics PPI': '269 PPI', 'Sensors': 'Fingerprint Sensor, Ambient Light Sensor, Proximity Sensor, E-compass, Accelerometer, Gyroscope', 'Other Features': 'Charger: 5V/2A, Body: Plastic Back, 14nm Architecture, IR Blaster', 'GPS Type': 'GLONASS, BeiDou', 'Battery Capacity': '3080 mAh', 'Dual Battery': 'No', 'Width': '77.26 mm', 'Height': '160.73 mm', 'Depth': '8.1 mm', 'Weight': '168 g', 'Warranty Summary': 'Brand Warranty of 1 Year Available for Mobile and 6 Months for Accessories', 'Domestic Warranty': '1 Year', 'International Warranty': '1 Year'}",10999
"OPPO F15 (Unicorn White, 128 GB)  (8 GB RAM)",4.4,"4,430 Ratings",460 Reviews,"{'In The Box': 'Handset, Headset, USB Cable, Adapter, SIM Card Pin, Protective Case, Quick Guide, Warranty Card', 'Model Number': 'CPH2001', 'Model Name': 'F15', 'Color': 'Unicorn White', 'Browse Type': 'Smartphones', 'SIM Type': 'Dual Sim', 'Hybrid Sim Slot': 'No', 'Touchscreen': 'Yes', 'OTG Compatible': 'Yes', 'Sound Enhancements': 'Dirac Audio, Dual Mic Noise Suppression', 'SAR Value': 'Head: 1.20 W/kg, Body: 0.55 W/kg', 'Display Size': '16.26 cm (6.4 inch)', 'Resolution': '2400 x 1080 Pixels', 'Resolution Type': 'Full HD+', 'GPU': 'ARM Mali G72 MP3 900 MHz', 'Display Type': 'AMOLED', 'Other Display Features': 'Screen Proportion: 20:9, Upper Frame: 2.32mm, Left and Right Frame: 1.67mm, Lower Frame: 5.2mm, Screen Ratio: 90.8%, Color Gamut: 100% NTSC, 104% NTSC DCI - P3, Color Contrast: 1000000:1, Color Saturation: Typical Value 100%, Maximum Screen Brightness: Typical Value 430nit, Corning Gorilla Glass 5, Multi-touch: 10, Oleophobic Layer, Oleophobic Layer on Film, Screen Refresh Rate: 60Hz, Touch Sampling Rate: 135Hz, TUV Rheinland Eye Comfort Certification, No Stroboscopic Eye Protection', 'Operating System': 'Android Pie 9', 'Processor Type': 'Helio P70', 'Processor Core': 'Octa Core', 'Primary Clock Speed': '2.1 GHz', 'Secondary Clock Speed': '2 GHz', 'Operating Frequency': 'GSM: 850/900/1800/1900 MHz, WCDMA: B1/B5/B8, FDD-LTE: B1/B3/B5/B8, TD-LTE: B38/B40/B41', 'Internal Storage': '128 GB', 'RAM': '8 GB', 'Expandable Storage': '256 GB', 'Supported Memory Card Type': 'microSD', 'Memory Card Slot Type': 'Dedicated Slot', 'Primary Camera Available': 'Yes', 'Primary Camera': '48MP + 8MP + 2MP + 2MP', 'Primary Camera Features': '48MP AI Quad Cam, Sensor Sizes/Pixel Size: Main 1/2.25inch, 0.8micrometer, Secondary Wide Angle: 1/4inch, 1.12 micrometer, 2M 1/5inch, 1.75micrometer, Sensor Type: CMOS, Zoom Mode: Main - 10X Digital Zoom, Wide Angle - 2X Digital Zoom, Aperture: Main - f/1.79, Wide Angle - f/2.25, Portrait and Mono - f/2.4, Focal Length: Main - 4.71mm, Wide Angle - 1.66mm, Portrait and Mono - 1.77mm, Wide Angle: Main - 79Degree, Wide Angle - 119 Degree, Portrait and Mono - 88.8Degree, Consecutive Shooting: Yes (20 Photos), Macro Lens: Back 3CM Macro Camera, EIS Stabilization, Lens Glass Material: GG5, Corning Gorilla Glass 5, Photo Size: 8000 x 6000 (FHD+ Mode), 4000 x 3000 (Standard Mode), Ultra Clear Mode 48MP, Photo, Video, Professional Mode, Panorama, Portrait, Night Scene, Time-lapse Photography, Slow Motion, Macro, Video Stabilization, AI Scene Recognition, Full Light for Shooting Video, MP4 Video Format, Anti-shake Video, Ultra Night Mode 2.0', 'Secondary Camera Available': 'Yes', 'Secondary Camera': '16MP Front Camera', 'Secondary Camera Features': 'Camera Structure: Water-drop, Sensor Type: CMOS (4-in-1 Pixel Technology), Sensor Size/Pixel Size: 1/3.1inch, 1.0micrometer, Focal Length: 3.54mm, Wide Angle of Front Lens: 77Degree, Flashlight Aperture: f/2.0, Lens Structure: 5P, Focusing Type: Focus, Lens Glass Material: GG5, Corning Gorilla Glass 5, Photo Size: 4608 x 3456, MP4 Video Format', 'Frame Rate': 'Rear Camera: Slow-motion Video - 1080p at 120fps, 720p at 240fps, Rear Camera: 1080P at 30fps, 720P at 30fps, Front Camera: 1080P/720P at 30fps, Rear Camera Default: 1080P at 30fps, Front Camera Default: 720P at 30fps fps', 'Dual Camera Lens': 'Primary Camera', 'Video Call Support': 'Yes', 'Call Records': 'Yes', 'Network Type': '4G VOLTE, 4G, 3G, 2G', 'Supported Networks': '4G VoLTE, 4G LTE, UMTS, WCDMA, CDMA, GSM', 'Internet Connectivity': '4G, 3G, Wi-Fi, EDGE, GPRS', '3G Speed': 'HSPA+', 'GPRS': 'Yes', 'Bluetooth Support': 'Yes', 'Bluetooth Version': 'v4.2', 'Wi-Fi': 'Yes', 'Wi-Fi Version': '802.11a/b/g/n/ac', 'Wi-Fi Hotspot': 'Yes', 'EDGE': 'Yes', 'Audio Jack': '3.5mm', 'Map Support': 'Google Maps', 'GPS Support': 'Yes', 'Touchscreen Type': 'Multi-touch Capacitive Screen', 'SIM Size': 'Dual Nano SIM', 'User Interface': 'ColorOS 6.1.2', 'Graphics PPI': '408 PPI', 'Sensors': 'In-screen Fingerprint, Magnetic Induction Sensor, Light Sensor, Proximity Sensor, G - Sensor/Acceleration Sensor, Gyroscope, Pedometer', 'Ringtones Format': 'MP3, AMR, APE, OGG, FLAC, WAV, MIDI, WMA', 'Other Features': ""Split Screen,Apps with Game Boost (Popular Games), Google Lens, Data Backup, Oshare (Indian Phone Number's Recognition), Apps Lock, Office Tools: Office Suite, Firewall: Support Call/Message Firewall, Files Zip/Unzip, File Encryption, 64bit Processor, Baseband Structure: 4 (Cortex A73) + 4 (Cortex A53), 12nm Processor, ROM Technology: UFS2.1, VoLTE, 4G Data Rate: 75Mbps (Carrier Model 150mbps), Downlink: 150Mbps (Carrrier Model 300Mbps), WLAN: 2.4G, 5.1G, 5.8G WLAN Display, USB 2.0, VOOC Flash Charge 3.0, Reverse Charging, Standard Charge Power: 20W, Type-C USB Jack, Pin Number (USB): 14, Face Recognition, Single Channel,Eye Protection Mode, Clone App, Banner Call, Game Boost, Kids Space, Text Input, Support HD, Webpage Video Play, World Time, Lock Screen Clock, OPPO Share, E-compass, E-book, Screen Recording, Background Freeze, Caller Avatar, Call Background, Contact Grouping, Group Customization, Import/Export Messages, Number of Ram Channels: 2, Fingerprint Reset password, Sleek Design, Flashlight"", 'Important Apps': 'Bulit-in Browser: Chrome, Opera, OPPO Browsers', 'GPS Type': 'A-GPS, GLONASS, BeiDou', 'FM Radio': 'No', 'Audio Formats': 'AAC, APE, FLAC, AMR, MID, MP3, OGG, WAV, WMA, MKA', 'Video Formats': 'MP4, 3GP, ASF, AVI, FLV, M2TS, MKV, MPG, TS, WEBM, WMV', 'Battery Capacity': '4000 mAh', 'Width': '73.3 mm', 'Height': '160.2 mm', 'Depth': '7.9 mm', 'Weight': '172 g', 'Warranty Summary': 'Brand Warranty of 1 Year Available for Mobile Including Battery and 6 Months for Accessories'}",19990
"Vivo V5 Plus (Gold, 64 GB)  (4 GB RAM)",4.3,"4,469 Ratings",848 Reviews,"{'In The Box': 'Earphone, User Manual, microUSB to USB Cable, USB Power Adapter, SIM Ejector Pin, Handset, Screen Guard (1 applied,1 backup), Silicon Back Cover', 'Model Name': 'V5 Plus', 'Color': 'Gold', 'Browse Type': 'Smartphones', 'SIM Type': 'Dual Sim', 'Hybrid Sim Slot': 'No', 'Touchscreen': 'Yes', 'OTG Compatible': 'Yes', 'Quick Charging': 'Yes', 'Sound Enhancements': 'AK4376 Hi-Fi Audio Chip, SNR as High as 115 dB', 'Display Size': '13.97 cm (5.5 inch)', 'Resolution': '1920 x 1080 pixels', 'Resolution Type': 'Full HD', 'Other Display Features': 'Smart Split 2.0, 1.78 mm Ultra-slim Bezel and 5th Generation Corning Gorilla Glass, Eye Protection Mode', 'Operating System': 'Android Marshmallow 6', 'Processor Type': 'Qualcomm Snapdragon 625 64-bit Octa Core 2 GHz', 'Processor Core': 'Octa Core', 'Primary Clock Speed': '2 GHz', 'Operating Frequency': 'GSM - Bands (2 / 3 / 5 / 8); WCDMA - Bands (1 / 5 / 8); 4G LTE (FDD) - Bands (1 / 3 / 5 / 7 / 8), LTE (TDD) - Band 40', 'Internal Storage': '64 GB', 'RAM': '4 GB', 'Call Log Memory': 'Yes', 'Primary Camera Available': 'Yes', 'Primary Camera': '16MP Rear Camera', 'Primary Camera Features': 'Anti Shake Mode, Night Mode, Sport Mode', 'Secondary Camera Available': 'Yes', 'Secondary Camera': '20MP + 8MP Dual Front Camera', 'Secondary Camera Features': 'Front Secondary Camera: 8 MP, Bokeh Mode, Selfies: Bright and Clear, Color Accuracy, Detail gets Captured, Group Selfie, Individual Selfie, Moonlight Glow, Shot Refocus, Dual Front Camera Portrait Shot, Sony IMX376 Flagship Standard Sensor, Face Beauty 6.0', 'HD Recording': 'Yes', 'Full HD Recording': 'Yes', 'Video Recording': 'Yes', 'Video Recording Resolution': '3840 x 2160', 'Dual Camera Lens': 'Secondary Camera', 'Phone Book': 'Yes', 'Network Type': '3G, 4G, 2G', 'Supported Networks': '4G LTE', 'Internet Connectivity': '4G, 3G', '3G': 'Yes', 'Pre-installed Browser': 'Android', 'Micro USB Port': 'Yes', 'USB Connectivity': 'Yes', 'Smartphone': 'Yes', 'SMS': 'Yes', 'Upgradable Operating System': 'Android Nougat 7.0', 'Other Features': 'Dual Fast Charging Engine, Funtouch OS 3.0 Based on Android 6.0, Unibody Metal Design, U Type Antenna, Fingerprint Scanner Unlocking in 0.2 sec, Double Tap on Fingerprint Scanner for Quick Access to Applications', 'Audio Formats': 'AMR, MIDI, OGG, FLAC, WMA, WAV, APE, MP3', 'Video Formats': 'MP4, 3GP, AVI, MKV, WEBM, WMV, ASF', 'Battery Capacity': '3055 mAh', 'Width': '74 mm', 'Height': '152.58 mm', 'Warranty Summary': 'Brand Warranty of 1 Year Available for Mobile and 6 Months for Accessories'}",25990
"mPhone 7s (Gold, 32 GB)  (3 GB RAM)",2.6,18 Ratings,2 Reviews,"{'In The Box': 'Transparent Case, Earphone, Warranty Card, Screen Guard, User Cable, Handset, Travel Adapter, Battery', 'Model Number': '7s', 'Model Name': '7s', 'Color': 'Gold', 'Browse Type': 'Smartphones', 'SIM Type': 'Dual Sim', 'Hybrid Sim Slot': 'Yes', 'Touchscreen': 'Yes', 'OTG Compatible': 'Yes', 'Quick Charging': 'Yes', 'Display Size': '13.97 cm (5.5 inch)', 'Resolution': '720 x 1280 Pixels', 'Operating System': 'Android Nougat 7.0.1', 'Processor Core': 'Quad Core', 'Primary Clock Speed': '1.5 GHz', 'Internal Storage': '32 GB', 'RAM': '3 GB', 'Memory Card Slot Type': 'Hybrid Slot', 'Primary Camera Available': 'Yes', 'Primary Camera': '13MP Rear Camera', 'Primary Camera Features': '13MP + 5MP, Dual Camera', 'Optical Zoom': 'Yes', 'Secondary Camera Available': 'Yes', 'Secondary Camera': '13MP Front Camera', 'Secondary Camera Features': '13MP', 'Flash': 'Yes', 'HD Recording': 'Yes', 'Full HD Recording': 'Yes', 'Video Recording': 'Yes', 'Image Editor': 'Yes', 'Dual Camera Lens': 'Primary Camera', 'Call Wait/Hold': 'Yes', 'Conference Call': 'Yes', 'Hands Free': 'Yes', 'Video Call Support': 'Yes', 'Call Divert': 'Yes', 'Phone Book': 'Yes', 'Call Timer': 'Yes', 'Speaker Phone': 'Yes', 'Speed Dialing': 'Yes', 'Network Type': '3G, 4G VOLTE, 2G', 'Supported Networks': 'GSM, 4G VoLTE', '3G': 'Yes', 'Bluetooth Support': 'Yes', 'Wi-Fi': 'Yes', 'Wi-Fi Hotspot': 'Yes', 'USB Tethering': 'Yes', 'Infrared': 'Yes', 'USB Connectivity': 'Yes', 'Audio Jack': '3.5mm', 'Smartphone': 'Yes', 'Touchscreen Type': 'Yes', 'SIM Size': 'Hybrid SIM', 'Keypad Type': 'Alphanumeric', 'User Interface': 'Yes', 'Social Networking Phone': 'Yes', 'Instant Message': 'Yes', 'Business Phone': 'Yes', 'Removable Battery': 'No', 'MMS': 'Yes', 'SMS': 'Yes', 'Keypad': 'No', 'Voice Input': 'Yes', 'Predictive Text Input': 'Yes', 'User Memory': '25.65', 'SIM Access': 'GSM', 'Upgradable Operating System': 'Yes', 'Series': '7s', 'Browser': 'Chrome', 'Battery Capacity': '3000 mAh', 'Width': '17 mm', 'Depth': '5 mm', 'Weight': '155 g', 'Warranty Summary': '1 Year', 'Warranty Service Type': '1 Year Manufacturer Warranty and 6 Month for Accessories', 'Covered in Warranty': 'Warranty of the product is limited', 'Not Covered in Warranty': 'Water damage, Physical damage', 'Domestic Warranty': '1 Year', 'International Warranty': '1 Year'}",7299
