Name,Stars,Ratings,Reviews,Specifications,Price
"iVooMi Me3S (Champagne Gold, 32 GB)  (3 GB RAM)",3.3,"11,664 Ratings","2,695 Reviews","{'In The Box': 'Handset, AC Power Adapter, USB Cable, User Manual, Warranty Card', 'Model Number': 'iV 501', 'Model Name': 'Me3S', 'Color': 'Champagne Gold', 'Browse Type': 'Smartphones', 'SIM Type': 'Dual Sim', 'Hybrid Sim Slot': 'No', 'Touchscreen': 'Yes', 'OTG Compatible': 'Yes', 'Additional Content': 'Toughend Glass', 'Display Size': '13.21 cm (5.2 inch)', 'Resolution': '1280 x 720 pixels', 'Resolution Type': 'HD', 'GPU': 'ARM Mali-T720 MPI; 650 MHz', 'HD Game Support': 'Yes', 'Display Colors': '16 M', 'Other Display Features': 'Toughed Glass with Feather Touch Feel, Full Lamination Display with Narrow Bazels & 2.5D Curved Glass with 460 nits Brightness, ShatterProof Display', 'Operating System': 'Android Nougat 7', 'Processor Type': 'MediaTek 6737 64-bit 1.3GHz', 'Processor Core': 'Quad Core', 'Primary Clock Speed': '1.3 GHz', 'Operating Frequency': 'GSM - 850, 900, 1800, 1900; UMT - 900, 2100; LTE:FDD - 850, 1800, 2100MHz, TDD - 2300, 2600', 'Internal Storage': '32 GB', 'RAM': '3 GB', 'Expandable Storage': '128 GB', 'Supported Memory Card Type': 'microSD', 'Memory Card Slot Type': 'Dedicated Slot', 'Phone Book Memory': 'Yes', 'Call Log Memory': 'Yes', 'SMS Memory': 'Yes', 'Primary Camera': '13MP Rear Camera', 'Primary Camera Features': 'Samsung 1.0um Sensor with 5 MP lens & f/2.0 aperture, Auto HDR Mode, Low light Photography, Beauty Mode, Panorama, Flash, Auto Focus', 'Optical Zoom': 'Yes', 'Secondary Camera Available': 'Yes', 'Secondary Camera': '8MP Front Camera', 'Secondary Camera Features': 'Front Flash, Samsung 1.12um Sensor With F/2.0 Aperture, Wide-Angle Lens, Beauty Mode', 'Flash': 'Front & Back Flash', 'HD Recording': 'Yes', 'Video Recording': 'Yes', 'Image Editor': 'Yes', 'Call Wait/Hold': 'Yes', 'Video Call Support': 'Yes', 'Call Divert': 'Yes', 'Phone Book': 'Yes', 'Call Timer': 'Yes', 'Network Type': '3G, 4G VOLTE, 2G', 'Supported Networks': 'GSM, WCDMA, 4G VoLTE', 'Internet Connectivity': '4G, 3G, Wi-Fi', 'GPRS': 'Yes', 'Pre-installed Browser': 'Chrome', 'Bluetooth Version': '4', 'Wi-Fi': 'Yes', 'Wi-Fi Version': '802.11 a/b/g/n', 'Wi-Fi Hotspot': 'Yes', 'USB Tethering': 'Yes', 'USB Connectivity': 'Yes', 'Audio Jack': '3.5 mm', 'Map Support': 'Google Maps', 'GPS Support': 'Yes', 'Smartphone': 'Yes', 'Touchscreen Type': 'Capacitive', 'SIM Size': 'Nano SIM', 'Instant Message': 'Yes', 'Business Phone': 'Yes', 'Removable Battery': 'Yes', 'SMS': 'Yes', 'Voice Input': 'Yes', 'Graphics PPI': '283 PPI', 'Predictive Text Input': 'Yes', 'User Memory': '27.6', 'SIM Access': 'Dual Standby', 'Sensors': 'Light Sensor, G-Sensor, Proximity Sensor', 'Supported Languages': 'Supports English, Hindi', 'Games': 'HD Games', 'Series': 'Me', 'Browser': 'Chrome', 'Ringtones Format': 'MP3', 'Other Features': 'Shatter Proof Display, Turbo Battery Power Saver Mode - Efficient Power Saving, System Speedup, Machine Learning', 'Important Apps': 'YouTube, Google Play Store, Flipkart', 'DLNA Support': 'Yes', 'Audio Formats': 'MP3 & All major formats', 'Music Player': 'Yes', 'Video Formats': 'MP4, 3GP, FLV & All Major Formats', 'Battery Capacity': '3000 mAh', 'Battery Type': 'Li-Ion', 'Warranty Summary': 'Brand Warranty of 1 Year Available for Mobile and 6 Months for Accessories', 'Warranty Service Type': 'Through Authorized service centers and if service center is not avialbale in city then can avail service by calling on iVooMi Customer support at +91 9335828282', 'Domestic Warranty': '1 Year'}",7800
"Moto X Play(With Turbo Charger) (White, 16 GB)  (2 GB RAM)",4.2,"60,983 Ratings","9,509 Reviews","{'In The Box': 'Handset, Turbo Charger, Headset, Guides', 'Model Number': 'XT1562', 'Model Name': 'Moto X Play(With Turbo Charger)', 'Color': 'White', 'Browse Type': 'Smartphones', 'SIM Type': 'Dual Sim', 'Hybrid Sim Slot': 'Yes', 'Touchscreen': 'Yes', 'OTG Compatible': 'Yes', 'Additional Content': 'Turbo Charger', 'Sound Enhancements': '3-mic Support', 'SAR Value': 'At the Head - 0.80 W/Kg, At the Body - 1.23 W/Kg', 'Display Size': '13.97 cm (5.5 inch)', 'Resolution': '1920 x 1080 Pixels', 'Resolution Type': 'Full HD', 'GPU': 'Adreno 405; 550 MHz', 'Other Display Features': 'Corning Gorilla Glass 3, 403 PPI', 'Operating System': 'Android Lollipop 5.1.1', 'Processor Type': 'Qualcomm Snapdragon 615', 'Processor Core': 'Octa Core', 'Primary Clock Speed': '1.7 GHz', 'Operating Frequency': 'GSM - 850, 900, 1800, 1900; UMTS - 2100; 4G - LTE Bands (1, 3, 5, 7, 8, 19, 20, 28, 38, 40, 41)', 'Internal Storage': '16 GB', 'RAM': '2 GB', 'Expandable Storage': '128 GB', 'Supported Memory Card Type': 'MicroSD', 'Memory Card Slot Type': 'Dedicated Slot', 'Phone Book Memory': 'Yes', 'Call Log Memory': 'Yes', 'SMS Memory': 'Yes', 'Primary Camera Available': 'Yes', 'Primary Camera': '21MP Rear Camera', 'Primary Camera Features': 'f/2.0 Aperture, Quick Capture, Tap Anywhere to Capture, Slow Motion Video, Burst Mode, Night Mode, Auto HDR, Panorama, Drag to Focus and Exposure, Closed Loop Processing', 'Secondary Camera Available': 'Yes', 'Secondary Camera': '5MP Front Camera', 'Flash': 'Dynamic CCT Dual LED', 'HD Recording': 'Yes', 'Full HD Recording': 'Yes', 'Video Recording': 'Yes', 'Video Recording Resolution': '1920 x 1080', 'Digital Zoom': 'Digital Zoom - 4x', 'Frame Rate': '30 fps', 'Phone Book': 'Yes', 'Network Type': '3G, 4G, 2G', 'Supported Networks': '4G LTE', 'Internet Connectivity': '4G, 3G, Wi-Fi, GPRS, EDGE', '3G': 'Yes', '3G Speed': 'HSPA+', 'GPRS': 'Yes', 'Pre-installed Browser': 'Android', 'Micro USB Port': 'Yes', 'Micro USB Version': '2', 'Bluetooth Support': 'Yes', 'Bluetooth Version': '4', 'Wi-Fi': 'Yes', 'Wi-Fi Version': '802.11 a/g/b/n', 'Wi-Fi Hotspot': 'Yes', 'NFC': 'Yes', 'USB Tethering': 'Yes', 'USB Connectivity': 'Yes', 'EDGE': 'Yes', 'Audio Jack': '3.5 mm', 'Map Support': 'Google Maps', 'GPS Support': 'Yes', 'Smartphone': 'Yes', 'SIM Size': 'Nano SIM', 'Removable Battery': 'No', 'SMS': 'Yes', 'User Memory': '8.29 GB', 'Sensors': 'Accelerometer, Ambient Light Sensor, eCompass, Hall Effect Sensor, Magnetometer, Proximity Sensor, Sensor Hub', 'Other Features': 'Curve: 8.9 - 10.9 mm, Water Repellent Coating', 'GPS Type': 'A-GPS, GLONASS, BeiDou', 'FM Radio': 'Yes', 'Audio Formats': 'MP3', 'Video Formats': 'MPEG4, H.264', 'Battery Capacity': '3630 mAh', 'Battery Type': 'Li-Ion', 'Width': '75 mm', 'Height': '148 mm', 'Weight': '169 g', 'Warranty Summary': 'Brand Warranty of 1 Year'}",17499
"ZOPO Color - X5.5 (Space Grey, 16 GB)  (3 GB RAM)",3.6,61 Ratings,12 Reviews,"{'In The Box': 'Travel Charger, Handset, Battery, Quick Guide', 'Model Number': 'Color - X5.5', 'Model Name': 'Color - X5.5', 'Color': 'Space Grey', 'Browse Type': 'Smartphones', 'SIM Type': 'Dual Sim', 'Hybrid Sim Slot': 'Yes', 'Touchscreen': 'Yes', 'OTG Compatible': 'Yes', 'Quick Charging': 'Yes', 'Additional Content': '5 Pin micro USB Data Cable, Handset, Battery, 3.5mm Earphone', 'Display Size': '13.97 cm (5.5 inch)', 'Resolution': '1280 x 720 Pixels', 'Operating System': 'Android Marshmallow 6', 'Processor Core': 'Quad Core', 'Primary Clock Speed': '1.3 GHz', 'Internal Storage': '16 GB', 'RAM': '3 GB', 'Supported Memory Card Type': 'microSD', 'Memory Card Slot Type': 'Hybrid Slot', 'Phone Book Memory': 'Yes', 'SMS Memory': 'UNLIMITED', 'Primary Camera': '8MP Rear Camera', 'Secondary Camera': '5MP Front Camera', 'Flash': 'Single LED', 'HD Recording': 'Yes', 'Conference Call': 'Yes', 'Hands Free': 'Yes', 'Video Call Support': 'Yes', 'Speaker Phone': 'Yes', 'Network Type': '3G, 4G VOLTE, 4G', 'Supported Networks': 'GSM, 4G VoLTE', 'Bluetooth Version': '4', 'Wi-Fi Version': '802.11 a/b/g/n', 'Audio Jack': '3.5 mm', 'Map Support': 'Google Map', 'Touchscreen Type': 'Capacitive screen', 'SIM Size': 'Micro SIM and Nano SIM', 'Instant Message': 'Yes', 'Business Phone': 'Yes', 'SMS': 'Yes', 'Graphics PPI': '267 PPI', 'SIM Access': 'Dual', 'Supported Languages': 'English, Hindi, Gujarati, Marathi, 35+ Indian Languagues', 'Games': 'Yes', 'Ringtones Format': 'MP4', 'Music Player': 'Yes', 'Battery Capacity': '2500 mAh', 'Battery Type': 'Li-Polymer', 'Talk Time': '15', 'Dual Battery': 'No', 'Weight': '166 g', 'Warranty Summary': '1 year manufacturer warranty for device and 6 months manufacturer warranty for in-box accessories including batteries from the date of purchase.', 'Domestic Warranty': '12 Months', 'International Warranty': '12 Months'}",4480
"OPPO A9 2020 (Space Purple, 128 GB)  (4 GB RAM)",4.4,"2,227 Ratings",212 Reviews,"{'In The Box': 'Handset, Adapter, Headset, Micro USB Cable, Important Info. Booklet with Warranty Card, Quick Start Guide, Sim Card Tool, Protective Film, Pre-applied, Case', 'Model Number': 'CPH1937', 'Model Name': 'A9 2020', 'Color': 'Space Purple', 'Browse Type': 'Smartphones', 'SIM Type': 'Dual Sim', 'Hybrid Sim Slot': 'No', 'Touchscreen': 'Yes', 'OTG Compatible': 'Yes', 'Sound Enhancements': 'Dolby Atmos and Dual Stereo Speakers', 'Display Size': '16.51 cm (6.5 inch)', 'Resolution': '1600 x 720 Pixels', 'GPU': 'Adreno 610', 'Display Type': 'TFT-LCD', 'Display Colors': '16M', 'Other Display Features': 'Touch Panel Technology: In-cell, Narrow Frame - Upper Border: 2.44mm, Left and Right Border: 1.98mm, Lower Border: 6.6mm, Screen Ratio: 89.0%, Screen Contrast: 1500:1, Color Saturation: Typical 71%, Maximum Brightness: 480nits, Touch Panel Glass Type: GG3+, TYPE-C USB 2.0', 'Operating System': 'Android Pie 9', 'Processor Type': 'Qualcomm SM6125', 'Processor Core': 'Octa Core', 'Primary Clock Speed': '1.8 GHz', 'Secondary Clock Speed': '2 GHz', 'Internal Storage': '128 GB', 'RAM': '4 GB', 'Memory Card Slot Type': 'Dedicated Slot', 'Primary Camera Available': 'Yes', 'Primary Camera': '48MP + 8MP + 2MP + 2MP', 'Primary Camera Features': 'Ultra Wide Quad Camera, Sensor Type: 48MP CMOS/S5KGM1SP/OV48B, 8MP COMS/Hi846/OV8856, 2MP CMOS/OV02A1B/GC02M0, 2MP CMOS/GC02M0/OV02A1B, Maximum Zoom Multiples: 10X, Aperture: 48MP (f/1.8) + 8MP (f/2.25) + 2MP (f/2.4) + 2MP (f/2.4), Focal Length: 48MP (4.71mm) + 8MP (1.66mm) + 2MP (1.77mm) + 2MP (f1.77mm), Lens Number: 48MP (6P) + 8MP (5P) + 2MP (3P) + 2MP (3P)', 'Secondary Camera Available': 'Yes', 'Secondary Camera': '16MP Front Camera', 'Secondary Camera Features': 'Sensor Sizes/Pixel Data - 1/3.1inch, 1.0micrometer, Sensor Type: S5K3P9SP04, Wide Angle of Front: 79Degree, Aperture: F2.0, Focal Length: 3.42mm, Lens Number: 5P', 'Flash': 'Rear LED Flash', 'Frame Rate': 'Front Camera Video: 1080P/720P at 30 fps', 'Dual Camera Lens': 'Primary Camera', 'Network Type': '4G VOLTE, 4G, 3G, 2G', 'Supported Networks': '4G VoLTE, UMTS, GSM, 4G LTE, WCDMA, CDMA', 'Internet Connectivity': '4G, 3G, Wi-Fi, EDGE, GPRS', '3G Speed': 'HSPA+', 'GPRS': 'Yes', 'Micro USB Port': 'Yes', 'Micro USB Version': '2', 'Bluetooth Support': 'Yes', 'Bluetooth Version': 'v5.0', 'Wi-Fi': 'Yes', 'Wi-Fi Version': '802.11a/b/g/n/ac', 'USB Connectivity': 'Yes', 'EDGE': 'Yes', 'Audio Jack': '3.5mm', 'Smartphone': 'Yes', 'Touchscreen Type': 'Capacitive Screen, Multi-touch', 'SIM Size': 'Dual Nano SIM', 'User Interface': 'ColorOS 6.0.1', 'Removable Battery': 'No', 'Graphics PPI': '269 PPI', 'Ringtones Format': 'MP3/AMR/APE/OGG/FLAC/WAV/MIDI/WMA', 'Other Features': 'Face Recognition, Split Screen (Specific Apps), Clone Apps, Night Shield, Sensor Hub, Game Acceleration (Specific Apps), CPU Technology - 11nm, ROM Technology: UFS 2.1, Energy Density - 696 Wh/L, Charge Speed/Power - 5V 2A, 10W, WLAN 2.4G, WLAN 5.1G, WLAN 5.8G, WLAN Display, Game Boost 2.0, 4G+, 64 bits Processor, Video Stability, Ultra Night Mode 2.0, Reverse Charging', 'FM Radio': 'Yes', 'Audio Formats': 'MP3/AAC/APE/AMR/WAV/MID/OGG/FLAC/WMA', 'Video Formats': 'AVI/3GP/MP4/WMV/MKV/MOV/ASF/FLV', 'Battery Capacity': '5000 mAh', 'Width': '75.6 mm', 'Height': '163.6 mm', 'Depth': '9.1 mm', 'Weight': '195 g', 'Warranty Summary': 'Brand Warranty of 1 Year Available for Mobile and 6 Months for Accessories'}",14990
"Gionee M7 Power (Black, 64 GB)  (4 GB RAM)",4.2,"2,866 Ratings",393 Reviews,"{'In The Box': 'Handset, Charger, Handsfree, Data Cable, User Guide, Warranty Card, Protective cover, Protective Film, SIM Tray Ejector', 'Model Number': 'M7 Power', 'Model Name': 'M7 Power', 'Color': 'Black', 'Browse Type': 'Smartphones', 'SIM Type': 'Dual Sim', 'Hybrid Sim Slot': 'Yes', 'Touchscreen': 'Yes', 'OTG Compatible': 'Yes', 'Display Size': '15.24 cm (6 inch)', 'Resolution': '1440 x 720 Pixels', 'Resolution Type': 'HD+', 'Display Type': 'IPS', 'Other Display Features': '18:9 Full View HD+ IPS Display with 2.5D Display with Gorilla Glass 3 Protection, 85% Screen to Body Ratio, 25% Brighter and 15% Wider Color Range than Normal IPS Display, Intellient Eye Protection', 'Operating System': 'Android Nougat 7.1', 'Processor Type': 'Qualcomm Snapdragon MSM8940 64-bit', 'Processor Core': 'Octa Core', 'Primary Clock Speed': '1.4 GHz', 'Internal Storage': '64 GB', 'RAM': '4 GB', 'Expandable Storage': '256 GB', 'Supported Memory Card Type': 'microSD', 'Memory Card Slot Type': 'Hybrid Slot', 'Primary Camera Available': 'Yes', 'Primary Camera': '13MP Rear Camera', 'Primary Camera Features': 'Three Dimentional Dynamic Picture, Auto Focus F2.0 Aperture, Night, Text Recongnisation, Translation, PicNote, Slow Motion, Time-lapse, Professional, Multiple Selfie, 3D Photo,\xa0 Panorama, Card Scanner, Back Light, Face Beauty', 'Secondary Camera Available': 'Yes', 'Secondary Camera': '8MP Front Camera', 'Secondary Camera Features': 'Fixed Focus F2.2 Aperture, Group Selfie, Boken Selfie', 'Flash': 'Rear LED Flash', 'Video Recording': 'Yes', 'Video Call Support': 'Yes', 'Network Type': '3G, 4G VOLTE, 4G, 2G', 'Supported Networks': 'GSM, WCDMA, 4G VoLTE, UMTS', 'Internet Connectivity': '4G, 3G, Wi-Fi', '3G': 'Yes', 'Bluetooth Support': 'Yes', 'Wi-Fi': 'Yes', 'Infrared': 'Yes', 'Map Support': 'Google Maps', 'GPS Support': 'Yes', 'Smartphone': 'Yes', 'SIM Size': 'Nano SIM and Nano SIM', 'SMS': 'Yes', 'Graphics PPI': '268 PPI', 'SIM Access': 'Dual-standby (4G + 2G)', 'Sensors': 'Multi Functional FingerPrint Sensor (Camera, Torch, Recorder)', 'Other Features': 'Battery with Smart Power Saving System, Metal Body Made from No.6 Series Aluminium, Stylish Diamond Cut / Laser Cut Flat Back Cover for Making it Slip Proof, Support Upto Three Whatsapp Account, Private Space 2.0, App Clone, Split Screen, Infrared Remote - Peel Remote, Standby Time: 625 hrs', 'FM Radio': 'Yes', 'Battery Capacity': '5000 mAh', 'Talk Time': '56 hrs', 'Width': '75.65 mm', 'Height': '156.35 mm', 'Depth': '8.6 mm', 'Weight': '199 g', 'Warranty Summary': 'Brand Warranty of 1 Year Available for Mobile and 6 Months for Accessories'}",16900
"Sony Xperia Z3+ (White, 32 GB)  (3 GB RAM)",3.8,585 Ratings,131 Reviews,"{'In The Box': 'Handset, Charger, USB Cable, Stereo Headset, User Guide, Screen Protector', 'Model Name': 'Xperia Z3+', 'Color': 'White', 'Browse Type': 'Smartphones', 'SIM Type': 'Single Sim', 'Sound Enhancements': 'S-Force, Clear Audio+, Clear Bass, DSEE HX (Digital Sound Enhancement Engine), xLoud Experience, High-resolution Audio, Stereo Recording', 'Display Size': '13.21 cm (5.2 inch)', 'Resolution': '1920 x 1080 Pixels', 'Resolution Type': 'Full HD', 'GPU': 'Adreno 430', 'Other Display Features': 'TRILUMINOS Display with X-Reality for Mobile, IPS Display', 'Operating System': 'Android Lollipop 5', 'Processor Type': 'Qualcomm Snapdragon 810 MSM8994', 'Processor Core': 'Octa Core', 'Primary Clock Speed': '2 GHz', 'Secondary Clock Speed': '1.5 GHz', 'Operating Frequency': 'GSM - 900, 1800, 1900; UMTS - 2100; 4G - LTE', 'Internal Storage': '32 GB', 'RAM': '3 GB', 'Expandable Storage': '128 GB', 'Supported Memory Card Type': 'MicroSD', 'Phone Book Memory': 'Yes', 'Call Log Memory': 'Yes', 'SMS Memory': 'Yes', 'Primary Camera Available': 'Yes', 'Primary Camera': '20.7MP Rear Camera', 'Primary Camera Features': '1/2.3 Exmor RS, ISO 12800 Photo / 3200 Video, Digital Zoom - 8x, HDR, Superior Auto, 25 mm Wide Angle G Lens, Sony Exmor R, SteadyShot with Intelligent Active Mode, Superior Auto Scene Recognition, Image Stabiliser, Geo-tagging, Xperia Camera Apps, F2.0 Aperture, Camera Apps (Style Portrait, AR Mask, Sound Photo', 'Secondary Camera Available': 'Yes', 'Secondary Camera': '5MP Front Camera', 'Secondary Camera Features': 'Sony Exmor R, 25 mm Wide Angle, Steadyshot with Intelligent Active Mode, Selfie, Superior Auto Scene Recognition, HDR, Xperia Camera Apps', 'HD Recording': 'Yes', 'Full HD Recording': 'Yes', 'Video Recording': 'Yes', 'Video Recording Resolution': '3840 x 2160', 'Digital Zoom': 'Yes', 'Network Type': '3G, 4G', 'Supported Networks': 'GSM', 'Internet Connectivity': 'GPRS, Wi-Fi, 3G, 4G', '3G': 'Yes', 'GPRS': 'Yes', 'Pre-installed Browser': 'Android', 'Micro USB Port': 'Yes', 'Micro USB Version': '2', 'Bluetooth Support': 'Yes', 'Bluetooth Version': '4.1', 'Wi-Fi': 'Yes', 'Wi-Fi Hotspot': 'Yes', 'NFC': 'Yes', 'USB Tethering': 'Yes', 'USB Connectivity': 'Yes', 'Audio Jack': '3.5 mm', 'Map Support': 'Google Maps', 'GPS Support': 'Yes', 'Smartphone': 'Yes', 'SIM Size': 'Nano SIM', 'Upgradable Operating System': '6.0 (Marshmallow)', 'Games': 'Yes', 'Other Features': 'Waterproof and Dust Tight (IP65 and IP68), ANT+ Wireless Technology, PlayMemories, Submersion to 1.5 m for 30 mins, Miracast, Screen Mirroring, Chromecast, USB Tethering, Wi-Fi MiMo, Ultra STAMINA Mode, One-touch Connectivity, MHL 3.0 Connector, PS4 Remote Play, Dualshock 4 Controller', 'Important Apps': 'Xperia Lounge, Facebook, Google, SyncML', 'GPS Type': 'A-GPS, GLONASS', 'FM Radio': 'Yes', 'DLNA Support': 'Yes', 'Audio Formats': 'M4A, AAC, MNV, MP3, MID, OTA, OGG, MKV, MKA, WAV, FLAC, WMA', 'Video Formats': 'MP4, 3GP, 3GPP, FLAC, XMF', 'Battery Capacity': '2930 mAh', 'Width': '71.9 mm', 'Height': '146.3 mm', 'Depth': '6.9 mm', 'Weight': '144 g', 'Warranty Summary': 'Brand Warranty of 1 Year Available for Mobile and 6 Months for Accessories'}",55990
"Honor Bee 2 (White, 8 GB)  (1 GB RAM)",3.9,897 Ratings,125 Reviews,"{'In The Box': 'Handset, Battery, Charger, Earphones, Warranty Card, USB Cable, User Manual', 'Model Number': 'LUA-L22', 'Model Name': 'Bee 2', 'Color': 'White', 'Browse Type': 'Smartphones', 'SIM Type': 'Dual Sim', 'Hybrid Sim Slot': 'No', 'Touchscreen': 'Yes', 'OTG Compatible': 'No', 'Display Size': '11.43 cm (4.5 inch)', 'Resolution': '480 x 854 pixels', 'Resolution Type': 'FWVGA', 'GPU': 'Mali-T720 MP2', 'Operating System': 'Android Lollipop 5.1', 'Processor Type': 'Cortex-A53', 'Processor Core': 'Quad Core', 'Primary Clock Speed': '1.2 GHz', 'Internal Storage': '8 GB', 'RAM': '1 GB', 'Expandable Storage': '32 GB', 'Supported Memory Card Type': 'microSD', 'Memory Card Slot Type': 'Dedicated Slot', 'Primary Camera Available': 'Yes', 'Primary Camera': '5MP Rear Camera', 'Primary Camera Features': 'Geo-Tagging, Face Detection', 'Secondary Camera Available': 'Yes', 'Secondary Camera': '2MP Front Camera', 'Flash': 'LED', 'Call Wait/Hold': 'Yes', 'Phone Book': 'Yes', 'Speaker Phone': 'Yes', 'Logs': 'Yes', 'Network Type': '3G, 4G VOLTE, 2G', 'Supported Networks': 'GSM, 4G VoLTE', 'GPRS': 'Yes', 'Pre-installed Browser': 'Android', 'Micro USB Port': 'Yes', 'Micro USB Version': '2', 'Bluetooth Support': 'Yes', 'Bluetooth Version': '4', 'Wi-Fi': 'Yes', 'Wi-Fi Version': '802.11 b/g/n', 'Wi-Fi Hotspot': 'Yes', 'USB Connectivity': 'Yes', 'Audio Jack': '3.5 mm', 'Map Support': 'Yes', 'GPS Support': 'Yes', 'Smartphone': 'Yes', 'Touchscreen Type': 'Capacitive', 'SIM Size': 'Micro SIM', 'User Interface': 'EMUI 3.1', 'Removable Battery': 'Yes', 'Graphics PPI': '218 PPI', 'Sensors': 'G-Sensor, L-Sensor, Proximity Sensor', 'FM Radio': 'Yes', 'Audio Formats': 'MP3', 'Video Formats': 'MP4', 'Battery Capacity': '2100 mAh', 'Battery Type': 'Li-Po', 'Warranty Summary': '12 Months on handset, 6 Months on battery , 6 Months on charger & 3 Months on data cable'}",6999
"OPPO F15 (Unicorn White, 128 GB)  (8 GB RAM)",4.4,"4,430 Ratings",460 Reviews,"{'In The Box': 'Handset, Headset, USB Cable, Adapter, SIM Card Pin, Protective Case, Quick Guide, Warranty Card', 'Model Number': 'CPH2001', 'Model Name': 'F15', 'Color': 'Unicorn White', 'Browse Type': 'Smartphones', 'SIM Type': 'Dual Sim', 'Hybrid Sim Slot': 'No', 'Touchscreen': 'Yes', 'OTG Compatible': 'Yes', 'Sound Enhancements': 'Dirac Audio, Dual Mic Noise Suppression', 'SAR Value': 'Head: 1.20 W/kg, Body: 0.55 W/kg', 'Display Size': '16.26 cm (6.4 inch)', 'Resolution': '2400 x 1080 Pixels', 'Resolution Type': 'Full HD+', 'GPU': 'ARM Mali G72 MP3 900 MHz', 'Display Type': 'AMOLED', 'Other Display Features': 'Screen Proportion: 20:9, Upper Frame: 2.32mm, Left and Right Frame: 1.67mm, Lower Frame: 5.2mm, Screen Ratio: 90.8%, Color Gamut: 100% NTSC, 104% NTSC DCI - P3, Color Contrast: 1000000:1, Color Saturation: Typical Value 100%, Maximum Screen Brightness: Typical Value 430nit, Corning Gorilla Glass 5, Multi-touch: 10, Oleophobic Layer, Oleophobic Layer on Film, Screen Refresh Rate: 60Hz, Touch Sampling Rate: 135Hz, TUV Rheinland Eye Comfort Certification, No Stroboscopic Eye Protection', 'Operating System': 'Android Pie 9', 'Processor Type': 'Helio P70', 'Processor Core': 'Octa Core', 'Primary Clock Speed': '2.1 GHz', 'Secondary Clock Speed': '2 GHz', 'Operating Frequency': 'GSM: 850/900/1800/1900 MHz, WCDMA: B1/B5/B8, FDD-LTE: B1/B3/B5/B8, TD-LTE: B38/B40/B41', 'Internal Storage': '128 GB', 'RAM': '8 GB', 'Expandable Storage': '256 GB', 'Supported Memory Card Type': 'microSD', 'Memory Card Slot Type': 'Dedicated Slot', 'Primary Camera Available': 'Yes', 'Primary Camera': '48MP + 8MP + 2MP + 2MP', 'Primary Camera Features': '48MP AI Quad Cam, Sensor Sizes/Pixel Size: Main 1/2.25inch, 0.8micrometer, Secondary Wide Angle: 1/4inch, 1.12 micrometer, 2M 1/5inch, 1.75micrometer, Sensor Type: CMOS, Zoom Mode: Main - 10X Digital Zoom, Wide Angle - 2X Digital Zoom, Aperture: Main - f/1.79, Wide Angle - f/2.25, Portrait and Mono - f/2.4, Focal Length: Main - 4.71mm, Wide Angle - 1.66mm, Portrait and Mono - 1.77mm, Wide Angle: Main - 79Degree, Wide Angle - 119 Degree, Portrait and Mono - 88.8Degree, Consecutive Shooting: Yes (20 Photos), Macro Lens: Back 3CM Macro Camera, EIS Stabilization, Lens Glass Material: GG5, Corning Gorilla Glass 5, Photo Size: 8000 x 6000 (FHD+ Mode), 4000 x 3000 (Standard Mode), Ultra Clear Mode 48MP, Photo, Video, Professional Mode, Panorama, Portrait, Night Scene, Time-lapse Photography, Slow Motion, Macro, Video Stabilization, AI Scene Recognition, Full Light for Shooting Video, MP4 Video Format, Anti-shake Video, Ultra Night Mode 2.0', 'Secondary Camera Available': 'Yes', 'Secondary Camera': '16MP Front Camera', 'Secondary Camera Features': 'Camera Structure: Water-drop, Sensor Type: CMOS (4-in-1 Pixel Technology), Sensor Size/Pixel Size: 1/3.1inch, 1.0micrometer, Focal Length: 3.54mm, Wide Angle of Front Lens: 77Degree, Flashlight Aperture: f/2.0, Lens Structure: 5P, Focusing Type: Focus, Lens Glass Material: GG5, Corning Gorilla Glass 5, Photo Size: 4608 x 3456, MP4 Video Format', 'Frame Rate': 'Rear Camera: Slow-motion Video - 1080p at 120fps, 720p at 240fps, Rear Camera: 1080P at 30fps, 720P at 30fps, Front Camera: 1080P/720P at 30fps, Rear Camera Default: 1080P at 30fps, Front Camera Default: 720P at 30fps fps', 'Dual Camera Lens': 'Primary Camera', 'Video Call Support': 'Yes', 'Call Records': 'Yes', 'Network Type': '4G VOLTE, 4G, 3G, 2G', 'Supported Networks': '4G VoLTE, 4G LTE, UMTS, WCDMA, CDMA, GSM', 'Internet Connectivity': '4G, 3G, Wi-Fi, EDGE, GPRS', '3G Speed': 'HSPA+', 'GPRS': 'Yes', 'Bluetooth Support': 'Yes', 'Bluetooth Version': 'v4.2', 'Wi-Fi': 'Yes', 'Wi-Fi Version': '802.11a/b/g/n/ac', 'Wi-Fi Hotspot': 'Yes', 'EDGE': 'Yes', 'Audio Jack': '3.5mm', 'Map Support': 'Google Maps', 'GPS Support': 'Yes', 'Touchscreen Type': 'Multi-touch Capacitive Screen', 'SIM Size': 'Dual Nano SIM', 'User Interface': 'ColorOS 6.1.2', 'Graphics PPI': '408 PPI', 'Sensors': 'In-screen Fingerprint, Magnetic Induction Sensor, Light Sensor, Proximity Sensor, G - Sensor/Acceleration Sensor, Gyroscope, Pedometer', 'Ringtones Format': 'MP3, AMR, APE, OGG, FLAC, WAV, MIDI, WMA', 'Other Features': ""Split Screen,Apps with Game Boost (Popular Games), Google Lens, Data Backup, Oshare (Indian Phone Number's Recognition), Apps Lock, Office Tools: Office Suite, Firewall: Support Call/Message Firewall, Files Zip/Unzip, File Encryption, 64bit Processor, Baseband Structure: 4 (Cortex A73) + 4 (Cortex A53), 12nm Processor, ROM Technology: UFS2.1, VoLTE, 4G Data Rate: 75Mbps (Carrier Model 150mbps), Downlink: 150Mbps (Carrrier Model 300Mbps), WLAN: 2.4G, 5.1G, 5.8G WLAN Display, USB 2.0, VOOC Flash Charge 3.0, Reverse Charging, Standard Charge Power: 20W, Type-C USB Jack, Pin Number (USB): 14, Face Recognition, Single Channel,Eye Protection Mode, Clone App, Banner Call, Game Boost, Kids Space, Text Input, Support HD, Webpage Video Play, World Time, Lock Screen Clock, OPPO Share, E-compass, E-book, Screen Recording, Background Freeze, Caller Avatar, Call Background, Contact Grouping, Group Customization, Import/Export Messages, Number of Ram Channels: 2, Fingerprint Reset password, Sleek Design, Flashlight"", 'Important Apps': 'Bulit-in Browser: Chrome, Opera, OPPO Browsers', 'GPS Type': 'A-GPS, GLONASS, BeiDou', 'FM Radio': 'No', 'Audio Formats': 'AAC, APE, FLAC, AMR, MID, MP3, OGG, WAV, WMA, MKA', 'Video Formats': 'MP4, 3GP, ASF, AVI, FLV, M2TS, MKV, MPG, TS, WEBM, WMV', 'Battery Capacity': '4000 mAh', 'Width': '73.3 mm', 'Height': '160.2 mm', 'Depth': '7.9 mm', 'Weight': '172 g', 'Warranty Summary': 'Brand Warranty of 1 Year Available for Mobile Including Battery and 6 Months for Accessories'}",19990
