Name,Stars,Ratings,Reviews,Specifications,Price
"Micromax Vdeo 3 (Champagne, 8 GB)  (1 GB RAM)",4,"3,844 Ratings",280 Reviews,"{'In The Box': 'Handset, Charger, Battery, Handsfree, USB Cable, User Guide, Screen Guard', 'Model Number': 'Q4202', 'Model Name': 'Vdeo 3', 'Color': 'Champagne', 'Browse Type': 'Smartphones', 'SIM Type': 'Dual Sim', 'Hybrid Sim Slot': 'No', 'Touchscreen': 'Yes', 'OTG Compatible': 'No', 'Display Size': '12.7 cm (5 inch)', 'Resolution': '1280 x 720 pixels', 'Resolution Type': 'HD', 'GPU': 'A304 at 400 MHz', 'Display Colors': '16.7 M', 'Other Display Features': 'Oncell Display and Screen, Pinch Zoom, 2 Multitouch', 'Operating System': 'Android Marshmallow 6', 'Processor Type': 'Snapdragon 210�Quad Core 1.1GHz', 'Processor Core': 'Quad Core', 'Primary Clock Speed': '1.1 GHz', 'Operating Frequency': 'GSM - 850 / 900 / 1800 / 1900 MHz; WCDMA - 900 / 2100 MHz; 4G LTE - B3 / B5 / B40', 'Internal Storage': '8 GB', 'RAM': '1 GB', 'Expandable Storage': '32 GB', 'Supported Memory Card Type': 'microSD', 'Memory Card Slot Type': 'Dedicated Slot', 'Phone Book Memory': 'Yes', 'Call Log Memory': 'Yes', 'Primary Camera Available': 'Yes', 'Primary Camera': '5MP Rear Camera', 'Primary Camera Features': 'Auto Focus, Zoom Level: 6, Multi Shot, Night Mode', 'Secondary Camera Available': 'Yes', 'Secondary Camera': '2MP Front Camera', 'Flash': 'Rear Flash', 'HD Recording': 'Yes', 'Video Recording': 'Yes', 'Video Recording Resolution': '1280 x 720', 'Frame Rate': '30 fps', 'Video Call Support': 'Yes', 'Phone Book': 'Yes', 'Speaker Phone': 'Yes', 'Network Type': '3G, 4G VOLTE, 2G', 'Supported Networks': '4G LTE', 'Internet Connectivity': '4G, 3G, Wi-Fi, GPRS, EDGE', '3G': 'Yes', '3G Speed': 'HSDPA (Downlink Speed) - 150 Mbps, HSUPA (Uplink Speed) - 50 Mbps', 'GPRS': 'Yes', 'Pre-installed Browser': 'Android, SWE 32-bit Browser', 'Micro USB Port': 'Yes', 'Bluetooth Support': 'Yes', 'Bluetooth Version': '4', 'Wi-Fi': 'Yes', 'Wi-Fi Version': '802.11 b/g/n', 'Wi-Fi Hotspot': 'Yes', 'USB Connectivity': 'Yes', 'EDGE': 'Yes', 'GPRS Features': 'Class 12', 'Audio Jack': '3.5 mm', 'EDGE Features': 'Class 12', 'Map Support': 'Google Maps', 'GPS Support': 'Yes', 'Smartphone': 'Yes', 'SIM Size': 'Micro SIM and Micro SIM', 'MMS': 'Yes', 'SMS': 'Yes', 'User Memory': '4 GB', 'Sensors': 'Gravity Sensors, Proximity Sensor, Light Sensor, Accelerometer', 'Browser': 'Yes', 'Other Features': '4.2 V Battery, Browsing Time: 2G - 4 hours, 3G - 3 hours, 4G - 3hours, CE Charger Certification, 4-pin Charger, FM Radio Band: 88.0 MHz - 108 MHz, FM Recording Format: MP3, Email: POP3, IMAP4, Streaming Suppport, 1.2 m Data Cable Length, Headset Type: Stereo, STK / UTK', 'FM Radio': 'Yes', 'FM Radio Recording': 'Yes', 'Audio Formats': 'MP3, MIDI, AAC, AMR, AAC+, WAV', 'Video Formats': 'MPEG4, H.264', 'Battery Capacity': '2000 mAh', 'Width': '73 mm', 'Height': '143.5 mm', 'Depth': '9.55 mm', 'Weight': '110 g', 'Warranty Summary': 'Brand Warranty of 1 Year Available for Mobile and 6 Months for Accessories'}",5749
"OPPO A9 2020 (Space Purple, 128 GB)  (4 GB RAM)",4.4,"2,227 Ratings",212 Reviews,"{'In The Box': 'Handset, Adapter, Headset, Micro USB Cable, Important Info. Booklet with Warranty Card, Quick Start Guide, Sim Card Tool, Protective Film, Pre-applied, Case', 'Model Number': 'CPH1937', 'Model Name': 'A9 2020', 'Color': 'Space Purple', 'Browse Type': 'Smartphones', 'SIM Type': 'Dual Sim', 'Hybrid Sim Slot': 'No', 'Touchscreen': 'Yes', 'OTG Compatible': 'Yes', 'Sound Enhancements': 'Dolby Atmos and Dual Stereo Speakers', 'Display Size': '16.51 cm (6.5 inch)', 'Resolution': '1600 x 720 Pixels', 'GPU': 'Adreno 610', 'Display Type': 'TFT-LCD', 'Display Colors': '16M', 'Other Display Features': 'Touch Panel Technology: In-cell, Narrow Frame - Upper Border: 2.44mm, Left and Right Border: 1.98mm, Lower Border: 6.6mm, Screen Ratio: 89.0%, Screen Contrast: 1500:1, Color Saturation: Typical 71%, Maximum Brightness: 480nits, Touch Panel Glass Type: GG3+, TYPE-C USB 2.0', 'Operating System': 'Android Pie 9', 'Processor Type': 'Qualcomm SM6125', 'Processor Core': 'Octa Core', 'Primary Clock Speed': '1.8 GHz', 'Secondary Clock Speed': '2 GHz', 'Internal Storage': '128 GB', 'RAM': '4 GB', 'Memory Card Slot Type': 'Dedicated Slot', 'Primary Camera Available': 'Yes', 'Primary Camera': '48MP + 8MP + 2MP + 2MP', 'Primary Camera Features': 'Ultra Wide Quad Camera, Sensor Type: 48MP CMOS/S5KGM1SP/OV48B, 8MP COMS/Hi846/OV8856, 2MP CMOS/OV02A1B/GC02M0, 2MP CMOS/GC02M0/OV02A1B, Maximum Zoom Multiples: 10X, Aperture: 48MP (f/1.8) + 8MP (f/2.25) + 2MP (f/2.4) + 2MP (f/2.4), Focal Length: 48MP (4.71mm) + 8MP (1.66mm) + 2MP (1.77mm) + 2MP (f1.77mm), Lens Number: 48MP (6P) + 8MP (5P) + 2MP (3P) + 2MP (3P)', 'Secondary Camera Available': 'Yes', 'Secondary Camera': '16MP Front Camera', 'Secondary Camera Features': 'Sensor Sizes/Pixel Data - 1/3.1inch, 1.0micrometer, Sensor Type: S5K3P9SP04, Wide Angle of Front: 79Degree, Aperture: F2.0, Focal Length: 3.42mm, Lens Number: 5P', 'Flash': 'Rear LED Flash', 'Frame Rate': 'Front Camera Video: 1080P/720P at 30 fps', 'Dual Camera Lens': 'Primary Camera', 'Network Type': '4G VOLTE, 4G, 3G, 2G', 'Supported Networks': '4G VoLTE, UMTS, GSM, 4G LTE, WCDMA, CDMA', 'Internet Connectivity': '4G, 3G, Wi-Fi, EDGE, GPRS', '3G Speed': 'HSPA+', 'GPRS': 'Yes', 'Micro USB Port': 'Yes', 'Micro USB Version': '2', 'Bluetooth Support': 'Yes', 'Bluetooth Version': 'v5.0', 'Wi-Fi': 'Yes', 'Wi-Fi Version': '802.11a/b/g/n/ac', 'USB Connectivity': 'Yes', 'EDGE': 'Yes', 'Audio Jack': '3.5mm', 'Smartphone': 'Yes', 'Touchscreen Type': 'Capacitive Screen, Multi-touch', 'SIM Size': 'Dual Nano SIM', 'User Interface': 'ColorOS 6.0.1', 'Removable Battery': 'No', 'Graphics PPI': '269 PPI', 'Ringtones Format': 'MP3/AMR/APE/OGG/FLAC/WAV/MIDI/WMA', 'Other Features': 'Face Recognition, Split Screen (Specific Apps), Clone Apps, Night Shield, Sensor Hub, Game Acceleration (Specific Apps), CPU Technology - 11nm, ROM Technology: UFS 2.1, Energy Density - 696 Wh/L, Charge Speed/Power - 5V 2A, 10W, WLAN 2.4G, WLAN 5.1G, WLAN 5.8G, WLAN Display, Game Boost 2.0, 4G+, 64 bits Processor, Video Stability, Ultra Night Mode 2.0, Reverse Charging', 'FM Radio': 'Yes', 'Audio Formats': 'MP3/AAC/APE/AMR/WAV/MID/OGG/FLAC/WMA', 'Video Formats': 'AVI/3GP/MP4/WMV/MKV/MOV/ASF/FLV', 'Battery Capacity': '5000 mAh', 'Width': '75.6 mm', 'Height': '163.6 mm', 'Depth': '9.1 mm', 'Weight': '195 g', 'Warranty Summary': 'Brand Warranty of 1 Year Available for Mobile and 6 Months for Accessories'}",14990
"OPPO Reno2 (Ocean Blue, 256 GB)  (8 GB RAM)",4.5,"1,195 Ratings",175 Reviews,"{'In The Box': 'Handset, Power Adapter, Micro USB Cable, Important info booklet with warranty card, Quick start guide, SIM card tool, Protection film, Shell/case', 'Model Number': 'CPH1907', 'Model Name': 'Reno2', 'Color': 'Ocean Blue', 'Browse Type': 'Smartphones', 'SIM Type': 'Dual Sim', 'Hybrid Sim Slot': 'Yes', 'Touchscreen': 'Yes', 'OTG Compatible': 'Yes', 'SAR Value': 'Head: 1.183 W/kg, Body: 0.780 W/kg', 'Display Size': '16.51 cm (6.5 inch)', 'Resolution': '2340 x 1080 Pixels', 'GPU': 'Adreno 618', 'Display Type': 'AMOLED', 'Display Colors': '16M', 'Other Display Features': 'Upper Bezel: 1.77 mm; Left and Right Bezels: 1.65 mm; Lower Bezel: 3.35 mm', 'Operating System': 'Android Pie 9', 'Processor Type': 'Qualcomm Snapdragon 730G', 'Processor Core': 'Octa Core', 'Primary Clock Speed': '2.2 GHz', 'Secondary Clock Speed': '1.8 GHz', 'Internal Storage': '256 GB', 'RAM': '8 GB', 'Expandable Storage': '256 GB', 'Memory Card Slot Type': 'Hybrid Slot', 'Primary Camera Available': 'Yes', 'Primary Camera': '48MP + 8MP + 13MP + 2MP', 'Primary Camera Features': 'Sensor Sizes/Pixel Data - Main Camera 1/2.0inch, 0.8micrometer, 13M Long Focus Lens 1/3.4inch, 1.0micrometer, 8M Wide angle Lens 1/3.2inch 1.4micrometer, 2M Bokeh Lens 1/5.0 inch, 1.75micrometer, Sensor Type - IMX586+S5K3M5+imx319+GC02MOB, Optical Focusing - Yes, Maximum Zoom Multiples - 2X, Aperture - Main Camera F1.7, Long Focus Seconadary Camera F2.4, Wide Angle Seconadary Camera F2.2, Bokeh Seconadary Camera F2.4, Focal Length - Main camera: Focal Length 4.77mm, Equivalent Focal Length 25.8mm; Long-Focus Secondary Camera: Focal Length 6.25mm, Equivalent Focal Length 57.5mm; Wide-angle Secondary Camera 2.13mm, Equivalent Focal Length 18.4mm; Bokeh Secondary Camera: Focal Length1.77mm, Equivalent Focal Length 23.9mm, Lenses - Main camera 6P; Long - Focus Secondary Camera 5P; Wide-angle Secondary Camera 5P; Bokeh Secondary Camera 3P, Video - The Rear Cameras Support up to 4K@30fps, 1080P@60fps/30fps, 720P@60fps/30fps; The Ultra Steady Video Support 1080P 60fps, The Video Hybrid Video Support 1080P 30 fps.', 'Secondary Camera Available': 'Yes', 'Secondary Camera': '16MP Front Camera', 'Secondary Camera Features': 'Sensor Sizes/Pixel Data - 1/3.1inch, 1.0micrometer, Sensor Type - IMX471, Sensor Model/Manufacturers - Sony, Focusing method - Focus, Optical Focusing - No, Wide Angle of Front - 79.3°, Aperture - F2.0, Focal Length - 3.41 mm, Video, Photo, Video, Panorama, Photo Management, Potrait, etc', 'Flash': 'Rear Flash and Front Screen Flash', 'Image Editor': 'Yes', 'Dual Camera Lens': 'Primary Camera', 'Network Type': '4G, 2G, 3G', 'Supported Networks': '4G VoLTE, GSM, WCDMA', 'Internet Connectivity': '4G, Wi-Fi, EDGE, GPRS', '3G Speed': 'Uplink : 11.5Mbps; Downlink : 42Mbps', 'GPRS': 'Yes', 'Micro USB Port': 'Yes', 'Micro USB Version': '2', 'Bluetooth Support': 'Yes', 'Bluetooth Version': '5', 'Wi-Fi': 'Yes', 'Wi-Fi Version': '802.11a/b/g/n/ac', 'USB Connectivity': 'Yes', 'EDGE': 'Yes', 'Audio Jack': '3.5mm', 'Map Support': 'Google Maps', 'GPS Support': 'Yes', 'Smartphone': 'Yes', 'Touchscreen Type': 'Multi-Touch Capacitive Screen', 'SIM Size': 'Dual Nano SIM', 'User Interface': 'ColorOS 6.1', 'Removable Battery': 'No', 'Graphics PPI': '401 PPI', 'Predictive Text Input': 'Yes', 'Ringtones Format': 'MP3/AMR/APE/OGG/FLAC/WAV/MIDI/WMA', 'Other Features': 'Physical Key, Face Recognition, Kids Space, Clone Apps, Oshare, Face Unlocking, Music Interconnection, Fingerprint Access Time, Face Recognition Time, Program Frozen, File Encryption, Baseband Architecture, CPU Technology, UFS 2.1, Full Charge Time(0-100%), VOOC Flash Charge, Energy Density, Charge Speed/Power, WLAN 2.4G, WLAN 5.1G, WLAN 5.8G, WLAN Display, Eye Protection Mode', 'GPS Type': 'Beidou, Glonass, Galileo', 'FM Radio': 'No', 'Battery Capacity': '4000 mAh', 'Width': '74.3 mm', 'Height': '160 mm', 'Depth': '9.5 mm', 'Weight': '189 g', 'Warranty Summary': 'Brand Warranty of 1 Year Available for Mobile with Battery and 6 Months for Accessories'}",36990
"Karbonn Titanium S4 (Black, 4 GB)  (1 GB RAM)",3.4,28 Ratings,7 Reviews,"{'Model Name': 'Titanium S4', 'Color': 'Black', 'Browse Type': 'Smartphones', 'SIM Type': 'Dual Sim', 'Display Size': '11.94 cm (4.7 inch)', 'Resolution': '1280 x 720 Pixels', 'Resolution Type': 'HD', 'Display Type': 'AMOLED', 'Other Display Features': 'Multi-touch, Pinch-to-Zoom', 'Operating System': 'Android Jelly Bean 4.2', 'Processor Core': 'Quad Core', 'Primary Clock Speed': '1.2 GHz', 'Operating Frequency': 'GSM - 900, 1800; UMTS - 2100', 'Internal Storage': '4 GB', 'RAM': '1 GB', 'Expandable Storage': '32 GB', 'Supported Memory Card Type': 'MicroSD', 'Phone Book Memory': 'Yes', 'Call Log Memory': 'Yes', 'SMS Memory': 'Yes', 'Primary Camera Available': 'Yes', 'Primary Camera': '13MP Rear Camera', 'Primary Camera Features': 'Auto Focus, Flash Support', 'Secondary Camera Available': 'Yes', 'Secondary Camera': '2MP Front Camera', 'HD Recording': 'No', 'Network Type': '3G', 'Supported Networks': 'GSM', 'Internet Connectivity': '3G, WAP, Wi-Fi', '3G': 'Yes', '3G Speed': '21 Mbps HSDPA', 'WAP': 'Yes', 'Pre-installed Browser': 'Android, WAP', 'Bluetooth Support': 'Yes', 'Wi-Fi': 'Yes', 'Wi-Fi Version': '802.11 b/g/n', 'Wi-Fi Hotspot': 'Yes', 'NFC': 'No', 'Audio Jack': '3.5 mm', 'Map Support': 'Google Maps', 'GPS Support': 'Yes', 'Smartphone': 'Yes', 'Touchscreen Type': 'Capacitive', 'Voice Input': 'Yes', 'Sensors': 'Ambient Light Sensor, Accelerometer, Proximity Sensor', 'Other Features': 'Voice Search and Dialing, Multi-tasking, Graphics Support, Games, Face Unlock', 'Important Apps': 'Google Play Store, Customizable Widgets, Notification Panel', 'GPS Type': 'A-GPS', 'Audio Formats': 'MP3', 'Battery Capacity': '1800 mAh', 'Width': '59 mm', 'Height': '135 mm', 'Depth': '7.9 mm', 'Warranty Summary': '1 Year for Mobile & 6 Months for Accessories'}",13298
"Karbonn Titanium S4 (White, 4 GB)  (1 GB RAM)",3.4,28 Ratings,7 Reviews,"{'Model Name': 'Titanium S4', 'Color': 'White', 'Browse Type': 'Smartphones', 'SIM Type': 'Dual Sim', 'Display Size': '11.94 cm (4.7 inch)', 'Resolution': '1280 x 720 Pixels', 'Resolution Type': 'HD', 'Display Type': 'AMOLED', 'Other Display Features': 'Multi-touch, Pinch-to-Zoom', 'Operating System': 'Android Jelly Bean 4.2', 'Processor Core': 'Quad Core', 'Primary Clock Speed': '1.2 GHz', 'Operating Frequency': 'GSM - 900, 1800; UMTS - 2100', 'Internal Storage': '4 GB', 'RAM': '1 GB', 'Expandable Storage': '32 GB', 'Supported Memory Card Type': 'MicroSD', 'Phone Book Memory': 'Yes', 'Call Log Memory': 'Yes', 'SMS Memory': 'Yes', 'Primary Camera Available': 'Yes', 'Primary Camera': '13MP Rear Camera', 'Primary Camera Features': 'Auto Focus, Flash Support', 'Secondary Camera Available': 'Yes', 'Secondary Camera': '2MP Front Camera', 'HD Recording': 'No', 'Network Type': '3G', 'Supported Networks': 'GSM', 'Internet Connectivity': '3G, WAP, Wi-Fi', '3G': 'Yes', '3G Speed': '21 Mbps HSDPA', 'WAP': 'Yes', 'Pre-installed Browser': 'Android, WAP', 'Bluetooth Support': 'Yes', 'Wi-Fi': 'Yes', 'Wi-Fi Version': '802.11 b/g/n', 'Wi-Fi Hotspot': 'Yes', 'NFC': 'No', 'Audio Jack': '3.5 mm', 'Map Support': 'Google Maps', 'GPS Support': 'Yes', 'Smartphone': 'Yes', 'Touchscreen Type': 'Capacitive', 'Voice Input': 'Yes', 'Sensors': 'Ambient Light Sensor, Accelerometer, Proximity Sensor', 'Other Features': 'Voice Search and Dialing, Multi-tasking, Graphics Support, Games, Face Unlock', 'Important Apps': 'Google Play Store, Customizable Widgets, Notification Panel', 'GPS Type': 'A-GPS', 'Audio Formats': 'MP3', 'Battery Capacity': '1800 mAh', 'Width': '59 mm', 'Height': '135 mm', 'Depth': '7.9 mm', 'Warranty Summary': '1 Year for Mobile & 6 Months for Accessories'}",14990
"Apple iPhone 11 Pro (Gold, 64 GB)",4.7,"1,095 Ratings",97 Reviews,"{'In The Box': 'Handset, EarPods with Lightning Connector, USB-C to Lightning Cable, 18W USB-C Power Adapter, Documentation', 'Model Number': 'MWC52HN/A', 'Model Name': 'iPhone 11 Pro', 'Color': 'Gold', 'Browse Type': 'Smartphones', 'SIM Type': 'Dual Sim', 'Hybrid Sim Slot': 'No', 'Touchscreen': 'Yes', 'OTG Compatible': 'No', 'SAR Value': '1.6 W/kg (over 1 g) SAR Limit, Head: 1.18, Body: 1.16', 'Display Size': '14.73 cm (5.8 inch)', 'Resolution': '2436 x 1125 Pixels', 'Resolution Type': 'Super Retina XDR Display', 'Other Display Features': '2,000,000:1 Contrast Ratio (Typical), True Tone Display, Wide Colour Display (P3), Haptic Touch, 800 nits Max Brightness (Typical), 1200 nits Max Brightness (HDR), Fingerprint-resistant Oleophobic Coating, Support for Display of Multiple Languages and Characters Simultaneously', 'Operating System': 'iOS 13', 'Processor Type': 'A13 Bionic Chip', 'Internal Storage': '64 GB', 'Primary Camera Available': 'Yes', 'Primary Camera': '12MP + 12MP + 12MP', 'Primary Camera Features': 'Triple 12MP Ultra Wide, Wide and Telephoto Cameras, Ultra Wide: f/2.4 Aperture and 120Degree Field of View, Wide: f/1.8 Aperture, Telephoto: f/2.0 Aperture, Portrait Mode with Advanced Bokeh and Depth Control, Portrait Lighting with Six Effects (Natural, Studio, Contour, Stage, Stage Mono, High-key Mono), Dual Optical Image Stabilisation (Wide and Telephoto), Five Element Lens (Ultra Wide), Six-element Lens (Wide and Telephoto), Brighter True Tone flash with Slow Sync, Panorama (up to 64MP), 100% Focus Pixels (Wide), Night Mode, Auto Adjustments, Next Generation Smart HDR for Photos, Wide Colour Capture for Photos and Live Photos, Advanced Red Eye Correction, Photo Geotagging, Auto Image Stabilisation, Burst Mode, Image Formats Captured: HEIF and JPEG', 'Optical Zoom': 'Yes', 'Secondary Camera Available': 'Yes', 'Secondary Camera': '12MP Front Camera', 'Secondary Camera Features': 'TrueDepth Camera - 12MP Camera, f/2.2 Aperture, Portrait Mode with Advanced Bokeh and Depth Control, Portrait Lighting with Six Effects (Natural, Studio, Contour, Stage, Stage Mono, High Key Mono), Animoji and Memoji, 4K Video Recording at 24 fps, 30 fps or 60 fps, 1080p HD Video Recording at 30 fps or 60 fps, Slow-motion Video Support for 1080p at 120 fps, Next-generation Smart HDR for Photos, Extended Dynamic Range for Video at 30 fps, Cinematic Video Stabilisation(4K, 1080p and 720p), Wide Colour Capture for Photos and Live Photos, Retina Flash, Auto Image Stabilisation, Burst Mode', 'Flash': 'Rear Brighter True Tone Flash with Slow Sync and Front Retina Flash', 'HD Recording': 'Yes', 'Full HD Recording': 'Yes', 'Video Recording': 'Yes', 'Frame Rate': 'Rear Camera - 4K Video Recording at 24 fps, 30 fps or 60 fps, 1080p HD Video Recording at 30 fps or 60 fps, 720p HD Video Recording at 30 fps, Extended Dynamic Range for Video upto 60 fps, Slow-motion Video Support for 1080p at 120 fps or 240 fps | True Depth Camera - 4K Video Recording at 24 fps, 30 fps or 60 fps, 1080p HD Video Recording at 30 fps or 60 fps, Slow-motion Video Support for 1080p at 120 fps, Extended Dynamic Range for Video at 30 fps fps', 'Dual Camera Lens': 'Primary Camera', 'Phone Book': 'Yes', 'Speaker Phone': 'Yes', 'Network Type': '4G VOLTE, 4G, 3G, 2G', 'Supported Networks': '4G VoLTE, 4G LTE, UMTS, GSM', 'Internet Connectivity': '4G, 3G, Wi-Fi', '3G': 'Yes', 'Pre-installed Browser': 'Safari', 'Bluetooth Support': 'Yes', 'Bluetooth Version': '5', 'Wi-Fi': 'Yes', 'Wi-Fi Version': '802.11ax Wi-Fi 6 with 2x2 MIMO', 'Wi-Fi Hotspot': 'Yes', 'NFC': 'Yes', 'Smartphone': 'Yes', 'SIM Size': 'Nano SIM and eSIM', 'Removable Battery': 'No', 'Graphics PPI': '458 PPI', 'Sensors': 'Face ID, Barometer, Three Axis Gyro, Accelerometer, Proximity Sensor, Ambient Light Sensor', 'Supported Languages': 'Multi Languages Support', 'Series': 'iPhone 11 Pro', 'Other Features': 'Water Resistant upto 4 Metres for up to 30 Minutes, Upto 5 More Hours of Battery life, Faster Face ID�', 'Audio Formats': 'AAC LC, HE AAC, HE AAC v2, Protected AAC, MP3, Linear PCM, Apple Lossless, FLAC, Dolby Digital (AC 3), Dolby Digital Plus (E AC 3), Dolby Atmos and Audible (Formats 2, 3, 4, Audible Enhanced Audio, AAX and AAX+)', 'Video Formats': 'HEVC, H.264, MPEG 4 Part 2 and Motion JPEG, High Dynamic Range with Dolby Vision and HDR10 Content', 'Width': '71.4 mm', 'Height': '144 mm', 'Depth': '8.1 mm', 'Weight': '188 g', 'Warranty Summary': 'Brand Warranty for 1 Year'}",99900
"OPPO F15 (Unicorn White, 128 GB)  (8 GB RAM)",4.4,"4,430 Ratings",460 Reviews,"{'In The Box': 'Handset, Headset, USB Cable, Adapter, SIM Card Pin, Protective Case, Quick Guide, Warranty Card', 'Model Number': 'CPH2001', 'Model Name': 'F15', 'Color': 'Unicorn White', 'Browse Type': 'Smartphones', 'SIM Type': 'Dual Sim', 'Hybrid Sim Slot': 'No', 'Touchscreen': 'Yes', 'OTG Compatible': 'Yes', 'Sound Enhancements': 'Dirac Audio, Dual Mic Noise Suppression', 'SAR Value': 'Head: 1.20 W/kg, Body: 0.55 W/kg', 'Display Size': '16.26 cm (6.4 inch)', 'Resolution': '2400 x 1080 Pixels', 'Resolution Type': 'Full HD+', 'GPU': 'ARM Mali G72 MP3 900 MHz', 'Display Type': 'AMOLED', 'Other Display Features': 'Screen Proportion: 20:9, Upper Frame: 2.32mm, Left and Right Frame: 1.67mm, Lower Frame: 5.2mm, Screen Ratio: 90.8%, Color Gamut: 100% NTSC, 104% NTSC DCI - P3, Color Contrast: 1000000:1, Color Saturation: Typical Value 100%, Maximum Screen Brightness: Typical Value 430nit, Corning Gorilla Glass 5, Multi-touch: 10, Oleophobic Layer, Oleophobic Layer on Film, Screen Refresh Rate: 60Hz, Touch Sampling Rate: 135Hz, TUV Rheinland Eye Comfort Certification, No Stroboscopic Eye Protection', 'Operating System': 'Android Pie 9', 'Processor Type': 'Helio P70', 'Processor Core': 'Octa Core', 'Primary Clock Speed': '2.1 GHz', 'Secondary Clock Speed': '2 GHz', 'Operating Frequency': 'GSM: 850/900/1800/1900 MHz, WCDMA: B1/B5/B8, FDD-LTE: B1/B3/B5/B8, TD-LTE: B38/B40/B41', 'Internal Storage': '128 GB', 'RAM': '8 GB', 'Expandable Storage': '256 GB', 'Supported Memory Card Type': 'microSD', 'Memory Card Slot Type': 'Dedicated Slot', 'Primary Camera Available': 'Yes', 'Primary Camera': '48MP + 8MP + 2MP + 2MP', 'Primary Camera Features': '48MP AI Quad Cam, Sensor Sizes/Pixel Size: Main 1/2.25inch, 0.8micrometer, Secondary Wide Angle: 1/4inch, 1.12 micrometer, 2M 1/5inch, 1.75micrometer, Sensor Type: CMOS, Zoom Mode: Main - 10X Digital Zoom, Wide Angle - 2X Digital Zoom, Aperture: Main - f/1.79, Wide Angle - f/2.25, Portrait and Mono - f/2.4, Focal Length: Main - 4.71mm, Wide Angle - 1.66mm, Portrait and Mono - 1.77mm, Wide Angle: Main - 79Degree, Wide Angle - 119 Degree, Portrait and Mono - 88.8Degree, Consecutive Shooting: Yes (20 Photos), Macro Lens: Back 3CM Macro Camera, EIS Stabilization, Lens Glass Material: GG5, Corning Gorilla Glass 5, Photo Size: 8000 x 6000 (FHD+ Mode), 4000 x 3000 (Standard Mode), Ultra Clear Mode 48MP, Photo, Video, Professional Mode, Panorama, Portrait, Night Scene, Time-lapse Photography, Slow Motion, Macro, Video Stabilization, AI Scene Recognition, Full Light for Shooting Video, MP4 Video Format, Anti-shake Video, Ultra Night Mode 2.0', 'Secondary Camera Available': 'Yes', 'Secondary Camera': '16MP Front Camera', 'Secondary Camera Features': 'Camera Structure: Water-drop, Sensor Type: CMOS (4-in-1 Pixel Technology), Sensor Size/Pixel Size: 1/3.1inch, 1.0micrometer, Focal Length: 3.54mm, Wide Angle of Front Lens: 77Degree, Flashlight Aperture: f/2.0, Lens Structure: 5P, Focusing Type: Focus, Lens Glass Material: GG5, Corning Gorilla Glass 5, Photo Size: 4608 x 3456, MP4 Video Format', 'Frame Rate': 'Rear Camera: Slow-motion Video - 1080p at 120fps, 720p at 240fps, Rear Camera: 1080P at 30fps, 720P at 30fps, Front Camera: 1080P/720P at 30fps, Rear Camera Default: 1080P at 30fps, Front Camera Default: 720P at 30fps fps', 'Dual Camera Lens': 'Primary Camera', 'Video Call Support': 'Yes', 'Call Records': 'Yes', 'Network Type': '4G VOLTE, 4G, 3G, 2G', 'Supported Networks': '4G VoLTE, 4G LTE, UMTS, WCDMA, CDMA, GSM', 'Internet Connectivity': '4G, 3G, Wi-Fi, EDGE, GPRS', '3G Speed': 'HSPA+', 'GPRS': 'Yes', 'Bluetooth Support': 'Yes', 'Bluetooth Version': 'v4.2', 'Wi-Fi': 'Yes', 'Wi-Fi Version': '802.11a/b/g/n/ac', 'Wi-Fi Hotspot': 'Yes', 'EDGE': 'Yes', 'Audio Jack': '3.5mm', 'Map Support': 'Google Maps', 'GPS Support': 'Yes', 'Touchscreen Type': 'Multi-touch Capacitive Screen', 'SIM Size': 'Dual Nano SIM', 'User Interface': 'ColorOS 6.1.2', 'Graphics PPI': '408 PPI', 'Sensors': 'In-screen Fingerprint, Magnetic Induction Sensor, Light Sensor, Proximity Sensor, G - Sensor/Acceleration Sensor, Gyroscope, Pedometer', 'Ringtones Format': 'MP3, AMR, APE, OGG, FLAC, WAV, MIDI, WMA', 'Other Features': ""Split Screen,Apps with Game Boost (Popular Games), Google Lens, Data Backup, Oshare (Indian Phone Number's Recognition), Apps Lock, Office Tools: Office Suite, Firewall: Support Call/Message Firewall, Files Zip/Unzip, File Encryption, 64bit Processor, Baseband Structure: 4 (Cortex A73) + 4 (Cortex A53), 12nm Processor, ROM Technology: UFS2.1, VoLTE, 4G Data Rate: 75Mbps (Carrier Model 150mbps), Downlink: 150Mbps (Carrrier Model 300Mbps), WLAN: 2.4G, 5.1G, 5.8G WLAN Display, USB 2.0, VOOC Flash Charge 3.0, Reverse Charging, Standard Charge Power: 20W, Type-C USB Jack, Pin Number (USB): 14, Face Recognition, Single Channel,Eye Protection Mode, Clone App, Banner Call, Game Boost, Kids Space, Text Input, Support HD, Webpage Video Play, World Time, Lock Screen Clock, OPPO Share, E-compass, E-book, Screen Recording, Background Freeze, Caller Avatar, Call Background, Contact Grouping, Group Customization, Import/Export Messages, Number of Ram Channels: 2, Fingerprint Reset password, Sleek Design, Flashlight"", 'Important Apps': 'Bulit-in Browser: Chrome, Opera, OPPO Browsers', 'GPS Type': 'A-GPS, GLONASS, BeiDou', 'FM Radio': 'No', 'Audio Formats': 'AAC, APE, FLAC, AMR, MID, MP3, OGG, WAV, WMA, MKA', 'Video Formats': 'MP4, 3GP, ASF, AVI, FLV, M2TS, MKV, MPG, TS, WEBM, WMV', 'Battery Capacity': '4000 mAh', 'Width': '73.3 mm', 'Height': '160.2 mm', 'Depth': '7.9 mm', 'Weight': '172 g', 'Warranty Summary': 'Brand Warranty of 1 Year Available for Mobile Including Battery and 6 Months for Accessories'}",19990
