Name,Stars,Ratings,Reviews,Specifications,Price
"Realme C2 (Diamond Black, 32 GB)  (3 GB RAM)",4.3,"1,09,203 Ratings","8,787 Reviews","{'In The Box': 'Handset, Adapter (5V/2A), Micro-USB Cable, Important Information Booklet with Warranty Card, Quick Guide, SIM Card Tool, Screen Protect Film', 'Model Number': 'RMX1941', 'Model Name': 'C2', 'Color': 'Diamond Black', 'Browse Type': 'Smartphones', 'SIM Type': 'Dual Sim', 'Hybrid Sim Slot': 'No', 'Touchscreen': 'Yes', 'OTG Compatible': 'Yes', 'Display Size': '15.49 cm (6.1 inch)', 'Resolution': '1560 x 720 pixels', 'Resolution Type': 'HD+', 'GPU': 'GE8320', 'Display Colors': '16.7M', 'Other Display Features': 'Screen Texture: a-Si, In-cell Touch Panel Technology, Screen Ratio: 19.5:9, Touch Panel Glass Type: GG3, Screen Contrast: 1200/900, Color Saturation: 70%/65% NTSC, Maximum Brightness: 450 nits/400 nits', 'Operating System': 'Android Pie 9.0', 'Processor Type': 'MediaTek P22 Octa Core 2.0 GHz', 'Processor Core': 'Octa Core', 'Primary Clock Speed': '2 GHz', 'Operating Frequency': 'GSM: 850/900/1800/1900 MHz, WCDMA: 850/900/2100 MHz, 4G LTE-FDD: B1/B3/B5/B8, 4G LTE-TD: B38/B40/B41 (2535 - 2655 MHz)', 'Internal Storage': '32 GB', 'RAM': '3 GB', 'Expandable Storage': '256 GB', 'Supported Memory Card Type': 'microSD', 'Memory Card Slot Type': 'Dedicated Slot', 'Primary Camera Available': 'Yes', 'Primary Camera': '13MP + 2MP', 'Primary Camera Features': '5P Lens, Focusing Method: AF, 4x Maximum Zoom Multiples, Focal Length: 3.462mm + 1.75mm, Bokeh Mode, Photo Management: Photo Editing, Sensor Size/Pixel Data: Main - 1.12 micrometer, Secondary-pixel Size: 1.75 micrometer, Aperture: F2.2 + F2.4, Video: 720p, 1080p, Sensor Type: CMOS', 'Secondary Camera Available': 'Yes', 'Secondary Camera': '5MP Front Camera', 'Secondary Camera Features': 'Sensor Size/Pixel Data: 1.12 micrometer, Aperture: F2.0, Bokeh Mode, Photo Management: Photo Editing, Focusing Method: FF, Focal Length: 2.63mm, 4P Lens, Video: 720p, 1080p, AI Beautification, Sensor Type: CMOS', 'Flash': 'Rear Flash', 'HD Recording': 'Yes', 'Full HD Recording': 'Yes', 'Video Recording': 'Yes', 'Video Recording Resolution': '1080p, 720p', 'Dual Camera Lens': 'Primary Camera', 'Network Type': '3G, 4G VOLTE, 4G, 2G', 'Supported Networks': 'GSM, WCDMA, 4G VoLTE, 4G LTE', 'Internet Connectivity': '4G, 3G, EDGE, GPRS', '3G': 'Yes', '3G Speed': 'HSPA+', 'GPRS': 'Yes', 'Micro USB Port': 'Yes', 'Bluetooth Support': 'Yes', 'Bluetooth Version': '4.2', 'Wi-Fi': 'Yes', 'Wi-Fi Version': '802.11 b/g/n', 'USB Connectivity': 'Yes', 'EDGE': 'Yes', 'Audio Jack': '3.5mm', 'Map Support': 'Google Maps', 'GPS Support': 'Yes', 'Smartphone': 'Yes', 'Touchscreen Type': 'Multi-touch', 'SIM Size': 'Dual Nano SIM', 'User Interface': 'ColorOS 6.0', 'Removable Battery': 'No', 'Graphics PPI': '282.22 PPI', 'Sensors': 'Magnetic Induction, Light Sensor, Proximity Sensor, G-sensor, Acceleration Sensor', 'Other Features': 'File Encryption, Import and Export Contacts, Game Acceleration (Specific Apps), Connection and Sharing, Oshare (Aim at the Indian Phone Number Recognition), Flashlight, Clone Apps, Face Recognition, Diamond Cut Design, Program Frozen, Dual VoLTE, WLAN Display, Files Compression and Decompression, 12nm CPU Technology, Kids Space, Dewdrop Screen, Import and Export Messages, Night Shield', 'GPS Type': 'GLONASS', 'Battery Capacity': '4000 mAh', 'Width': '73.7 mm', 'Height': '154.3 mm', 'Depth': '8.5 mm', 'Weight': '166 g', 'Warranty Summary': 'Brand Warranty of 1 Year Available for Mobile and 6 Months for Accessories'}",6999
"Realme C2 (Diamond Blue, 32 GB)  (2 GB RAM)",4.4,"7,24,835 Ratings","62,591 Reviews","{'In The Box': 'Handset, Adapter (5V/2A), Micro-USB Cable, Important Information Booklet with Warranty Card, Quick Guide, SIM Card Tool, Screen Protect Film', 'Model Number': 'RMX1941', 'Model Name': 'C2', 'Color': 'Diamond Blue', 'Browse Type': 'Smartphones', 'SIM Type': 'Dual Sim', 'Hybrid Sim Slot': 'No', 'Touchscreen': 'Yes', 'OTG Compatible': 'Yes', 'Display Size': '15.49 cm (6.1 inch)', 'Resolution': '1560 x 720 pixels', 'Resolution Type': 'HD+', 'GPU': 'GE8320', 'Display Colors': '16.7M', 'Other Display Features': 'Screen Texture: a-Si, In-cell Touch Panel Technology, Screen Ratio: 19.5:9, Touch Panel Glass Type: GG3, Screen Contrast: 1200/900, Color Saturation: 70%/65% NTSC, Maximum Brightness: 450 nits/400 nits', 'Operating System': 'Android Pie 9.0', 'Processor Type': 'MediaTek P22 Octa Core 2.0 GHz', 'Processor Core': 'Octa Core', 'Primary Clock Speed': '2 GHz', 'Operating Frequency': 'GSM: 850/900/1800/1900 MHz, WCDMA: 850/900/2100 MHz, 4G LTE-FDD: B1/B3/B5/B8, 4G LTE-TD: B38/B40/B41 (2535 - 2655 MHz)', 'Internal Storage': '32 GB', 'RAM': '2 GB', 'Expandable Storage': '256 GB', 'Supported Memory Card Type': 'microSD', 'Memory Card Slot Type': 'Dedicated Slot', 'Primary Camera Available': 'Yes', 'Primary Camera': '13MP + 2MP', 'Primary Camera Features': '5P Lens, Focusing Method: AF, 4x Maximum Zoom Multiples, Focal Length: 3.462mm + 1.75mm, Bokeh Mode, Photo Management: Photo Editing, Sensor Size/Pixel Data: Main - 1.12 micrometer, Secondary-pixel Size: 1.75 micrometer, Aperture: F2.2 + F2.4, Video: 720p, 1080p, Sensor Type: CMOS', 'Secondary Camera Available': 'Yes', 'Secondary Camera': '5MP Front Camera', 'Secondary Camera Features': 'Sensor Size/Pixel Data: 1.12 micrometer, Aperture: F2.0, Bokeh Mode, Photo Management: Photo Editing, Focusing Method: FF, Focal Length: 2.63mm, 4P Lens, Video: 720p, 1080p, AI Beautification, Sensor Type: CMOS', 'Flash': 'Rear Flash', 'HD Recording': 'Yes', 'Full HD Recording': 'Yes', 'Video Recording': 'Yes', 'Video Recording Resolution': '1080p, 720p', 'Dual Camera Lens': 'Primary Camera', 'Network Type': '3G, 4G VOLTE, 4G, 2G', 'Supported Networks': 'GSM, WCDMA, 4G VoLTE, 4G LTE', 'Internet Connectivity': '4G, 3G, EDGE, GPRS', '3G': 'Yes', '3G Speed': 'HSPA+', 'GPRS': 'Yes', 'Micro USB Port': 'Yes', 'Bluetooth Support': 'Yes', 'Bluetooth Version': '4.2', 'Wi-Fi': 'Yes', 'Wi-Fi Version': '802.11 b/g/n', 'USB Connectivity': 'Yes', 'EDGE': 'Yes', 'Audio Jack': '3.5mm', 'Map Support': 'Google Maps', 'GPS Support': 'Yes', 'Smartphone': 'Yes', 'Touchscreen Type': 'Multi-touch', 'SIM Size': 'Dual Nano SIM', 'User Interface': 'ColorOS 6.0', 'Removable Battery': 'No', 'Graphics PPI': '282.22 PPI', 'Sensors': 'Magnetic Induction, Light Sensor, Proximity Sensor, G-sensor, Acceleration Sensor', 'Other Features': 'File Encryption, Import and Export Contacts, Game Acceleration (Specific Apps), Connection and Sharing, Oshare (Aim at the Indian Phone Number Recognition), Flashlight, Clone Apps, Face Recognition, Diamond Cut Design, Program Frozen, Dual VoLTE, WLAN Display, Files Compression and Decompression, 12nm CPU Technology, Kids Space, Dewdrop Screen, Import and Export Messages, Night Shield', 'GPS Type': 'GLONASS', 'Battery Capacity': '4000 mAh', 'Width': '73.7 mm', 'Height': '154.3 mm', 'Depth': '8.5 mm', 'Weight': '166 g', 'Warranty Summary': 'Brand Warranty of 1 Year Available for Mobile and 6 Months for Accessories'}",5999
"Realme 6 Pro (Lightning Blue, 128 GB)  (8 GB RAM)",4.7,716 Ratings,114 Reviews,"{'In The Box': 'Handset, Adapter (5V/6A), Type C Cable, SIM Card Tool, Case, Warranty Card, Quick Guide', 'Model Number': 'RBS0627IN', 'Model Name': '6 Pro', 'Color': 'Lightning Blue', 'Browse Type': 'Smartphones', 'SIM Type': 'Dual Sim', 'Hybrid Sim Slot': 'No', 'Touchscreen': 'Yes', 'OTG Compatible': 'Yes', 'Sound Enhancements': 'Dolby Panorama Sound Effect, WCD9370 Audio Decoding Chip, Audio Certification Standard: Hi-Res, Dolby', 'SAR Value': 'Head (1 g) - 1.187 W/kg, Body (1 g) - 0.921 W/kg', 'Display Size': '16.76 cm (6.6 inch)', 'Resolution': '2400 x 1080 Pixels', 'Resolution Type': 'Full HD+', 'GPU': 'A618 (8 nm)', 'Display Type': 'Full HD+ LCD Display', 'Display Colors': '16.7M', 'Other Display Features': 'In-cell Touch Panel Technology, Screen Sealing Process: COG, 20:9 Screen Ratio, 90.5% Screen-to-body Ratio, 1500:1 (Typical) / 1200:1 (Minimum) Screen Contrast, 90 HZ Screen Refresh Rate, NTSC: 81.5% (Typical) Color Saturation, Maximum Brightness: 400 nits (Minimum), 480 nits (Typical), Gorilla Glass 5 Protection, 120 HZ Touch Sampling Rate, Touch Screen Supplier: JDI, BOE, Oleophpbic Coating', 'Operating System': 'Android 10', 'Processor Type': 'Snapdragon 720G', 'Processor Core': 'Octa Core', 'Primary Clock Speed': '2.3 GHz', 'Secondary Clock Speed': '1.8 GHz', 'Operating Frequency': 'GSM: 850 / 900 / 1800 / 1900, WCDMA: Bands 1 / 5 / 8, LTE: Bands 1 / 3 / 5 / 8 / 38 / 40 / 41 (2535 MHz - 2655 MHz)', 'Internal Storage': '128 GB', 'RAM': '8 GB', 'Expandable Storage': '256 GB', 'Supported Memory Card Type': 'microSD', 'Memory Card Slot Type': 'Dedicated Slot', 'Primary Camera Available': 'Yes', 'Primary Camera': '64MP + 12MP + 8MP + 2MP', 'Primary Camera Features': '64 MP Main Camera, 12 MP Long Focus Camera, 8 MP Wide Camera, 2 MP Macro Camera, Sensor Sizes / Pixel Data: Rear Main 1/1.7, 0.8 um, Long Focus 1/3.4, 1 um, Rear Wide 1/4, 1.12 um, Macro 1/5 1.75 um, Focusing Method: Rear Main PDAF, Long Focus PDAF, Rear Wide Fixed Focus, Macro Fixed Focus, Aperture: Rear Main - F1.8, Long Focus - F2.5, Rear Wide - F2.3, Macro - F2.4, Focal Length: Rear Main - 26 mm, Long Focus - 54 mm, Rear Wide -15.7 mm, Wide Angle of Rear Camera: Rear Main - 78.6 Degree, Long Focus - 45 Degree, Rear Wide - 119 Degree, Macro - 88.8 Degree, Mens Material: GG5, Lens Number: Rear Main - 6P, Long Focus - 5P, Rear Wide - 5P, Macro - 3P, Macro Lens - 4 cm FF, Slow Motion, Rear Main - 720p at 240 fps, 1080p at 120 fps, Characteristic Function for Photograph: 64 MP Mode, Ultra Steady Video, Ultra Steady Max Video, Night Mode, Panoramic view, Expert, Timelapse, Portrait Mode, HDR, Ultra wide, Ultra Macro, AI Scene Recognition, AI Beauty, Filter, Chroma Boost, Slow Motion, Bokeh Effect Control', 'Secondary Camera Available': 'Yes', 'Secondary Camera': '16MP + 8MP Dual Front Camera', 'Secondary Camera Features': 'Sensor Sizes/Pixel data: 16 MP - 1/3.09, Full Size 16M Pixel Size 1.0 um, 8 MP - 1/4, Pixel Size 1.12 um, CMOS Sensor, Focusing Mode: Fixed Focus + Fixed Focus, Wide Angle of Front Camera: 16 MP - 79.3 Degree, 8 MP - 105 Degree, Aperture: 16 MP - F2.1, 8 MP - F2.2, Front Camera Lens Material: GG5, Lens Number: 5P+5P, EIS Support, Characteristic Function for Photograph: Ultra Steady Video, Portrait Mode, Timelapse, Panoramic View, Beauty Mode, HDR, Face Recognition, Filter, Night Mode, Bokeh Effect Control, Ways of Taking Photos: Timer, Touch, Gesture, Volume Button, Supported Resolution and Frame Rate in Video: 720p at 30 fps (Default), 1080p at 30 fps (Support), Sensor Manufacturer and Model: Sony / IMX471 (16 MP)', 'Flash': 'Rear Flash', 'Full HD Recording': 'Yes', 'Video Recording': 'Yes', 'Video Recording Resolution': 'Front Camera: 720P at 30 fps, 1080P at 30 fps, Rear Camera: 720p at 30 fps, 720p at 60 fps, 1080p at 30 fps, 1080p at 60 fps, 4K at 30 fps', 'Dual Camera Lens': 'Primary & Secondary Camera', 'Call Records': 'Yes', 'Network Type': '4G VOLTE, 4G, 3G, 2G', 'Supported Networks': '4G VoLTE, 4G LTE, WCDMA, GSM', 'Internet Connectivity': '4G, 3G, Wi-Fi, EDGE, GPRS', 'GPRS': 'Yes', 'Bluetooth Support': 'Yes', 'Bluetooth Version': 'v5.1', 'Wi-Fi': 'Yes', 'Wi-Fi Version': '802.11a/b/g/n/ac', 'Wi-Fi Hotspot': 'Yes', 'NFC': 'No', 'USB Connectivity': 'Yes', 'Audio Jack': '3.5mm', 'Map Support': 'Google Maps', 'GPS Support': 'Yes', 'Smartphone': 'Yes', 'Touchscreen Type': 'Capacitive', 'SIM Size': 'Nano SIM', 'User Interface': 'realme UI Based on Android 10', 'SMS': 'Yes', 'Graphics PPI': '400 PPI', 'Sensors': 'Magnetic Induction Sensor, Light Sensor, Proximity Sensor, Gyro, Acceleration Sensor', 'Browser': 'Google Chrome', 'Ringtones Format': 'OGG', 'Other Features': 'Back Cover Material: Glass, Back Cover Technology: 3D Glass + Film, OTG Storage Format: FAT32, NTFS, EXFAT, Heat Dissipation Technology: Double Layers Graphite + Copper Foil, Vooc Flash Charging Protocol Supported, Charging Power: 30 W, PD Charge Support, RF Antenna Technology: Support 2x2 MIMO Antenna Technology, Bluetooth Audio Codec: SBC, AAC, APTX, APTX-HD, LDAC, APTX-TWS+, WLAN Display, Game Accelerattion, APP Market, Theme Store, Clone Phone, Telephone Number Identification, Fingerprint Access Time: 437 ms, Wet Hand Unlock (Little Water), Face Unlock, Face Unlock Time: 508 ms, File Encryption, 71 Countries Language Supported, AI Camera, Dual Channel RAM, RAM Frequency: Upto 1866 MHz, UFS 2.1 ROM, Snapdragon 720G (2 x Gold (A76) at 2.3G HZ + 6 x Silver (A55) at 1.8 GHz) 8 nm 64-bit Processor', 'GPS Type': 'A-GPS, GLONASS, BeiDou', 'FM Radio': 'Yes', 'Music Player': 'Yes', 'Video Formats': 'MP4', 'Battery Capacity': '4300 mAh', 'Width': '75.8 mm', 'Height': '163.9 mm', 'Depth': '9.4 mm', 'Weight': '195 g', 'Warranty Summary': 'Brand Warranty of 1 Year Available for Mobile Including Battery and 6 Months for Accessories', 'Domestic Warranty': '1 Year'}",18999
"Redmi Note 7 Pro (Space Black, 64 GB)  (6 GB RAM)",4.5,"2,48,806 Ratings","21,242 Reviews","{'In The Box': 'Handset, SIM Ejector Tool, Soft Case, Manual, Adapter, Cable', 'Model Number': 'MZB7465IN', 'Model Name': 'Redmi Note 7 Pro', 'Color': 'Space Black', 'Browse Type': 'Smartphones', 'SIM Type': 'Dual Sim', 'Hybrid Sim Slot': 'Yes', 'Touchscreen': 'Yes', 'OTG Compatible': 'Yes', 'Quick Charging': 'Yes', 'Sound Enhancements': 'Speaker - Single (Bottom Opening), Microphones - 2 (For Noise Cancellation), Smart PA', 'SAR Value': 'India SAR 1g limit: 1.6W/Kg, Head SAR: 0.962W/Kg (0mm Separation), Body SAR Value: 0.838W/Kg (15mm Separation)', 'Display Size': '16.0 cm (6.3 inch)', 'Resolution': '2340 x 1080 pixels', 'Resolution Type': 'Full HD+', 'GPU': 'Adreno 612', 'Display Type': 'IPS (In-cell), RD', 'Other Display Features': 'Contrast Ratio - 1500:1, NTSC Ratio - 81.41%, 2.5D Glass (In-front), Corning Gorilla Glass 5 (Front and Back), Dot Notch Display', 'Operating System': 'Android Pie 9', 'Processor Type': 'Qualcomm Snapdragon 675', 'Processor Core': 'Octa Core', 'Primary Clock Speed': '2 GHz', 'Secondary Clock Speed': '1.7 GHz', 'Operating Frequency': 'GSM - B2, B3, B5, B8, WCDMA - B1, B2, B5, B8, LTE TDD - B40, B41, LTE FDD - B1, B3, B5, B8, CA - 1C (Only DLCA), 3C, 40C, 41C', 'Internal Storage': '64 GB', 'RAM': '6 GB', 'Expandable Storage': '256 GB', 'Supported Memory Card Type': 'microSD', 'Memory Card Slot Type': 'Hybrid Slot', 'Primary Camera Available': 'Yes', 'Primary Camera': '48MP + 5MP', 'Primary Camera Features': '48MP - f1.79, 1.6micrometer (4-in-1), 5MP - f2.2, 1.12mirometer, Primary 6P Lens, Secondary 3P Lens, PDAF, AI Dual Camera', 'Secondary Camera Available': 'Yes', 'Secondary Camera': '13MP Front Camera', 'Secondary Camera Features': 'Aperture - F2.0, Pixel Size - 1.12micrometer, AI Front Camera', 'Flash': 'Single Tone Dual LED Flash', 'HD Recording': 'Yes', 'Full HD Recording': 'Yes', 'Video Recording': 'Yes', 'Dual Camera Lens': 'Primary Camera', 'Network Type': '3G, 4G VOLTE, 2G', 'Supported Networks': 'GSM, WCDMA, 4G VoLTE, 4G LTE', 'Internet Connectivity': '4G, 3G, Wi-Fi', 'Bluetooth Support': 'Yes', 'Bluetooth Version': 'v5.0', 'Wi-Fi': 'Yes', 'Wi-Fi Version': '802.11 a/b/g/n/ac', 'USB Connectivity': 'Yes', 'Audio Jack': '3.5mm', 'Map Support': 'Google Maps', 'GPS Support': 'Yes', 'SIM Size': 'Nano SIM + Nano SIM', 'User Interface': 'MIUI 10', 'Graphics PPI': '409 PPI', 'Sensors': 'Rear Fingerprint Scanner, Ambient Light Sensor, Proximity Sensor, E-compass, Accelerometer, Gyroscope, Sony IMX586 Sensor', 'Other Features': 'Processor - 2 x Gold 2.0 GHz + 6 x Silver 1.7 GHz, eMMC v5.1, Body - 2.5D Glass Back, USB Type-C, IR Blaster, Charger - 5V/2A, Super Low Light Mode, Quick Charge 4.0, Dual VoLTE, Two Days Battery, Aura Design, Gradient Reflective Glass Back, EIS for Video Recording, Studio Lighting', 'GPS Type': 'A-GPS, GLONASS, BeiDou', 'Battery Capacity': '4000 mAh', 'Width': '75.21 mm', 'Height': '159.21 mm', 'Depth': '8.1 mm', 'Weight': '186 g', 'Warranty Summary': 'Brand Warranty of 1 Year Available for Mobile and 6 Months for Accessories'}",10999
"OPPO A9 2020 (Space Purple, 128 GB)  (4 GB RAM)",4.4,"2,227 Ratings",212 Reviews,"{'In The Box': 'Handset, Adapter, Headset, Micro USB Cable, Important Info. Booklet with Warranty Card, Quick Start Guide, Sim Card Tool, Protective Film, Pre-applied, Case', 'Model Number': 'CPH1937', 'Model Name': 'A9 2020', 'Color': 'Space Purple', 'Browse Type': 'Smartphones', 'SIM Type': 'Dual Sim', 'Hybrid Sim Slot': 'No', 'Touchscreen': 'Yes', 'OTG Compatible': 'Yes', 'Sound Enhancements': 'Dolby Atmos and Dual Stereo Speakers', 'Display Size': '16.51 cm (6.5 inch)', 'Resolution': '1600 x 720 Pixels', 'GPU': 'Adreno 610', 'Display Type': 'TFT-LCD', 'Display Colors': '16M', 'Other Display Features': 'Touch Panel Technology: In-cell, Narrow Frame - Upper Border: 2.44mm, Left and Right Border: 1.98mm, Lower Border: 6.6mm, Screen Ratio: 89.0%, Screen Contrast: 1500:1, Color Saturation: Typical 71%, Maximum Brightness: 480nits, Touch Panel Glass Type: GG3+, TYPE-C USB 2.0', 'Operating System': 'Android Pie 9', 'Processor Type': 'Qualcomm SM6125', 'Processor Core': 'Octa Core', 'Primary Clock Speed': '1.8 GHz', 'Secondary Clock Speed': '2 GHz', 'Internal Storage': '128 GB', 'RAM': '4 GB', 'Memory Card Slot Type': 'Dedicated Slot', 'Primary Camera Available': 'Yes', 'Primary Camera': '48MP + 8MP + 2MP + 2MP', 'Primary Camera Features': 'Ultra Wide Quad Camera, Sensor Type: 48MP CMOS/S5KGM1SP/OV48B, 8MP COMS/Hi846/OV8856, 2MP CMOS/OV02A1B/GC02M0, 2MP CMOS/GC02M0/OV02A1B, Maximum Zoom Multiples: 10X, Aperture: 48MP (f/1.8) + 8MP (f/2.25) + 2MP (f/2.4) + 2MP (f/2.4), Focal Length: 48MP (4.71mm) + 8MP (1.66mm) + 2MP (1.77mm) + 2MP (f1.77mm), Lens Number: 48MP (6P) + 8MP (5P) + 2MP (3P) + 2MP (3P)', 'Secondary Camera Available': 'Yes', 'Secondary Camera': '16MP Front Camera', 'Secondary Camera Features': 'Sensor Sizes/Pixel Data - 1/3.1inch, 1.0micrometer, Sensor Type: S5K3P9SP04, Wide Angle of Front: 79Degree, Aperture: F2.0, Focal Length: 3.42mm, Lens Number: 5P', 'Flash': 'Rear LED Flash', 'Frame Rate': 'Front Camera Video: 1080P/720P at 30 fps', 'Dual Camera Lens': 'Primary Camera', 'Network Type': '4G VOLTE, 4G, 3G, 2G', 'Supported Networks': '4G VoLTE, UMTS, GSM, 4G LTE, WCDMA, CDMA', 'Internet Connectivity': '4G, 3G, Wi-Fi, EDGE, GPRS', '3G Speed': 'HSPA+', 'GPRS': 'Yes', 'Micro USB Port': 'Yes', 'Micro USB Version': '2', 'Bluetooth Support': 'Yes', 'Bluetooth Version': 'v5.0', 'Wi-Fi': 'Yes', 'Wi-Fi Version': '802.11a/b/g/n/ac', 'USB Connectivity': 'Yes', 'EDGE': 'Yes', 'Audio Jack': '3.5mm', 'Smartphone': 'Yes', 'Touchscreen Type': 'Capacitive Screen, Multi-touch', 'SIM Size': 'Dual Nano SIM', 'User Interface': 'ColorOS 6.0.1', 'Removable Battery': 'No', 'Graphics PPI': '269 PPI', 'Ringtones Format': 'MP3/AMR/APE/OGG/FLAC/WAV/MIDI/WMA', 'Other Features': 'Face Recognition, Split Screen (Specific Apps), Clone Apps, Night Shield, Sensor Hub, Game Acceleration (Specific Apps), CPU Technology - 11nm, ROM Technology: UFS 2.1, Energy Density - 696 Wh/L, Charge Speed/Power - 5V 2A, 10W, WLAN 2.4G, WLAN 5.1G, WLAN 5.8G, WLAN Display, Game Boost 2.0, 4G+, 64 bits Processor, Video Stability, Ultra Night Mode 2.0, Reverse Charging', 'FM Radio': 'Yes', 'Audio Formats': 'MP3/AAC/APE/AMR/WAV/MID/OGG/FLAC/WMA', 'Video Formats': 'AVI/3GP/MP4/WMV/MKV/MOV/ASF/FLV', 'Battery Capacity': '5000 mAh', 'Width': '75.6 mm', 'Height': '163.6 mm', 'Depth': '9.1 mm', 'Weight': '195 g', 'Warranty Summary': 'Brand Warranty of 1 Year Available for Mobile and 6 Months for Accessories'}",14990
"Redmi 8A (Sunset Red, 32 GB)  (3 GB RAM)",4.4,"1,05,772 Ratings","8,682 Reviews","{'In The Box': 'Handset, Data Cable, Adapter, Manual, SIM Card Ejector', 'Model Number': 'MZB8459IN', 'Model Name': 'Redmi 8A', 'Color': 'Sunset Red', 'Browse Type': 'Smartphones', 'SIM Type': 'Dual Sim', 'Hybrid Sim Slot': 'No', 'Touchscreen': 'Yes', 'OTG Compatible': 'Yes', 'Quick Charging': 'Yes', 'SAR Value': 'Head: 0.339 W/kg, Body: 1.000 W/kg', 'Display Size': '15.8 cm (6.22 inch)', 'Resolution': '1520 x 720 Pixels', 'Resolution Type': 'HD+', 'GPU': 'Adreno 505 at 650 MHz', 'Other Display Features': 'Screen Protection: Gorilla Glass 5 (Front Glass), Screen Mirror/Cast', 'Operating System': 'Android Pie 9.0', 'Processor Type': 'Qualcomm Snapdragon 439', 'Processor Core': 'Octa Core', 'Primary Clock Speed': '1.95 GHz', 'Secondary Clock Speed': '1.45 GHz', 'Operating Frequency': 'GSM: B2, B3, B5, B8, WCDMA: B1, B2, B5, B8, LTE TDD: B40, B41, LTE FDD: B1, B3, B5, B8', 'Internal Storage': '32 GB', 'RAM': '3 GB', 'Expandable Storage': '512 GB', 'Supported Memory Card Type': 'microSD', 'Memory Card Slot Type': 'Dedicated Slot', 'Primary Camera Available': 'Yes', 'Primary Camera': '12MP Rear Camera', 'Primary Camera Features': '12MP 1.4 micrometer Large Pixel Size with f/1.8, 6P Lens and Dual PD, Portrait, Bokeh, Panaroma', 'Secondary Camera Available': 'Yes', 'Secondary Camera': '8MP Front Camera', 'Secondary Camera Features': 'f/2.0, Portrait, Beauty Mode', 'Flash': 'Rear and Front Screen Flash', 'Network Type': '4G VOLTE, 3G, 2G', 'Supported Networks': '4G VoLTE, 4G LTE, WCDMA, GSM', 'Internet Connectivity': '4G, 3G, Wi-Fi', 'Bluetooth Support': 'Yes', 'Bluetooth Version': 'v4.2', 'Wi-Fi': 'Yes', 'Wi-Fi Version': '802.11 b/g/n', 'Wi-Fi Hotspot': 'Yes', 'USB Connectivity': 'Yes', 'Audio Jack': '3.5mm', 'Map Support': 'Google Maps', 'GPS Support': 'Yes', 'Smartphone': 'Yes', 'SIM Size': 'Nano SIM + Nano SIM', 'User Interface': 'MIUI 10', 'Removable Battery': 'No', 'Graphics PPI': '270.4 PPI', 'Other Features': 'Face Unlock, Dual App Support, Quick Charging Version: QC 3.0, Charger Details: 5V/2A (Phone Support 18W), USB Type: Type C 2.0, Processor Type: 4 x 1.95 GHz, 4 x 1.45 GHz, A53 + A53, Aura Wave Grip Design, Splash-proof by P2i, Wireless FM Radio', 'FM Radio': 'Yes', 'Battery Capacity': '5000 mAh', 'Battery Type': 'Li-polymer', 'Width': '75.41 mm', 'Height': '156.48 mm', 'Depth': '9.4 mm', 'Weight': '188 g', 'Warranty Summary': 'Brand Warranty of 1 Year Available for Mobile and 6 Months for Accessories'}",6999
