Name,Stars,Ratings,Reviews,Specifications,Price
"InFocus A3 (Platinum Gold, 16 GB)  (2 GB RAM)",3.9,"1,115 Ratings",187 Reviews,"{'In The Box': 'Handset, Battery, Charger, Earphone', 'Model Number': 'A3', 'Model Name': 'A3', 'Color': 'Platinum Gold', 'Browse Type': 'Smartphones', 'SIM Type': 'Dual Sim', 'Hybrid Sim Slot': 'Yes', 'Touchscreen': 'Yes', 'OTG Compatible': 'Yes', 'Display Size': '13.21 cm (5.2 inch)', 'Resolution': '720 x 1280 Pixels', 'Resolution Type': 'HD', 'Operating System': 'Android Nougat 7', 'Processor Core': 'Quad Core', 'Primary Clock Speed': '1.3 GHz', 'Internal Storage': '16 GB', 'RAM': '2 GB', 'Memory Card Slot Type': 'Hybrid Slot', 'Primary Camera Available': 'Yes', 'Primary Camera': '13MP + 2MP', 'Primary Camera Features': 'Flash', 'Secondary Camera Available': 'Yes', 'Secondary Camera': '8MP Front Camera', 'Dual Camera Lens': 'Primary Camera', 'Call Wait/Hold': 'Yes', 'Conference Call': 'Yes', 'Hands Free': 'Yes', 'Video Call Support': 'Yes', 'Call Divert': 'Yes', 'Phone Book': 'Yes', 'Speaker Phone': 'Yes', 'Call Records': 'Yes', 'Logs': 'Yes', 'Network Type': '3G, 4G, 2G', 'Supported Networks': 'GSM, 4G LTE', 'Smartphone': 'Yes', 'Keypad Type': 'QWERTY', 'Social Networking Phone': 'Yes', 'Instant Message': 'Yes', 'Business Phone': 'Yes', 'MMS': 'Yes', 'SMS': 'Yes', 'Voice Input': 'Yes', 'SIM Access': 'Dual SIM', 'Sensors': 'Fingerprint Sensor', 'Battery Capacity': '3000 mAh', 'Dual Battery': 'No', 'Warranty Summary': '1 Year', 'Covered in Warranty': 'Manufacturer Warranty', 'Domestic Warranty': '1 Year'}",4199
"Samsung Galaxy A70s (Prism Crush White, 128 GB)  (8 GB RAM)",4.4,622 Ratings,81 Reviews,"{'In The Box': 'Handset, Travel Adapter, USB Cable , Earphones and User Manual', 'Model Number': 'SM-A707FZWWINS', 'Model Name': 'Galaxy A70s', 'Color': 'Prism Crush White', 'Browse Type': 'Smartphones', 'SIM Type': 'Dual Sim', 'Hybrid Sim Slot': 'No', 'Touchscreen': 'Yes', 'OTG Compatible': 'Yes', 'Display Size': '17.02 cm (6.7 inch)', 'Resolution': '1080 x 2400 Pixels', 'Resolution Type': 'Full HD+', 'GPU': 'Qualcomm Adreno 612', 'Display Type': 'Amoled', 'Operating System': 'Android Pie 9', 'Processor Type': 'Qualcomm SM6150', 'Processor Core': 'Octa Core', 'Primary Clock Speed': '2 GHz', 'Secondary Clock Speed': '1.7 GHz', 'Internal Storage': '128 GB', 'RAM': '8 GB', 'Expandable Storage': '512 GB', 'Memory Card Slot Type': 'Dedicated Slot', 'Primary Camera Available': 'Yes', 'Primary Camera': '64MP + 5MP + 8MP', 'Primary Camera Features': 'Aperture: 64MP (F1.8) + 5MP (F2.2) + 8MP (F2.2), Night Mode', 'Secondary Camera Available': 'Yes', 'Secondary Camera': '32MP Front Camera', 'Secondary Camera Features': 'Aperture: F(2.0), Self Portrait', 'Dual Camera Lens': 'Primary Camera', 'Network Type': '3G, 4G, 2G', 'Supported Networks': 'GSM, WCDMA, 4G LTE', 'Audio Jack': '3.5mm', 'Smartphone': 'Yes', 'SIM Size': 'Nano SIM', 'Removable Battery': 'No', 'Keypad': 'No', 'Graphics PPI': '393 PPI', 'Battery Capacity': '4500 mAh', 'Width': '76.7 mm', 'Height': '164.3 mm', 'Depth': '7.9 mm', 'Weight': '188 g', 'Warranty Summary': 'Brand Warranty of 1 Year Available for Mobile and 6 Months for Accessories'}",27999
"Apple iPhone 11 Pro Max (Space Grey, 64 GB)",4.7,795 Ratings,88 Reviews,"{'In The Box': 'Handset, EarPods with Lightning Connector, USB-C to Lightning Cable, 18W USB-C Power Adapter, Documentation', 'Model Number': 'MWHD2HN/A', 'Model Name': 'iPhone 11 Pro Max', 'Color': 'Space Grey', 'Browse Type': 'Smartphones', 'SIM Type': 'Dual Sim', 'Hybrid Sim Slot': 'No', 'Touchscreen': 'Yes', 'OTG Compatible': 'No', 'SAR Value': '1.6 W/kg (over 1 g) SAR Limit, Head: 1.16, Body: 1.17', 'Display Size': '16.51 cm (6.5 inch)', 'Resolution': '2688 x 1242 Pixels', 'Resolution Type': 'Super Retina XDR Display', 'Other Display Features': '2,000,000:1 Contrast Ratio (Typical), True Tone Display, Wide Colour Display (P3), Haptic Touch, 800 nits Max Brightness (Typical), 1200 nits Max Brightness (HDR), Fingerprint-resistant Oleophobic Coating, Support for Display of Multiple Languages and Characters Simultaneously', 'Operating System': 'iOS 13', 'Processor Type': 'A13 Bionic Chip', 'Internal Storage': '64 GB', 'Primary Camera Available': 'Yes', 'Primary Camera': '12MP + 12MP + 12MP', 'Primary Camera Features': 'Triple 12MP Ultra Wide, Wide and Telephoto Cameras, Ultra Wide: f/2.4 Aperture and 120Degree Field of View, Wide: f/1.8 Aperture, Telephoto: f/2.0 Aperture, Portrait Mode with Advanced Bokeh and Depth Control, Portrait Lighting with Six Effects (Natural, Studio, Contour, Stage, Stage Mono, High-key Mono), Dual Optical Image Stabilisation (Wide and Telephoto), Five Element Lens (Ultra Wide), Six-element Lens (Wide and Telephoto), Brighter True Tone flash with Slow Sync, Panorama (up to 64MP), 100% Focus Pixels (Wide), Night Mode, Auto Adjustments, Next Generation Smart HDR for Photos, Wide Colour Capture for Photos and Live Photos, Advanced Red Eye Correction, Photo Geotagging, Auto Image Stabilisation, Burst Mode, Image Formats Captured: HEIF and JPEG', 'Optical Zoom': 'Yes', 'Secondary Camera Available': 'Yes', 'Secondary Camera': '12MP Front Camera', 'Secondary Camera Features': 'TrueDepth Camera - 12MP Camera, f/2.2 Aperture, Portrait Mode with Advanced Bokeh and Depth Control, Portrait Lighting with Six Effects (Natural, Studio, Contour, Stage, Stage Mono, High Key Mono), Animoji and Memoji, 4K Video Recording at 24 fps, 30 fps or 60 fps, 1080p HD Video Recording at 30 fps or 60 fps, Slow-motion Video Support for 1080p at 120 fps, Next-generation Smart HDR for Photos, Extended Dynamic Range for Video at 30 fps, Cinematic Video Stabilisation (4K,1080p and 720p), Wide Colour Capture for Photos and Live Photos, Retina Flash, Auto Image Stabilisation, Burst Mode', 'Flash': 'Rear Brighter True Tone Flash with Slow Sync and Front Retina Flash', 'HD Recording': 'Yes', 'Full HD Recording': 'Yes', 'Video Recording': 'Yes', 'Frame Rate': 'Rear Camera - 4K Video Recording at 24 fps, 30 fps or 60 fps, 1080p HD Video Recording at 30 fps or 60 fps, 720p HD Video Recording at 30 fps, Extended Dynamic Range for Video upto 60 fps, Slow-motion Video Support for 1080p at 120 fps or 240 fps | True Depth Camera - 4K Video Recording at 24 fps, 30 fps or 60 fps, 1080p HD Video Recording at 30 fps or 60 fps, Slow-motion Video Support for 1080p at 120 fps, Extended Dynamic Range for Video at 30 fps fps', 'Dual Camera Lens': 'Primary Camera', 'Phone Book': 'Yes', 'Speaker Phone': 'Yes', 'Network Type': '4G VOLTE, 4G, 3G, 2G', 'Supported Networks': '4G VoLTE, 4G LTE, UMTS, GSM', 'Internet Connectivity': '4G, 3G, Wi-Fi', '3G': 'Yes', 'Pre-installed Browser': 'Safari', 'Bluetooth Support': 'Yes', 'Bluetooth Version': '5', 'Wi-Fi': 'Yes', 'Wi-Fi Version': '802.11ax Wi-Fi 6 with 2x2 MIMO', 'Wi-Fi Hotspot': 'Yes', 'NFC': 'Yes', 'Smartphone': 'Yes', 'SIM Size': 'Nano SIM and eSIM', 'Removable Battery': 'No', 'Graphics PPI': '458 PPI', 'Sensors': 'Face ID, Barometer, Three Axis Gyro, Accelerometer, Proximity Sensor, Ambient Light Sensor', 'Supported Languages': 'Multi Languages Support', 'Series': 'iPhone 11 Pro Max', 'Other Features': 'Water Resistant upto 4 Metres for up to 30 Minutes, Upto 5 More Hours of Battery life, Faster Face ID�', 'Audio Formats': 'AAC LC, HE AAC, HE AAC v2, Protected AAC, MP3, Linear PCM, Apple Lossless, FLAC, Dolby Digital (AC 3), Dolby Digital Plus (E AC 3), Dolby Atmos and Audible (Formats 2, 3, 4, Audible Enhanced Audio, AAX and AAX+)', 'Video Formats': 'HEVC, H.264, MPEG 4 Part 2 and Motion JPEG, High Dynamic Range with Dolby Vision and HDR10 Content', 'Width': '77.8 mm', 'Height': '158 mm', 'Depth': '8.1 mm', 'Weight': '226 g', 'Warranty Summary': 'Brand Warranty for 1 Year'}",109900
"OPPO A9 2020 (Space Purple, 128 GB)  (4 GB RAM)",4.4,"2,227 Ratings",212 Reviews,"{'In The Box': 'Handset, Adapter, Headset, Micro USB Cable, Important Info. Booklet with Warranty Card, Quick Start Guide, Sim Card Tool, Protective Film, Pre-applied, Case', 'Model Number': 'CPH1937', 'Model Name': 'A9 2020', 'Color': 'Space Purple', 'Browse Type': 'Smartphones', 'SIM Type': 'Dual Sim', 'Hybrid Sim Slot': 'No', 'Touchscreen': 'Yes', 'OTG Compatible': 'Yes', 'Sound Enhancements': 'Dolby Atmos and Dual Stereo Speakers', 'Display Size': '16.51 cm (6.5 inch)', 'Resolution': '1600 x 720 Pixels', 'GPU': 'Adreno 610', 'Display Type': 'TFT-LCD', 'Display Colors': '16M', 'Other Display Features': 'Touch Panel Technology: In-cell, Narrow Frame - Upper Border: 2.44mm, Left and Right Border: 1.98mm, Lower Border: 6.6mm, Screen Ratio: 89.0%, Screen Contrast: 1500:1, Color Saturation: Typical 71%, Maximum Brightness: 480nits, Touch Panel Glass Type: GG3+, TYPE-C USB 2.0', 'Operating System': 'Android Pie 9', 'Processor Type': 'Qualcomm SM6125', 'Processor Core': 'Octa Core', 'Primary Clock Speed': '1.8 GHz', 'Secondary Clock Speed': '2 GHz', 'Internal Storage': '128 GB', 'RAM': '4 GB', 'Memory Card Slot Type': 'Dedicated Slot', 'Primary Camera Available': 'Yes', 'Primary Camera': '48MP + 8MP + 2MP + 2MP', 'Primary Camera Features': 'Ultra Wide Quad Camera, Sensor Type: 48MP CMOS/S5KGM1SP/OV48B, 8MP COMS/Hi846/OV8856, 2MP CMOS/OV02A1B/GC02M0, 2MP CMOS/GC02M0/OV02A1B, Maximum Zoom Multiples: 10X, Aperture: 48MP (f/1.8) + 8MP (f/2.25) + 2MP (f/2.4) + 2MP (f/2.4), Focal Length: 48MP (4.71mm) + 8MP (1.66mm) + 2MP (1.77mm) + 2MP (f1.77mm), Lens Number: 48MP (6P) + 8MP (5P) + 2MP (3P) + 2MP (3P)', 'Secondary Camera Available': 'Yes', 'Secondary Camera': '16MP Front Camera', 'Secondary Camera Features': 'Sensor Sizes/Pixel Data - 1/3.1inch, 1.0micrometer, Sensor Type: S5K3P9SP04, Wide Angle of Front: 79Degree, Aperture: F2.0, Focal Length: 3.42mm, Lens Number: 5P', 'Flash': 'Rear LED Flash', 'Frame Rate': 'Front Camera Video: 1080P/720P at 30 fps', 'Dual Camera Lens': 'Primary Camera', 'Network Type': '4G VOLTE, 4G, 3G, 2G', 'Supported Networks': '4G VoLTE, UMTS, GSM, 4G LTE, WCDMA, CDMA', 'Internet Connectivity': '4G, 3G, Wi-Fi, EDGE, GPRS', '3G Speed': 'HSPA+', 'GPRS': 'Yes', 'Micro USB Port': 'Yes', 'Micro USB Version': '2', 'Bluetooth Support': 'Yes', 'Bluetooth Version': 'v5.0', 'Wi-Fi': 'Yes', 'Wi-Fi Version': '802.11a/b/g/n/ac', 'USB Connectivity': 'Yes', 'EDGE': 'Yes', 'Audio Jack': '3.5mm', 'Smartphone': 'Yes', 'Touchscreen Type': 'Capacitive Screen, Multi-touch', 'SIM Size': 'Dual Nano SIM', 'User Interface': 'ColorOS 6.0.1', 'Removable Battery': 'No', 'Graphics PPI': '269 PPI', 'Ringtones Format': 'MP3/AMR/APE/OGG/FLAC/WAV/MIDI/WMA', 'Other Features': 'Face Recognition, Split Screen (Specific Apps), Clone Apps, Night Shield, Sensor Hub, Game Acceleration (Specific Apps), CPU Technology - 11nm, ROM Technology: UFS 2.1, Energy Density - 696 Wh/L, Charge Speed/Power - 5V 2A, 10W, WLAN 2.4G, WLAN 5.1G, WLAN 5.8G, WLAN Display, Game Boost 2.0, 4G+, 64 bits Processor, Video Stability, Ultra Night Mode 2.0, Reverse Charging', 'FM Radio': 'Yes', 'Audio Formats': 'MP3/AAC/APE/AMR/WAV/MID/OGG/FLAC/WMA', 'Video Formats': 'AVI/3GP/MP4/WMV/MKV/MOV/ASF/FLV', 'Battery Capacity': '5000 mAh', 'Width': '75.6 mm', 'Height': '163.6 mm', 'Depth': '9.1 mm', 'Weight': '195 g', 'Warranty Summary': 'Brand Warranty of 1 Year Available for Mobile and 6 Months for Accessories'}",14990
"Lenovo X2-AP (Gold, 32 GB)  (2 GB RAM)",3.7,"3,557 Ratings",907 Reviews,"{'In The Box': 'User Guide, Earphones, Travel Adaptor, Warranty Card, USB Cable, Handset', 'Model Name': 'X2-AP', 'Color': 'Gold', 'Browse Type': 'Smartphones', 'SIM Type': 'Dual Sim', 'Hybrid Sim Slot': 'No', 'Touchscreen': 'Yes', 'Sound Enhancements': '1 x Speaker, Hi-Fi Sound', 'SAR Value': 'At the Head - 0.612 W/Kg, At the Body 0.297 W/Kg', 'Display Size': '12.7 cm (5 inch)', 'Resolution': '1920 x 1080 Pixels', 'Resolution Type': 'Full HD', 'GPU': 'Power VR G6200; 450MHz Speed (Two Clusters)', 'Display Colors': '16 M', 'Other Display Features': 'Gorilla Glass 3, IPS Display', 'Operating System': 'Android KitKat 4.4', 'Processor Type': 'MediaTek 6595M', 'Processor Core': 'Octa Core', 'Primary Clock Speed': '2 GHz', 'Operating Frequency': 'GSM - 850, 900, 1800, 1900; UMTS - 2100; 4G: LTE (FDD) - Band 1, Band 3, Band 7, Band 20, LTE (TDD) - Band 40', 'Internal Storage': '32 GB', 'RAM': '2 GB', 'Phone Book Memory': 'Yes', 'Call Log Memory': 'Yes', 'SMS Memory': 'Yes', 'Primary Camera Available': 'Yes', 'Primary Camera': '13MP Rear Camera', 'Primary Camera Features': 'Auto Focus, Zoom 4x', 'Secondary Camera Available': 'Yes', 'Secondary Camera': '5MP Front Camera', 'Secondary Camera Features': 'Fixed Focus', 'Flash': 'LED', 'HD Recording': 'Yes', 'Video Recording': 'Yes', 'Video Recording Resolution': '720 x 1080', 'Phone Book': 'Yes', 'Network Type': '3G, 4G', 'Supported Networks': 'GSM, 4G LTE', 'Internet Connectivity': '3G, 4G, Wi-Fi', '3G': 'Yes', '3G Speed': '150 Mbps HSDPA; 50 Mbps HSUPA; HSPA+', 'Pre-installed Browser': 'Android, UC Browser', 'Micro USB Port': 'Yes', 'Bluetooth Support': 'Yes', 'Bluetooth Version': '4', 'Wi-Fi': 'Yes', 'Wi-Fi Version': '802.11 b/g/n/ac', 'Wi-Fi Hotspot': 'Yes', 'USB Connectivity': 'Yes', 'Audio Jack': '3.5 mm', 'Map Support': 'Google Maps', 'GPS Support': 'Yes', 'Smartphone': 'Yes', 'Touchscreen Type': 'Capacitive', 'SIM Size': 'Micro SIM and Nano SIM', 'Removable Battery': 'No', 'SMS': 'Yes', 'Sensors': 'eCompass, Light Sensor, Proximity Sensor, Gravitation', 'Other Features': 'Standby Time (4G) - 180 hrs, Talk Time (4G) - 19 hrs, Games, Background Light is Available, Non Removable Battery', 'Important Apps': 'Facebook, Skype, Twitter, Evernote, SHAREit, SYNCit, Google Apps, Route 66 Navi + Maps, Guvera Music', 'GPS Type': 'A-GPS', 'FM Radio': 'Yes', 'Audio Formats': 'MP3', 'Battery Capacity': '2300 mAh', 'Battery Type': 'Li-Polymer', 'Width': '68.6 mm', 'Height': '140.2 mm', 'Depth': '7.277 mm', 'Weight': '120 g', 'Warranty Summary': '1 Year Manufacturer Warranty'}",17499
"Vivo V11 (Nebula Purple, 64 GB)  (6 GB RAM)",4.5,"17,576 Ratings","1,750 Reviews","{'In The Box': 'Handset, Earphone, User Manual, Micro-USB to USB Cable, USB Power Adapter, SIM Ejector Pin, Protective Case', 'Model Number': '1806/PD1813F_EX', 'Model Name': 'V11', 'Color': 'Nebula Purple', 'Browse Type': 'Smartphones', 'SIM Type': 'Dual Sim', 'Hybrid Sim Slot': 'No', 'Touchscreen': 'Yes', 'OTG Compatible': 'Yes', 'Quick Charging': 'Yes', 'SAR Value': 'Head - 1.110 W/kg, Body - 0.311 W/kg', 'Display Size': '16.0 cm (6.3 inch)', 'Resolution': '2280 x 1080 pixels', 'Resolution Type': 'Full HD+', 'GPU': 'ARM Mali-G72', 'Display Type': 'IPS Incell', 'Display Colors': '16M', 'Other Display Features': 'Bezel - 1.75mm Side, 5.1mm Bottom, 90.4% Screen to Body Ratio', 'Operating System': 'Android Oreo 8.1', 'Processor Type': 'MediaTek P60 Octa Core 2.0 GHz', 'Processor Core': 'Octa Core', 'Primary Clock Speed': '2 GHz', 'Operating Frequency': 'GSM - Bands (2/3 5/8), WCDMA - Bands (1/5/8), 4G LTE (FDD) - Bands (1/3/5/8), LTE (TDD) - Bands 38/40/41', 'Internal Storage': '64 GB', 'RAM': '6 GB', 'Expandable Storage': '256 GB', 'Supported Memory Card Type': 'microSD', 'Memory Card Slot Type': 'Dedicated Slot', 'Call Log Memory': 'Yes', 'Primary Camera Available': 'Yes', 'Primary Camera': '16MP + 5MP', 'Primary Camera Features': '16MP - f/2.0 (Rear) and 5MP - f/2.4 (Secondary Rear), PPT, Professional, Slow, Time-lapse Photography, Camera Filter, Live, Bokeh, Al Backlight HDR, AI Face Beauty, Panorama, Palm Capture, Gender Detection, AR Stickers, Time Watermark, AI Scene Recognition, Google Lens, AI Portrait Framing', 'Secondary Camera Available': 'Yes', 'Secondary Camera': '25MP Front Camera', 'Secondary Camera Features': 'f2.0, Camera Filter, Live Photo, Portrait, AI Backlight HDR, AI Face Beauty, Palm Capture, Gender Detection, AR Stickers, AI Face Shaping, Time Watermark, AI Selfie Lighting, Group Selfie', 'Flash': 'Rear LED Flash and Front Screen Flash', 'HD Recording': 'Yes', 'Full HD Recording': 'Yes', 'Video Recording': 'Yes', 'Video Recording Resolution': '1080p', 'Frame Rate': '30 fps', 'Dual Camera Lens': 'Primary Camera', 'Phone Book': 'Yes', 'Network Type': '3G, 4G VOLTE, 4G, 2G', 'Supported Networks': 'GSM, WCDMA, 4G VoLTE, 4G LTE', 'Internet Connectivity': '4G, 3G, Wi-Fi', '3G': 'Yes', 'Pre-installed Browser': 'Vivo Browser, UC Browser, Google Chrome', 'Bluetooth Support': 'Yes', 'Bluetooth Version': '4.2', 'Wi-Fi': 'Yes', 'Wi-Fi Hotspot': 'Yes', 'USB Connectivity': 'Yes', 'Audio Jack': '3.5mm', 'Map Support': 'Google Maps', 'GPS Support': 'Yes', 'Smartphone': 'Yes', 'Touchscreen Type': 'LTPS Capacitive', 'SIM Size': 'Nano SIM + Nano SIM', 'User Interface': 'Funtouch OS 4.5', 'Removable Battery': 'No', 'SMS': 'Yes', 'Graphics PPI': '403 PPI', 'SIM Access': 'Dual Standby', 'Sensors': 'Fingerprint Scanner, Accelerometer, Ambient Light Sensor, Proximity Sensor, E-compass', 'Other Features': 'Dual 4G, Game Mode, Smart Split, Eye Protection Mode, Motorbike Mode, App Clone - WhatsApp, Facebook, WeChat, Instagram', 'Important Apps': 'Facebook, WhatsApp, NewsPoint, PhonePe', 'GPS Type': 'GLONASS, Beidou', 'FM Radio': 'Yes', 'Audio Formats': 'WAV, MP3, MP2, AMR-NB, AMR-WB, MIDI, Vorbis, APE, FLAC', 'Video Formats': 'MP4, 3GP, AVI', 'Battery Capacity': '3315 mAh', 'Battery Type': 'Li-ion', 'Width': '75.63 mm', 'Height': '155.97 mm', 'Depth': '8.1 mm', 'Weight': '163.7 g', 'Warranty Summary': 'Brand Warranty 1 Year for Mobile'}",24990
"Google Pixel 3 XL (Clearly White, 64 GB)  (4 GB RAM)",4.6,823 Ratings,108 Reviews,"{'In The Box': 'Handset, USB Type-C 18W Adaptor with USB-PD, C-C Cable (USB 2.0), SIM Tool, Quick Switch Adapter, 3.5mm to USB-C Headphone Adapter (aka Headphone Adapter), USB Type-C Earbuds', 'Model Number': 'G013C', 'Model Name': 'Pixel 3 XL', 'Color': 'Clearly White', 'Browse Type': 'Smartphones', 'SIM Type': 'Single Sim', 'Hybrid Sim Slot': 'No', 'Touchscreen': 'Yes', 'OTG Compatible': 'No', 'Quick Charging': 'Yes', 'Display Size': '16.0 cm (6.3 inch)', 'Resolution': '2960 x 1440 pixels', 'Resolution Type': 'Quad HD+', 'GPU': 'Adreno 630', 'Display Colors': '16.77M', 'Other Display Features': 'Notch/Frame, Flexible OLED Display, Display - 100000:1, 18.5:9, 3D Corning Gorilla Glass 5, Always-on Display, Now Playing v2, 100% DCI-P3 Coverage, Super Contrast Ratio, True Black Panel, D67 Whitepoint (More Natural), HDR Support (UHDA Certification)', 'Operating System': 'Android Pie 9', 'Processor Type': 'Qualcomm Snapdragon 845 64-bit', 'Processor Core': 'Octa Core', 'Primary Clock Speed': '2.5 GHz', 'Secondary Clock Speed': '1.6 GHz', 'Operating Frequency': 'Global RF, 5xCA, 4x4 MIMO, LAA (Band 46), 3.5 GHz (Band 42), 600 MHz (Band 71), CBRS (Proto w/Band 48)', 'Internal Storage': '64 GB', 'RAM': '4 GB', 'Primary Camera Available': 'Yes', 'Primary Camera': '12.2MP Rear Camera', 'Primary Camera Features': '1.4micrometer, Autofocus + Dual Pixel Phase Detection, Optical + Electronic Image Stabilization, Spectral + Flicker Sensor Combo, f/1.8 Aperture, Field of View - DFoV (76Degree)', 'Secondary Camera Available': 'Yes', 'Secondary Camera': '8MP + 8MP Dual Front Camera', 'Secondary Camera Features': 'Wide-angle and Telephoto Cameras, Wide-angle - f/2.2 Aperture and DFoV 107Degree, Telephoto - f/1.8 Aperture and DFoV 75Degree, Wide Angle Selfie + Natural Passive Authentication', 'HD Recording': 'Yes', 'Full HD Recording': 'Yes', 'Video Recording': 'Yes', 'Video Recording Resolution': '2160p', 'Frame Rate': 'Rear Camera - 1080p at 30fps, 60fps, 120fps, 720p at 30fps, 60fps, 240fps, 4K at 30fps, Slo-mo - 1080p at 240fps, Front Camera - 1080p at 30fps, 720p at 30fps, 480p at 30 fps', 'Dual Camera Lens': 'Secondary Camera', 'Network Type': '3G, 4G VOLTE, 4G, 2G', 'Supported Networks': 'GSM, 4G VoLTE, 4G LTE, UMTS', 'Internet Connectivity': '4G, 3G, Wi-Fi', '3G': 'Yes', 'Bluetooth Support': 'Yes', 'Bluetooth Version': '5', 'Wi-Fi': 'Yes', 'Wi-Fi Version': '802.11a/b/g/n/ac (2.4G + 5GHz) 2x2 MIMO', 'NFC': 'Yes', 'USB Connectivity': 'Yes', 'Map Support': 'Google Maps', 'GPS Support': 'Yes', 'Smartphone': 'Yes', 'SIM Size': 'Nano SIM', 'Graphics PPI': '523 PPI', 'Sensors': 'Active Edge v2, Proximity / Ambient Light Sensor, Accelerometer / Gyrometer, Magnetometer, Pixel Imprint - Back-mounted Fingerprint Sensor for Fast Unlocking, Barometer, Android Sensor Hub, Advanced X-axis Haptics for Sharper / Defined Response', 'Other Features': 'Design - Metal Frame + Soft Touch Glass + Refined Iconic Shade, IP68 Water and Dust Resistant, Processor - Pixel Visual Core, Titan M Security Module, Charging - USB Type-C 18W Adaptor with USB-PD 2.0, 18W Fast Charging, Ports - USB Type-C, 3.1 Gen 1, Qi Wireless Charging, Google Cast, Location - Rest of World, Network - Intraband Contiguous Uplink CA CAT13, Google Assistant, Hearing Aid Compatibility - M3/T3 HAC Rating, AR/VR - Daydream-ready (Built for VR to Work with Google Daydream View Headset, Upto 10 Layer Support (1Gbps Max Download) - Cat 16 (Carrier Specific)', 'GPS Type': 'GLONASS, BeiDou, Galileo', 'Battery Capacity': '3430 mAh', 'Width': '76.7 mm', 'Height': '158 mm', 'Depth': '7.9 mm', 'Weight': '184 g', 'Warranty Summary': 'Brand Warranty of 1 Year Available for Mobile'}",54999
"Redmi Note 5 Pro (Red, 64 GB)  (6 GB RAM)",4.5,"2,51,975 Ratings","25,164 Reviews","{'In The Box': 'Handset, Power Adapter, USB Data Cable, Ultra Thin Case, Warranty Card, Getting Started Guide, Pin', 'Model Number': 'MZB6633IN', 'Model Name': 'Redmi Note 5 Pro', 'Color': 'Red', 'Browse Type': 'Smartphones', 'SIM Type': 'Dual Sim', 'Hybrid Sim Slot': 'Yes', 'Touchscreen': 'Yes', 'OTG Compatible': 'Yes', 'Sound Enhancements': 'Speaker - Single (Bottom Opening), Microphones - 2 (For Noise Cancellation)', 'SAR Value': 'Head: 1.188 W/Kg, Body: 0.334 W/Kg', 'Display Size': '15.21 cm (5.99 inch)', 'Resolution': '2160 x 1080 Pixels', 'Resolution Type': 'Full HD+', 'GPU': 'Adreno 509', 'Display Type': 'IPS (in-cell)', 'Other Display Features': 'Contrast Ratio: 1000:1 (min), 2.5D Glass, Corning Gorilla Glass, 18:9 Display', 'Operating System': 'Android Nougat 7.1.2', 'Processor Type': 'Qualcomm Snapdragon 636', 'Processor Core': 'Octa Core', 'Primary Clock Speed': '1.8 GHz', 'Operating Frequency': 'GSM - B2, B3, B5, B8, WCDMA - B1, B2, B5, B8, 4G LTE TDD - B40, B41 (2535 - 2655 MHz), LTE FDD - B1, B3, B5', 'Internal Storage': '64 GB', 'RAM': '6 GB', 'Expandable Storage': '128 GB', 'Supported Memory Card Type': 'microSD', 'Memory Card Slot Type': 'Hybrid Slot', 'Primary Camera Available': 'Yes', 'Primary Camera': '12MP + 5MP', 'Primary Camera Features': 'Primary Sensor - f/2.2, 1.25 microns Pixel Size, 5P Lens, Secondary Sensor - f/2.0, 1.12 microns Pixel Size, 4P Lens, PDAF', 'Secondary Camera Available': 'Yes', 'Secondary Camera': '20MP Front Camera', 'Secondary Camera Features': 'Aperture - f/2.2, 1.0 microns Pixel Size', 'Flash': 'Rear and Front Flash', 'Dual Camera Lens': 'Primary Camera', 'Network Type': '3G, 4G VOLTE, 4G', 'Supported Networks': 'GSM, WCDMA, 4G VoLTE, UMTS, 4G LTE', 'Internet Connectivity': '4G, 3G, Wi-Fi', '3G': 'Yes', 'Micro USB Port': 'Yes', 'Bluetooth Support': 'Yes', 'Bluetooth Version': '5', 'Wi-Fi': 'Yes', 'Wi-Fi Version': '802.11 a/b/g/n/ac', 'USB Connectivity': 'Yes', 'Audio Jack': '3.5 mm', 'Map Support': 'Google Maps', 'GPS Support': 'Yes', 'Smartphone': 'Yes', 'SIM Size': 'Nano SIM and Nano SIM', 'Graphics PPI': '403 PPI', 'Sensors': 'Fingerprint Scanner, Ambient Light Sensor, Proximity Sensor, E Compass, Accelerometer, Hall Sensor, Gyroscope', 'Other Features': '14 nm Architecture Processor, Internal Memory - eMMC v5.1, Body - Metal Back, IR Blaster, Charger - 5 V x 2 A, AI Face Unlock, Electronic Image Stabilization For Video Recording', 'GPS Type': 'GLONASS, BeiDou', 'Battery Capacity': '4000 mAh', 'Width': '75.35 mm', 'Height': '158.58 mm', 'Depth': '8.05 mm', 'Weight': '181 g', 'Warranty Summary': 'Brand Warranty of 1 Year Available for Mobile and 6 Months for Accessories'}",13999
"Tecno Camon i Sky (midnight black, 16 GB)  (2 GB RAM)",4.1,197 Ratings,20 Reviews,"{'In The Box': 'Charger, Headset, USB Cable, Handset', 'Model Number': 'Camon i Sky', 'Model Name': 'Camon i Sky', 'Color': 'midnight black', 'Browse Type': 'Smartphones', 'SIM Type': 'Dual Sim', 'Hybrid Sim Slot': 'No', 'Touchscreen': 'Yes', 'OTG Compatible': 'Yes', 'Display Size': '13.84 cm (5.45 inch)', 'Resolution': '960 x 480 Pixels', 'Operating System': 'Android Oreo 8.1', 'Processor Core': 'Quad Core', 'Primary Clock Speed': '1.28 GHz', 'Internal Storage': '16 GB', 'RAM': '2 GB', 'Memory Card Slot Type': 'Dedicated Slot', 'Primary Camera': '13MP Rear Camera', 'Network Type': '3G, 4G, 2G', 'Supported Networks': 'GSM, 4G LTE', 'Battery Capacity': '3050 mAh', 'Warranty Summary': '12 Months'}",5340
