Name,Stars,Ratings,Reviews,Specifications,Price
"Apple iPhone 11 (Black, 128 GB)",4.7,"10,341 Ratings",904 Reviews,"{'In The Box': 'Handset, EarPods with Lightning Connector, Lightning to USB Cable, USB Power Adapter, Documentation', 'Model Number': 'MWM02HN/A', 'Model Name': 'iPhone 11', 'Color': 'Black', 'Browse Type': 'Smartphones', 'SIM Type': 'Dual Sim', 'Hybrid Sim Slot': 'No', 'Touchscreen': 'Yes', 'OTG Compatible': 'No', 'SAR Value': '1.6 W/kg (over 1 g) SAR Limit, Head: 1.09, Body: 1.18', 'Display Size': '15.49 cm (6.1 inch)', 'Resolution': '1792 x 828 Pixels', 'Resolution Type': 'Liquid Retina HD Display', 'Other Display Features': '1400:1 Contrast Ratio (Typical), True Tone Display, Wide Colour Display (P3), Haptic Touch, 625 nits Max Brightness (Typical), Fingerprint Resistant Oleophobic Coating, Support for Display of Multiple Languages and Characters Simultaneously', 'Operating System': 'iOS 13', 'Processor Type': 'A13 Bionic Chip', 'Internal Storage': '128 GB', 'Primary Camera Available': 'Yes', 'Primary Camera': '12MP + 12MP', 'Primary Camera Features': 'Dual 12MP Ultra Wide and Wide Cameras, Ultra Wide: f/2.4 Aperture and 120Degree Field of View, Wide: f/1.8 Aperture, Portrait Mode with Advanced Bokeh and Depth Control, Portrait Lighting with Six Effects (Natural, Studio, Contour, Stage, Stage Mono, High-key Mono), Optical Image Stabilisation (Wide), Five Element Lens (Ultra Wide), Six Element Lens (Wide), Brighter True Tone Flash with Slow Sync, Panorama (Up to 64MP), 100% Focus Pixels (Wide), Night Mode, Auto Adjustments, Next-generation Smart HDR for Photos, Wide Colour Capture for Photos and Live Photos, Advanced Red Eye Correction, Auto Image Stabilisation, Burst Mode, Photo Geotagging, Image Formats Captured: HEIF and JPEG', 'Optical Zoom': 'Yes', 'Secondary Camera Available': 'Yes', 'Secondary Camera': '12MP Front Camera', 'Secondary Camera Features': 'TrueDepth Camera - 12MP Camera, f/2.2 Aperture, Portrait Mode with Advanced Bokeh and Depth Control, Portrait Lighting with Six Effects (Natural, Studio, Contour, Stage, Stage Mono, High Key Mono), Animoji and Memoji, 4K Video Recording at 24 fps, 30 fps or 60 fps, 1080p HD Video Recording at 30 fps or 60 fps, Slow-motion Video Support for 1080p at 120 fps, Next Generation Smart HDR for Photos, Extended Dynamic Range for Video at 30 fps, Cinematic Video Stabilisation (4K, 1080p and 720p), Wide Colour Capture for Photos and Live Photos, Retina Flash, Auto Image Stabilisation, Burst Mode', 'Flash': 'Rear Brighter True Tone Flash with Slow Sync and Front Retina Flash', 'HD Recording': 'Yes', 'Full HD Recording': 'Yes', 'Video Recording': 'Yes', 'Frame Rate': 'Rear Camera - 4K Video Recording at 24 fps, 30 fps or 60 fps, 1080p HD Video Recording at 30 fps or 60 fps, 720p HD Video Recording at 30 fps, Extended Dynamic Range for Video upto 60 fps, Slow-motion Video Support for 1080p at 120 fps or 240 fps | True Depth Camera - 4K Video Recording at 24 fps, 30 fps or 60 fps, 1080p HD Video Recording at 30 fps or 60 fps, Slow-motion Video Support for 1080p at 120 fps, Extended Dynamic Range for Video at 30 fps fps', 'Dual Camera Lens': 'Primary Camera', 'Phone Book': 'Yes', 'Speaker Phone': 'Yes', 'Network Type': '4G VOLTE, 4G, 3G, 2G', 'Supported Networks': '4G VoLTE, 4G LTE, UMTS, GSM', 'Internet Connectivity': '4G, 3G, Wi-Fi', '3G': 'Yes', 'Pre-installed Browser': 'Safari', 'Bluetooth Support': 'Yes', 'Bluetooth Version': '5', 'Wi-Fi': 'Yes', 'Wi-Fi Version': '802.11ax Wi-Fi 6 with 2x2 MIMO', 'Wi-Fi Hotspot': 'Yes', 'NFC': 'Yes', 'Smartphone': 'Yes', 'SIM Size': 'Nano SIM and eSIM', 'Removable Battery': 'No', 'Graphics PPI': '326 PPI', 'Sensors': 'Face ID, Barometer, Three Axis Gyro, Accelerometer, Proximity Sensor, Ambient Light Sensor', 'Supported Languages': 'Multi Languages Support', 'Series': 'iPhone 11', 'Other Features': 'Faster Face ID, Slo-mo Selfies, Water Resistant upto 2 Metres for up to 30 Minutes�', 'Audio Formats': 'AAC LC, HE AAC, HE AAC v2, Protected AAC, MP3, Linear PCM, Apple Lossless, FLAC, Dolby Digital (AC 3), Dolby Digital Plus (E AC 3), Dolby Atmos and Audible (Formats 2, 3, 4, Audible Enhanced Audio, AAX and AAX+)', 'Video Formats': 'HEVC, H.264, MPEG 4 Part 2 and Motion JPEG, Supports Dolby Vision and HDR10 Content', 'Width': '75.7 mm', 'Height': '150.9 mm', 'Depth': '8.3 mm', 'Weight': '194 g', 'Warranty Summary': 'Brand Warranty for 1 Year'}",69900
"Motorola One Macro (Ultra Violet, 64 GB)  (4 GB RAM)",4.3,"14,823 Ratings","1,485 Reviews","{'In The Box': 'Handset, 10W Rapid Charger, USB-C Cable, SIM Pin, Guides, Protect Cover', 'Model Number': 'PAGS0006IN', 'Model Name': 'One Macro', 'Color': 'Ultra Violet', 'Browse Type': 'Smartphones', 'SIM Type': 'Dual Sim', 'Hybrid Sim Slot': 'Yes', 'Touchscreen': 'Yes', 'OTG Compatible': 'Yes', 'Quick Charging': 'Yes', 'Sound Enhancements': '1 Loudspeaker with Smart PA, 2-microphones', 'SAR Value': 'Head - 0.542 W/kg, Body - 1.328 W/kg', 'Display Size': '15.75 cm (6.2 inch)', 'Resolution': '1520 x 720 Pixels', 'Resolution Type': 'HD+', 'GPU': 'Mali-G72 900MHz', 'Other Display Features': 'Max Vision Display', 'Operating System': 'Android Pie 9', 'Processor Type': 'MediaTek Helio P70', 'Processor Core': 'Octa Core', 'Primary Clock Speed': '2 GHz', 'Operating Frequency': '2G: GSM - B2/B3/B5/B8, 3G: WCDMA - B1/B24/B5/B8/B19, 4G: LTE - B1/B2/B3/B45/B7/B8/B19/B20/B38/B40/B41', 'Internal Storage': '64 GB', 'RAM': '4 GB', 'Expandable Storage': '512 GB', 'Supported Memory Card Type': 'microSD', 'Memory Card Slot Type': 'Hybrid Slot', 'Primary Camera Available': 'Yes', 'Primary Camera': '13MP + 2MP + 2MP', 'Primary Camera Features': '13MP Main Sensor (f2.0, 1.12micrometer Pixel) Laser Autofocus, 2MP (f/2.2, 1.75micrometer Pixel) Depth Sensor, 2MP Dedicated Macro Lens (f2.2, 1.75micrometer Pixel), PDAF (Phase Detection Autofocus), Digital Zoom (Upto 8x), Burst Shot, Auto HDR, Timer, High Res Zoom, Live Filter, Shot Optimization, Smart Composition, Auto Smile Capture, Cinemagraph, Portrait Mode, Cutout, Panorama, Manual Mode, RAW Photo Output, Active Photos, Spot Color, Best Shot, Slow Motion Video, Timelapse Video, Hyperlapse Video, Electronic Video Stabilization, YouTube Live, Google Lens Integration, Macro Vision Camera', 'Secondary Camera Available': 'Yes', 'Secondary Camera': '8MP Front Camera', 'Secondary Camera Features': '8MP (f/2.2, 1.12micrometer Pixel), Auto HDR, Timer, Face Beauty, Auto Smile Capture, Cinemagraph, Portrait Mode, Group Selfie, Spot Color, Slow Motion Video, Timelapse', 'Flash': 'Rear LED Flash and Front Screen Flash', 'Frame Rate': '1080P - 120 fps/60 fps/30 fps, 720P - 240 fps/30 fps', 'Dual Camera Lens': 'Primary Camera', 'Network Type': '4G, 3G, 2G', 'Supported Networks': '4G LTE, WCDMA, GSM', 'Internet Connectivity': '4G, 3G, Wi-Fi', 'Bluetooth Support': 'Yes', 'Bluetooth Version': 'v4.2', 'Wi-Fi': 'Yes', 'Wi-Fi Version': '802.11 b/g/n (2.4 GHz)', 'Wi-Fi Hotspot': 'Yes', 'NFC': 'No', 'USB Connectivity': 'Yes', 'Audio Jack': '3.5mm', 'Map Support': 'Google Maps', 'GPS Support': 'Yes', 'Smartphone': 'Yes', 'SIM Size': 'Dual Nano SIM', 'Removable Battery': 'No', 'Graphics PPI': '270 PPI', 'Sensors': 'Fingerprint Reader, Proximity, Accelerometer, Ambient Light, Gyroscope', 'Other Features': 'Water Protection - IPX2, Water Repellent Design, Connectivity: USB-C Port, USB 2.0', 'GPS Type': 'A-GPS, LTEPP, SUPL, GLONASS, Galileo', 'FM Radio': 'Yes', 'Battery Capacity': '4000 mAh', 'Width': '75.41 mm', 'Height': '157.6 mm', 'Depth': '8.99 mm', 'Weight': '186 g', 'Warranty Summary': 'Brand Warranty of 1 Year Available for Mobile and 6 Months for Accessories'}",8999
"Samsung Galaxy A10s (Black, 32 GB)  (3 GB RAM)",4.3,816 Ratings,63 Reviews,"{'In The Box': 'Handset, Travel Adapter, USB Cable and User Manual', 'Model Number': 'SM-A107FZKGINS', 'Model Name': 'Galaxy A10s', 'Color': 'Black', 'Browse Type': 'Smartphones', 'SIM Type': 'Dual Sim', 'Hybrid Sim Slot': 'No', 'Touchscreen': 'Yes', 'OTG Compatible': 'Yes', 'Display Size': '15.75 cm (6.2 inch)', 'Resolution': '720 x 1560', 'Resolution Type': 'HD+', 'GPU': 'Imagination GE8320', 'Display Type': 'TFT V Cut Display', 'Display Colors': '16M', 'Operating System': 'Android Pie 9', 'Processor Type': 'MediaTek MT6762', 'Processor Core': 'Octa Core', 'Primary Clock Speed': '2 GHz', 'Secondary Clock Speed': '1.5 GHz', 'Internal Storage': '32 GB', 'RAM': '3 GB', 'Expandable Storage': '512 GB', 'Primary Camera Available': 'Yes', 'Primary Camera': '13MP + 2MP', 'Primary Camera Features': '13MP (F1.8) + 2 MP (F2.4)', 'Secondary Camera': '8MP Front Camera', 'Secondary Camera Features': '5MP(F2.0)', 'Dual Camera Lens': 'Primary Camera', 'Phone Book': 'Yes', 'Network Type': '4G, 3G, 2G', 'Supported Networks': 'GSM, WCDMA, 4G LTE', 'Internet Connectivity': '4G, 3G, Wi-Fi, GPRS', '3G': 'Yes', 'GPRS': 'Yes', 'Wi-Fi': 'Yes', 'Wi-Fi Hotspot': 'Yes', 'Map Support': 'Google Maps', 'GPS Support': 'Yes', 'Smartphone': 'Yes', 'Instant Message': 'Yes', 'Removable Battery': 'No', 'MMS': 'Yes', 'SMS': 'Yes', 'Predictive Text Input': 'Yes', 'Series': 'Galaxy A', 'FM Radio': 'Yes', 'Battery Capacity': '4000 mAh', 'Width': '75.8 mm', 'Height': '156.9 mm', 'Depth': '7.8 mm', 'Weight': '168 g', 'Warranty Summary': 'Brand Warranty of 1 Year Available for Mobile and 6 Months for Accessories', 'Warranty Service Type': 'Fingerprint Sensor, Face Recognition'}",9499
"Redmi Note 8 (Cosmic Purple, 64 GB)  (4 GB RAM)",4.4,"9,581 Ratings",697 Reviews,"{'In The Box': 'Handset / Simple protective cover / USB Type-C cable / SIM eject tool', 'Model Number': 'M1908C3JI', 'Model Name': 'Redmi Note 8', 'Color': 'Cosmic Purple', 'Browse Type': 'Smartphones', 'SIM Type': 'Dual Sim', 'Hybrid Sim Slot': 'No', 'Touchscreen': 'Yes', 'OTG Compatible': 'Yes', 'Additional Content': 'No', 'Display Size': '16.0 cm (6.3 inch)', 'Resolution': '2280 x 1080$$Pixels', 'Operating System': 'Android Pie 9', 'Processor Core': 'Octa Core', 'Primary Clock Speed': '2.5 GHz', 'Internal Storage': '64 GB', 'RAM': '4 GB', 'Memory Card Slot Type': 'Dedicated Slot', 'Primary Camera': '48MP Rear Camera', 'Dual Camera Lens': 'Primary Camera', 'Network Type': '4G VOLTE', 'Supported Networks': '4G VoLTE', 'NFC': 'No', 'Smartphone': 'Yes', 'Removable Battery': 'No', 'Keypad': 'No', 'Battery Capacity': '4000 mAh', 'Battery Type': 'lithium-ion', 'Warranty Summary': '1 Year Warranty'}",11699
"POCO X2 (Matrix Purple, 128 GB)  (6 GB RAM)",4.6,"25,936 Ratings","3,308 Reviews","{'In The Box': 'Handset, USB Type C Data Cable, SIM Ejector Tool, User Guide, 27W Fast Charger', 'Model Number': 'MZB8743IN', 'Model Name': 'X2', 'Color': 'Matrix Purple', 'Browse Type': 'Smartphones', 'SIM Type': 'Dual Sim', 'Hybrid Sim Slot': 'Yes', 'Touchscreen': 'Yes', 'OTG Compatible': 'Yes', 'Quick Charging': 'Yes', 'Sound Enhancements': '1217 Super Linear Speaker, Dual Mic Microphone', 'SAR Value': 'Head - 1.080 W/kg, Body - 0.620 W/kg', 'Display Size': '16.94 cm (6.67 inch)', 'Resolution': '2400 x 1080 Pixels', 'Resolution Type': 'Full HD+', 'GPU': 'Adreno 618', 'Other Display Features': 'Corning Gorilla Glass 5, 120Hz Display Refresh Rate, 20:9 Aspect Ratio, Screen Mirror/cast', 'Operating System': 'Android 10', 'Processor Type': 'Qualcomm Snapdragon 730G', 'Processor Core': 'Octa Core', 'Primary Clock Speed': '2.2 GHz', 'Operating Frequency': '4G: FDD - B1/B3/B5/B8, TDD - B40/B41, 3G: B1/B2/B5/B8, 2G: B2/B3/B5/B8', 'Internal Storage': '128 GB', 'RAM': '6 GB', 'Expandable Storage': '512 GB', 'Supported Memory Card Type': 'microSD', 'Memory Card Slot Type': 'Hybrid Slot', 'Primary Camera Available': 'Yes', 'Primary Camera': '64MP + 8MP + 2MP + 2MP', 'Primary Camera Features': 'Quad Rear Camera, Wide 64MP + Macro 2MP + Ultra 8MP + Depth 2MP, 64MP Ultra Clear Mode, Super Night Mode, AI Scene Detection, Ultra Wide Angle, Distortion Correction, Pro Mode, Portrait Mode, Panorama Mode, Slow Motion Capture', 'Secondary Camera Available': 'Yes', 'Secondary Camera': '20MP + 2MP Dual Front Camera', 'Secondary Camera Features': 'Dual In-display Camera, 20MP: 0.8micrometer, 2MP: 1.75micrometer, Gesture Camera, Front HDR, Short Video', 'Flash': 'Rear Flash', 'Frame Rate': 'Front: 720p at 30 fps, 1080p at 30 fps, Rear: 1080p at 60 fps, 4k at 30 fps', 'Dual Camera Lens': 'Primary Camera', 'Network Type': '4G VOLTE, 4G, 3G, 2G', 'Supported Networks': '4G VoLTE, UMTS, GSM, 4G LTE, WCDMA', 'Internet Connectivity': '4G, 3G, Wi-Fi', 'Bluetooth Support': 'Yes', 'Bluetooth Version': 'v5.0', 'Wi-Fi': 'Yes', 'Wi-Fi Version': '802.11 a/b/g/n/ac', 'Wi-Fi Hotspot': 'Yes', 'USB Connectivity': 'Yes', 'Audio Jack': '3.5mm', 'Map Support': 'Google Maps', 'GPS Support': 'Yes', 'SIM Size': 'Nano SIM', 'User Interface': 'MIUI 11', 'Removable Battery': 'No', 'Graphics PPI': '395 PPI', 'Sensors': 'Fingerprint Scanner', 'Other Features': 'Face Unlock, Dual App Support, USB Type C, Kryo 4 Architecture, Fingerprint Scanner Position: Side, Quick Charging Version: Supports Upto 27W', 'Battery Capacity': '4500 mAh', 'Width': '76.6 mm', 'Height': '165.3 mm', 'Depth': '8.79 mm', 'Weight': '208 g', 'Warranty Summary': 'Brand Warranty of 1 Year Available for Mobile and 6 Months for Accessories'}",16999
"OPPO A9 2020 (Marine Green, 128 GB)  (4 GB RAM)",4.4,"2,227 Ratings",212 Reviews,"{'In The Box': 'Handset, Adapter, Headset, Micro USB Cable, Important Info. Booklet with Warranty Card, Quick Start Guide, Sim Card Tool, Protective Film, Pre-applied, Case', 'Model Number': 'CPH1937', 'Model Name': 'A9 2020', 'Color': 'Marine Green', 'Browse Type': 'Smartphones', 'SIM Type': 'Dual Sim', 'Hybrid Sim Slot': 'No', 'Touchscreen': 'Yes', 'OTG Compatible': 'Yes', 'Sound Enhancements': 'Dolby Atmos and Dual Stereo Speakers', 'Display Size': '16.51 cm (6.5 inch)', 'Resolution': '1600 x 720 Pixels', 'GPU': 'Adreno 610', 'Display Type': 'TFT-LCD', 'Display Colors': '16M', 'Other Display Features': 'Touch Panel Technology: In-cell, Narrow Frame - Upper Border: 2.44mm, Left and Right Border: 1.98mm, Lower Border: 6.6mm, Screen Ratio: 89.0%, Screen Contrast: 1500:1, Color Saturation: Typical 71%, Maximum Brightness: 480nits, Touch Panel Glass Type: GG3+, TYPE-C USB 2.0', 'Operating System': 'Android Pie 9', 'Processor Type': 'Qualcomm SM6125', 'Processor Core': 'Octa Core', 'Primary Clock Speed': '1.8 GHz', 'Secondary Clock Speed': '2 GHz', 'Internal Storage': '128 GB', 'RAM': '4 GB', 'Memory Card Slot Type': 'Dedicated Slot', 'Primary Camera Available': 'Yes', 'Primary Camera': '48MP + 8MP + 2MP + 2MP', 'Primary Camera Features': 'Ultra Wide Quad Camera, Sensor Type: 48MP CMOS/S5KGM1SP/OV48B, 8MP COMS/Hi846/OV8856, 2MP CMOS/OV02A1B/GC02M0, 2MP CMOS/GC02M0/OV02A1B, Maximum Zoom Multiples: 10X, Aperture: 48MP (f/1.8) + 8MP (f/2.25) + 2MP (f/2.4) + 2MP (f/2.4), Focal Length: 48MP (4.71mm) + 8MP (1.66mm) + 2MP (1.77mm) + 2MP (f1.77mm), Lens Number: 48MP (6P) + 8MP (5P) + 2MP (3P) + 2MP (3P)', 'Secondary Camera Available': 'Yes', 'Secondary Camera': '16MP Front Camera', 'Secondary Camera Features': 'Sensor Sizes/Pixel Data - 1/3.1inch, 1.0micrometer, Sensor Type: S5K3P9SP04, Wide Angle of Front: 79Degree, Aperture: F2.0, Focal Length: 3.42mm, Lens Number: 5P', 'Flash': 'Rear LED Flash', 'Frame Rate': 'Front Camera Video: 1080P/720P at 30 fps', 'Dual Camera Lens': 'Primary Camera', 'Network Type': '4G VOLTE, 4G, 3G, 2G', 'Supported Networks': '4G VoLTE, UMTS, GSM, 4G LTE, WCDMA, CDMA', 'Internet Connectivity': '4G, 3G, Wi-Fi, EDGE, GPRS', '3G Speed': 'HSPA+', 'GPRS': 'Yes', 'Micro USB Port': 'Yes', 'Micro USB Version': '2', 'Bluetooth Support': 'Yes', 'Bluetooth Version': 'v5.0', 'Wi-Fi': 'Yes', 'Wi-Fi Version': '802.11a/b/g/n/ac', 'USB Connectivity': 'Yes', 'EDGE': 'Yes', 'Audio Jack': '3.5mm', 'Smartphone': 'Yes', 'Touchscreen Type': 'Capacitive Screen, Multi-touch', 'SIM Size': 'Dual Nano SIM', 'User Interface': 'ColorOS 6.0.1', 'Removable Battery': 'No', 'Graphics PPI': '269 PPI', 'Ringtones Format': 'MP3/AMR/APE/OGG/FLAC/WAV/MIDI/WMA', 'Other Features': 'Face Recognition, Split Screen (Specific Apps), Clone Apps, Night Shield, Sensor Hub, Game Acceleration (Specific Apps), CPU Technology - 11nm, ROM Technology: UFS 2.1, Energy Density - 696 Wh/L, Charge Speed/Power - 5V 2A, 10W, WLAN 2.4G, WLAN 5.1G, WLAN 5.8G, WLAN Display, Game Boost 2.0, 4G+, 64 bits Processor, Video Stability, Ultra Night Mode 2.0, Reverse Charging', 'FM Radio': 'Yes', 'Audio Formats': 'MP3/AAC/APE/AMR/WAV/MID/OGG/FLAC/WMA', 'Video Formats': 'AVI/3GP/MP4/WMV/MKV/MOV/ASF/FLV', 'Battery Capacity': '5000 mAh', 'Width': '75.6 mm', 'Height': '163.6 mm', 'Depth': '9.1 mm', 'Weight': '195 g', 'Warranty Summary': 'Brand Warranty of 1 Year Available for Mobile and 6 Months for Accessories'}",14990
"OPPO Reno3 Pro (Auroral Blue, 128 GB)  (8 GB RAM)",4.6,372 Ratings,53 Reviews,"{'In The Box': 'Handset, Power Adaptor, Headset, USB Cable, Important Notes (Including the Warranty Card), Quick Start Guide, SIM Card Pin, OPPO Screen Protector, Protection Case', 'Model Number': 'CPH2035', 'Model Name': 'Reno3 Pro', 'Color': 'Auroral Blue', 'Browse Type': 'Smartphones', 'SIM Type': 'Dual Sim', 'Hybrid Sim Slot': 'No', 'Touchscreen': 'Yes', 'OTG Compatible': 'Yes', 'Sound Enhancements': 'Dolby Atmos', 'SAR Value': 'Head: 1.18 W/kg, Body: 1.07 W/kg', 'Display Size': '16.26 cm (6.4 inch)', 'Resolution': '2400 x 1080 Pixels', 'Display Type': 'Super AMOLED', 'Display Colors': '16.7M', 'Other Display Features': 'Screen to Body Ratio: 91.5%, Screen Supplier: Samsung', 'Operating System': 'Android 10', 'Processor Type': 'MediaTek Helio P95', 'Processor Core': 'Octa Core', 'Primary Clock Speed': '2.2 GHz', 'Secondary Clock Speed': '2 GHz', 'Operating Frequency': 'GSM: 850/900/1800/1900 MHz, WCDMA: B1/B5/B8, FDD-LTE: B1/B3/B5/B8, TD-LTE: B38/B40/B41, Note: B41: 2535-2655 MHz', 'Internal Storage': '128 GB', 'RAM': '8 GB', 'Expandable Storage': '256 GB', 'Memory Card Slot Type': 'Dedicated Slot', 'Primary Camera Available': 'Yes', 'Primary Camera': '64MP + 13MP + 8MP + 2MP', 'Primary Camera Features': '64MP Rear Quadcam with 20x Zoom, 64MP Main Camera: (Samsung S5KGW1, 0.8micrometer Pixel Area, 1/1.72inch Photosensitive Area, 78.6Degree Wide Angle, f/1.8 Aperture, 6P Lens, Automatic Focus, Open-loop Motor), 13MP Telephoto Camera: (Samsung S5K3M5, 1micrometer Pixel Area, 1/3.4inch Photosensitive Area, 45Degree Wide Angle, f/2.4 Aperture, 5P Lens, Automatic Focus, Open-loop Motor), 8MP Ultra-wide Angle Camera: (Galaxy Core GC8054, 1.12micrometer Pixel Area, 1/4inch Photosensitive Area, 119.9Degree Wide Angle, f/2.2 Aperture, 5P Lens, Automatic Focus, Open-loop Motor), 2MP Main Camera (Mono): (1.75micrometer Pixel Area, 88.8Degree Wide Angle, f/2.4 Aperture, 3P Lens), Focus Mode: Contrast Detection Auto Focus + Phase Detection Auto Focus, Photo Size: Rear Camera: 12032 x 9024 (Ultra HD Mode), 4608 x 3456 (Normal Mode), Ultra Dark Mode, Ultra Steady Video 2.0, Video Bokeh + Video Zoom', 'Optical Zoom': 'Yes', 'Secondary Camera Available': 'Yes', 'Secondary Camera': '44MP + 2MP Dual Front Camera', 'Secondary Camera Features': ""World's First 44MP Dual Punch Hole Camera, 44MP Main Camera - (Samsung S5KGH1, 0.7micrometer Pixel Area, 1/2.65inch Photosensitive Area, f/2.4 Aperture, 80.4Degree Wide Angle, 5P Lens), 2MP Sub Camera - (1.75micrometer Pixel Area, 78.3Degree Wide Angle, f/2.4 Aperture, 3P Lens), Photo Size - Front Camera: 7296 x 5472, Focus Mode: Fixed Focus"", 'Flash': 'Rear LED Flash', 'Dual Camera Lens': 'Primary & Secondary Camera', 'Network Type': '4G VOLTE, 4G', 'Supported Networks': '4G VoLTE', 'Bluetooth Support': 'Yes', 'Bluetooth Version': 'v5.0', 'Wi-Fi': 'Yes', 'Wi-Fi Version': '802.11 a/b/g/n/ac', 'Touchscreen Type': 'Capacitive Multi Touch Screen', 'SIM Size': 'Nano SIM', 'User Interface': 'ColorOS 7', 'Removable Battery': 'No', 'Sensors': 'Electronic Compass, Geomagnetic Induction, Photo Induction, Distance Sensor, Integrated Gravity and Acceleration Sensor', 'Other Features': 'Theoretical Talk Time - Max GSM: 36Hrs, WCDMA: 27Hrs, Theoretical Standby Time: Max 362Hrs, Uplink and Downlink Rates on a 4G Network: Uplink: 75 Mbps, Downlink: 200 Mbps, Uplink and Downlink Rates on a High-speed Network: Uplink: 11.5 Mbps, Downlink: 42 Mbps, Button Type: Physical Button + Virtual Button, USB Interface: Type-C USB 2.0, WLAN Features: WLAN 2.4G, WLAN 5.1G, WLAN 5.8G, WLAN Display, E-book: iReader, VOOC 4.0 30W Flash Charge, In Display Fingerprint 3.0, 5V6A 30W Charge Power', 'GPS Type': 'A-GPS, GLONASS, BeiDou, Galileo', 'FM Radio': 'Yes', 'Battery Capacity': '4025 mAh', 'Width': '73.4 mm', 'Height': '158.8 mm', 'Depth': '8.1 mm', 'Weight': '175 g', 'Warranty Summary': 'Brand Warranty of 1 Year Available for Mobile and 6 Months for Accessories'}",29990
"OPPO Reno3 Pro (Midnight Black, 128 GB)  (8 GB RAM)",4.6,372 Ratings,53 Reviews,"{'In The Box': 'Handset, Power Adaptor, Headset, USB Cable, Important Notes (Including the Warranty Card), Quick Start Guide, SIM Card Pin, OPPO Screen Protector, Protection Case', 'Model Number': 'CPH2035', 'Model Name': 'Reno3 Pro', 'Color': 'Midnight Black', 'Browse Type': 'Smartphones', 'SIM Type': 'Dual Sim', 'Hybrid Sim Slot': 'No', 'Touchscreen': 'Yes', 'OTG Compatible': 'Yes', 'Sound Enhancements': 'Dolby Atmos', 'SAR Value': 'Head: 1.18 W/kg, Body: 1.07 W/kg', 'Display Size': '16.26 cm (6.4 inch)', 'Resolution': '2400 x 1080 Pixels', 'Display Type': 'Super AMOLED', 'Display Colors': '16.7M', 'Other Display Features': 'Screen to Body Ratio: 91.5%, Screen Supplier: Samsung', 'Operating System': 'Android 10', 'Processor Type': 'MediaTek Helio P95', 'Processor Core': 'Octa Core', 'Primary Clock Speed': '2.2 GHz', 'Secondary Clock Speed': '2 GHz', 'Operating Frequency': 'GSM: 850/900/1800/1900 MHz, WCDMA: B1/B5/B8, FDD-LTE: B1/B3/B5/B8, TD-LTE: B38/B40/B41, Note: B41: 2535-2655 MHz', 'Internal Storage': '128 GB', 'RAM': '8 GB', 'Expandable Storage': '256 GB', 'Memory Card Slot Type': 'Dedicated Slot', 'Primary Camera Available': 'Yes', 'Primary Camera': '64MP + 13MP + 8MP + 2MP', 'Primary Camera Features': '64MP Rear Quadcam with 20x Zoom, 64MP Main Camera: (Samsung S5KGW1, 0.8micrometer Pixel Area, 1/1.72inch Photosensitive Area, 78.6Degree Wide Angle, f/1.8 Aperture, 6P Lens, Automatic Focus, Open-loop Motor), 13MP Telephoto Camera: (Samsung S5K3M5, 1micrometer Pixel Area, 1/3.4inch Photosensitive Area, 45Degree Wide Angle, f/2.4 Aperture, 5P Lens, Automatic Focus, Open-loop Motor), 8MP Ultra-wide Angle Camera: (Galaxy Core GC8054, 1.12micrometer Pixel Area, 1/4inch Photosensitive Area, 119.9Degree Wide Angle, f/2.2 Aperture, 5P Lens, Automatic Focus, Open-loop Motor), 2MP Main Camera (Mono): (1.75micrometer Pixel Area, 88.8Degree Wide Angle, f/2.4 Aperture, 3P Lens), Focus Mode: Contrast Detection Auto Focus + Phase Detection Auto Focus, Photo Size: Rear Camera: 12032 x 9024 (Ultra HD Mode), 4608 x 3456 (Normal Mode), Ultra Dark Mode, Ultra Steady Video 2.0, Video Bokeh + Video Zoom', 'Optical Zoom': 'Yes', 'Secondary Camera Available': 'Yes', 'Secondary Camera': '44MP + 2MP Dual Front Camera', 'Secondary Camera Features': ""World's First 44MP Dual Punch Hole Camera, 44MP Main Camera - (Samsung S5KGH1, 0.7micrometer Pixel Area, 1/2.65inch Photosensitive Area, f/2.4 Aperture, 80.4Degree Wide Angle, 5P Lens), 2MP Sub Camera - (1.75micrometer Pixel Area, 78.3Degree Wide Angle, f/2.4 Aperture, 3P Lens), Photo Size - Front Camera: 7296 x 5472, Focus Mode: Fixed Focus"", 'Flash': 'Rear LED Flash', 'Dual Camera Lens': 'Primary & Secondary Camera', 'Network Type': '4G VOLTE, 4G', 'Supported Networks': '4G VoLTE', 'Bluetooth Support': 'Yes', 'Bluetooth Version': 'v5.0', 'Wi-Fi': 'Yes', 'Wi-Fi Version': '802.11 a/b/g/n/ac', 'Touchscreen Type': 'Capacitive Multi Touch Screen', 'SIM Size': 'Nano SIM', 'User Interface': 'ColorOS 7', 'Removable Battery': 'No', 'Sensors': 'Electronic Compass, Geomagnetic Induction, Photo Induction, Distance Sensor, Integrated Gravity and Acceleration Sensor', 'Other Features': 'Theoretical Talk Time - Max GSM: 36Hrs, WCDMA: 27Hrs, Theoretical Standby Time: Max 362Hrs, Uplink and Downlink Rates on a 4G Network: Uplink: 75 Mbps, Downlink: 200 Mbps, Uplink and Downlink Rates on a High-speed Network: Uplink: 11.5 Mbps, Downlink: 42 Mbps, Button Type: Physical Button + Virtual Button, USB Interface: Type-C USB 2.0, WLAN Features: WLAN 2.4G, WLAN 5.1G, WLAN 5.8G, WLAN Display, E-book: iReader, VOOC 4.0 30W Flash Charge, In Display Fingerprint 3.0, 5V6A 30W Charge Power', 'GPS Type': 'A-GPS, GLONASS, BeiDou, Galileo', 'FM Radio': 'Yes', 'Battery Capacity': '4025 mAh', 'Width': '73.4 mm', 'Height': '158.8 mm', 'Depth': '8.1 mm', 'Weight': '175 g', 'Warranty Summary': 'Brand Warranty of 1 Year Available for Mobile and 6 Months for Accessories'}",29990
