Name,Stars,Ratings,Reviews,Specifications,Price
"Nokia 5.1 Plus (Black, 32 GB)  (3 GB RAM)",4.3,"1,72,596 Ratings","22,072 Reviews","{'In The Box': 'Handset, Headset, Charger, Cable, User Guide', 'Model Number': 'TA-1102 DS', 'Model Name': '5.1 Plus', 'Color': 'Black', 'Browse Type': 'Smartphones', 'SIM Type': 'Dual Sim', 'Hybrid Sim Slot': 'Yes', 'Touchscreen': 'Yes', 'OTG Compatible': 'Yes', 'Sound Enhancements': '2 Mics', 'SAR Value': '1.10 W/kg over 1g', 'Display Size': '14.73 cm (5.8 inch)', 'Resolution': '720 x 1520 pixels', 'Resolution Type': 'HD+', 'Other Display Features': '19:9 Display, 2.5D Cover Glass', 'Operating System': 'Android Oreo 8.1.0', 'Processor Type': 'MediaTek Helio P60', 'Processor Core': 'Octa Core', 'Primary Clock Speed': '1.8 GHz', 'Operating Frequency': 'GSM - Band 2/3/5/8, WCDMA - Band 1/5/8, FDD LTE - Band 1/3/5/8, TDD LTE - Band 40/41', 'Internal Storage': '32 GB', 'RAM': '3 GB', 'Expandable Storage': '400 GB', 'Supported Memory Card Type': 'microSD', 'Memory Card Slot Type': 'Hybrid Slot', 'Primary Camera Available': 'Yes', 'Primary Camera': '13MP + 5MP', 'Primary Camera Features': '13MP PDAF f/2 + 5MP Depth Sense', 'Secondary Camera Available': 'Yes', 'Secondary Camera': '8MP Front Camera', 'Secondary Camera Features': 'Fixed Focus, f/2.2, 80.4 FoV, Beauty Shot, Selfie Bokeh, Live Bokeh, Panorama, HDR, Hybrid Zoom (Digital), Color and Mono, Slow-motion Video, 1.0 micrometer', 'Flash': 'Rear LED Flash', 'HD Recording': 'Yes', 'Full HD Recording': 'Yes', 'Video Recording': 'Yes', 'Video Recording Resolution': '1080p', 'Dual Camera Lens': 'Primary Camera', 'Network Type': '3G, 4G, 2G', 'Supported Networks': 'GSM, WCDMA, 4G LTE, UMTS', 'Internet Connectivity': '4G, 3G, Wi-Fi, EDGE', '3G': 'Yes', '3G Speed': 'HSPA+', 'Bluetooth Support': 'Yes', 'Bluetooth Version': '4.2', 'Wi-Fi': 'Yes', 'Wi-Fi Version': '802.11a/b/g/n/ac (2.4 GHz + 5 GHz)', 'Wi-Fi Hotspot': 'Yes', 'USB Connectivity': 'Yes', 'EDGE': 'Yes', 'Audio Jack': '3.5mm Stereo Headset Connector', 'Map Support': 'Google Maps', 'GPS Support': 'Yes', 'Smartphone': 'Yes', 'SIM Size': 'Dual Nano SIM', 'Removable Battery': 'No', 'Sensors': 'Fingerprint Sensor, Ambient Light Sensor, Proximity Sensor, Accelerometer (G-sensor), E-compass, Gyroscope', 'Other Features': '4G LTE (Cat 4), USB Type-C, MediaTek Helio P60 4 x A73 1.8GHz + 4 x A53 1.8GHz, Wi-Fi Hotspot + C5', 'GPS Type': 'A-GPS + GLONASS + BDS + Cellular and Wi-Fi Network Positioning', 'FM Radio': 'Yes', 'Battery Capacity': '3060 mAh', 'Width': '71.98 mm', 'Height': '149.51 mm', 'Depth': '8 mm', 'Weight': '151 g', 'Warranty Summary': 'Brand Warranty of 1 Year Available for Mobile and 6 Months for Accessories'}",6999
"OPPO A9 2020 (Marine Green, 128 GB)  (4 GB RAM)",4.4,"2,227 Ratings",212 Reviews,"{'In The Box': 'Handset, Adapter, Headset, Micro USB Cable, Important Info. Booklet with Warranty Card, Quick Start Guide, Sim Card Tool, Protective Film, Pre-applied, Case', 'Model Number': 'CPH1937', 'Model Name': 'A9 2020', 'Color': 'Marine Green', 'Browse Type': 'Smartphones', 'SIM Type': 'Dual Sim', 'Hybrid Sim Slot': 'No', 'Touchscreen': 'Yes', 'OTG Compatible': 'Yes', 'Sound Enhancements': 'Dolby Atmos and Dual Stereo Speakers', 'Display Size': '16.51 cm (6.5 inch)', 'Resolution': '1600 x 720 Pixels', 'GPU': 'Adreno 610', 'Display Type': 'TFT-LCD', 'Display Colors': '16M', 'Other Display Features': 'Touch Panel Technology: In-cell, Narrow Frame - Upper Border: 2.44mm, Left and Right Border: 1.98mm, Lower Border: 6.6mm, Screen Ratio: 89.0%, Screen Contrast: 1500:1, Color Saturation: Typical 71%, Maximum Brightness: 480nits, Touch Panel Glass Type: GG3+, TYPE-C USB 2.0', 'Operating System': 'Android Pie 9', 'Processor Type': 'Qualcomm SM6125', 'Processor Core': 'Octa Core', 'Primary Clock Speed': '1.8 GHz', 'Secondary Clock Speed': '2 GHz', 'Internal Storage': '128 GB', 'RAM': '4 GB', 'Memory Card Slot Type': 'Dedicated Slot', 'Primary Camera Available': 'Yes', 'Primary Camera': '48MP + 8MP + 2MP + 2MP', 'Primary Camera Features': 'Ultra Wide Quad Camera, Sensor Type: 48MP CMOS/S5KGM1SP/OV48B, 8MP COMS/Hi846/OV8856, 2MP CMOS/OV02A1B/GC02M0, 2MP CMOS/GC02M0/OV02A1B, Maximum Zoom Multiples: 10X, Aperture: 48MP (f/1.8) + 8MP (f/2.25) + 2MP (f/2.4) + 2MP (f/2.4), Focal Length: 48MP (4.71mm) + 8MP (1.66mm) + 2MP (1.77mm) + 2MP (f1.77mm), Lens Number: 48MP (6P) + 8MP (5P) + 2MP (3P) + 2MP (3P)', 'Secondary Camera Available': 'Yes', 'Secondary Camera': '16MP Front Camera', 'Secondary Camera Features': 'Sensor Sizes/Pixel Data - 1/3.1inch, 1.0micrometer, Sensor Type: S5K3P9SP04, Wide Angle of Front: 79Degree, Aperture: F2.0, Focal Length: 3.42mm, Lens Number: 5P', 'Flash': 'Rear LED Flash', 'Frame Rate': 'Front Camera Video: 1080P/720P at 30 fps', 'Dual Camera Lens': 'Primary Camera', 'Network Type': '4G VOLTE, 4G, 3G, 2G', 'Supported Networks': '4G VoLTE, UMTS, GSM, 4G LTE, WCDMA, CDMA', 'Internet Connectivity': '4G, 3G, Wi-Fi, EDGE, GPRS', '3G Speed': 'HSPA+', 'GPRS': 'Yes', 'Micro USB Port': 'Yes', 'Micro USB Version': '2', 'Bluetooth Support': 'Yes', 'Bluetooth Version': 'v5.0', 'Wi-Fi': 'Yes', 'Wi-Fi Version': '802.11a/b/g/n/ac', 'USB Connectivity': 'Yes', 'EDGE': 'Yes', 'Audio Jack': '3.5mm', 'Smartphone': 'Yes', 'Touchscreen Type': 'Capacitive Screen, Multi-touch', 'SIM Size': 'Dual Nano SIM', 'User Interface': 'ColorOS 6.0.1', 'Removable Battery': 'No', 'Graphics PPI': '269 PPI', 'Ringtones Format': 'MP3/AMR/APE/OGG/FLAC/WAV/MIDI/WMA', 'Other Features': 'Face Recognition, Split Screen (Specific Apps), Clone Apps, Night Shield, Sensor Hub, Game Acceleration (Specific Apps), CPU Technology - 11nm, ROM Technology: UFS 2.1, Energy Density - 696 Wh/L, Charge Speed/Power - 5V 2A, 10W, WLAN 2.4G, WLAN 5.1G, WLAN 5.8G, WLAN Display, Game Boost 2.0, 4G+, 64 bits Processor, Video Stability, Ultra Night Mode 2.0, Reverse Charging', 'FM Radio': 'Yes', 'Audio Formats': 'MP3/AAC/APE/AMR/WAV/MID/OGG/FLAC/WMA', 'Video Formats': 'AVI/3GP/MP4/WMV/MKV/MOV/ASF/FLV', 'Battery Capacity': '5000 mAh', 'Width': '75.6 mm', 'Height': '163.6 mm', 'Depth': '9.1 mm', 'Weight': '195 g', 'Warranty Summary': 'Brand Warranty of 1 Year Available for Mobile and 6 Months for Accessories'}",14990
"Mi A2 (Lake Blue, 128 GB)  (6 GB RAM)",4.1,"2,247 Ratings",199 Reviews,"{'In The Box': 'User Guide, Power Adapter, Type-C to Audio Adapter, Clear Soft Case, Warranty Card, USB Cable, SIM Eject Tool, Handset', 'Model Number': 'MZB7129IN/MZB6438IN', 'Model Name': 'Mi A2', 'Color': 'Lake Blue', 'Browse Type': 'Smartphones', 'SIM Type': 'Dual Sim', 'Hybrid Sim Slot': 'No', 'Touchscreen': 'Yes', 'OTG Compatible': 'Yes', 'Sound Enhancements': 'Speaker: Single (Bottom Opening), 2 Microphones (for Noise Cancellation), Smart PA', 'SAR Value': 'Head - 1.092W/kg, Body - 0.259W/kg', 'Display Size': '15.21 cm (5.99 inch)', 'Resolution': '2160 x 1080 Pixels', 'Resolution Type': 'Full HD+', 'GPU': 'Adreno 512', 'Display Type': 'IPS', 'Other Display Features': '1500:1 Contrast Ratio, 83% NTSC Ratio, 2.5D Glass, Corning Gorilla Glass 5, 18:9 Display', 'Operating System': 'Android Oreo 8.1', 'Processor Type': 'Qualcomm Snapdragon 660 AIE', 'Processor Core': 'Octa Core', 'Primary Clock Speed': '2.2 GHz', 'Operating Frequency': 'GSM: B2, B3, B5, B8, WCDMA: B1, B2, B5, B8, 4G LTE-TDD: B40, B41, 4G LTE-FDD: B1, B3, B5', 'Internal Storage': '128 GB', 'RAM': '6 GB', 'Primary Camera Available': 'Yes', 'Primary Camera': '20MP + 12MP', 'Primary Camera Features': 'Panorama Mode, Dual Camera Lens: Sony IMX486, 1.25 micrometer pixels, Large f/1.75 Aperture, PDAF, Video: 4K Video Shooting (3840 x 2160 pixels at 30fps), 1080p Video Shooting (1920 x 1080 pixels at 30fps), 720p Video Shooting (1280 x 720 pixels at 30fps), 480p Video Shooting (720 x 480 pixels at 30fps), Slow Motion Video (720p at 120fps), Single Color Temperature Flash, 2.0 micrometer Pixels, Light Enhancement Technology, Sony IMX376, HDR Imaging Technology, Face Recognition, Burst Mode, Group Selfie, EIS for Video Recording, 4-in-1 Pixel Binning Technique, f/1.75 Large Aperture, AI Beautify 4.0, PDAF, Background Blurring in Portrait Mode, 5P Lens (20MP) + 5P Lens (12MP)', 'Secondary Camera Available': 'Yes', 'Secondary Camera': '20MP Front Camera', 'Secondary Camera Features': 'Group Selfie, 5P Lens, 4500K Soft-toned Selfie Light, Selfie Timer, F2.2 Aperture, Front Light, HDR, AI-powered Semantic Segmentation, Front Camera pixel Size: 1 micron, AI-powered Beautify 4.0, Face Recognition', 'Flash': 'Rear Flash', 'HD Recording': 'Yes', 'Full HD Recording': 'Yes', 'Video Recording': 'Yes', 'Video Recording Resolution': '3840 x 2160 pixels', 'Dual Camera Lens': 'Primary Camera', 'Network Type': '3G, 4G VOLTE, 4G, 2G', 'Supported Networks': 'GSM, WCDMA, 4G VoLTE, 4G LTE', 'Internet Connectivity': '4G, 3G, Wi-Fi', '3G': 'Yes', 'Bluetooth Support': 'Yes', 'Bluetooth Version': '5', 'Wi-Fi': 'Yes', 'Wi-Fi Version': '802.11a/b/g/n/ac', 'Map Support': 'Google Maps', 'GPS Support': 'Yes', 'Smartphone': 'Yes', 'Touchscreen Type': 'Capacitive', 'SIM Size': 'Nano SIM + Nano SIM', 'Graphics PPI': '403 PPI', 'SIM Access': 'Dual Standby', 'Sensors': 'Rear Fingerprint Sensor, Ambient Light Sensor, Proximity Sensor, E-compass, Accelerometer, Gyroscope', 'Upgradable Operating System': 'Android Pie 9.0', 'Other Features': 'Charger: 5 V/2 A, Support QC 4.0, Cores/Bits: 8 x Kyro/14nm Architecture, Android One, Body: Metal Unibody, IR Blaster, No Expandble Storag, USB Type-C (2.0)', 'GPS Type': 'A-GPS, GLONASS, BeiDou', 'Battery Capacity': '3010 mAh', 'Battery Type': 'Li-polymer', 'Width': '75.4 mm', 'Height': '158.7 mm', 'Depth': '7.3 mm', 'Weight': '168 g', 'Warranty Summary': 'Brand Warranty of 1 Year Available for Mobile and 6 Months for Battery and Accessories'}",15999
"Redmi Note 5 Pro (Red, 64 GB)  (4 GB RAM)",4.5,"11,51,756 Ratings","1,23,675 Reviews","{'In The Box': 'Handset, Power Adapter, USB Data Cable, Ultra Thin Case, Warranty Card, Getting Started Guide, Pin', 'Model Number': 'MZB6634IN', 'Model Name': 'Redmi Note 5 Pro', 'Color': 'Red', 'Browse Type': 'Smartphones', 'SIM Type': 'Dual Sim', 'Hybrid Sim Slot': 'Yes', 'Touchscreen': 'Yes', 'OTG Compatible': 'Yes', 'Sound Enhancements': 'Speaker - Single (Bottom Opening), Microphones - 2 (For Noise Cancellation)', 'SAR Value': 'Head: 1.188 W/Kg, Body: 0.334 W/Kg', 'Display Size': '15.21 cm (5.99 inch)', 'Resolution': '2160 x 1080 Pixels', 'Resolution Type': 'Full HD+', 'GPU': 'Adreno 509', 'Display Type': 'IPS (in-cell)', 'Other Display Features': 'Contrast Ratio: 1000:1 (min), 2.5D Glass, Corning Gorilla Glass, 18:9 Display', 'Operating System': 'Android Nougat 7.1.2', 'Processor Type': 'Qualcomm Snapdragon 636', 'Processor Core': 'Octa Core', 'Primary Clock Speed': '1.8 GHz', 'Operating Frequency': 'GSM - B2, B3, B5, B8, WCDMA - B1, B2, B5, B8, 4G LTE TDD - B40, B41 (2535 - 2655 MHz), LTE FDD - B1, B3, B5', 'Internal Storage': '64 GB', 'RAM': '4 GB', 'Expandable Storage': '128 GB', 'Supported Memory Card Type': 'microSD', 'Memory Card Slot Type': 'Hybrid Slot', 'Primary Camera Available': 'Yes', 'Primary Camera': '12MP + 5MP', 'Primary Camera Features': 'Primary Sensor - f/2.2, 1.25 microns Pixel Size, 5P Lens, Secondary Sensor - f/2.0, 1.12 microns Pixel Size, 4P Lens, PDAF', 'Secondary Camera Available': 'Yes', 'Secondary Camera': '20MP Front Camera', 'Secondary Camera Features': 'Aperture - f/2.2, 1.0 microns Pixel Size', 'Flash': 'Rear and Front Flash', 'Dual Camera Lens': 'Primary Camera', 'Network Type': '3G, 4G VOLTE, 4G', 'Supported Networks': 'GSM, WCDMA, 4G VoLTE, UMTS, 4G LTE', 'Internet Connectivity': '4G, 3G, Wi-Fi', '3G': 'Yes', 'Micro USB Port': 'Yes', 'Bluetooth Support': 'Yes', 'Bluetooth Version': '5', 'Wi-Fi': 'Yes', 'Wi-Fi Version': '802.11 a/b/g/n/ac', 'USB Connectivity': 'Yes', 'Audio Jack': '3.5 mm', 'Map Support': 'Google Maps', 'GPS Support': 'Yes', 'Smartphone': 'Yes', 'SIM Size': 'Nano SIM and Nano SIM', 'Graphics PPI': '403 PPI', 'Sensors': 'Fingerprint Scanner, Ambient Light Sensor, Proximity Sensor, E Compass, Accelerometer, Hall Sensor, Gyroscope', 'Other Features': '14 nm Architecture Processor, Internal Memory - eMMC v5.1, Body - Metal Back, IR Blaster, Charger - 5 V x 2 A, AI Face Unlock, Electronic Image Stabilization For Video Recording', 'GPS Type': 'GLONASS, BeiDou', 'Battery Capacity': '4000 mAh', 'Width': '75.35 mm', 'Height': '158.58 mm', 'Depth': '8.05 mm', 'Weight': '181 g', 'Warranty Summary': 'Brand Warranty of 1 Year Available for Mobile and 6 Months for Accessories'}",12999
"Alcatel 3X (Blue, 32 GB)  (3 GB RAM)",3.9,53 Ratings,10 Reviews,"{'In The Box': 'Handset, Battery, Charger, Data Cable', 'Model Number': '5058', 'Model Name': '3X', 'Color': 'Blue', 'Browse Type': 'Smartphones', 'SIM Type': 'Dual Sim', 'Hybrid Sim Slot': 'Yes', 'Touchscreen': 'Yes', 'OTG Compatible': 'No', 'Display Size': '14.48 cm (5.7 inch)', 'Resolution': '1440 x 720$$Pixels', 'Operating System': 'Android Nougat 7.1.1', 'Processor Core': 'Quad Core', 'Primary Clock Speed': '1.28 GHz', 'Internal Storage': '32 GB', 'RAM': '3 GB', 'Memory Card Slot Type': 'Hybrid Slot', 'Primary Camera': '16MP Rear Camera', 'Network Type': '3G, 4G, 2G', 'Supported Networks': 'GSM, 4G LTE', 'Battery Capacity': '3000 mAh', 'Warranty Summary': '18 Months'}",9999
"OPPO Reno2 F (Sky White, 128 GB)  (8 GB RAM)",4.5,"1,664 Ratings",158 Reviews,"{'In The Box': 'Handset, Adapter, Headset, Micro USB Cable, Important info. Booklet with Warranty Card, Quick Guide, SIM Card Tool, Screen Protect Film: The screen Protecton is On the Phone and the Battery Protection Film is Included in the Packing List, Case', 'Model Number': 'CPH1989', 'Model Name': 'Reno2 F', 'Color': 'Sky White', 'Browse Type': 'Smartphones', 'SIM Type': 'Dual Sim', 'Hybrid Sim Slot': 'No', 'Touchscreen': 'Yes', 'OTG Compatible': 'Yes', 'SAR Value': 'Head: 1.183 W/kg, Body: 0.780 W/kg', 'Display Size': '16.51 cm (6.5 inch)', 'Resolution': '2400 x 1080 Pixels', 'GPU': 'ARM Mali-G72 MP3 900MHz', 'Display Type': 'AMOLED', 'Display Colors': '16M', 'Other Display Features': 'Corning Gorilla Glass 5, Upper Bezel: 2.20 mm; Left and Right Bezels: 1.62 mm; Lower Bezel: 5.53 mm', 'Operating System': 'Android Pie 9', 'Processor Type': 'MTK MT6771V(P70) 64bit', 'Processor Core': 'Octa Core', 'Primary Clock Speed': '2.1 GHz', 'Secondary Clock Speed': '2 GHz', 'Internal Storage': '128 GB', 'RAM': '8 GB', 'Memory Card Slot Type': 'Hybrid Slot', 'Primary Camera Available': 'Yes', 'Primary Camera': '48MP + 8MP + 2MP + 2MP', 'Primary Camera Features': '2 MP, 2MP Sensor Sizes/Pixel data - 1/2.25inch, 0.8micrometer, Secondary Camera 1/4.0inch, 1.12micrometer, Mono 1/5.0inch, 1.75micrometer, Mono 1/5.0inch, 1.75micrometer, Sensor Type - S5KGM1SP + Hi846 + Ov02A1B, Maximum Zoom Multiples - Digital Zooming 10X, Aperture - Main Camera F1.79, Seconadary Camera F2.2, Mono F2.4, Mono F2.4, Focal Length - Main Camera 4.71mm, Secondary Camera 1.6 mm, Mono 1.7mm, Mono 1.7mm, Lens Number - Main Camera 6P, Secondary Camera 5P, Mono 3P, Mono 3P', 'Secondary Camera Available': 'Yes', 'Secondary Camera': '16MP Front Camera', 'Secondary Camera Features': 'Sensor Sizes/Pixel Data - 1/3.1inch, 1.0micrometer, Sensor Type - S5K3P9SP, Sensor Model/Manufacturers - Samsung, Focusing method - Focus, Wide Angle of Front - 79Degree, Aperture - F2.0, Focal Length - 3.419 mm, Lens Number - 5P, Photo Management - Photo Editing, Characteristic Function For Photograph - Photo, Video, Panorama, Portrait', 'Flash': 'Rear Flash', 'HD Recording': 'Yes', 'Frame Rate': 'Rear: 1080p at 30 fps, 720p at 30 fps, Front: 1080p/720p at 30 fps fps', 'Image Editor': 'Yes', 'Dual Camera Lens': 'Primary Camera', 'Network Type': '4G, 2G, 3G', 'Supported Networks': '4G VoLTE, GSM, WCDMA', 'Internet Connectivity': '4G, Wi-Fi, EDGE, GPRS', 'GPRS': 'Yes', 'Micro USB Port': 'Yes', 'Bluetooth Support': 'Yes', 'Bluetooth Version': 'v4.2', 'Wi-Fi': 'Yes', 'Wi-Fi Version': '802.11a/b/g/n/ac', 'USB Connectivity': 'Yes', 'EDGE': 'Yes', 'Audio Jack': '3.5mm', 'Map Support': 'Google Maps', 'GPS Support': 'Yes', 'Smartphone': 'Yes', 'Touchscreen Type': 'Multi-touch Capacitive Screen', 'SIM Size': 'Dual Nano SIM', 'User Interface': 'ColorOS 6.1', 'Removable Battery': 'No', 'Graphics PPI': '394 PPI', 'Predictive Text Input': 'Yes', 'Sensors': 'Light Sensor, Proximity Sensor, G-Sensor, Acceleration Sensor, Hall Sensor/Window-view Mode, Gyro-Meter, E-Compass', 'Other Features': 'Physical Key, Face Recognition, Kids Space, Clone Apps, Night Shiled, Sensor Hub, Oshare, Face Unlocking, Music Interconnection, Fingerprint Access Time, Face Recognition Time, Program Frozen, File Encryption, Baseband Architecture, CPU Technology, UFS 2.1, Full Charge Time(0-100%), VOOC Flash Charge, Energy Density, Charge Speed/Power, WLAN 2.4G, WLAN 5.1G, WLAN 5.8G, WLAN Display', 'GPS Type': 'BeiDou, GLONASS', 'FM Radio': 'Yes', 'Battery Capacity': '4000 mAh', 'Width': '75.8 mm', 'Height': '161.8 mm', 'Depth': '8.67 mm', 'Weight': '195 g', 'Warranty Summary': 'Brand Warranty of 1 Year Available for Mobile with Battery and 6 Months for Accessories'}",21990
