Name,Stars,Ratings,Reviews,Specifications,Price
"Redmi K20 (Pearl White, 128 GB)  (6 GB RAM)",4.5,"43,678 Ratings","4,778 Reviews","{'In The Box': 'Redmi K20, Power adapter, Simple protective cover, USB Type-C cable, SIM eject tool, User guide, Warranty card', 'Model Number': 'MZB8194IN', 'Model Name': 'Redmi K20', 'Color': 'Pearl White', 'Browse Type': 'Smartphones', 'SIM Type': 'Dual Sim', 'Hybrid Sim Slot': 'No', 'Touchscreen': 'Yes', 'OTG Compatible': 'Yes', 'Quick Charging': 'Yes', 'Sound Enhancements': 'Speaker - Single (Bottom Opening), Microphones - 2 (For Noise Cancellation), Smart PA/HiFi', 'SAR Value': 'Head SAR: 1.07W/kg, Body SAR: 0.723W/kg (Distance 15mm)', 'Display Size': '16.23 cm (6.39 inch)', 'Resolution': '2340 x 1080 pixels', 'Resolution Type': 'Full HD+', 'GPU': 'Adreno 618', 'Display Type': 'AMOLED', 'Display Colors': 'Contrast Ratio - 60000:1, NTSC Ratio - 103.8%', 'Operating System': 'Android Pie 9', 'Processor Type': 'Qualcomm Snapdragon 730', 'Processor Core': 'Octa Core', 'Primary Clock Speed': '2.2 GHz', 'Secondary Clock Speed': '1.8 GHz', 'Operating Frequency': 'GSM - B2, B3, B5, B8, WCDMA - B1, B2, B5, B8, LTE TDD - B38, B40, B41 (120MHz), LTE FDD - B1, B3, B5, B7, B8', 'Internal Storage': '128 GB', 'RAM': '6 GB', 'Primary Camera Available': 'Yes', 'Primary Camera': '48MP + 13MP + 8MP', 'Primary Camera Features': '48MP - IMX582, 1/2.0inch, 1.6micormeter, 6P, F1.75, FOV79, AF, OL, 13MP - S5K3L6 1/3inch, 1.12micrometer, 5P, F2.4, FOV124.8, FF, 8MP - OV8856 1/4inch, 1.12micrometer, 5P, F2.4, FOV44.5, AF, OL, PDAF, Slow Motion Support - 960 fps', 'Secondary Camera Available': 'Yes', 'Secondary Camera': '20MP Front Camera', 'Secondary Camera Features': '20MP Popup Camera with R/B LED - Aperture - F2.2, Front Camera Pixel Size - 0.8micrometer', 'Flash': 'Rear Flash', 'Dual Camera Lens': 'Primary Camera', 'Network Type': '3G, 4G VOLTE, 2G', 'Supported Networks': 'GSM, WCDMA, 4G VoLTE, 4G LTE', 'Internet Connectivity': '4G, 3G, Wi-Fi', '3G': 'Yes', 'Bluetooth Support': 'Yes', 'Bluetooth Version': '5', 'Wi-Fi': 'Yes', 'Wi-Fi Version': '802.11 a/b/g/n/ac', 'USB Connectivity': 'Yes', 'Audio Jack': '3.5mm', 'Map Support': 'Google Maps', 'GPS Support': 'Yes', 'SIM Size': 'Dual Nano SIM', 'Graphics PPI': '403 PPI', 'Sensors': '7th Gen In-display Fingerprint Sensor, Ambient Light Sensor, Proximity Sensor, E-compass, Accelerometer, Gyroscope', 'Other Features': 'Internal Memory - UFS2.1, USB Type C, QC 3.0, Processor Cores - 2 x Gold 2.2GHz + 6 x Silver 1.8 GHz, Game Turbo 2.0, 8-layer Graphite Stack Cooling System', 'GPS Type': 'A-GPS, GLONASS, BeiDou', 'Battery Capacity': '4000 mAh', 'Width': '74.3 mm', 'Height': '156.7 mm', 'Depth': '8.8 mm', 'Weight': '191 g', 'Warranty Summary': 'Brand Warranty of 1 Year Available for Mobile and 6 Months for Accessories'}",22999
"OPPO A9 2020 (Space Purple, 128 GB)  (4 GB RAM)",4.4,"2,227 Ratings",212 Reviews,"{'In The Box': 'Handset, Adapter, Headset, Micro USB Cable, Important Info. Booklet with Warranty Card, Quick Start Guide, Sim Card Tool, Protective Film, Pre-applied, Case', 'Model Number': 'CPH1937', 'Model Name': 'A9 2020', 'Color': 'Space Purple', 'Browse Type': 'Smartphones', 'SIM Type': 'Dual Sim', 'Hybrid Sim Slot': 'No', 'Touchscreen': 'Yes', 'OTG Compatible': 'Yes', 'Sound Enhancements': 'Dolby Atmos and Dual Stereo Speakers', 'Display Size': '16.51 cm (6.5 inch)', 'Resolution': '1600 x 720 Pixels', 'GPU': 'Adreno 610', 'Display Type': 'TFT-LCD', 'Display Colors': '16M', 'Other Display Features': 'Touch Panel Technology: In-cell, Narrow Frame - Upper Border: 2.44mm, Left and Right Border: 1.98mm, Lower Border: 6.6mm, Screen Ratio: 89.0%, Screen Contrast: 1500:1, Color Saturation: Typical 71%, Maximum Brightness: 480nits, Touch Panel Glass Type: GG3+, TYPE-C USB 2.0', 'Operating System': 'Android Pie 9', 'Processor Type': 'Qualcomm SM6125', 'Processor Core': 'Octa Core', 'Primary Clock Speed': '1.8 GHz', 'Secondary Clock Speed': '2 GHz', 'Internal Storage': '128 GB', 'RAM': '4 GB', 'Memory Card Slot Type': 'Dedicated Slot', 'Primary Camera Available': 'Yes', 'Primary Camera': '48MP + 8MP + 2MP + 2MP', 'Primary Camera Features': 'Ultra Wide Quad Camera, Sensor Type: 48MP CMOS/S5KGM1SP/OV48B, 8MP COMS/Hi846/OV8856, 2MP CMOS/OV02A1B/GC02M0, 2MP CMOS/GC02M0/OV02A1B, Maximum Zoom Multiples: 10X, Aperture: 48MP (f/1.8) + 8MP (f/2.25) + 2MP (f/2.4) + 2MP (f/2.4), Focal Length: 48MP (4.71mm) + 8MP (1.66mm) + 2MP (1.77mm) + 2MP (f1.77mm), Lens Number: 48MP (6P) + 8MP (5P) + 2MP (3P) + 2MP (3P)', 'Secondary Camera Available': 'Yes', 'Secondary Camera': '16MP Front Camera', 'Secondary Camera Features': 'Sensor Sizes/Pixel Data - 1/3.1inch, 1.0micrometer, Sensor Type: S5K3P9SP04, Wide Angle of Front: 79Degree, Aperture: F2.0, Focal Length: 3.42mm, Lens Number: 5P', 'Flash': 'Rear LED Flash', 'Frame Rate': 'Front Camera Video: 1080P/720P at 30 fps', 'Dual Camera Lens': 'Primary Camera', 'Network Type': '4G VOLTE, 4G, 3G, 2G', 'Supported Networks': '4G VoLTE, UMTS, GSM, 4G LTE, WCDMA, CDMA', 'Internet Connectivity': '4G, 3G, Wi-Fi, EDGE, GPRS', '3G Speed': 'HSPA+', 'GPRS': 'Yes', 'Micro USB Port': 'Yes', 'Micro USB Version': '2', 'Bluetooth Support': 'Yes', 'Bluetooth Version': 'v5.0', 'Wi-Fi': 'Yes', 'Wi-Fi Version': '802.11a/b/g/n/ac', 'USB Connectivity': 'Yes', 'EDGE': 'Yes', 'Audio Jack': '3.5mm', 'Smartphone': 'Yes', 'Touchscreen Type': 'Capacitive Screen, Multi-touch', 'SIM Size': 'Dual Nano SIM', 'User Interface': 'ColorOS 6.0.1', 'Removable Battery': 'No', 'Graphics PPI': '269 PPI', 'Ringtones Format': 'MP3/AMR/APE/OGG/FLAC/WAV/MIDI/WMA', 'Other Features': 'Face Recognition, Split Screen (Specific Apps), Clone Apps, Night Shield, Sensor Hub, Game Acceleration (Specific Apps), CPU Technology - 11nm, ROM Technology: UFS 2.1, Energy Density - 696 Wh/L, Charge Speed/Power - 5V 2A, 10W, WLAN 2.4G, WLAN 5.1G, WLAN 5.8G, WLAN Display, Game Boost 2.0, 4G+, 64 bits Processor, Video Stability, Ultra Night Mode 2.0, Reverse Charging', 'FM Radio': 'Yes', 'Audio Formats': 'MP3/AAC/APE/AMR/WAV/MID/OGG/FLAC/WMA', 'Video Formats': 'AVI/3GP/MP4/WMV/MKV/MOV/ASF/FLV', 'Battery Capacity': '5000 mAh', 'Width': '75.6 mm', 'Height': '163.6 mm', 'Depth': '9.1 mm', 'Weight': '195 g', 'Warranty Summary': 'Brand Warranty of 1 Year Available for Mobile and 6 Months for Accessories'}",14990
"Samsung Galaxy M30s (Black, 64 GB)  (4 GB RAM)",4.4,"2,135 Ratings",206 Reviews,"{'In The Box': 'New', 'Model Number': 'SM-M307FZKDINS', 'Model Name': 'Galaxy M30s', 'Color': 'Black', 'Browse Type': 'Smartphones', 'SIM Type': 'Dual Sim', 'Hybrid Sim Slot': 'No', 'Touchscreen': 'Yes', 'OTG Compatible': 'Yes', 'Display Size': '16.26 cm (6.4 Inches)', 'Resolution': '1080x2400', 'Operating System': 'Android Pie 9', 'Processor Core': 'Quad Core', 'Primary Clock Speed': '2.3 GHz', 'Internal Storage': '64 GB', 'RAM': '4 GB', 'Memory Card Slot Type': 'Dedicated Slot', 'Primary Camera': '48MP Rear Camera', 'Dual Camera Lens': 'Primary & Secondary Camera', 'Network Type': '4G VOLTE, 2G', 'Supported Networks': 'GSM, 4G LTE', 'Battery Capacity': '6000 mAH', 'Warranty Summary': 'Twelve Months'}",14290
"Yuho Vast Plus (Diamond Black, 32 GB)  (4 GB RAM)",3.5,52 Ratings,7 Reviews,"{'In The Box': 'Handset, Headset, Charger, Data Cable', 'Model Number': 'Vast Plus', 'Model Name': 'Vast Plus', 'Color': 'Diamond Black', 'Browse Type': 'Smartphones', 'SIM Type': 'Dual Sim', 'Hybrid Sim Slot': 'No', 'Touchscreen': 'Yes', 'OTG Compatible': 'Yes', 'Quick Charging': 'No', 'Additional Content': 'Protactive Case', 'Display Size': '15.75 cm (6.2 inch)', 'Resolution': '720 x 1280 Pixels', 'Resolution Type': 'HD', 'GPU': 'NO', 'Display Type': '6.2 IPS', 'HD Game Support': 'No', 'Display Colors': 'NA', 'Operating System': 'Android Oreo 8.1', 'Processor Type': 'Mediatek', 'Processor Core': 'Quad Core', 'Primary Clock Speed': '1.4 GHz', 'Secondary Clock Speed': '1.4 GHz', 'Internal Storage': '32 GB', 'RAM': '4 GB', 'Total Memory': '32 GB', 'Expandable Storage': '128 GB', 'Supported Memory Card Type': 'microSD', 'Memory Card Slot Type': 'Dedicated Slot', 'Phone Book Memory': 'YES', 'Hot SWAP Support': 'No', 'Call Log Memory': 'Yes', 'SMS Memory': 'YES', 'Primary Camera Available': 'Yes', 'Primary Camera': '13MP Rear Camera', 'Primary Camera Features': '13MP', 'Optical Zoom': 'No', 'Secondary Camera Available': 'Yes', 'Secondary Camera Features': '13MP', 'Flash': 'YES', 'HD Recording': 'Yes', 'Full HD Recording': 'No', 'Video Recording': 'Yes', 'Digital Zoom': 'YES', 'Image Editor': 'No', 'Dual Camera Lens': 'Primary Camera', 'Call Wait/Hold': 'Yes', 'Conference Call': 'Yes', 'Hands Free': 'Yes', 'Video Call Support': 'Yes', 'Call Divert': 'Yes', 'Phone Book': 'Yes', 'Call Timer': 'Yes', 'Speaker Phone': 'Yes', 'Speed Dialing': 'Yes', 'Call Records': 'YES', 'Logs': 'Yes', 'Network Type': '3G, 4G VOLTE, 2G', 'Supported Networks': 'GSM, 4G VoLTE', 'Internet Connectivity': 'YES', '3G': 'Yes', 'GPRS': 'Yes', 'WAP': 'Yes', 'Pre-installed Browser': 'YES', 'Micro USB Port': 'No', 'Micro USB Version': 'NA', 'Mini USB Port': 'No', 'Mini USB Version': 'NA', 'Bluetooth Support': 'Yes', 'Bluetooth Version': '4', 'Wi-Fi': 'Yes', 'Wi-Fi Version': '2', 'Wi-Fi Hotspot': 'Yes', 'Mini HDMI Port': 'No', 'NFC': 'No', 'USB Tethering': 'No', 'TV Out': 'No', 'Infrared': 'No', 'USB Connectivity': 'Yes', 'EDGE': 'No', 'Audio Jack': '3.5 mm', 'Map Support': 'YES', 'GPS Support': 'Yes', 'Smartphone': 'Yes', 'Touchscreen Type': 'IPS', 'SIM Size': 'Nano SIM', 'Mobile Tracker': 'No', 'Keypad Type': 'QWERTY', 'Instant Message': 'No', 'Business Phone': 'No', 'Java Application': 'No', 'Removable Battery': 'Yes', 'JAVA Support': 'No', 'MMS': 'Yes', 'SMS': 'Yes', 'Keypad': 'No', 'Voice Input': 'No', 'Graphics PPI': '330 ppi', 'Predictive Text Input': 'Yes', 'Sensors': 'G-Sensor,Light Sensor,Proximity Sensor', 'Supported Languages': 'Multi Language', 'Games': 'Yes', 'Browser': 'YES', 'Ringtones Format': 'MP3', 'FM Radio': 'Yes', 'FM Radio Recording': 'No', 'DLNA Support': 'No', 'Audio Formats': 'MP3', 'Music Player': 'MP3', 'Video Formats': 'MP4', 'Battery Capacity': '3000 mAh', 'Battery Type': 'Li-Ion', 'Dual Battery': 'Yes', 'Warranty Summary': '12 MONTH', 'Warranty Service Type': 'Repair Only', 'Domestic Warranty': '12 Months'}",6499
"Samsung Galaxy A30s (Prism Crush Violet, 64 GB)  (4 GB RAM)",4.3,"2,837 Ratings",219 Reviews,"{'In The Box': 'Handset, Headset, Travel Adapter, USB Cable and User Manual', 'Model Number': 'SM-A307FZLVINS', 'Model Name': 'Galaxy A30s', 'Color': 'Prism Crush Violet', 'Browse Type': 'Smartphones', 'SIM Type': 'Dual Sim', 'Hybrid Sim Slot': 'No', 'Touchscreen': 'Yes', 'OTG Compatible': 'Yes', 'Quick Charging': 'Yes', 'Display Size': '16.26 cm (6.4 inch)', 'Resolution': '1920 x 1080 Pixels', 'Resolution Type': 'HD+', 'GPU': 'ARM Mali-G71 MP2', 'Display Type': 'Super Amoled V Cut Display', 'Display Colors': '16M', 'Operating System': 'Android Pie 9.0', 'Processor Type': 'Exynos 7904', 'Processor Core': 'Octa Core', 'Primary Clock Speed': '1.8 GHz', 'Secondary Clock Speed': '1.6 GHz', 'Internal Storage': '64 GB', 'RAM': '4 GB', 'Supported Memory Card Type': 'microSD', 'Memory Card Slot Type': 'Dedicated Slot', 'Primary Camera Available': 'Yes', 'Primary Camera': '25MP + 5MP + 8MP', 'Primary Camera Features': 'Aperture - 25MP (F1.7)+ 5MP(2.2) + 8MP (2.2), Triple Camera', 'Secondary Camera Available': 'Yes', 'Secondary Camera': '16MP Front Camera', 'Secondary Camera Features': 'Live Focus Mode, Beauty Mode', 'Dual Camera Lens': 'Primary Camera', 'Call Wait/Hold': 'Yes', 'Conference Call': 'Yes', 'Hands Free': 'Yes', 'Video Call Support': 'Yes', 'Call Divert': 'Yes', 'Phone Book': 'Yes', 'Call Timer': 'Yes', 'Speaker Phone': 'Yes', 'Speed Dialing': 'Yes', 'Logs': 'Received, Missed, Dial', 'Network Type': '3G, 4G, 2G', 'Supported Networks': 'GSM, WCDMA, 4G LTE', 'Internet Connectivity': '4G, Wi-Fi, EDGE, GPRS', 'GPRS': 'Yes', 'Wi-Fi': 'Yes', 'Wi-Fi Hotspot': 'Yes', 'Map Support': 'Google Maps', 'GPS Support': 'Yes', 'Smartphone': 'Yes', 'SIM Size': 'Dual Nano SIM', 'Instant Message': 'Yes', 'Removable Battery': 'No', 'MMS': 'Yes', 'SMS': 'Yes', 'Keypad': 'No', 'Predictive Text Input': 'Yes', 'Sensors': 'On-Screen Fingerprint Sensor', 'Other Features': 'SAMSUNG Pay, Knox Security, Game Booster, 15W Fast Charging with USB Type C', 'FM Radio': 'Yes', 'Battery Capacity': '4000 mAh', 'Width': '74.6 mm', 'Height': '158.3 mm', 'Depth': '7.8 mm', 'Weight': '169 g', 'Warranty Summary': 'Brand Warranty of 1 Year Available for Mobile and 6 Months for Battery and Accessories'}",14999
"OPPO F15 (Unicorn White, 128 GB)  (8 GB RAM)",4.4,"4,430 Ratings",460 Reviews,"{'In The Box': 'Handset, Headset, USB Cable, Adapter, SIM Card Pin, Protective Case, Quick Guide, Warranty Card', 'Model Number': 'CPH2001', 'Model Name': 'F15', 'Color': 'Unicorn White', 'Browse Type': 'Smartphones', 'SIM Type': 'Dual Sim', 'Hybrid Sim Slot': 'No', 'Touchscreen': 'Yes', 'OTG Compatible': 'Yes', 'Sound Enhancements': 'Dirac Audio, Dual Mic Noise Suppression', 'SAR Value': 'Head: 1.20 W/kg, Body: 0.55 W/kg', 'Display Size': '16.26 cm (6.4 inch)', 'Resolution': '2400 x 1080 Pixels', 'Resolution Type': 'Full HD+', 'GPU': 'ARM Mali G72 MP3 900 MHz', 'Display Type': 'AMOLED', 'Other Display Features': 'Screen Proportion: 20:9, Upper Frame: 2.32mm, Left and Right Frame: 1.67mm, Lower Frame: 5.2mm, Screen Ratio: 90.8%, Color Gamut: 100% NTSC, 104% NTSC DCI - P3, Color Contrast: 1000000:1, Color Saturation: Typical Value 100%, Maximum Screen Brightness: Typical Value 430nit, Corning Gorilla Glass 5, Multi-touch: 10, Oleophobic Layer, Oleophobic Layer on Film, Screen Refresh Rate: 60Hz, Touch Sampling Rate: 135Hz, TUV Rheinland Eye Comfort Certification, No Stroboscopic Eye Protection', 'Operating System': 'Android Pie 9', 'Processor Type': 'Helio P70', 'Processor Core': 'Octa Core', 'Primary Clock Speed': '2.1 GHz', 'Secondary Clock Speed': '2 GHz', 'Operating Frequency': 'GSM: 850/900/1800/1900 MHz, WCDMA: B1/B5/B8, FDD-LTE: B1/B3/B5/B8, TD-LTE: B38/B40/B41', 'Internal Storage': '128 GB', 'RAM': '8 GB', 'Expandable Storage': '256 GB', 'Supported Memory Card Type': 'microSD', 'Memory Card Slot Type': 'Dedicated Slot', 'Primary Camera Available': 'Yes', 'Primary Camera': '48MP + 8MP + 2MP + 2MP', 'Primary Camera Features': '48MP AI Quad Cam, Sensor Sizes/Pixel Size: Main 1/2.25inch, 0.8micrometer, Secondary Wide Angle: 1/4inch, 1.12 micrometer, 2M 1/5inch, 1.75micrometer, Sensor Type: CMOS, Zoom Mode: Main - 10X Digital Zoom, Wide Angle - 2X Digital Zoom, Aperture: Main - f/1.79, Wide Angle - f/2.25, Portrait and Mono - f/2.4, Focal Length: Main - 4.71mm, Wide Angle - 1.66mm, Portrait and Mono - 1.77mm, Wide Angle: Main - 79Degree, Wide Angle - 119 Degree, Portrait and Mono - 88.8Degree, Consecutive Shooting: Yes (20 Photos), Macro Lens: Back 3CM Macro Camera, EIS Stabilization, Lens Glass Material: GG5, Corning Gorilla Glass 5, Photo Size: 8000 x 6000 (FHD+ Mode), 4000 x 3000 (Standard Mode), Ultra Clear Mode 48MP, Photo, Video, Professional Mode, Panorama, Portrait, Night Scene, Time-lapse Photography, Slow Motion, Macro, Video Stabilization, AI Scene Recognition, Full Light for Shooting Video, MP4 Video Format, Anti-shake Video, Ultra Night Mode 2.0', 'Secondary Camera Available': 'Yes', 'Secondary Camera': '16MP Front Camera', 'Secondary Camera Features': 'Camera Structure: Water-drop, Sensor Type: CMOS (4-in-1 Pixel Technology), Sensor Size/Pixel Size: 1/3.1inch, 1.0micrometer, Focal Length: 3.54mm, Wide Angle of Front Lens: 77Degree, Flashlight Aperture: f/2.0, Lens Structure: 5P, Focusing Type: Focus, Lens Glass Material: GG5, Corning Gorilla Glass 5, Photo Size: 4608 x 3456, MP4 Video Format', 'Frame Rate': 'Rear Camera: Slow-motion Video - 1080p at 120fps, 720p at 240fps, Rear Camera: 1080P at 30fps, 720P at 30fps, Front Camera: 1080P/720P at 30fps, Rear Camera Default: 1080P at 30fps, Front Camera Default: 720P at 30fps fps', 'Dual Camera Lens': 'Primary Camera', 'Video Call Support': 'Yes', 'Call Records': 'Yes', 'Network Type': '4G VOLTE, 4G, 3G, 2G', 'Supported Networks': '4G VoLTE, 4G LTE, UMTS, WCDMA, CDMA, GSM', 'Internet Connectivity': '4G, 3G, Wi-Fi, EDGE, GPRS', '3G Speed': 'HSPA+', 'GPRS': 'Yes', 'Bluetooth Support': 'Yes', 'Bluetooth Version': 'v4.2', 'Wi-Fi': 'Yes', 'Wi-Fi Version': '802.11a/b/g/n/ac', 'Wi-Fi Hotspot': 'Yes', 'EDGE': 'Yes', 'Audio Jack': '3.5mm', 'Map Support': 'Google Maps', 'GPS Support': 'Yes', 'Touchscreen Type': 'Multi-touch Capacitive Screen', 'SIM Size': 'Dual Nano SIM', 'User Interface': 'ColorOS 6.1.2', 'Graphics PPI': '408 PPI', 'Sensors': 'In-screen Fingerprint, Magnetic Induction Sensor, Light Sensor, Proximity Sensor, G - Sensor/Acceleration Sensor, Gyroscope, Pedometer', 'Ringtones Format': 'MP3, AMR, APE, OGG, FLAC, WAV, MIDI, WMA', 'Other Features': ""Split Screen,Apps with Game Boost (Popular Games), Google Lens, Data Backup, Oshare (Indian Phone Number's Recognition), Apps Lock, Office Tools: Office Suite, Firewall: Support Call/Message Firewall, Files Zip/Unzip, File Encryption, 64bit Processor, Baseband Structure: 4 (Cortex A73) + 4 (Cortex A53), 12nm Processor, ROM Technology: UFS2.1, VoLTE, 4G Data Rate: 75Mbps (Carrier Model 150mbps), Downlink: 150Mbps (Carrrier Model 300Mbps), WLAN: 2.4G, 5.1G, 5.8G WLAN Display, USB 2.0, VOOC Flash Charge 3.0, Reverse Charging, Standard Charge Power: 20W, Type-C USB Jack, Pin Number (USB): 14, Face Recognition, Single Channel,Eye Protection Mode, Clone App, Banner Call, Game Boost, Kids Space, Text Input, Support HD, Webpage Video Play, World Time, Lock Screen Clock, OPPO Share, E-compass, E-book, Screen Recording, Background Freeze, Caller Avatar, Call Background, Contact Grouping, Group Customization, Import/Export Messages, Number of Ram Channels: 2, Fingerprint Reset password, Sleek Design, Flashlight"", 'Important Apps': 'Bulit-in Browser: Chrome, Opera, OPPO Browsers', 'GPS Type': 'A-GPS, GLONASS, BeiDou', 'FM Radio': 'No', 'Audio Formats': 'AAC, APE, FLAC, AMR, MID, MP3, OGG, WAV, WMA, MKA', 'Video Formats': 'MP4, 3GP, ASF, AVI, FLV, M2TS, MKV, MPG, TS, WEBM, WMV', 'Battery Capacity': '4000 mAh', 'Width': '73.3 mm', 'Height': '160.2 mm', 'Depth': '7.9 mm', 'Weight': '172 g', 'Warranty Summary': 'Brand Warranty of 1 Year Available for Mobile Including Battery and 6 Months for Accessories'}",19990
"Realme 3 Pro (Nitro Blue, 128 GB)  (6 GB RAM)",4.5,"1,21,726 Ratings","14,165 Reviews","{'In The Box': 'Handset, Adapter, Micro-USB Cable, Important Information Booklet with Warranty Card, Quick Guide, SIM Card Tool, Screen Protect Film (Applied), Case', 'Model Number': 'RMX1851', 'Model Name': '3 Pro', 'Color': 'Nitro Blue', 'Browse Type': 'Smartphones', 'SIM Type': 'Dual Sim', 'Hybrid Sim Slot': 'No', 'Touchscreen': 'Yes', 'OTG Compatible': 'Yes', 'Display Size': '16.0 cm (6.3 inch)', 'Resolution': '2340 x 1080 pixels', 'Resolution Type': 'Full HD+', 'GPU': 'Adreno 616', 'Other Display Features': 'Maximum Brightness: 400 nits, Screen Contrast: 1200:1 (Minimum), Touch Panel/Type: 2.5D, Gorilla Glass 5, Screen-off Gestures', 'Operating System': 'Android Pie 9.0', 'Processor Type': 'Qualcomm Snapdragon 710 Octa Core 2.2 GHz AIE', 'Processor Core': 'Octa Core', 'Primary Clock Speed': '2.2 GHz', 'Operating Frequency': 'GSM: 850/900/1800/1900 MHz, WCDMA: 850/900/2100 MHz, 4G LTE-FDD: B1/B3/B5/B8, 4G LTE-TD: B38/B40/B41 (2535 - 2655 MHz)', 'Internal Storage': '128 GB', 'RAM': '6 GB', 'Expandable Storage': '256 GB', 'Supported Memory Card Type': 'microSD', 'Memory Card Slot Type': 'Dedicated Slot', 'Primary Camera Available': 'Yes', 'Primary Camera': '16MP + 5MP', 'Primary Camera Features': 'Aperture: f/1.7 (16MP) + f/2.4 (5MP), Rear Camera Sensor: IMX519 + GC5035', 'Secondary Camera Available': 'Yes', 'Secondary Camera': '25MP Front Camera', 'Secondary Camera Features': '25MP AI Selfie Camera, Aperture: f/2.0', 'Flash': 'Rear LED Flash', 'Dual Camera Lens': 'Primary Camera', 'Network Type': '3G, 4G VOLTE, 4G, 2G', 'Supported Networks': 'GSM, WCDMA, 4G VoLTE, 4G LTE', 'Internet Connectivity': '4G, 3G, Wi-Fi, EDGE, GPRS', '3G': 'Yes', '3G Speed': 'HSDPA+ DL 42Mbps, HSUPA UL 11Mbps', 'GPRS': 'Yes', 'Micro USB Port': 'Yes', 'Bluetooth Support': 'Yes', 'Bluetooth Version': '5.0', 'Wi-Fi': 'Yes', 'Wi-Fi Version': '802.11a/b/g/n/ac (2.4GHz, 5GHz)', 'USB Connectivity': 'Yes', 'EDGE': 'Yes', 'Audio Jack': '3.5mm', 'Map Support': 'Google Maps', 'GPS Support': 'Yes', 'Touchscreen Type': 'IPS', 'SIM Size': 'Dual Nano SIM', 'User Interface': 'ColorOS 6.0', 'Removable Battery': 'No', 'Graphics PPI': '408 PPI', 'Sensors': 'M-sensor, G-sensor, Gyrometer, Light Sensor, Proximity Sensor, Fingerprint Sensor', 'Other Features': 'Widevine L1 Support and Bootloader Unlock Support, 30 Mins Power Up 50%, Charger: 5V/4A, VOOC Flash Charge 3.0, Super Nightscape, Widevine L1, Hyper Boost 2.0, 960 fps Super Slo-mo Video, Dewdrop Screen, Le Mans-inspired Speedway Design, 3D Speedway Design', 'GPS Type': 'A-GPS, GLONASS', 'FM Radio': 'Yes', 'Battery Capacity': '4045 mAh', 'Talk Time': '35 hrs', 'Width': '74.2 mm', 'Height': '156.8 mm', 'Depth': '8.3 mm', 'Weight': '172 g', 'Warranty Summary': 'Brand Warranty of 1 Year Available for Mobile and 6 Months for Accessories'}",12999
"Realme 3 Pro (Lightning Purple, 64 GB)  (6 GB RAM)",4.5,"1,21,726 Ratings","14,165 Reviews","{'In The Box': 'Handset, Adapter, Micro-USB Cable, Important Information Booklet with Warranty Card, Quick Guide, SIM Card Tool, Screen Protect Film (Applied), Case', 'Model Number': 'RMX1851', 'Model Name': '3 Pro', 'Color': 'Lightning Purple', 'Browse Type': 'Smartphones', 'SIM Type': 'Dual Sim', 'Hybrid Sim Slot': 'No', 'Touchscreen': 'Yes', 'OTG Compatible': 'Yes', 'Display Size': '16.0 cm (6.3 inch)', 'Resolution': '2340 x 1080 pixels', 'Resolution Type': 'Full HD+', 'GPU': 'Adreno 616', 'Other Display Features': 'Maximum Brightness: 400 nits, Screen Contrast: 1200:1 (Minimum), Touch Panel/Type: 2.5D, Gorilla Glass 5, Screen-off Gestures', 'Operating System': 'Android Pie 9.0', 'Processor Type': 'Qualcomm Snapdragon 710 Octa Core 2.2 GHz AIE', 'Processor Core': 'Octa Core', 'Primary Clock Speed': '2.2 GHz', 'Operating Frequency': 'GSM: 850/900/1800/1900 MHz, WCDMA: 850/900/2100 MHz, 4G LTE-FDD: B1/B3/B5/B8, 4G LTE-TD: B38/B40/B41 (2535 - 2655 MHz)', 'Internal Storage': '64 GB', 'RAM': '6 GB', 'Expandable Storage': '256 GB', 'Supported Memory Card Type': 'microSD', 'Memory Card Slot Type': 'Dedicated Slot', 'Primary Camera Available': 'Yes', 'Primary Camera': '16MP + 5MP', 'Primary Camera Features': 'Aperture: f/1.7 (16MP) + f/2.4 (5MP), Rear Camera Sensor: IMX519 + GC5035', 'Secondary Camera Available': 'Yes', 'Secondary Camera': '25MP Front Camera', 'Secondary Camera Features': '25MP AI Selfie Camera, Aperture: f/2.0', 'Flash': 'Rear LED Flash', 'Dual Camera Lens': 'Primary Camera', 'Network Type': '3G, 4G VOLTE, 4G, 2G', 'Supported Networks': 'GSM, WCDMA, 4G VoLTE, 4G LTE', 'Internet Connectivity': '4G, 3G, Wi-Fi, EDGE, GPRS', '3G': 'Yes', '3G Speed': 'HSDPA+ DL 42Mbps, HSUPA UL 11Mbps', 'GPRS': 'Yes', 'Micro USB Port': 'Yes', 'Bluetooth Support': 'Yes', 'Bluetooth Version': '5.0', 'Wi-Fi': 'Yes', 'Wi-Fi Version': '802.11a/b/g/n/ac (2.4GHz, 5GHz)', 'USB Connectivity': 'Yes', 'EDGE': 'Yes', 'Audio Jack': '3.5mm', 'Map Support': 'Google Maps', 'GPS Support': 'Yes', 'Touchscreen Type': 'IPS', 'SIM Size': 'Dual Nano SIM', 'User Interface': 'ColorOS 6.0', 'Removable Battery': 'No', 'Graphics PPI': '408 PPI', 'Sensors': 'M-sensor, G-sensor, Gyrometer, Light Sensor, Proximity Sensor, Fingerprint Sensor', 'Other Features': 'Widevine L1 Support and Bootloader Unlock Support, 30 Mins Power Up 50%, Charger: 5V/4A, VOOC Flash Charge 3.0, Super Nightscape, Widevine L1, Hyper Boost 2.0, 960 fps Super Slo-mo Video, Dewdrop Screen, Le Mans-inspired Speedway Design, 3D Speedway Design', 'GPS Type': 'A-GPS, GLONASS', 'FM Radio': 'Yes', 'Battery Capacity': '4045 mAh', 'Talk Time': '35 hrs', 'Width': '74.2 mm', 'Height': '156.8 mm', 'Depth': '8.3 mm', 'Weight': '172 g', 'Warranty Summary': 'Brand Warranty of 1 Year Available for Mobile and 6 Months for Accessories'}",11999
