Name,Stars,Ratings,Reviews,Specifications,Price
"Apple iPhone 11 (White, 64 GB)",4.7,"10,341 Ratings",904 Reviews,"{'In The Box': 'Handset, EarPods with Lightning Connector, Lightning to USB Cable, USB Power Adapter, Documentation', 'Model Number': 'MWLU2HN/A', 'Model Name': 'iPhone 11', 'Color': 'White', 'Browse Type': 'Smartphones', 'SIM Type': 'Dual Sim', 'Hybrid Sim Slot': 'No', 'Touchscreen': 'Yes', 'OTG Compatible': 'No', 'SAR Value': '1.6 W/kg (over 1 g) SAR Limit, Head: 1.09, Body: 1.18', 'Display Size': '15.49 cm (6.1 inch)', 'Resolution': '1792 x 828 Pixels', 'Resolution Type': 'Liquid Retina HD Display', 'Other Display Features': '1400:1 Contrast Ratio (Typical), True Tone Display, Wide Colour Display (P3), Haptic Touch, 625 nits Max Brightness (Typical), Fingerprint Resistant Oleophobic Coating, Support for Display of Multiple Languages and Characters Simultaneously', 'Operating System': 'iOS 13', 'Processor Type': 'A13 Bionic Chip', 'Internal Storage': '64 GB', 'Primary Camera Available': 'Yes', 'Primary Camera': '12MP + 12MP', 'Primary Camera Features': 'Dual 12MP Ultra Wide and Wide Cameras, Ultra Wide: f/2.4 Aperture and 120Degree Field of View, Wide: f/1.8 Aperture, Portrait Mode with Advanced Bokeh and Depth Control, Portrait Lighting with Six Effects (Natural, Studio, Contour, Stage, Stage Mono, High-key Mono), Optical Image Stabilisation (Wide), Five Element Lens (Ultra Wide), Six Element Lens (Wide), Brighter True Tone Flash with Slow Sync, Panorama (Up to 64MP), 100% Focus Pixels (Wide), Night Mode, Auto Adjustments, Next-generation Smart HDR for Photos, Wide Colour Capture for Photos and Live Photos, Advanced Red Eye Correction, Auto Image Stabilisation, Burst Mode, Photo Geotagging, Image Formats Captured: HEIF and JPEG', 'Optical Zoom': 'Yes', 'Secondary Camera Available': 'Yes', 'Secondary Camera': '12MP Front Camera', 'Secondary Camera Features': 'TrueDepth Camera - 12MP Camera, f/2.2 Aperture, Portrait Mode with Advanced Bokeh and Depth Control, Portrait Lighting with Six Effects (Natural, Studio, Contour, Stage, Stage Mono, High Key Mono), Animoji and Memoji, 4K Video Recording at 24 fps, 30 fps or 60 fps, 1080p HD Video Recording at 30 fps or 60 fps, Slow-motion Video Support for 1080p at 120 fps, Next Generation Smart HDR for Photos, Extended Dynamic Range for Video at 30 fps, Cinematic Video Stabilisation (4K, 1080p and 720p), Wide Colour Capture for Photos and Live Photos, Retina Flash, Auto Image Stabilisation, Burst Mode', 'Flash': 'Rear Brighter True Tone Flash with Slow Sync and Front Retina Flash', 'HD Recording': 'Yes', 'Full HD Recording': 'Yes', 'Video Recording': 'Yes', 'Frame Rate': 'Rear Camera - 4K Video Recording at 24 fps, 30 fps or 60 fps, 1080p HD Video Recording at 30 fps or 60 fps, 720p HD Video Recording at 30 fps, Extended Dynamic Range for Video upto 60 fps, Slow-motion Video Support for 1080p at 120 fps or 240 fps | True Depth Camera - 4K Video Recording at 24 fps, 30 fps or 60 fps, 1080p HD Video Recording at 30 fps or 60 fps, Slow-motion Video Support for 1080p at 120 fps, Extended Dynamic Range for Video at 30 fps fps', 'Dual Camera Lens': 'Primary Camera', 'Phone Book': 'Yes', 'Speaker Phone': 'Yes', 'Network Type': '4G VOLTE, 4G, 3G, 2G', 'Supported Networks': '4G VoLTE, 4G LTE, UMTS, GSM', 'Internet Connectivity': '4G, 3G, Wi-Fi', '3G': 'Yes', 'Pre-installed Browser': 'Safari', 'Bluetooth Support': 'Yes', 'Bluetooth Version': '5', 'Wi-Fi': 'Yes', 'Wi-Fi Version': '802.11ax Wi-Fi 6 with 2x2 MIMO', 'Wi-Fi Hotspot': 'Yes', 'NFC': 'Yes', 'Smartphone': 'Yes', 'SIM Size': 'Nano SIM and eSIM', 'Removable Battery': 'No', 'Graphics PPI': '326 PPI', 'Sensors': 'Face ID, Barometer, Three Axis Gyro, Accelerometer, Proximity Sensor, Ambient Light Sensor', 'Supported Languages': 'Multi Languages Support', 'Series': 'iPhone 11', 'Other Features': 'Faster Face ID, Slo-mo Selfies, Water Resistant upto 2 Metres for up to 30 Minutes�', 'Audio Formats': 'AAC LC, HE AAC, HE AAC v2, Protected AAC, MP3, Linear PCM, Apple Lossless, FLAC, Dolby Digital (AC 3), Dolby Digital Plus (E AC 3), Dolby Atmos and Audible (Formats 2, 3, 4, Audible Enhanced Audio, AAX and AAX+)', 'Video Formats': 'HEVC, H.264, MPEG 4 Part 2 and Motion JPEG, Supports Dolby Vision and HDR10 Content', 'Width': '75.7 mm', 'Height': '150.9 mm', 'Depth': '8.3 mm', 'Weight': '194 g', 'Warranty Summary': 'Brand Warranty for 1 Year'}",64900
"OPPO A9 2020 (Space Purple, 128 GB)  (4 GB RAM)",4.4,"2,227 Ratings",212 Reviews,"{'In The Box': 'Handset, Adapter, Headset, Micro USB Cable, Important Info. Booklet with Warranty Card, Quick Start Guide, Sim Card Tool, Protective Film, Pre-applied, Case', 'Model Number': 'CPH1937', 'Model Name': 'A9 2020', 'Color': 'Space Purple', 'Browse Type': 'Smartphones', 'SIM Type': 'Dual Sim', 'Hybrid Sim Slot': 'No', 'Touchscreen': 'Yes', 'OTG Compatible': 'Yes', 'Sound Enhancements': 'Dolby Atmos and Dual Stereo Speakers', 'Display Size': '16.51 cm (6.5 inch)', 'Resolution': '1600 x 720 Pixels', 'GPU': 'Adreno 610', 'Display Type': 'TFT-LCD', 'Display Colors': '16M', 'Other Display Features': 'Touch Panel Technology: In-cell, Narrow Frame - Upper Border: 2.44mm, Left and Right Border: 1.98mm, Lower Border: 6.6mm, Screen Ratio: 89.0%, Screen Contrast: 1500:1, Color Saturation: Typical 71%, Maximum Brightness: 480nits, Touch Panel Glass Type: GG3+, TYPE-C USB 2.0', 'Operating System': 'Android Pie 9', 'Processor Type': 'Qualcomm SM6125', 'Processor Core': 'Octa Core', 'Primary Clock Speed': '1.8 GHz', 'Secondary Clock Speed': '2 GHz', 'Internal Storage': '128 GB', 'RAM': '4 GB', 'Memory Card Slot Type': 'Dedicated Slot', 'Primary Camera Available': 'Yes', 'Primary Camera': '48MP + 8MP + 2MP + 2MP', 'Primary Camera Features': 'Ultra Wide Quad Camera, Sensor Type: 48MP CMOS/S5KGM1SP/OV48B, 8MP COMS/Hi846/OV8856, 2MP CMOS/OV02A1B/GC02M0, 2MP CMOS/GC02M0/OV02A1B, Maximum Zoom Multiples: 10X, Aperture: 48MP (f/1.8) + 8MP (f/2.25) + 2MP (f/2.4) + 2MP (f/2.4), Focal Length: 48MP (4.71mm) + 8MP (1.66mm) + 2MP (1.77mm) + 2MP (f1.77mm), Lens Number: 48MP (6P) + 8MP (5P) + 2MP (3P) + 2MP (3P)', 'Secondary Camera Available': 'Yes', 'Secondary Camera': '16MP Front Camera', 'Secondary Camera Features': 'Sensor Sizes/Pixel Data - 1/3.1inch, 1.0micrometer, Sensor Type: S5K3P9SP04, Wide Angle of Front: 79Degree, Aperture: F2.0, Focal Length: 3.42mm, Lens Number: 5P', 'Flash': 'Rear LED Flash', 'Frame Rate': 'Front Camera Video: 1080P/720P at 30 fps', 'Dual Camera Lens': 'Primary Camera', 'Network Type': '4G VOLTE, 4G, 3G, 2G', 'Supported Networks': '4G VoLTE, UMTS, GSM, 4G LTE, WCDMA, CDMA', 'Internet Connectivity': '4G, 3G, Wi-Fi, EDGE, GPRS', '3G Speed': 'HSPA+', 'GPRS': 'Yes', 'Micro USB Port': 'Yes', 'Micro USB Version': '2', 'Bluetooth Support': 'Yes', 'Bluetooth Version': 'v5.0', 'Wi-Fi': 'Yes', 'Wi-Fi Version': '802.11a/b/g/n/ac', 'USB Connectivity': 'Yes', 'EDGE': 'Yes', 'Audio Jack': '3.5mm', 'Smartphone': 'Yes', 'Touchscreen Type': 'Capacitive Screen, Multi-touch', 'SIM Size': 'Dual Nano SIM', 'User Interface': 'ColorOS 6.0.1', 'Removable Battery': 'No', 'Graphics PPI': '269 PPI', 'Ringtones Format': 'MP3/AMR/APE/OGG/FLAC/WAV/MIDI/WMA', 'Other Features': 'Face Recognition, Split Screen (Specific Apps), Clone Apps, Night Shield, Sensor Hub, Game Acceleration (Specific Apps), CPU Technology - 11nm, ROM Technology: UFS 2.1, Energy Density - 696 Wh/L, Charge Speed/Power - 5V 2A, 10W, WLAN 2.4G, WLAN 5.1G, WLAN 5.8G, WLAN Display, Game Boost 2.0, 4G+, 64 bits Processor, Video Stability, Ultra Night Mode 2.0, Reverse Charging', 'FM Radio': 'Yes', 'Audio Formats': 'MP3/AAC/APE/AMR/WAV/MID/OGG/FLAC/WMA', 'Video Formats': 'AVI/3GP/MP4/WMV/MKV/MOV/ASF/FLV', 'Battery Capacity': '5000 mAh', 'Width': '75.6 mm', 'Height': '163.6 mm', 'Depth': '9.1 mm', 'Weight': '195 g', 'Warranty Summary': 'Brand Warranty of 1 Year Available for Mobile and 6 Months for Accessories'}",14990
"OnePlus 7T (Glacier Blue, 256 GB)  (8 GB RAM)",4.6,"3,945 Ratings",320 Reviews,"{'In The Box': 'OnePlus 7T\nWarp Charge 30 Power Adapter\nWarp Charge Type-C Cable (Support USB 2.0)\nQuick Start Guide\nWelcome Letter\nSafety Information and Warranty Card\nLogo Sticker\nCase\nScreen Protector (pre-applied)\nSIM Tray Ejector', 'Model Number': 'HD1901', 'Model Name': '7T', 'Color': 'Glacier Blue', 'Browse Type': 'Smartphones', 'SIM Type': 'Dual Sim', 'Hybrid Sim Slot': 'No', 'Touchscreen': 'Yes', 'OTG Compatible': 'Yes', 'Quick Charging': 'Yes', 'Display Size': '16.64 cm (6.55 inch)', 'Resolution': '\xa02400 x 1080$$Pixels', 'GPU': 'Adreno 640', 'Other Display Features': 'The OnePlus 7T’s smooth 90 Hz refresh rate is enhanced by over 370 optimizations in OxygenOS for seamless visuals and ultra-responsive touch design. Once you experience the smoothness of Fluid Display, you’ll never settle for anything less.\nBinge all your favorites in jaw-dropping clarity with HDR playback on Netflix, YouTube, and Amazon Prime Video. HDR10+ produces deeper blacks, brighter whites, and more true-to-life visuals for stunning movies, games, and photos. Experience more immersive entertainment, anytime, anywhere.\nImproved with new sensors and algorithms, our next-generation fingerprint reader is more accurate and more secure. Simply tap on the display to unlock the OnePlus 7T in an instant.\nIn direct sunlight, an astonishing 1,000 nits of brightness ensures that everything is clear and vivid. In the dark, TÜV-certified blue-light reduction allows for safer, more comfortable nighttime reading. It’s the smartphone display that’s designed to go anywhere.', 'Operating System': 'Android Pie 10', 'Processor Type': 'Qualcomm®\xa0Snapdragon™\xa0855 Plus', 'Processor Core': 'Octa Core', 'Primary Clock Speed': '2.9 GHz', 'Operating Frequency': '\xa0855\xa0', 'Internal Storage': '256 GB', 'RAM': '8 GB', 'Primary Camera Available': 'Yes', 'Primary Camera': '48 MP + 12 MP + 16 MP', 'Primary Camera Features': 'Ultra wide angle : When shooting photos or videos, switch over to the ultra wide angle camera at the press of a button to instantly widen your frame to a dramatic 117° field of view. Even up close, effortlessly capture large group shots and sprawling landscapes.\nNightscape : Available on both the main camera and the ultra wide angle camera, Nightscape mode combines information from multiple frames in varying exposures to produce a wider dynamic range. The result? Bright, clear, dramatic photos—even in surprisingly dark environments.\nUltraShot Engine : Optimized with our intelligent photography engine, the OnePlus 7T takes breathtaking photos, even in difficult lighting. From backlit portraits to sunsets at dusk, capture it all in remarkable clarity.', 'Optical Zoom': 'Yes', 'Secondary Camera Available': 'Yes', 'Secondary Camera': '16MP Front Camera', 'Secondary Camera Features': 'Front camera : The OnePlus 7T’s 16 MP front-facing camera has Portrait mode built right in for more impressive selfies, while EIS stabilization keeps videos smooth and steady when streaming or video chatting.', 'Flash': 'Back Flash', 'Dual Camera Lens': 'Primary Camera', 'Call Wait/Hold': 'Yes', 'Conference Call': 'Yes', 'Video Call Support': 'Yes', 'Call Divert': 'Yes', 'Phone Book': 'Yes', 'Call Timer': 'Yes', 'Speaker Phone': 'Yes', 'Speed Dialing': 'Yes', 'Network Type': '4G, 3G, 2G', 'Supported Networks': '4G LTE, GSM', 'Wi-Fi': 'Yes', 'Wi-Fi Version': '802.11 a/b/g/n/ac', 'Wi-Fi Hotspot': 'Yes', 'Smartphone': 'Yes', 'SIM Size': 'Nano', 'Keypad Type': 'QWERTY', 'Social Networking Phone': 'Yes', 'Instant Message': 'Yes', 'Removable Battery': 'No', 'SMS': 'Yes', 'Keypad': 'No', 'Voice Input': 'Yes', 'Graphics PPI': '640 ppi', 'Predictive Text Input': 'Yes', 'SIM Access': 'dual-standby\xa0', 'Sensors': 'Accelerometer,Ambient Light,Proximity', 'Other Features': 'UltraShot, Nightscape, Portrait, Pro Mode, Panorama, HDR, AI Scene Detection, RAW Image', 'Audio Formats': 'MP3, AAC, AAC+, WMA, AMR-NB, AMR-WB, WAV, FLAC, APE, OGG, MID, M4A, IMY, AC3, EAC3, EAC3-JOC, AC4', 'Video Formats': '\xa0MKV, MOV, MP4, H.265(HEVC), AVI, WMV, TS, 3GP, FLV, WEBM', 'Battery Capacity': '3800 mAh', 'Battery Type': '\xa0lithium-ion\xa0', 'Width': '7.4 mm', 'Height': '16.1 mm', 'Depth': '0.8 mm', 'Weight': '190 g', 'Warranty Summary': '1 year manufacturer warranty for device and 6 months manufacturer warranty for in-box accessories including batteries from the date of purchase', 'Covered in Warranty': '1 year manufacturer warranty for device and 6 months manufacturer warranty for in-box accessories including batteries from the date of purchase'}",36952
"Redmi Note 8 Pro (Electric Blue, 64 GB)  (6 GB RAM)",4.5,"15,317 Ratings","1,228 Reviews","{'In The Box': 'Handset / Simple protective cover /\nUSB Type-C cable / SIM eject tool', 'Model Number': 'M1906G7I', 'Model Name': 'Redmi Note 8 Pro', 'Color': 'Electric Blue', 'Browse Type': 'Smartphones', 'SIM Type': 'Dual Sim', 'Hybrid Sim Slot': 'Yes', 'Touchscreen': 'Yes', 'OTG Compatible': 'Yes', 'Quick Charging': 'Yes', 'Display Size': '16.59 cm (6.53 inch)', 'Resolution': '2340 x 1080$$Pixels', 'Resolution Type': 'Full HD+', 'GPU': 'Mali-G76 MC4', 'Display Type': 'Gorilla Glass', 'Display Colors': '16M', 'Other Display Features': 'Resolution: 2340 x 1080 FHD+\nBrightness: 500nit (typ) / 420nit (min)\nContrast: 1500:1 (typ) | NTSC: 84% (typ)\nStandard mode | Sunshine mode | Night mode | Color temperature adjustment |\n256 ranks adjustable Reading mode certified by TÜV Rheinland\nCorning® Gorilla® Glass 5\nAnti-oil and anti-fingerprint protective coating\nSupports HDR display', 'Operating System': 'Android Pie 9', 'Processor Core': 'Octa Core', 'Primary Clock Speed': '2.05 GHz', 'Internal Storage': '64 GB', 'RAM': '6 GB', 'Expandable Storage': '128 GB', 'Memory Card Slot Type': 'Dedicated Slot', 'Primary Camera Available': 'Yes', 'Primary Camera': '64MP + 8MP', 'Primary Camera Features': '64MP HD | Ultra nightscape mode | AI scene detection 5.0 | Smart ultra-wide angle mode | Ultra wide-angle edge distortion correction | AI Beautify | Burst mode | Tilt-shift | Level display | Custom watermark | Pro mode | Portrait mode background blur adjustment | 3D Lighting | Panorama mode | AI high resolution photos | AI Skyscaping*', 'Secondary Camera Available': 'Yes', 'Secondary Camera Features': 'Panorama selfie | Palm shutter | AI silhouette detection | Front camera HDR | Front camera display brightness correction | Face recognition\nAI Beautify | AI portrait mode | AI scene detection | AI studio lighting', 'Flash': 'Back', 'HD Recording': 'Yes', 'Full HD Recording': 'Yes', 'Video Recording': 'Yes', 'Digital Zoom': '10x digital zoom', 'Dual Camera Lens': 'Primary Camera', 'Call Wait/Hold': 'Yes', 'Conference Call': 'Yes', 'Video Call Support': 'Yes', 'Call Divert': 'Yes', 'Speaker Phone': 'Yes', 'Network Type': '4G VOLTE, 3G', 'Supported Networks': '4G LTE, GSM', 'Bluetooth Support': 'Yes', 'Bluetooth Version': '5', 'Wi-Fi': 'Yes', 'Wi-Fi Version': '802.11a/b/g/n/ac', 'Wi-Fi Hotspot': 'Yes', 'NFC': 'Yes', 'Audio Jack': '3.5mm', 'Smartphone': 'Yes', 'SIM Size': 'Nano', 'Keypad Type': 'QWERTY', 'Removable Battery': 'No', 'Keypad': 'No', 'Voice Input': 'Yes', 'Predictive Text Input': 'Yes', 'Sensors': 'Proximity sensor', 'Audio Formats': '\xa0WAV | AAC | MP3 | AMR | FLAC | APE', 'Video Formats': 'MP4 | M4V | MKV | XVID\xa0', 'Battery Capacity': '4500 mAh', 'Battery Type': 'lithium-ion', 'Talk Time': '41', 'Width': '8.8 mm', 'Height': '161.3 mm', 'Depth': '76.4 mm', 'Weight': '199.8 g', 'Warranty Summary': '1 year manufacturer warranty for device and 6 months manufacturer warranty for in-box accessories including batteries from the date of purchase'}",14900
"OnePlus 7T (Frosted Silver, 128 GB)  (8 GB RAM)",4.6,"3,945 Ratings",320 Reviews,"{'In The Box': 'OnePlus 7T\nWarp Charge 30 Power Adapter\nWarp Charge Type-C Cable (Support USB 2.0)\nQuick Start Guide\nWelcome Letter\nSafety Information and Warranty Card\nLogo Sticker\nCase\nScreen Protector (pre-applied)\nSIM Tray Ejector', 'Model Number': 'HD1901', 'Model Name': '7T', 'Color': 'Frosted Silver', 'Browse Type': 'Smartphones', 'SIM Type': 'Dual Sim', 'Hybrid Sim Slot': 'No', 'Touchscreen': 'Yes', 'OTG Compatible': 'Yes', 'Quick Charging': 'Yes', 'Display Size': '16.64 cm (6.55 inch)', 'Resolution': '\xa02400 x 1080$$Pixels', 'GPU': 'Adreno 640', 'Other Display Features': 'The OnePlus 7T’s smooth 90 Hz refresh rate is enhanced by over 370 optimizations in OxygenOS for seamless visuals and ultra-responsive touch design. Once you experience the smoothness of Fluid Display, you’ll never settle for anything less.\nBinge all your favorites in jaw-dropping clarity with HDR playback on Netflix, YouTube, and Amazon Prime Video. HDR10+ produces deeper blacks, brighter whites, and more true-to-life visuals for stunning movies, games, and photos. Experience more immersive entertainment, anytime, anywhere.\nImproved with new sensors and algorithms, our next-generation fingerprint reader is more accurate and more secure. Simply tap on the display to unlock the OnePlus 7T in an instant.\nIn direct sunlight, an astonishing 1,000 nits of brightness ensures that everything is clear and vivid. In the dark, TÜV-certified blue-light reduction allows for safer, more comfortable nighttime reading. It’s the smartphone display that’s designed to go anywhere.', 'Operating System': 'Android Pie 10', 'Processor Type': 'Qualcomm®\xa0Snapdragon™\xa0855 Plus', 'Processor Core': 'Octa Core', 'Primary Clock Speed': '2.9 GHz', 'Operating Frequency': '\xa0855\xa0', 'Internal Storage': '128 GB', 'RAM': '8 GB', 'Primary Camera Available': 'Yes', 'Primary Camera': '48 MP + 12 MP + 16 MP', 'Primary Camera Features': 'Ultra wide angle : When shooting photos or videos, switch over to the ultra wide angle camera at the press of a button to instantly widen your frame to a dramatic 117° field of view. Even up close, effortlessly capture large group shots and sprawling landscapes.\nNightscape : Available on both the main camera and the ultra wide angle camera, Nightscape mode combines information from multiple frames in varying exposures to produce a wider dynamic range. The result? Bright, clear, dramatic photos—even in surprisingly dark environments.\nUltraShot Engine : Optimized with our intelligent photography engine, the OnePlus 7T takes breathtaking photos, even in difficult lighting. From backlit portraits to sunsets at dusk, capture it all in remarkable clarity.', 'Optical Zoom': 'Yes', 'Secondary Camera Available': 'Yes', 'Secondary Camera': '16MP Front Camera', 'Secondary Camera Features': 'Front camera : The OnePlus 7T’s 16 MP front-facing camera has Portrait mode built right in for more impressive selfies, while EIS stabilization keeps videos smooth and steady when streaming or video chatting.', 'Flash': 'Back Flash', 'Dual Camera Lens': 'Primary Camera', 'Call Wait/Hold': 'Yes', 'Conference Call': 'Yes', 'Video Call Support': 'Yes', 'Call Divert': 'Yes', 'Phone Book': 'Yes', 'Call Timer': 'Yes', 'Speaker Phone': 'Yes', 'Speed Dialing': 'Yes', 'Network Type': '4G, 3G, 2G', 'Supported Networks': '4G LTE, GSM', 'Wi-Fi': 'Yes', 'Wi-Fi Version': '802.11 a/b/g/n/ac', 'Wi-Fi Hotspot': 'Yes', 'Smartphone': 'Yes', 'SIM Size': 'Nano', 'Keypad Type': 'QWERTY', 'Social Networking Phone': 'Yes', 'Instant Message': 'Yes', 'Removable Battery': 'No', 'SMS': 'Yes', 'Keypad': 'No', 'Voice Input': 'Yes', 'Graphics PPI': '640 ppi', 'Predictive Text Input': 'Yes', 'SIM Access': 'dual-standby\xa0', 'Sensors': 'Accelerometer,Ambient Light,Proximity', 'Other Features': 'UltraShot, Nightscape, Portrait, Pro Mode, Panorama, HDR, AI Scene Detection, RAW Image', 'Audio Formats': 'MP3, AAC, AAC+, WMA, AMR-NB, AMR-WB, WAV, FLAC, APE, OGG, MID, M4A, IMY, AC3, EAC3, EAC3-JOC, AC4', 'Video Formats': '\xa0MKV, MOV, MP4, H.265(HEVC), AVI, WMV, TS, 3GP, FLV, WEBM', 'Battery Capacity': '3800 mAh', 'Battery Type': '\xa0lithium-ion\xa0', 'Width': '7.4 mm', 'Height': '16.1 mm', 'Depth': '0.8 mm', 'Weight': '190 g', 'Warranty Summary': '1 year manufacturer warranty for device and 6 months manufacturer warranty for in-box accessories including batteries from the date of purchase', 'Covered in Warranty': '1 year manufacturer warranty for device and 6 months manufacturer warranty for in-box accessories including batteries from the date of purchase'}",35199
"Vivo V15 Pro (Ruby Red, 128 GB)  (8 GB RAM)",4.5,"2,812 Ratings",247 Reviews,"{'In The Box': 'Handset, Earphone, User Manual, Micro-USB to USB Cable, USB Power Adapter, SIM Ejector Pin, Protective Case', 'Model Number': 'Vivo 1818', 'Model Name': 'V15 Pro', 'Color': 'Ruby Red', 'Browse Type': 'Smartphones', 'SIM Type': 'Dual Sim', 'Hybrid Sim Slot': 'No', 'Touchscreen': 'Yes', 'OTG Compatible': 'Yes', 'Quick Charging': 'Yes', 'SAR Value': 'Head: 1.155, Body: 0.284', 'Display Size': '16.23 cm (6.39 inch)', 'Resolution': '2340 x 1080 pixels', 'Resolution Type': 'Full HD+', 'GPU': 'Adreno 612', 'Display Type': 'Super AMOLED', 'Display Colors': '16M', 'Other Display Features': 'Bezel: 1.75mm (Side), 2.22mm (Top), 3.6mm (Bottom), Screen to Body Ratio: 91.64%, Ultra FullView Display', 'Operating System': 'Android Pie 9.0', 'Processor Type': 'Qualcomm Snapdragon 675AIE Octa Core 2.0GHz', 'Processor Core': 'Octa Core', 'Primary Clock Speed': '2 GHz', 'Operating Frequency': '2G GSM: B2/B3/B5/B8, 3G WCDMA: B1/B5/B8, 4G FDD LTE: B1/B3/B5/B8, 4G TDD LTE: B38/B40/B41', 'Internal Storage': '128 GB', 'RAM': '8 GB', 'Expandable Storage': '256 GB', 'Supported Memory Card Type': 'microSD', 'Memory Card Slot Type': 'Dedicated Slot', 'Call Log Memory': 'Yes', 'Primary Camera Available': 'Yes', 'Primary Camera': '48 Million Quad Pixel Sensor (12 Million Effective Pixel) + 8MP + 5MP, AI Triple Rear Camera', 'Primary Camera Features': 'AI Super Wide Angle, AI Body Shaping, Bokeh Mode, AI Face Beauty, Single Shot, Continously Shot, HDR, Professional Camera, Slow-Mode, Time-Lapse Photography, Panorama, PDAF, Live Photo, Gesture Photograph, Voice Photograph, 60 Frame Video, Portrait Light Effect, AR Sticker, Video Face Beauty, Ai Filter, Ai Scene Recognition, Ai Portrait Composition', 'Secondary Camera Available': 'Yes', 'Secondary Camera': '32MP Front Camera', 'Secondary Camera Features': 'AI Face Beauty, AI Portrait Composition, Bokeh Mode, AI Body Shaping, Single Shot, Continuously Shot, HDR, Panorama, Live Photo, Gesture Photograph, Voice Photograph, Portrait Light Effect, AR Sticker, Video Face Beauty, Gender Detection', 'Flash': 'Rear LED Flash and Front Screen Flash', 'HD Recording': 'Yes', 'Full HD Recording': 'Yes', 'Video Recording': 'Yes', 'Video Recording Resolution': '4K, 1080p, 720p', 'Frame Rate': '120 fps', 'Dual Camera Lens': 'Primary Camera', 'Phone Book': 'Yes', 'Network Type': '3G, 4G VOLTE, 4G, 2G', 'Supported Networks': 'GSM, WCDMA, 4G VoLTE, 4G LTE', 'Internet Connectivity': '4G, 3G, Wi-Fi', '3G': 'Yes', 'Pre-installed Browser': 'Vivo Browser, UC Browser, Google Chrome', 'Micro USB Port': 'Yes', 'Bluetooth Support': 'Yes', 'Bluetooth Version': '5.0', 'Wi-Fi': 'Yes', 'Wi-Fi Hotspot': 'Yes', 'USB Connectivity': 'Yes', 'Audio Jack': '3.5mm', 'Map Support': 'Google Maps', 'GPS Support': 'Yes', 'Smartphone': 'Yes', 'Touchscreen Type': 'Capacitive with Multi-touch', 'SIM Size': 'Nano SIM + Nano SIM', 'User Interface': 'Funtouch OS 9.0', 'Removable Battery': 'No', 'SMS': 'Yes', 'Graphics PPI': '404 PPI', 'SIM Access': 'Dual Standby', 'Sensors': '5th Generation In-display Fingerprint Sensor, Accelerometer, Ambient Light Sensor, Proximity Sensor, E-compass, Virtual Gyroscope', 'Other Features': 'AI Super Night Mode, Dual Engine, Wi-Fi Version: 2.4 GHz/5 GHz, Game Mode, Smart Split, Fast Charging, Motorbike Mode, Dual 4G, Eye Protection Mode, Face Unlock', 'Important Apps': 'Social Media Apps: Facebook, WhatsApp, Google Services: Play Store, Google, Gmail, YouTube, Google Drive, Google Play Music, Google Play Movies & TV, Google Duo, Google Photos, Google News, Others: NewsPoint, Amazon, Paytm, PhonePe, WPS Office, App Clone: WhatsApp, Facebook, WeChat, Instagram', 'GPS Type': 'GLONASS', 'FM Radio': 'Yes', 'Audio Formats': 'WAV, MP3, MP2, AMR-NB, AMR-WB, MIDI, Vorbis, APE, FLAC', 'Video Formats': 'MP4, 3GP, AVI', 'Battery Capacity': '3700 mAh', 'Width': '74.71 mm', 'Height': '157.25 mm', 'Depth': '8.21 mm', 'Weight': '185 g', 'Warranty Summary': 'Brand Warranty of 1 Year Available for Mobile and 6 Months for Accessories'}",26990
