Name,Stars,Ratings,Reviews,Specifications,Price
"Vivo V15 Pro (Ruby Red, 128 GB)  (6 GB RAM)",4.5,"28,198 Ratings","2,648 Reviews","{'In The Box': 'Handset, Earphone, User Manual, Micro-USB to USB Cable, USB Power Adapter, SIM Ejector Pin, Protective Case', 'Model Number': 'Vivo 1818', 'Model Name': 'V15 Pro', 'Color': 'Ruby Red', 'Browse Type': 'Smartphones', 'SIM Type': 'Dual Sim', 'Hybrid Sim Slot': 'No', 'Touchscreen': 'Yes', 'OTG Compatible': 'Yes', 'Quick Charging': 'Yes', 'SAR Value': 'Head: 1.155, Body: 0.284', 'Display Size': '16.23 cm (6.39 inch)', 'Resolution': '2340 x 1080 pixels', 'Resolution Type': 'Full HD+', 'GPU': 'Adreno 612', 'Display Type': 'Super AMOLED', 'Display Colors': '16M', 'Other Display Features': 'Bezel: 1.75mm (Side), 2.22mm (Top), 3.6mm (Bottom), Screen to Body Ratio: 91.64%, Ultra FullView Display', 'Operating System': 'Android Pie 9.0', 'Processor Type': 'Qualcomm Snapdragon 675AIE Octa Core 2.0GHz', 'Processor Core': 'Octa Core', 'Primary Clock Speed': '2 GHz', 'Operating Frequency': '2G GSM: B2/B3/B5/B8, 3G WCDMA: B1/B5/B8, 4G FDD LTE: B1/B3/B5/B8, 4G TDD LTE: B38/B40/B41', 'Internal Storage': '128 GB', 'RAM': '6 GB', 'Expandable Storage': '256 GB', 'Supported Memory Card Type': 'microSD', 'Memory Card Slot Type': 'Dedicated Slot', 'Call Log Memory': 'Yes', 'Primary Camera Available': 'Yes', 'Primary Camera': '48 Million Quad Pixel Sensor (12 Million Effective Pixel) + 8MP + 5MP, AI Triple Rear Camera', 'Primary Camera Features': 'Ai Super Wide Angle, Ai Body Shaping, Bokeh Mode, Ai Face Beauty, Single Shot, Continously Shot, HDR, Professional Camera, Slow-Mode, Time-Lapse Photography, Panorama, PDAF, Live Photo, Gesture Photograph, Voice Photograph, 60 Frame Video, Portrait Light Effect, AR Sticker, Video Face Beauty, Ai Filter, Ai Scene Recognition, Ai Portrait Composition', 'Secondary Camera Available': 'Yes', 'Secondary Camera': '32MP Front Camera', 'Secondary Camera Features': 'Ai Face Beauty, Ai Portrait Composition, Bokeh Mode, Ai Body Shaping, Single Shot, Continously Shot, HDR, Panorama, Live Photo, Gesture Photograph, Voice Photograph, Portrait Light Effect, AR Sticker, Video Face Beauty, Gender Detection', 'Flash': 'Rear LED Flash and Front Screen Flash', 'HD Recording': 'Yes', 'Full HD Recording': 'Yes', 'Video Recording': 'Yes', 'Video Recording Resolution': '4K, 1080p, 720p', 'Frame Rate': '120 fps', 'Dual Camera Lens': 'Primary Camera', 'Phone Book': 'Yes', 'Network Type': '3G, 4G VOLTE, 4G, 2G', 'Supported Networks': 'GSM, WCDMA, 4G VoLTE, 4G LTE', 'Internet Connectivity': '4G, 3G, Wi-Fi', '3G': 'Yes', 'Pre-installed Browser': 'Vivo Browser, UC Browser, Google Chrome', 'Micro USB Port': 'Yes', 'Bluetooth Support': 'Yes', 'Bluetooth Version': '5.0', 'Wi-Fi': 'Yes', 'Wi-Fi Hotspot': 'Yes', 'USB Connectivity': 'Yes', 'Audio Jack': '3.5mm', 'Map Support': 'Google Maps', 'GPS Support': 'Yes', 'Smartphone': 'Yes', 'Touchscreen Type': 'Capacitive with Multi-touch', 'SIM Size': 'Nano SIM + Nano SIM', 'User Interface': 'Funtouch OS 9.0', 'Removable Battery': 'No', 'SMS': 'Yes', 'Graphics PPI': '404 PPI', 'SIM Access': 'Dual Standby', 'Sensors': '5th Generation In-display Fingerprint Sensor, Accelerometer, Ambient Light Sensor, Proximity Sensor, E-compass, Virtual Gyroscope', 'Other Features': 'AI Super Night Mode, Dual Engine, Wi-Fi Version: 2.4 GHz/5 GHz, Game Mode, Smart Split, Fast Charging, Motorbike Mode, Dual 4G, Eye Protection Mode, Face Unlock', 'Important Apps': 'Social Media Apps: Facebook, WhatsApp, Google Services: Play Store, Google, Gmail, YouTube, Google Drive, Google Play Music, Google Play Movies & TV, Google Duo, Google Photos, Google News, Others: NewsPoint, Amazon, Paytm, PhonePe, WPS Office, App Clone: WhatsApp, Facebook, WeChat, Instagram', 'GPS Type': 'GLONASS', 'FM Radio': 'Yes', 'Audio Formats': 'WAV, MP3, MP2, AMR-NB, AMR-WB, MIDI, Vorbis, APE, FLAC', 'Video Formats': 'MP4, 3GP, AVI', 'Battery Capacity': '3700 mAh', 'Width': '74.71 mm', 'Height': '157.25 mm', 'Depth': '8.21 mm', 'Weight': '185 g', 'Warranty Summary': 'Brand Warranty of 1 Year Available for Mobile and 6 Months for Accessories'}",19990
"Lava Z62 (Midnight Blue, 16 GB)  (2 GB RAM)",4.1,206 Ratings,26 Reviews,"{'In The Box': 'Handset, Cable, Adapter, Back Cover, Screen Film, Google Assistant UM', 'Model Number': 'LF9810-Z62', 'Model Name': 'Z62', 'Color': 'Midnight Blue', 'Browse Type': 'Smartphones', 'SIM Type': 'Dual Sim', 'Hybrid Sim Slot': 'No', 'Touchscreen': 'Yes', 'OTG Compatible': 'Yes', 'Display Size': '15.24 cm (6 inch)', 'Resolution': '480 x 960 pixels', 'Display Type': 'LCD', 'Display Colors': '16M', 'Operating System': 'Android Pie 9', 'Processor Type': 'MTK 6761', 'Processor Core': 'Quad Core', 'Primary Clock Speed': '2 GHz', 'Operating Frequency': 'GSM: 900 MHz, 1800 MHz, WCDMA: 900 MHz, 2100 MHz, 4G VoLTE: 850 MHz, 1800 MHz, 2100 MHz, 2300 MHz, 2500 MHz', 'Internal Storage': '16 GB', 'RAM': '2 GB', 'Expandable Storage': '256 GB', 'Supported Memory Card Type': 'microSD', 'Memory Card Slot Type': 'Dedicated Slot', 'Primary Camera Available': 'Yes', 'Primary Camera': '8MP Rear Camera', 'Primary Camera Features': 'AR Sticker, 6 Level AI Photo Studio, Professional Mode', 'Secondary Camera Available': 'Yes', 'Secondary Camera': '5MP Front Camera', 'Secondary Camera Features': 'AR Sticker, AI Photo Studio', 'Flash': 'Rear Flash and Front Flash', 'HD Recording': 'Yes', 'Full HD Recording': 'Yes', 'Video Recording': 'Yes', 'Video Recording Resolution': '1080p', 'Call Wait/Hold': 'Yes', 'Conference Call': 'Yes', 'Video Call Support': 'Yes', 'Call Divert': 'Yes', 'Phone Book': 'Yes', 'Call Timer': 'Yes', 'Speaker Phone': 'Yes', 'Speed Dialing': 'Yes', 'Network Type': '3G, 4G VOLTE, 4G, 2G', 'Supported Networks': 'GSM, WCDMA, 4G VoLTE, 4G LTE', 'Internet Connectivity': '4G, 3G, Wi-Fi', '3G': 'Yes', 'Wi-Fi': 'Yes', 'Wi-Fi Hotspot': 'Yes', 'Smartphone': 'Yes', 'Mobile Tracker': 'Yes', 'Social Networking Phone': 'Yes', 'Instant Message': 'Yes', 'Business Phone': 'Yes', 'Removable Battery': 'No', 'MMS': 'Yes', 'SMS': 'Yes', 'Graphics PPI': '179 PPI', 'SIM Access': 'Dual Standby', 'Sensors': 'Accelerometer, Ambient Light Sensor, Proximity Sensor', 'Battery Capacity': '3380 mAh', 'Battery Type': 'Li-polymer', 'Width': '76.9 mm', 'Height': '157.4 mm', 'Depth': '8.95 mm', 'Weight': '182.8 g', 'Warranty Summary': 'Brand Warranty of 1 Year Available for Mobile and 6 Months for Accessories'}",5549
"OPPO Reno2 F (Sky White, 128 GB)  (8 GB RAM)",4.5,"1,664 Ratings",158 Reviews,"{'In The Box': 'Handset, Adapter, Headset, Micro USB Cable, Important info. Booklet with Warranty Card, Quick Guide, SIM Card Tool, Screen Protect Film: The screen Protecton is On the Phone and the Battery Protection Film is Included in the Packing List, Case', 'Model Number': 'CPH1989', 'Model Name': 'Reno2 F', 'Color': 'Sky White', 'Browse Type': 'Smartphones', 'SIM Type': 'Dual Sim', 'Hybrid Sim Slot': 'No', 'Touchscreen': 'Yes', 'OTG Compatible': 'Yes', 'SAR Value': 'Head: 1.183 W/kg, Body: 0.780 W/kg', 'Display Size': '16.51 cm (6.5 inch)', 'Resolution': '2400 x 1080 Pixels', 'GPU': 'ARM Mali-G72 MP3 900MHz', 'Display Type': 'AMOLED', 'Display Colors': '16M', 'Other Display Features': 'Corning Gorilla Glass 5, Upper Bezel: 2.20 mm; Left and Right Bezels: 1.62 mm; Lower Bezel: 5.53 mm', 'Operating System': 'Android Pie 9', 'Processor Type': 'MTK MT6771V(P70) 64bit', 'Processor Core': 'Octa Core', 'Primary Clock Speed': '2.1 GHz', 'Secondary Clock Speed': '2 GHz', 'Internal Storage': '128 GB', 'RAM': '8 GB', 'Memory Card Slot Type': 'Hybrid Slot', 'Primary Camera Available': 'Yes', 'Primary Camera': '48MP + 8MP + 2MP + 2MP', 'Primary Camera Features': '2 MP, 2MP Sensor Sizes/Pixel data - 1/2.25inch, 0.8micrometer, Secondary Camera 1/4.0inch, 1.12micrometer, Mono 1/5.0inch, 1.75micrometer, Mono 1/5.0inch, 1.75micrometer, Sensor Type - S5KGM1SP + Hi846 + Ov02A1B, Maximum Zoom Multiples - Digital Zooming 10X, Aperture - Main Camera F1.79, Seconadary Camera F2.2, Mono F2.4, Mono F2.4, Focal Length - Main Camera 4.71mm, Secondary Camera 1.6 mm, Mono 1.7mm, Mono 1.7mm, Lens Number - Main Camera 6P, Secondary Camera 5P, Mono 3P, Mono 3P', 'Secondary Camera Available': 'Yes', 'Secondary Camera': '16MP Front Camera', 'Secondary Camera Features': 'Sensor Sizes/Pixel Data - 1/3.1inch, 1.0micrometer, Sensor Type - S5K3P9SP, Sensor Model/Manufacturers - Samsung, Focusing method - Focus, Wide Angle of Front - 79Degree, Aperture - F2.0, Focal Length - 3.419 mm, Lens Number - 5P, Photo Management - Photo Editing, Characteristic Function For Photograph - Photo, Video, Panorama, Portrait', 'Flash': 'Rear Flash', 'HD Recording': 'Yes', 'Frame Rate': 'Rear: 1080p at 30 fps, 720p at 30 fps, Front: 1080p/720p at 30 fps fps', 'Image Editor': 'Yes', 'Dual Camera Lens': 'Primary Camera', 'Network Type': '4G, 2G, 3G', 'Supported Networks': '4G VoLTE, GSM, WCDMA', 'Internet Connectivity': '4G, Wi-Fi, EDGE, GPRS', 'GPRS': 'Yes', 'Micro USB Port': 'Yes', 'Bluetooth Support': 'Yes', 'Bluetooth Version': 'v4.2', 'Wi-Fi': 'Yes', 'Wi-Fi Version': '802.11a/b/g/n/ac', 'USB Connectivity': 'Yes', 'EDGE': 'Yes', 'Audio Jack': '3.5mm', 'Map Support': 'Google Maps', 'GPS Support': 'Yes', 'Smartphone': 'Yes', 'Touchscreen Type': 'Multi-touch Capacitive Screen', 'SIM Size': 'Dual Nano SIM', 'User Interface': 'ColorOS 6.1', 'Removable Battery': 'No', 'Graphics PPI': '394 PPI', 'Predictive Text Input': 'Yes', 'Sensors': 'Light Sensor, Proximity Sensor, G-Sensor, Acceleration Sensor, Hall Sensor/Window-view Mode, Gyro-Meter, E-Compass', 'Other Features': 'Physical Key, Face Recognition, Kids Space, Clone Apps, Night Shiled, Sensor Hub, Oshare, Face Unlocking, Music Interconnection, Fingerprint Access Time, Face Recognition Time, Program Frozen, File Encryption, Baseband Architecture, CPU Technology, UFS 2.1, Full Charge Time(0-100%), VOOC Flash Charge, Energy Density, Charge Speed/Power, WLAN 2.4G, WLAN 5.1G, WLAN 5.8G, WLAN Display', 'GPS Type': 'BeiDou, GLONASS', 'FM Radio': 'Yes', 'Battery Capacity': '4000 mAh', 'Width': '75.8 mm', 'Height': '161.8 mm', 'Depth': '8.67 mm', 'Weight': '195 g', 'Warranty Summary': 'Brand Warranty of 1 Year Available for Mobile with Battery and 6 Months for Accessories'}",21990
"Samsung Galaxy M10S (Metallic Blue, 32 GB)  (3 GB RAM)",4.4,719 Ratings,55 Reviews,"{'In The Box': 'Handset, Charger USB Cable, User Manual', 'Model Number': 'SM-M107FMBDINS', 'Model Name': 'Galaxy M10S', 'Color': 'Metallic Blue', 'Browse Type': 'Smartphones', 'SIM Type': 'Dual Sim', 'Hybrid Sim Slot': 'No', 'Touchscreen': 'Yes', 'OTG Compatible': 'Yes', 'Display Size': '16.26 cm (6.4 inch)', 'Resolution': '720 x 1560$$Pixels', 'Operating System': 'Android Oreo 8.1', 'Processor Core': 'Octa Core', 'Primary Clock Speed': '1.6 GHz', 'Internal Storage': '32 GB', 'RAM': '3 GB', 'Memory Card Slot Type': 'Dedicated Slot', 'Primary Camera': '13MP Rear Camera', 'Dual Camera Lens': 'Primary Camera', 'Network Type': '4G, 3G, 2G', 'Supported Networks': '4G LTE, GSM', 'Smartphone': 'Yes', 'SIM Size': 'Nano SIM', 'Mobile Tracker': 'Yes', 'Social Networking Phone': 'Yes', 'Instant Message': 'Yes', 'Removable Battery': 'No', 'MMS': 'Yes', 'SMS': 'Yes', 'Keypad': 'No', 'Voice Input': 'Yes', 'Predictive Text Input': 'Yes', 'SIM Access': 'Yes', 'Sensors': 'proximity, Accelerometer', 'Upgradable Operating System': '9.5', 'Battery Capacity': '4000 mAh', 'Warranty Summary': '12 months'}",9728
"OPPO A1K (Black, 32 GB)  (2 GB RAM)",4.3,"1,972 Ratings",134 Reviews,"{'In The Box': 'Handset, Adapter, Micro-USB Cable, Important Information Booklet with Warranty Card, Quick Guide, SIM Card Tool, Screen Protect Film, Case', 'Model Number': 'CPH1923', 'Model Name': 'A1K', 'Color': 'Black', 'Browse Type': 'Smartphones', 'SIM Type': 'Dual Sim', 'Hybrid Sim Slot': 'No', 'Touchscreen': 'Yes', 'OTG Compatible': 'Yes', 'Sound Enhancements': 'Sound Effect Type: DIRAC', 'SAR Value': 'Head: 1.323 W, kg, Body: 0.922 W, kg', 'Display Size': '15.49 cm (6.1 inch)', 'Resolution': '720 x 1560 pixels', 'Display Colors': '16M', 'Other Display Features': 'Screen Texture: a-Si TFT, GFF Touch Panel Technology, 87.43% Screen Ratio, Screen Contrast: 1200:1 (Typical), Color Saturation: NTSC 70% (Typical), Maximum Brightness: 450 nits (Typical), Touch Screen Supplier: BOE, INX, HSD, GFF Touch Screen Type, Touch Panel Glass Type: Corning Gorilla Glass 3', 'Operating System': 'Android Pie 9.0', 'Processor Type': 'MT6762R', 'Processor Core': 'Octa Core', 'Primary Clock Speed': '2 GHz', 'Secondary Clock Speed': '1.5 GHz', 'Operating Frequency': 'GSM: 850, 900, 1800, 1900 MHz, WCDMA: 850, 900, 2100 MHz 4G LTE-FDD: B1, B3, B5, B7, B8, 4G LTE-TD: B38, B40, B41 (2535 - 2655 MHz)', 'Internal Storage': '32 GB', 'RAM': '2 GB', 'Expandable Storage': '256 GB', 'Supported Memory Card Type': 'microSD', 'Memory Card Slot Type': 'Dedicated Slot', 'Primary Camera Available': 'Yes', 'Primary Camera': '8MP Rear Camera', 'Primary Camera Features': '5P Lens, Focusing Method: AF, Photo Management, Filter, Panorama, Focal Length: 3.73mm, Consecutive Capture Modes, Portrait, F2.2 Aperture, 4x Maximum Zoom Multiples, Beauty, HDR, Video 1080p, 720p, Sensor Sizes, Pixel Data: 1, 3.2 ,1.4 micrometer, Sensor Type: CMOS', 'Secondary Camera Available': 'Yes', 'Secondary Camera': '5MP Front Camera', 'Secondary Camera Features': 'Sensor Sizes, Pixel Data: 1, 5 inch, 1.12 micrometer, F2.0 Aperture, Photo Management, Filter, Panorama, Focal Length: 2.639mm, Portrait, 68.9Degree Wide Angle of Front, Sensor Model, Manufacturers: Hi556D, Hynix, Beauty, HDR, Video 1080p, 720p, 4P Lens, Sensor Type: CMOS', 'Flash': 'Rear Flash', 'HD Recording': 'Yes', 'Full HD Recording': 'Yes', 'Video Recording': 'Yes', 'Video Recording Resolution': '1080p, 720p', 'Network Type': '3G, 4G VOLTE, 4G, 2G', 'Supported Networks': 'GSM, WCDMA, 4G VoLTE, 4G LTE', '3G Speed': 'HSPA: Uplink - 11.5 Mbps, Downlink - 42 Mbps', 'GPRS': 'Yes', 'Pre-installed Browser': 'Gmail', 'Micro USB Port': 'Yes', 'Bluetooth Support': 'Yes', 'Bluetooth Version': '4.2', 'USB Connectivity': 'Yes', 'EDGE': 'Yes', 'Audio Jack': '3.5mm', 'Map Support': 'Google Maps', 'GPS Support': 'Yes', 'Smartphone': 'Yes', 'Touchscreen Type': 'Capacitive Screen, Multi-touch', 'SIM Size': 'Dual Nano SIM', 'User Interface': 'ColorOS Version 6.0', 'Removable Battery': 'No', 'Graphics PPI': '282 PPI', 'Sensors': 'Virtual Gyroscope, Magnetic Induction, Light Sensor, Proximity Sensor, G-sensor, Acceleration Sensor', 'Ringtones Format': 'OGG', 'Other Features': '4G Data Rate: Uplink - 50 Mbps, Downlink - 150 Mbps, 4G+, Connection and Sharing, Flashlight, Charge Speed, Power: 5V, 2A, 10W, Theoretical Audio Playing Time: 125hrs, Face Recognition, Face Recognition Time: 781s, Program Frozen, WLAN Display, Theoretical Video Playing Time: 9hrs, Image Format: JPEG/PNG/GIF/BMP, Kids Space, Night Shield, Sensor Hub, File Encryption, Record Format: MP3, Group Send Upper Limit: 3000 Articles, Simulated Duration: 17hrs, Firewall: Support SMS Interception and Call Interception, SIM Card Plugging Method: Left, Files Compression and Decompression, 12nm CPU Technology, World Time, Full Charge Time (0 - 100%): 180mins', 'GPS Type': 'A-GPS, GLONASS, BeiDou', 'FM Radio': 'Yes', 'Audio Formats': 'MP3, AAC, APE, AMR, WAV, MID, OGG, FLAC, WMA', 'Video Formats': 'AVI, 3GP, MP4, WMV, MKV, MOV, ASF, FLV', 'Battery Capacity': '4000 mAh', 'Width': '77.35 mm', 'Height': '154.4 mm', 'Depth': '8.35 mm', 'Weight': '165 g', 'Warranty Summary': 'Brand Warranty of 1 Year Available for Mobile and 6 Months for Accessories'}",7490
"Redmi K20 Pro (Carbon Black, 128 GB)  (6 GB RAM)",4.5,"52,617 Ratings","6,641 Reviews","{'In The Box': 'Redmi K20 Pro, Power adapter, Simple protective cover, USB Type-C cable, SIM eject tool, User guide, Warranty card', 'Model Number': 'MZB7750IN', 'Model Name': 'Redmi K20 Pro', 'Color': 'Carbon Black', 'Browse Type': 'Smartphones', 'SIM Type': 'Dual Sim', 'Hybrid Sim Slot': 'No', 'Touchscreen': 'Yes', 'OTG Compatible': 'Yes', 'Quick Charging': 'Yes', 'Sound Enhancements': 'Speaker - Single (Bottom Opening), Microphones - 2 (For Noise Cancellation), Smart PA/HiFi', 'SAR Value': 'Head SAR: 1.03W/kg, Body SAR: 0.72W/kg (Distance 15mm)', 'Display Size': '16.23 cm (6.39 inch)', 'Resolution': '2340 x 1080 pixels', 'Resolution Type': 'Full HD+', 'GPU': 'Adreno 640', 'Display Type': 'AMOLED', 'Display Colors': 'Contrast Ratio - 60000:1, NTSC Ratio - 103.8%', 'Operating System': 'Android Pie 9.0', 'Processor Type': 'Qualcomm Snapdragon 855', 'Processor Core': 'Octa Core', 'Primary Clock Speed': '2.84 GHz', 'Secondary Clock Speed': '2.42 GHz', 'Operating Frequency': 'GSM - B2, B3, B5, B8, WCDMA - B1, B2, B5, B8, LTE TDD - B38, B40, B41 (120MHz), LTE FDD - B1, B3, B5, B7, B8', 'Internal Storage': '128 GB', 'RAM': '6 GB', 'Primary Camera Available': 'Yes', 'Primary Camera': '48MP + 13MP + 8MP', 'Primary Camera Features': '48MP - IMX586,1/2.0inch, 1.6micrometer, 6P, F1.75, FOV79, AF, OL, 13MP - S5K3L6 1/3inch, 1.12micrometer, 5P, F2.4, FOV124.8, FF, 8MP - OV8856 1/4inch, 1.12micrometer, 5P, F2.4, FOV44.5, AF, OL, Laser Focus + PDAF, Slow Motion Support - 960 fps', 'Secondary Camera Available': 'Yes', 'Secondary Camera': '20MP Front Camera', 'Secondary Camera Features': '20MP Popup Camera with R/B LED - Aperture - F2.2, Front Camera Pixel Size - 0.8micrometer', 'Flash': 'Rear Flash', 'Dual Camera Lens': 'Primary Camera', 'Network Type': '3G, 4G VOLTE, 2G', 'Supported Networks': 'GSM, WCDMA, 4G VoLTE, 4G LTE', 'Internet Connectivity': '4G, 3G, Wi-Fi', '3G': 'Yes', 'Bluetooth Support': 'Yes', 'Bluetooth Version': '5.0', 'Wi-Fi': 'Yes', 'Wi-Fi Version': '802.11 a/b/g/n/ac (2x2 MiMo)', 'USB Connectivity': 'Yes', 'Audio Jack': '3.5mm', 'Map Support': 'Google Maps', 'GPS Support': 'Yes', 'SIM Size': 'Dual Nano SIM', 'Graphics PPI': '403 PPI', 'Sensors': 'Fingerprint on Display, Ambient Light Sensor, Proximity Sensor, E-compass, Accelerometer, Gyroscope', 'Other Features': 'Internal Memory - UFS2.1, USB Type C, QC 4.0, Processor Cores - 1 x Prime 2.84GHz + 3 x Gold 2.42GHz + 4 x Silver1.8GHz', 'GPS Type': '2 band-GPS/A-GPS, GLONASS, BeiDou', 'Battery Capacity': '4000 mAh', 'Width': '74.3 mm', 'Height': '156.7 mm', 'Depth': '8.8 mm', 'Weight': '191 g', 'Warranty Summary': 'Brand Warranty of 1 Year Available for Mobile and 6 Months for Accessories'}",24999
"Motorola One Vision (Sapphire Gradient, 128 GB)  (4 GB RAM)",4.1,"9,585 Ratings","1,286 Reviews","{'In The Box': 'Handset, Turbo Power Charger, USB Cable, Protective Cover', 'Model Number': 'PAFB0023IN', 'Model Name': 'Motorola One Vision', 'Color': 'Sapphire Gradient', 'Browse Type': 'Smartphones', 'SIM Type': 'Dual Sim', 'Hybrid Sim Slot': 'Yes', 'Touchscreen': 'Yes', 'OTG Compatible': 'Yes', 'Quick Charging': 'Yes', 'Sound Enhancements': 'Dolby Audio, One Speaker, Bottom Ported Speaker, 2 Microphones', 'Display Size': '16.0 cm (6.3 inch)', 'Resolution': '1080 x 2520 pixels', 'Resolution Type': 'Full HD+', 'GPU': 'Mali-G72 MP3', 'Display Type': 'LTPS IPS', 'Operating System': 'Android Pie 9', 'Processor Type': 'Samsung Exynos 9609', 'Processor Core': 'Octa Core', 'Primary Clock Speed': '2.2 GHz', 'Operating Frequency': 'GSM: B2/B3/B5/B8, WCDMA: B1/B2/B5/B8, 4G LTE: B1/B3/B5/B7/B8/B20/B38/B40/B41', 'Internal Storage': '128 GB', 'RAM': '4 GB', 'Expandable Storage': '256 GB', 'Supported Memory Card Type': 'microSD', 'Memory Card Slot Type': 'Hybrid Slot', 'Primary Camera Available': 'Yes', 'Primary Camera': '48MP + 5MP', 'Primary Camera Features': 'OIS, f/1.7 Aperture', 'Secondary Camera Available': 'Yes', 'Secondary Camera': '25MP Front Camera', 'Secondary Camera Features': 'Aperture: F2.0, Quad-pixel, 0.9 micrometer', 'Flash': 'Dual LED Flash', 'Frame Rate': 'UHD at 30 fps, FHD at 30 fps, FHD at 60 fps, HD at 30 fps', 'Dual Camera Lens': 'Primary Camera', 'Network Type': '3G, 4G, 2G', 'Supported Networks': 'GSM, WCDMA, 4G LTE, UMTS', '3G': 'Yes', '3G Speed': 'HSPA+', 'Bluetooth Support': 'Yes', 'Bluetooth Version': '5', 'Wi-Fi': 'Yes', 'Wi-Fi Version': '802.11a/b/g/n/ac, 2.4GHz + 5GHz', 'Wi-Fi Hotspot': 'Yes', 'NFC': 'Yes', 'USB Connectivity': 'Yes', 'EDGE': 'Yes', 'Map Support': 'Google Maps', 'GPS Support': 'Yes', 'SIM Size': 'Dual Nano SIM', 'Removable Battery': 'No', 'Graphics PPI': '432 PPI', 'Sensors': 'Fingerprint Reader, Proximity Sensor, Accelerometer, Ambient Light Sensor, Magnetometer, Gyroscope', 'Other Features': '15W Turbo Power for up to 7 hrs of Power in 15 mins of Charging, Network: 4G LTE (Cat 6), Connectivity: USB Type-C Port with Turbo Charge Support, IP52 Water Protection', 'GPS Type': 'A-GPS, GLONASS, Galileo', 'FM Radio': 'Yes', 'Battery Capacity': '3500 mAh', 'Width': '71.2 mm', 'Height': '160.1 mm', 'Depth': '8.7 mm', 'Weight': '180 g', 'Warranty Summary': 'Brand Warranty of 1 Year Available for Mobile and 6 Months for Accessories'}",13999
"Samsung Galaxy A50s (Prism Crush Black, 128 GB)  (6 GB RAM)",4.3,"7,164 Ratings",833 Reviews,"{'In The Box': 'Handset, Headset, Travel Adapter, USB Cable and User Manual', 'Model Number': 'SM-A507FZKWINS', 'Model Name': 'Galaxy A50s', 'Color': 'Prism Crush Black', 'Browse Type': 'Smartphones', 'SIM Type': 'Dual Sim', 'Hybrid Sim Slot': 'No', 'Touchscreen': 'Yes', 'OTG Compatible': 'Yes', 'Quick Charging': 'Yes', 'Display Size': '16.26 cm (6.4 inch)', 'Resolution': '2340 x 1080 Pixels', 'Resolution Type': 'Full HD+', 'GPU': 'ARM | Mali G72 MP3', 'Display Type': 'Super Amoled V Cut Display', 'Display Colors': '16M', 'Operating System': 'Android Pie 9.0', 'Processor Type': 'Exynos 9611', 'Processor Core': 'Octa Core', 'Primary Clock Speed': '2.3 GHz', 'Secondary Clock Speed': '1.7 GHz', 'Internal Storage': '128 GB', 'RAM': '6 GB', 'Supported Memory Card Type': 'microSD', 'Memory Card Slot Type': 'Dedicated Slot', 'Primary Camera Available': 'Yes', 'Primary Camera': '48MP + 8MP + 5MP', 'Primary Camera Features': 'Triple Camera, Aperture - 48MP (F2.2)+ 5MP(2.2) + 8MP (2.2)', 'Secondary Camera Available': 'Yes', 'Secondary Camera': '32MP Front Camera', 'Secondary Camera Features': 'Live Focus Mode, Beauty Mode', 'Dual Camera Lens': 'Primary Camera', 'Call Wait/Hold': 'Yes', 'Conference Call': 'Yes', 'Hands Free': 'Yes', 'Video Call Support': 'Yes', 'Call Divert': 'Yes', 'Phone Book': 'Yes', 'Call Timer': 'Yes', 'Speaker Phone': 'Yes', 'Speed Dialing': 'Yes', 'Logs': 'Received, Missed, Dial', 'Network Type': '4G, 3G, 2G', 'Supported Networks': '4G LTE, WCDMA, GSM', 'Internet Connectivity': '4G, Wi-Fi, EDGE, GPRS', 'GPRS': 'Yes', 'Wi-Fi': 'Yes', 'Wi-Fi Hotspot': 'Yes', 'Map Support': 'Google Maps', 'GPS Support': 'Yes', 'Smartphone': 'Yes', 'SIM Size': 'Dual Nano SIM', 'Instant Message': 'Yes', 'Removable Battery': 'No', 'MMS': 'Yes', 'SMS': 'Yes', 'Keypad': 'No', 'Predictive Text Input': 'Yes', 'FM Radio': 'Yes', 'Battery Capacity': '4000 mAh', 'Width': '74.5 mm', 'Height': '158.3 mm', 'Depth': '7.7 mm', 'Weight': '166 g', 'Warranty Summary': 'Brand Warranty of 1 Year Available for Mobile and 6 Months for Battery and Accessories'}",19999
