Name,Stars,Ratings,Reviews,Specifications,Price
"Realme 6 (Comet Blue, 128 GB)  (6 GB RAM)",4.6,965 Ratings,146 Reviews,"{'In The Box': 'Handset, Adapter (5V/6A), Type C Cable, SIM Card Tool, Screen Protect Film (2D TP), Case, Warranty Card, Quick Guide', 'Model Number': 'RBS0603IN', 'Model Name': '6', 'Color': 'Comet Blue', 'Browse Type': 'Smartphones', 'SIM Type': 'Dual Sim', 'Hybrid Sim Slot': 'No', 'Touchscreen': 'Yes', 'OTG Compatible': 'Yes', 'Sound Enhancements': 'Dirac Sound Effect, MT6359 Audio Decoding Chip', 'SAR Value': 'Head - 1.138W/kg, Body - 0.586W/kg', 'Display Size': '16.51 cm (6.5 inch)', 'Resolution': '2400 x 1080 Pixels', 'Resolution Type': 'Full HD+', 'GPU': 'ARM G76 (12 nm)', 'Display Type': 'Full HD+ LCD Display', 'Display Colors': '16.7M', 'Other Display Features': 'In-cell Touch Panel Technology, Screen Sealing Process: COG, 20:9 Screen Ratio, 90.5% Screen-to-body Ratio, 1500:1 (Typical) / 1100:1 (Minimum) Screen Contrast, 90 HZ (Max) Screen Refresh Rate, NTSC: 81.5% (Typical) / 76% (Minimum) Color Saturation, Maximum Brightness: 400 nits (Minimum), 480 nits (Typical), Gorilla Glass 3 Protection (2.5D), 120 HZ Touch Sampling Rate, Touch Screen Supplier: JDI', 'Operating System': 'Android 10', 'Processor Type': 'MediaTek Helio G90T', 'Processor Core': 'Octa Core', 'Primary Clock Speed': '2.05 GHz', 'Secondary Clock Speed': '2 GHz', 'Operating Frequency': 'GSM: 850 / 900 / 1800 / 1900, WCDMA: Bands 1 / 5 / 8, FDD-LTE: Bands 1 / 3 / 5 / 8, TD-LTE: Bands 38 / 40 / 41 (2535 - 2655 MHz)', 'Internal Storage': '128 GB', 'RAM': '6 GB', 'Expandable Storage': '256 GB', 'Supported Memory Card Type': 'microSD', 'Memory Card Slot Type': 'Dedicated Slot', 'Primary Camera Available': 'Yes', 'Primary Camera': '64MP + 8MP + 2MP + 2MP', 'Primary Camera Features': '64 MP Main Camera, 8 MP Wide Camera, 2 MP Macro Camera, 2 MP Mono Camera, CMOS Sensor, Sensor Manufacturer and Model: Samsung, GW1, Focusing Method: Rear Wide FF, Rear Main AF, Mono FF, Macro FF, Aperture: Rear Main F1.8, Rear Wide F2.3, Mono F2.4, Macro F2.4, Wide Angle of Rear Camera: Rear Sub 119.1 Degree, Rear Main 78.6 Degree, Mono 88.8 Degree, Macro 88.8 Degree, Sensor Sizes/Pixel Data: Rear Wide 1/4, 1.12 um, Rear Main 1/1.72 (S5KGW1SP03), 0.8 um, Mono 1/5, 1.75 um, Macro 1/5, 1.75 um, Photo Size: Rear Wide - 3264 x 2448, Rear Main - 9280 x 6944, Mono - 1600 x 1200, Supermacro, 1600 x 1200, Lens Material: Glass, Lens Number: Rear Wide 8 MP 5P, Rear Main 64 MP 6P, Mono 2 MP 3P, Macro 2 MP 3P, Macro Lens: Rear Main 64 MP Macro 10 cm, Rear Macro 2 MP Macro 4 cm, Slow Motion: 720P at 120 FPS, 1080P at 120 FPS, Characteristic Function for Photograph: Beauty, Filter, HDR, Panoramic View, Portrait, Timelapse, Slo-mo, NightScape, Expert, Continuous Capture Modes: 20 (Max)', 'Secondary Camera Available': 'Yes', 'Secondary Camera': '16MP Front Camera', 'Secondary Camera Features': 'Sensor Sizes/Pixel Data: 1/3.1, 1.0 um, Photo Size: 4608 x 3456, CMOS Sensor, Sensor Manufacturer and Model: Samsung / S5K3P9, Focusing Mode: Fixed Focus, Wide Angle of Front Camera: 79.3 Degree, Aperture: 2.0, Front Flashlight: No (Support Screen Fill Light), Front Camera Lens Material: Optical Plastics, Lens Number: 5P, Ways of Taking Photos: Timer, Touch, Gesture, Volume Button, EIS Support, Characteristic Function for Photograph: Beauty, Filter, HDR, Panoramic View, Portrait, Timelapse, Supported Resolution and Frame Rate in Video: 720P at 30 fps, 1080P at 30 fps', 'Flash': 'Rear Flash', 'Full HD Recording': 'Yes', 'Video Recording': 'Yes', 'Video Recording Resolution': 'Front Camera: 720P at 30 fps, 1080P at 30 fps, Rear Camera: 1080P at 60 fps, 720P at 60 fps, 1080P at 30 fps, 720P at 30 fps, 4K at 30 fps', 'Digital Zoom': '10x', 'Dual Camera Lens': 'Primary Camera', 'Call Records': 'Yes', 'Network Type': '4G VOLTE, 4G, 3G, 2G', 'Supported Networks': '4G VoLTE, 4G LTE, WCDMA, GSM', 'Internet Connectivity': '4G, 3G, Wi-Fi, EDGE, GPRS', 'GPRS': 'Yes', 'Bluetooth Support': 'Yes', 'Bluetooth Version': 'v5.0', 'Wi-Fi': 'Yes', 'Wi-Fi Version': '802.11a/b/g/n/ac', 'Wi-Fi Hotspot': 'Yes', 'NFC': 'No', 'USB Connectivity': 'Yes', 'Audio Jack': '3.5mm', 'Map Support': 'Google Maps', 'GPS Support': 'Yes', 'Smartphone': 'Yes', 'Touchscreen Type': 'Capacitive', 'SIM Size': 'Nano SIM', 'User Interface': 'realme UI Based on Android 10', 'SMS': 'Yes', 'Graphics PPI': '405 PPI', 'Sensors': 'Magnetic Induction Sensor, Light Sensor, Proximity Sensor, Gyro, Acceleration Sensor', 'Browser': 'Google Chrome', 'Ringtones Format': 'OGG', 'Other Features': 'WLAN Display, WIFI Antenna Technology: SISO, Night Shiled, Face Unlock, Wet Hand Unlock, Face Unlock Time: 711 ms, File Encryption, 71 Countries Language Support, Clone Phone, Theme Store, APP Market, Game Accelerattion, Telephone Number Identification, Dual Channel RAM, RAM Frequency: Upto 4266 MHz, UFS 2.1 ROM, OTG Storage Format: FAT12, FAT16, FAT32, NTFS, EXFAT, Heat Dissipation Technology: Dual Layer Graphite + Copper Foil, Charging Power: 30 W, PD Charge Support, RF Antenna Technology: Support 2x2 MIMO Antenna Technology, Bluetooth Audio Codec: SBC, AAC, APTX, APTX HD, LDAC, WideVine L1 Support, MediTek Helio G90T (2 x Cortex-A76 Cores at 2.05 GHz + 6 x Cortex-A55 Cores at 2.0 GHz) 12 nm 64-bit Processor', 'GPS Type': 'A-GPS, GLONASS, BeiDou', 'FM Radio': 'Yes', 'Audio Formats': 'AAC, APE, FLAC, AMR, MID, MP3, OGG, WAV, WMA, MKA', 'Music Player': 'Yes', 'Video Formats': 'AVI, MP4, 3GP, 3G2, 3GPP, 3GPP2, M4V, FLV, F4V, WEBM, WMV, ASF, MOV, QT, TS, M2TS, MTS, MKV', 'Battery Capacity': '4300 mAh', 'Width': '74.8 mm', 'Height': '162.1 mm', 'Depth': '9.6 mm', 'Weight': '191 g', 'Warranty Summary': 'Brand Warranty of 1 Year Available for Mobile Including Battery and 6 Months for Accessories', 'Domestic Warranty': '1 Year'}",14999
"Realme C2 (Diamond Ruby, 32 GB)  (3 GB RAM)",4.3,"1,09,203 Ratings","8,787 Reviews","{'In The Box': 'Handset, Adapter (5V/2A), Micro-USB Cable, Important Information Booklet with Warranty Card, Quick Guide, SIM Card Tool, Screen Protect Film', 'Model Number': 'RMX1941', 'Model Name': 'C2', 'Color': 'Diamond Ruby', 'Browse Type': 'Smartphones', 'SIM Type': 'Dual Sim', 'Hybrid Sim Slot': 'No', 'Touchscreen': 'Yes', 'OTG Compatible': 'Yes', 'Display Size': '15.49 cm (6.1 inch)', 'Resolution': '1560 x 720 pixels', 'Resolution Type': 'HD+', 'GPU': 'GE8320', 'Display Colors': '16.7M', 'Other Display Features': 'Screen Texture: a-Si, In-cell Touch Panel Technology, Screen Ratio: 19.5:9, Touch Panel Glass Type: GG3, Screen Contrast: 1200/900, Color Saturation: 70%/65% NTSC, Maximum Brightness: 450 nits/400 nits', 'Operating System': 'Android Pie 9.0', 'Processor Type': 'MediaTek P22 Octa Core 2.0 GHz', 'Processor Core': 'Octa Core', 'Primary Clock Speed': '2 GHz', 'Operating Frequency': 'GSM: 850/900/1800/1900 MHz, WCDMA: 850/900/2100 MHz, 4G LTE-FDD: B1/B3/B5/B8, 4G LTE-TD: B38/B40/B41 (2535 - 2655 MHz)', 'Internal Storage': '32 GB', 'RAM': '3 GB', 'Expandable Storage': '256 GB', 'Supported Memory Card Type': 'microSD', 'Memory Card Slot Type': 'Dedicated Slot', 'Primary Camera Available': 'Yes', 'Primary Camera': '13MP + 2MP', 'Primary Camera Features': '5P Lens, Focusing Method: AF, 4x Maximum Zoom Multiples, Focal Length: 3.462mm + 1.75mm, Bokeh Mode, Photo Management: Photo Editing, Sensor Size/Pixel Data: Main - 1.12 micrometer, Secondary-pixel Size: 1.75 micrometer, Aperture: F2.2 + F2.4, Video: 720p, 1080p, Sensor Type: CMOS', 'Secondary Camera Available': 'Yes', 'Secondary Camera': '5MP Front Camera', 'Secondary Camera Features': 'Sensor Size/Pixel Data: 1.12 micrometer, Aperture: F2.0, Bokeh Mode, Photo Management: Photo Editing, Focusing Method: FF, Focal Length: 2.63mm, 4P Lens, Video: 720p, 1080p, AI Beautification, Sensor Type: CMOS', 'Flash': 'Rear Flash', 'HD Recording': 'Yes', 'Full HD Recording': 'Yes', 'Video Recording': 'Yes', 'Video Recording Resolution': '1080p, 720p', 'Dual Camera Lens': 'Primary Camera', 'Network Type': '3G, 4G VOLTE, 4G, 2G', 'Supported Networks': 'GSM, WCDMA, 4G VoLTE, 4G LTE', 'Internet Connectivity': '4G, 3G, EDGE, GPRS', '3G': 'Yes', '3G Speed': 'HSPA+', 'GPRS': 'Yes', 'Micro USB Port': 'Yes', 'Bluetooth Support': 'Yes', 'Bluetooth Version': 'v4.2', 'Wi-Fi': 'Yes', 'Wi-Fi Version': '802.11 b/g/n', 'USB Connectivity': 'Yes', 'EDGE': 'Yes', 'Audio Jack': '3.5mm', 'Map Support': 'Google Maps', 'GPS Support': 'Yes', 'Smartphone': 'Yes', 'Touchscreen Type': 'Multi-touch', 'SIM Size': 'Dual Nano SIM', 'User Interface': 'ColorOS 6.0', 'Removable Battery': 'No', 'Graphics PPI': '282.22 PPI', 'Sensors': 'Magnetic Induction, Light Sensor, Proximity Sensor, G-sensor, Acceleration Sensor', 'Other Features': 'File Encryption, Import and Export Contacts, Game Acceleration (Specific Apps), Connection and Sharing, Oshare (Aim at the Indian Phone Number Recognition), Flashlight, Clone Apps, Face Recognition, Diamond Cut Design, Program Frozen, Dual VoLTE, WLAN Display, Files Compression and Decompression, 12nm CPU Technology, Kids Space, Dewdrop Screen, Import and Export Messages, Night Shield', 'GPS Type': 'GLONASS', 'Battery Capacity': '4000 mAh', 'Width': '73.7 mm', 'Height': '154.3 mm', 'Depth': '8.5 mm', 'Weight': '166 g', 'Warranty Summary': 'Brand Warranty of 1 Year Available for Mobile and 6 Months for Accessories'}",6999
"Vivo U10 (Electric Blue, 32 GB)  (3 GB RAM)",4.4,"10,348 Ratings",863 Reviews,"{'In The Box': 'Handset, User Manual, Micro USB to USB Cable, USB Power Adapter, SIM Ejection Pin, Protective Case, Protective Film (Applied)', 'Model Number': 'Vivo 1916/PD1928BF_IN', 'Model Name': 'U10', 'Color': 'Electric Blue', 'Browse Type': 'Smartphones', 'SIM Type': 'Dual Sim', 'Hybrid Sim Slot': 'No', 'Touchscreen': 'Yes', 'OTG Compatible': 'Yes', 'Quick Charging': 'Yes', 'Additional Content': 'Dual SIM, GPS, Music Player, Video Player, Accelerometer, Ambient light sensor, Proximity sensor, e-Compass, Virtual gyroscope, Fingerprint', 'SAR Value': 'Head: 1.047 W/kg, Body: 0.445 W/Kg', 'Display Size': '16.13 cm (6.35 inch)', 'Resolution': '720 x 1544 Pixels', 'Resolution Type': 'HD+', 'GPU': 'Adreno 610', 'Display Colors': '16M', 'Other Display Features': 'Bezel - Sides: 2mm, Upper: 2.6mm, Lower: 6.538mm, Screen to Body Ratio: 89%, Material Display: Panda MN228', 'Operating System': 'Android Pie 9', 'Processor Type': 'Qualcomm Snapdragon 665 AIE', 'Processor Core': 'Octa Core', 'Primary Clock Speed': '2 GHz', 'Operating Frequency': '2G GSM (B2/B3/B5/B8), 3G WCDMA (B1/B5/B8), 4G TDD_LTE (B38/B40/B41), 4G FDD_LTE (B1/B3/B5/B8)', 'Internal Storage': '32 GB', 'RAM': '3 GB', 'Expandable Storage': '256 GB', 'Supported Memory Card Type': 'microSD', 'Memory Card Slot Type': 'Dedicated Slot', 'Primary Camera Available': 'Yes', 'Primary Camera': '13MP + 8MP + 2MP', 'Primary Camera Features': 'AI Triple Rear Camera, 13MP (Clarity) + 8MP (Wide Angle) + 2MP (Bokeh), Primary Camera Sensor Brand and Model: OV13855, Aperture: 13MP (f2.2) + 8MP (f2.2) + 2MP (f2.4), Professional Mode, AI Filter, Backlight HDR, Portrait Bokeh, Slow Motion, Time-lapse Photography, AI Beauty, AI HDR', 'Secondary Camera Available': 'Yes', 'Secondary Camera': '8MP Front Camera', 'Secondary Camera Features': 'Secondary Camera Sensor Brand and Model: Samsung4H7, Aperture: 8MP (F1.8), AI Filters, AI Beauty, HDR', 'Flash': 'Rear Flash and Front Screen Flash', 'HD Recording': 'Yes', 'Full HD Recording': 'Yes', 'Video Recording': 'Yes', 'Video Recording Resolution': 'Yes - Upto 1080p, 720p', 'Frame Rate': '30 fps', 'Dual Camera Lens': 'Primary Camera', 'Network Type': '4G VOLTE, 4G, 2G, 3G', 'Supported Networks': '4G VoLTE, 4G LTE', 'Internet Connectivity': '4G, 3G, Wi-Fi', '3G': 'Yes', 'Pre-installed Browser': 'Vivo Browser, Google Chrome', 'Bluetooth Support': 'Yes', 'Bluetooth Version': 'v5.0', 'Wi-Fi': 'Yes', 'Wi-Fi Version': 'WLAN 2.4G, WLAN 5.1G, WLAN 5.8G', 'Wi-Fi Hotspot': 'Yes', 'NFC': 'No', 'USB Connectivity': 'Yes', 'Audio Jack': '3.5mm', 'Map Support': 'Google Maps', 'GPS Support': 'Yes', 'Smartphone': 'Yes', 'Touchscreen Type': 'IPS-IN-Cell (Capacitive Multi Touch Screen)', 'SIM Size': 'Nano SIM', 'User Interface': 'Funtouch OS 9.1', 'Removable Battery': 'No', 'SMS': 'Yes', 'Graphics PPI': '268 PPI', 'SIM Access': 'Dual Standby', 'Sensors': 'Fingerprint, Accelerometer, Ambient Light Sensor, Proximity, E-compass, Gyroscope Sensor', 'Other Features': 'Dual 4G, WLAN Display, USB 2.0, Ultra Game Mode, Smart Split, Eye Protection Mode, Fun Video, eMCC, Face Access, 18W Fast Charging', 'Important Apps': 'Social Media Apps: Facebook, Whatsapp, Google Services: Play Store, Google, Chrome, Gmail, Map, YouTube, Drive, Play Music, Play Movie & TV, Duo, Photos, Google News, Others: Amazon, Paytm, Gaana, Dailyhunt, Webnovel, Opera Browser, WPS Office, App Clone: WhatsApp, Facebook, WeChat, Instagram', 'GPS Type': 'Beidou, GLONASS', 'FM Radio': 'Yes', 'Audio Formats': 'WAV, MP3, MP2, AMR-NB, AMR-WB, MIDI, Vorbis, APE, FLAC', 'Video Formats': 'MP4, 3GP, AVI', 'Battery Capacity': '5000 mAh', 'Width': '76.77 mm', 'Height': '159.43 mm', 'Depth': '8.92 mm', 'Weight': '190.5 g', 'Warranty Summary': 'Brand Warranty of 1 Year Available for Mobile and 6 Months for Accessories'}",8990
"Realme 6 (Comet Blue, 128 GB)  (8 GB RAM)",4.5,731 Ratings,111 Reviews,"{'In The Box': 'Handset, Adapter (5V/6A), Type C Cable, SIM Card Tool, Screen Protect Film (2D TP), Case, Warranty Card, Quick Guide', 'Model Number': 'RBS0605IN', 'Model Name': '6', 'Color': 'Comet Blue', 'Browse Type': 'Smartphones', 'SIM Type': 'Dual Sim', 'Hybrid Sim Slot': 'No', 'Touchscreen': 'Yes', 'OTG Compatible': 'Yes', 'Sound Enhancements': 'Dirac Sound Effect, MT6359 Audio Decoding Chip', 'SAR Value': 'Head - 1.138W/kg, Body - 0.586W/kg', 'Display Size': '16.51 cm (6.5 inch)', 'Resolution': '2400 x 1080 Pixels', 'Resolution Type': 'Full HD+', 'GPU': 'ARM G76 (12 nm)', 'Display Type': 'Full HD+ LCD Display', 'Display Colors': '16.7M', 'Other Display Features': 'In-cell Touch Panel Technology, Screen Sealing Process: COG, 20:9 Screen Ratio, 90.5% Screen-to-body Ratio, 1500:1 (Typical) / 1100:1 (Minimum) Screen Contrast, 90 HZ (Max) Screen Refresh Rate, NTSC: 81.5% (Typical) / 76% (Minimum) Color Saturation, Maximum Brightness: 400 nits (Minimum), 480 nits (Typical), Gorilla Glass 3 Protection (2.5D), 120 HZ Touch Sampling Rate, Touch Screen Supplier: JDI', 'Operating System': 'Android 10', 'Processor Type': 'MediaTek Helio G90T', 'Processor Core': 'Octa Core', 'Primary Clock Speed': '2.05 GHz', 'Secondary Clock Speed': '2 GHz', 'Operating Frequency': 'GSM: 850 / 900 / 1800 / 1900, WCDMA: Bands 1 / 5 / 8, FDD-LTE: Bands 1 / 3 / 5 / 8, TD-LTE: Bands 38 / 40 / 41 (2535 - 2655 MHz)', 'Internal Storage': '128 GB', 'RAM': '8 GB', 'Expandable Storage': '256 GB', 'Supported Memory Card Type': 'microSD', 'Memory Card Slot Type': 'Dedicated Slot', 'Primary Camera Available': 'Yes', 'Primary Camera': '64MP + 8MP + 2MP + 2MP', 'Primary Camera Features': '64 MP Main Camera, 8 MP Wide Camera, 2 MP Macro Camera, 2 MP Mono Camera, CMOS Sensor, Sensor Manufacturer and Model: Samsung, GW1, Focusing Method: Rear Wide FF, Rear Main AF, Mono FF, Macro FF, Aperture: Rear Main F1.8, Rear Wide F2.3, Mono F2.4, Macro F2.4, Wide Angle of Rear Camera: Rear Sub 119.1 Degree, Rear Main 78.6 Degree, Mono 88.8 Degree, Macro 88.8 Degree, Sensor Sizes/Pixel Data: Rear Wide 1/4, 1.12 um, Rear Main 1/1.72 (S5KGW1SP03), 0.8 um, Mono 1/5, 1.75 um, Macro 1/5, 1.75 um, Photo Size: Rear Wide - 3264 x 2448, Rear Main - 9280 x 6944, Mono - 1600 x 1200, Supermacro, 1600 x 1200, Lens Material: Glass, Lens Number: Rear Wide 8 MP 5P, Rear Main 64 MP 6P, Mono 2 MP 3P, Macro 2 MP 3P, Macro Lens: Rear Main 64 MP Macro 10 cm, Rear Macro 2 MP Macro 4 cm, Slow Motion: 720P at 120 FPS, 1080P at 120 FPS, Characteristic Function for Photograph: Beauty, Filter, HDR, Panoramic View, Portrait, Timelapse, Slo-mo, NightScape, Expert, Continuous Capture Modes: 20 (Max)', 'Secondary Camera Available': 'Yes', 'Secondary Camera': '16MP Front Camera', 'Secondary Camera Features': 'Sensor Sizes/Pixel Data: 1/3.1, 1.0 um, Photo Size: 4608 x 3456, CMOS Sensor, Sensor Manufacturer and Model: Samsung / S5K3P9, Focusing Mode: Fixed Focus, Wide Angle of Front Camera: 79.3 Degree, Aperture: 2.0, Front Flashlight: No (Support Screen Fill Light), Front Camera Lens Material: Optical Plastics, Lens Number: 5P, Ways of Taking Photos: Timer, Touch, Gesture, Volume Button, EIS Support, Characteristic Function for Photograph: Beauty, Filter, HDR, Panoramic View, Portrait, Timelapse, Supported Resolution and Frame Rate in Video: 720P at 30 fps, 1080P at 30 fps', 'Flash': 'Rear Flash', 'Full HD Recording': 'Yes', 'Video Recording': 'Yes', 'Video Recording Resolution': 'Front Camera: 720P at 30 fps, 1080P at 30 fps, Rear Camera: 1080P at 60 fps, 720P at 60 fps, 1080P at 30 fps, 720P at 30 fps, 4K at 30 fps', 'Digital Zoom': '10x', 'Dual Camera Lens': 'Primary Camera', 'Call Records': 'Yes', 'Network Type': '4G VOLTE, 4G, 3G, 2G', 'Supported Networks': '4G VoLTE, 4G LTE, WCDMA, GSM', 'Internet Connectivity': '4G, 3G, Wi-Fi, EDGE, GPRS', 'GPRS': 'Yes', 'Bluetooth Support': 'Yes', 'Bluetooth Version': 'v5.0', 'Wi-Fi': 'Yes', 'Wi-Fi Version': '802.11a/b/g/n/ac', 'Wi-Fi Hotspot': 'Yes', 'NFC': 'No', 'USB Connectivity': 'Yes', 'Audio Jack': '3.5mm', 'Map Support': 'Google Maps', 'GPS Support': 'Yes', 'Smartphone': 'Yes', 'Touchscreen Type': 'Capacitive', 'SIM Size': 'Nano SIM', 'User Interface': 'realme UI Based on Android 10', 'SMS': 'Yes', 'Graphics PPI': '405 PPI', 'Sensors': 'Magnetic Induction Sensor, Light Sensor, Proximity Sensor, Gyro, Acceleration Sensor', 'Browser': 'Google Chrome', 'Ringtones Format': 'OGG', 'Other Features': 'WLAN Display, WIFI Antenna Technology: SISO, Night Shiled, Face Unlock, Wet Hand Unlock, Face Unlock Time: 711 ms, File Encryption, 71 Countries Language Support, Clone Phone, Theme Store, APP Market, Game Accelerattion, Telephone Number Identification, Dual Channel RAM, RAM Frequency: Upto 4266 MHz, UFS 2.1 ROM, OTG Storage Format: FAT12, FAT16, FAT32, NTFS, EXFAT, Heat Dissipation Technology: Dual Layer Graphite + Copper Foil, Charging Power: 30 W, PD Charge Support, RF Antenna Technology: Support 2x2 MIMO Antenna Technology, Bluetooth Audio Codec: SBC, AAC, APTX, APTX HD, LDAC, WideVine L1 Support, MediTek Helio G90T (2 x Cortex-A76 Cores at 2.05 GHz + 6 x Cortex-A55 Cores at 2.0 GHz) 12 nm 64-bit Processor', 'GPS Type': 'A-GPS, GLONASS, BeiDou', 'FM Radio': 'Yes', 'Audio Formats': 'AAC, APE, FLAC, AMR, MID, MP3, OGG, WAV, WMA, MKA', 'Music Player': 'Yes', 'Video Formats': 'AVI, MP4, 3GP, 3G2, 3GPP, 3GPP2, M4V, FLV, F4V, WEBM, WMV, ASF, MOV, QT, TS, M2TS, MTS, MKV', 'Battery Capacity': '4300 mAh', 'Width': '74.8 mm', 'Height': '162.1 mm', 'Depth': '9.6 mm', 'Weight': '191 g', 'Warranty Summary': 'Brand Warranty of 1 Year Available for Mobile Including Battery and 6 Months for Accessories', 'Domestic Warranty': '1 Year'}",15999
"OPPO A9 2020 (Marine Green, 128 GB)  (4 GB RAM)",4.4,"2,227 Ratings",212 Reviews,"{'In The Box': 'Handset, Adapter, Headset, Micro USB Cable, Important Info. Booklet with Warranty Card, Quick Start Guide, Sim Card Tool, Protective Film, Pre-applied, Case', 'Model Number': 'CPH1937', 'Model Name': 'A9 2020', 'Color': 'Marine Green', 'Browse Type': 'Smartphones', 'SIM Type': 'Dual Sim', 'Hybrid Sim Slot': 'No', 'Touchscreen': 'Yes', 'OTG Compatible': 'Yes', 'Sound Enhancements': 'Dolby Atmos and Dual Stereo Speakers', 'Display Size': '16.51 cm (6.5 inch)', 'Resolution': '1600 x 720 Pixels', 'GPU': 'Adreno 610', 'Display Type': 'TFT-LCD', 'Display Colors': '16M', 'Other Display Features': 'Touch Panel Technology: In-cell, Narrow Frame - Upper Border: 2.44mm, Left and Right Border: 1.98mm, Lower Border: 6.6mm, Screen Ratio: 89.0%, Screen Contrast: 1500:1, Color Saturation: Typical 71%, Maximum Brightness: 480nits, Touch Panel Glass Type: GG3+, TYPE-C USB 2.0', 'Operating System': 'Android Pie 9', 'Processor Type': 'Qualcomm SM6125', 'Processor Core': 'Octa Core', 'Primary Clock Speed': '1.8 GHz', 'Secondary Clock Speed': '2 GHz', 'Internal Storage': '128 GB', 'RAM': '4 GB', 'Memory Card Slot Type': 'Dedicated Slot', 'Primary Camera Available': 'Yes', 'Primary Camera': '48MP + 8MP + 2MP + 2MP', 'Primary Camera Features': 'Ultra Wide Quad Camera, Sensor Type: 48MP CMOS/S5KGM1SP/OV48B, 8MP COMS/Hi846/OV8856, 2MP CMOS/OV02A1B/GC02M0, 2MP CMOS/GC02M0/OV02A1B, Maximum Zoom Multiples: 10X, Aperture: 48MP (f/1.8) + 8MP (f/2.25) + 2MP (f/2.4) + 2MP (f/2.4), Focal Length: 48MP (4.71mm) + 8MP (1.66mm) + 2MP (1.77mm) + 2MP (f1.77mm), Lens Number: 48MP (6P) + 8MP (5P) + 2MP (3P) + 2MP (3P)', 'Secondary Camera Available': 'Yes', 'Secondary Camera': '16MP Front Camera', 'Secondary Camera Features': 'Sensor Sizes/Pixel Data - 1/3.1inch, 1.0micrometer, Sensor Type: S5K3P9SP04, Wide Angle of Front: 79Degree, Aperture: F2.0, Focal Length: 3.42mm, Lens Number: 5P', 'Flash': 'Rear LED Flash', 'Frame Rate': 'Front Camera Video: 1080P/720P at 30 fps', 'Dual Camera Lens': 'Primary Camera', 'Network Type': '4G VOLTE, 4G, 3G, 2G', 'Supported Networks': '4G VoLTE, UMTS, GSM, 4G LTE, WCDMA, CDMA', 'Internet Connectivity': '4G, 3G, Wi-Fi, EDGE, GPRS', '3G Speed': 'HSPA+', 'GPRS': 'Yes', 'Micro USB Port': 'Yes', 'Micro USB Version': '2', 'Bluetooth Support': 'Yes', 'Bluetooth Version': 'v5.0', 'Wi-Fi': 'Yes', 'Wi-Fi Version': '802.11a/b/g/n/ac', 'USB Connectivity': 'Yes', 'EDGE': 'Yes', 'Audio Jack': '3.5mm', 'Smartphone': 'Yes', 'Touchscreen Type': 'Capacitive Screen, Multi-touch', 'SIM Size': 'Dual Nano SIM', 'User Interface': 'ColorOS 6.0.1', 'Removable Battery': 'No', 'Graphics PPI': '269 PPI', 'Ringtones Format': 'MP3/AMR/APE/OGG/FLAC/WAV/MIDI/WMA', 'Other Features': 'Face Recognition, Split Screen (Specific Apps), Clone Apps, Night Shield, Sensor Hub, Game Acceleration (Specific Apps), CPU Technology - 11nm, ROM Technology: UFS 2.1, Energy Density - 696 Wh/L, Charge Speed/Power - 5V 2A, 10W, WLAN 2.4G, WLAN 5.1G, WLAN 5.8G, WLAN Display, Game Boost 2.0, 4G+, 64 bits Processor, Video Stability, Ultra Night Mode 2.0, Reverse Charging', 'FM Radio': 'Yes', 'Audio Formats': 'MP3/AAC/APE/AMR/WAV/MID/OGG/FLAC/WMA', 'Video Formats': 'AVI/3GP/MP4/WMV/MKV/MOV/ASF/FLV', 'Battery Capacity': '5000 mAh', 'Width': '75.6 mm', 'Height': '163.6 mm', 'Depth': '9.1 mm', 'Weight': '195 g', 'Warranty Summary': 'Brand Warranty of 1 Year Available for Mobile and 6 Months for Accessories'}",14990
