Name,Stars,Ratings,Reviews,Specifications,Price
"Apple iPhone 11 (Purple, 128 GB)",4.7,"10,341 Ratings",904 Reviews,"{'In The Box': 'Handset, EarPods with Lightning Connector, Lightning to USB Cable, USB Power Adapter, Documentation', 'Model Number': 'MWM52HN/A', 'Model Name': 'iPhone 11', 'Color': 'Purple', 'Browse Type': 'Smartphones', 'SIM Type': 'Dual Sim', 'Hybrid Sim Slot': 'No', 'Touchscreen': 'Yes', 'OTG Compatible': 'No', 'SAR Value': '1.6 W/kg (over 1 g) SAR Limit, Head: 1.09, Body: 1.18', 'Display Size': '15.49 cm (6.1 inch)', 'Resolution': '1792 x 828 Pixels', 'Resolution Type': 'Liquid Retina HD Display', 'Other Display Features': '1400:1 Contrast Ratio (Typical), True Tone Display, Wide Colour Display (P3), Haptic Touch, 625 nits Max Brightness (Typical), Fingerprint Resistant Oleophobic Coating, Support for Display of Multiple Languages and Characters Simultaneously', 'Operating System': 'iOS 13', 'Processor Type': 'A13 Bionic Chip', 'Internal Storage': '128 GB', 'Primary Camera Available': 'Yes', 'Primary Camera': '12MP + 12MP', 'Primary Camera Features': 'Dual 12MP Ultra Wide and Wide Cameras, Ultra Wide: f/2.4 Aperture and 120Degree Field of View, Wide: f/1.8 Aperture, Portrait Mode with Advanced Bokeh and Depth Control, Portrait Lighting with Six Effects (Natural, Studio, Contour, Stage, Stage Mono, High-key Mono), Optical Image Stabilisation (Wide), Five Element Lens (Ultra Wide), Six Element Lens (Wide), Brighter True Tone Flash with Slow Sync, Panorama (Up to 64MP), 100% Focus Pixels (Wide), Night Mode, Auto Adjustments, Next-generation Smart HDR for Photos, Wide Colour Capture for Photos and Live Photos, Advanced Red Eye Correction, Auto Image Stabilisation, Burst Mode, Photo Geotagging, Image Formats Captured: HEIF and JPEG', 'Optical Zoom': 'Yes', 'Secondary Camera Available': 'Yes', 'Secondary Camera': '12MP Front Camera', 'Secondary Camera Features': 'TrueDepth Camera - 12MP Camera, f/2.2 Aperture, Portrait Mode with Advanced Bokeh and Depth Control, Portrait Lighting with Six Effects (Natural, Studio, Contour, Stage, Stage Mono, High Key Mono), Animoji and Memoji, 4K Video Recording at 24 fps, 30 fps or 60 fps, 1080p HD Video Recording at 30 fps or 60 fps, Slow-motion Video Support for 1080p at 120 fps, Next Generation Smart HDR for Photos, Extended Dynamic Range for Video at 30 fps, Cinematic Video Stabilisation (4K, 1080p and 720p), Wide Colour Capture for Photos and Live Photos, Retina Flash, Auto Image Stabilisation, Burst Mode', 'Flash': 'Rear Brighter True Tone Flash with Slow Sync and Front Retina Flash', 'HD Recording': 'Yes', 'Full HD Recording': 'Yes', 'Video Recording': 'Yes', 'Frame Rate': 'Rear Camera - 4K Video Recording at 24 fps, 30 fps or 60 fps, 1080p HD Video Recording at 30 fps or 60 fps, 720p HD Video Recording at 30 fps, Extended Dynamic Range for Video upto 60 fps, Slow-motion Video Support for 1080p at 120 fps or 240 fps | True Depth Camera - 4K Video Recording at 24 fps, 30 fps or 60 fps, 1080p HD Video Recording at 30 fps or 60 fps, Slow-motion Video Support for 1080p at 120 fps, Extended Dynamic Range for Video at 30 fps fps', 'Dual Camera Lens': 'Primary Camera', 'Phone Book': 'Yes', 'Speaker Phone': 'Yes', 'Network Type': '4G VOLTE, 4G, 3G, 2G', 'Supported Networks': '4G VoLTE, 4G LTE, UMTS, GSM', 'Internet Connectivity': '4G, 3G, Wi-Fi', '3G': 'Yes', 'Pre-installed Browser': 'Safari', 'Bluetooth Support': 'Yes', 'Bluetooth Version': '5', 'Wi-Fi': 'Yes', 'Wi-Fi Version': '802.11ax Wi-Fi 6 with 2x2 MIMO', 'Wi-Fi Hotspot': 'Yes', 'NFC': 'Yes', 'Smartphone': 'Yes', 'SIM Size': 'Nano SIM and eSIM', 'Removable Battery': 'No', 'Graphics PPI': '326 PPI', 'Sensors': 'Face ID, Barometer, Three Axis Gyro, Accelerometer, Proximity Sensor, Ambient Light Sensor', 'Supported Languages': 'Multi Languages Support', 'Series': 'iPhone 11', 'Other Features': 'Faster Face ID, Slo-mo Selfies, Water Resistant upto 2 Metres for up to 30 Minutes�', 'Audio Formats': 'AAC LC, HE AAC, HE AAC v2, Protected AAC, MP3, Linear PCM, Apple Lossless, FLAC, Dolby Digital (AC 3), Dolby Digital Plus (E AC 3), Dolby Atmos and Audible (Formats 2, 3, 4, Audible Enhanced Audio, AAX and AAX+)', 'Video Formats': 'HEVC, H.264, MPEG 4 Part 2 and Motion JPEG, Supports Dolby Vision and HDR10 Content', 'Width': '75.7 mm', 'Height': '150.9 mm', 'Depth': '8.3 mm', 'Weight': '194 g', 'Warranty Summary': 'Brand Warranty for 1 Year'}",69900
"OPPO F15 (Unicorn White, 128 GB)  (8 GB RAM)",4.4,"4,430 Ratings",460 Reviews,"{'In The Box': 'Handset, Headset, USB Cable, Adapter, SIM Card Pin, Protective Case, Quick Guide, Warranty Card', 'Model Number': 'CPH2001', 'Model Name': 'F15', 'Color': 'Unicorn White', 'Browse Type': 'Smartphones', 'SIM Type': 'Dual Sim', 'Hybrid Sim Slot': 'No', 'Touchscreen': 'Yes', 'OTG Compatible': 'Yes', 'Sound Enhancements': 'Dirac Audio, Dual Mic Noise Suppression', 'SAR Value': 'Head: 1.20 W/kg, Body: 0.55 W/kg', 'Display Size': '16.26 cm (6.4 inch)', 'Resolution': '2400 x 1080 Pixels', 'Resolution Type': 'Full HD+', 'GPU': 'ARM Mali G72 MP3 900 MHz', 'Display Type': 'AMOLED', 'Other Display Features': 'Screen Proportion: 20:9, Upper Frame: 2.32mm, Left and Right Frame: 1.67mm, Lower Frame: 5.2mm, Screen Ratio: 90.8%, Color Gamut: 100% NTSC, 104% NTSC DCI - P3, Color Contrast: 1000000:1, Color Saturation: Typical Value 100%, Maximum Screen Brightness: Typical Value 430nit, Corning Gorilla Glass 5, Multi-touch: 10, Oleophobic Layer, Oleophobic Layer on Film, Screen Refresh Rate: 60Hz, Touch Sampling Rate: 135Hz, TUV Rheinland Eye Comfort Certification, No Stroboscopic Eye Protection', 'Operating System': 'Android Pie 9', 'Processor Type': 'Helio P70', 'Processor Core': 'Octa Core', 'Primary Clock Speed': '2.1 GHz', 'Secondary Clock Speed': '2 GHz', 'Operating Frequency': 'GSM: 850/900/1800/1900 MHz, WCDMA: B1/B5/B8, FDD-LTE: B1/B3/B5/B8, TD-LTE: B38/B40/B41', 'Internal Storage': '128 GB', 'RAM': '8 GB', 'Expandable Storage': '256 GB', 'Supported Memory Card Type': 'microSD', 'Memory Card Slot Type': 'Dedicated Slot', 'Primary Camera Available': 'Yes', 'Primary Camera': '48MP + 8MP + 2MP + 2MP', 'Primary Camera Features': '48MP AI Quad Cam, Sensor Sizes/Pixel Size: Main 1/2.25inch, 0.8micrometer, Secondary Wide Angle: 1/4inch, 1.12 micrometer, 2M 1/5inch, 1.75micrometer, Sensor Type: CMOS, Zoom Mode: Main - 10X Digital Zoom, Wide Angle - 2X Digital Zoom, Aperture: Main - f/1.79, Wide Angle - f/2.25, Portrait and Mono - f/2.4, Focal Length: Main - 4.71mm, Wide Angle - 1.66mm, Portrait and Mono - 1.77mm, Wide Angle: Main - 79Degree, Wide Angle - 119 Degree, Portrait and Mono - 88.8Degree, Consecutive Shooting: Yes (20 Photos), Macro Lens: Back 3CM Macro Camera, EIS Stabilization, Lens Glass Material: GG5, Corning Gorilla Glass 5, Photo Size: 8000 x 6000 (FHD+ Mode), 4000 x 3000 (Standard Mode), Ultra Clear Mode 48MP, Photo, Video, Professional Mode, Panorama, Portrait, Night Scene, Time-lapse Photography, Slow Motion, Macro, Video Stabilization, AI Scene Recognition, Full Light for Shooting Video, MP4 Video Format, Anti-shake Video, Ultra Night Mode 2.0', 'Secondary Camera Available': 'Yes', 'Secondary Camera': '16MP Front Camera', 'Secondary Camera Features': 'Camera Structure: Water-drop, Sensor Type: CMOS (4-in-1 Pixel Technology), Sensor Size/Pixel Size: 1/3.1inch, 1.0micrometer, Focal Length: 3.54mm, Wide Angle of Front Lens: 77Degree, Flashlight Aperture: f/2.0, Lens Structure: 5P, Focusing Type: Focus, Lens Glass Material: GG5, Corning Gorilla Glass 5, Photo Size: 4608 x 3456, MP4 Video Format', 'Frame Rate': 'Rear Camera: Slow-motion Video - 1080p at 120fps, 720p at 240fps, Rear Camera: 1080P at 30fps, 720P at 30fps, Front Camera: 1080P/720P at 30fps, Rear Camera Default: 1080P at 30fps, Front Camera Default: 720P at 30fps fps', 'Dual Camera Lens': 'Primary Camera', 'Video Call Support': 'Yes', 'Call Records': 'Yes', 'Network Type': '4G VOLTE, 4G, 3G, 2G', 'Supported Networks': '4G VoLTE, 4G LTE, UMTS, WCDMA, CDMA, GSM', 'Internet Connectivity': '4G, 3G, Wi-Fi, EDGE, GPRS', '3G Speed': 'HSPA+', 'GPRS': 'Yes', 'Bluetooth Support': 'Yes', 'Bluetooth Version': 'v4.2', 'Wi-Fi': 'Yes', 'Wi-Fi Version': '802.11a/b/g/n/ac', 'Wi-Fi Hotspot': 'Yes', 'EDGE': 'Yes', 'Audio Jack': '3.5mm', 'Map Support': 'Google Maps', 'GPS Support': 'Yes', 'Touchscreen Type': 'Multi-touch Capacitive Screen', 'SIM Size': 'Dual Nano SIM', 'User Interface': 'ColorOS 6.1.2', 'Graphics PPI': '408 PPI', 'Sensors': 'In-screen Fingerprint, Magnetic Induction Sensor, Light Sensor, Proximity Sensor, G - Sensor/Acceleration Sensor, Gyroscope, Pedometer', 'Ringtones Format': 'MP3, AMR, APE, OGG, FLAC, WAV, MIDI, WMA', 'Other Features': ""Split Screen,Apps with Game Boost (Popular Games), Google Lens, Data Backup, Oshare (Indian Phone Number's Recognition), Apps Lock, Office Tools: Office Suite, Firewall: Support Call/Message Firewall, Files Zip/Unzip, File Encryption, 64bit Processor, Baseband Structure: 4 (Cortex A73) + 4 (Cortex A53), 12nm Processor, ROM Technology: UFS2.1, VoLTE, 4G Data Rate: 75Mbps (Carrier Model 150mbps), Downlink: 150Mbps (Carrrier Model 300Mbps), WLAN: 2.4G, 5.1G, 5.8G WLAN Display, USB 2.0, VOOC Flash Charge 3.0, Reverse Charging, Standard Charge Power: 20W, Type-C USB Jack, Pin Number (USB): 14, Face Recognition, Single Channel,Eye Protection Mode, Clone App, Banner Call, Game Boost, Kids Space, Text Input, Support HD, Webpage Video Play, World Time, Lock Screen Clock, OPPO Share, E-compass, E-book, Screen Recording, Background Freeze, Caller Avatar, Call Background, Contact Grouping, Group Customization, Import/Export Messages, Number of Ram Channels: 2, Fingerprint Reset password, Sleek Design, Flashlight"", 'Important Apps': 'Bulit-in Browser: Chrome, Opera, OPPO Browsers', 'GPS Type': 'A-GPS, GLONASS, BeiDou', 'FM Radio': 'No', 'Audio Formats': 'AAC, APE, FLAC, AMR, MID, MP3, OGG, WAV, WMA, MKA', 'Video Formats': 'MP4, 3GP, ASF, AVI, FLV, M2TS, MKV, MPG, TS, WEBM, WMV', 'Battery Capacity': '4000 mAh', 'Width': '73.3 mm', 'Height': '160.2 mm', 'Depth': '7.9 mm', 'Weight': '172 g', 'Warranty Summary': 'Brand Warranty of 1 Year Available for Mobile Including Battery and 6 Months for Accessories'}",19990
"Apple iPhone 11 (White, 128 GB)",4.7,"10,341 Ratings",904 Reviews,"{'In The Box': 'Handset, EarPods with Lightning Connector, Lightning to USB Cable, USB Power Adapter, Documentation', 'Model Number': 'MWM22HN/A', 'Model Name': 'iPhone 11', 'Color': 'White', 'Browse Type': 'Smartphones', 'SIM Type': 'Dual Sim', 'Hybrid Sim Slot': 'No', 'Touchscreen': 'Yes', 'OTG Compatible': 'No', 'SAR Value': '1.6 W/kg (over 1 g) SAR Limit, Head: 1.09, Body: 1.18', 'Display Size': '15.49 cm (6.1 inch)', 'Resolution': '1792 x 828 Pixels', 'Resolution Type': 'Liquid Retina HD Display', 'Other Display Features': '1400:1 Contrast Ratio (Typical), True Tone Display, Wide Colour Display (P3), Haptic Touch, 625 nits Max Brightness (Typical), Fingerprint Resistant Oleophobic Coating, Support for Display of Multiple Languages and Characters Simultaneously', 'Operating System': 'iOS 13', 'Processor Type': 'A13 Bionic Chip', 'Internal Storage': '128 GB', 'Primary Camera Available': 'Yes', 'Primary Camera': '12MP + 12MP', 'Primary Camera Features': 'Dual 12MP Ultra Wide and Wide Cameras, Ultra Wide: f/2.4 Aperture and 120Degree Field of View, Wide: f/1.8 Aperture, Portrait Mode with Advanced Bokeh and Depth Control, Portrait Lighting with Six Effects (Natural, Studio, Contour, Stage, Stage Mono, High-key Mono), Optical Image Stabilisation (Wide), Five Element Lens (Ultra Wide), Six Element Lens (Wide), Brighter True Tone Flash with Slow Sync, Panorama (Up to 64MP), 100% Focus Pixels (Wide), Night Mode, Auto Adjustments, Next-generation Smart HDR for Photos, Wide Colour Capture for Photos and Live Photos, Advanced Red Eye Correction, Auto Image Stabilisation, Burst Mode, Photo Geotagging, Image Formats Captured: HEIF and JPEG', 'Optical Zoom': 'Yes', 'Secondary Camera Available': 'Yes', 'Secondary Camera': '12MP Front Camera', 'Secondary Camera Features': 'TrueDepth Camera - 12MP Camera, f/2.2 Aperture, Portrait Mode with Advanced Bokeh and Depth Control, Portrait Lighting with Six Effects (Natural, Studio, Contour, Stage, Stage Mono, High Key Mono), Animoji and Memoji, 4K Video Recording at 24 fps, 30 fps or 60 fps, 1080p HD Video Recording at 30 fps or 60 fps, Slow-motion Video Support for 1080p at 120 fps, Next Generation Smart HDR for Photos, Extended Dynamic Range for Video at 30 fps, Cinematic Video Stabilisation (4K, 1080p and 720p), Wide Colour Capture for Photos and Live Photos, Retina Flash, Auto Image Stabilisation, Burst Mode', 'Flash': 'Rear Brighter True Tone Flash with Slow Sync and Front Retina Flash', 'HD Recording': 'Yes', 'Full HD Recording': 'Yes', 'Video Recording': 'Yes', 'Frame Rate': 'Rear Camera - 4K Video Recording at 24 fps, 30 fps or 60 fps, 1080p HD Video Recording at 30 fps or 60 fps, 720p HD Video Recording at 30 fps, Extended Dynamic Range for Video upto 60 fps, Slow-motion Video Support for 1080p at 120 fps or 240 fps | True Depth Camera - 4K Video Recording at 24 fps, 30 fps or 60 fps, 1080p HD Video Recording at 30 fps or 60 fps, Slow-motion Video Support for 1080p at 120 fps, Extended Dynamic Range for Video at 30 fps fps', 'Dual Camera Lens': 'Primary Camera', 'Phone Book': 'Yes', 'Speaker Phone': 'Yes', 'Network Type': '4G VOLTE, 4G, 3G, 2G', 'Supported Networks': '4G VoLTE, 4G LTE, UMTS, GSM', 'Internet Connectivity': '4G, 3G, Wi-Fi', '3G': 'Yes', 'Pre-installed Browser': 'Safari', 'Bluetooth Support': 'Yes', 'Bluetooth Version': '5', 'Wi-Fi': 'Yes', 'Wi-Fi Version': '802.11ax Wi-Fi 6 with 2x2 MIMO', 'Wi-Fi Hotspot': 'Yes', 'NFC': 'Yes', 'Smartphone': 'Yes', 'SIM Size': 'Nano SIM and eSIM', 'Removable Battery': 'No', 'Graphics PPI': '326 PPI', 'Sensors': 'Face ID, Barometer, Three Axis Gyro, Accelerometer, Proximity Sensor, Ambient Light Sensor', 'Supported Languages': 'Multi Languages Support', 'Series': 'iPhone 11', 'Other Features': 'Faster Face ID, Slo-mo Selfies, Water Resistant upto 2 Metres for up to 30 Minutes�', 'Audio Formats': 'AAC LC, HE AAC, HE AAC v2, Protected AAC, MP3, Linear PCM, Apple Lossless, FLAC, Dolby Digital (AC 3), Dolby Digital Plus (E AC 3), Dolby Atmos and Audible (Formats 2, 3, 4, Audible Enhanced Audio, AAX and AAX+)', 'Video Formats': 'HEVC, H.264, MPEG 4 Part 2 and Motion JPEG, Supports Dolby Vision and HDR10 Content', 'Width': '75.7 mm', 'Height': '150.9 mm', 'Depth': '8.3 mm', 'Weight': '194 g', 'Warranty Summary': 'Brand Warranty for 1 Year'}",69900
"Vivo Y17 (Mystic Purple, 128 GB)  (4 GB RAM)",4.4,"10,965 Ratings",884 Reviews,"{'In The Box': 'Handset, User Manual, Micro-USB to USB Cable, USB Power Adapter, SIM Ejector Pin, Protective Case, Protective Film (1 Applied), Earphones (XE160)', 'Model Number': 'Vivo 1902', 'Model Name': 'Y17', 'Color': 'Mystic Purple', 'Browse Type': 'Smartphones', 'SIM Type': 'Dual Sim', 'Hybrid Sim Slot': 'No', 'Touchscreen': 'Yes', 'OTG Compatible': 'Yes', 'Quick Charging': 'Yes', 'SAR Value': 'Head: 1.007 W/kg, Body: 0.752 W/kg', 'Display Size': '16.13 cm (6.35 inch)', 'Resolution': '720 x 1544 pixels', 'Resolution Type': 'HD+', 'GPU': 'GE8320', 'Display Type': 'LCD', 'Display Colors': '16.7M', 'Other Display Features': 'Halo FullView Display, 19.3:9 Aspect Ratio, 89% Screen to Body Ratio, Material Display: LCD', 'Operating System': 'Android Pie 9.0', 'Processor Type': 'MTK Helio P35 (MT6765)', 'Processor Core': 'Octa Core', 'Primary Clock Speed': '2.3 GHz', 'Operating Frequency': 'GSM: B3/B5/B8, WCDMA: B1/B5/B8, 4G LTE-FDD: B1/B3/B5/B8, 4G LTE-TDD: B40/B41', 'Internal Storage': '128 GB', 'RAM': '4 GB', 'Expandable Storage': '256 GB', 'Supported Memory Card Type': 'microSD', 'Memory Card Slot Type': 'Dedicated Slot', 'Call Log Memory': 'Yes', 'Primary Camera Available': 'Yes', 'Primary Camera': '13MP + 2MP + 8MP', 'Primary Camera Features': 'Face Beauty for Video Calls, Time Watermark, Time Lapse, Auto Scene, Panorama, 120Degree AI Super Wide Angle Camera, PPT, Camera Filter, Voice Control, Live Photos, AI Face Beauty, Slow Motion, Palm Capture, HDR, Gender Detection, Professional, PDAF, Model Watermark, Portrait Bokeh, Aperture: f/2.2 (13MP) + f/2.2 (8MP) + f/2.4 (2MP), AI Triple Rear Camera', 'Secondary Camera Available': 'Yes', 'Secondary Camera': '20MP Front Camera', 'Secondary Camera Features': 'Time Watermark, Panorama, Aperture: f/2.0, Live Photo, Voice Control, Pro, Beauty Camera Filter, Face Beauty, Portrait, Doc, Palm Capture, HDR, Gender Detection, Model Watermark', 'Flash': 'Rear LED Flash and Front Screen Flash', 'HD Recording': 'Yes', 'Full HD Recording': 'Yes', 'Video Recording': 'Yes', 'Video Recording Resolution': '1080p', 'Frame Rate': '30 fps', 'Dual Camera Lens': 'Primary Camera', 'Phone Book': 'Yes', 'Network Type': '3G, 4G VOLTE, 4G, 2G', 'Supported Networks': 'GSM, WCDMA, 4G VoLTE, 4G LTE', 'Internet Connectivity': '4G, 3G, Wi-Fi', '3G': 'Yes', 'Pre-installed Browser': 'Vivo Browser, UC Browser, Google Chrome', 'Micro USB Port': 'Yes', 'Bluetooth Support': 'Yes', 'Bluetooth Version': '5.0', 'Wi-Fi': 'Yes', 'Wi-Fi Hotspot': 'Yes', 'USB Connectivity': 'Yes', 'Audio Jack': '3.5mm', 'Map Support': 'Google Maps', 'GPS Support': 'Yes', 'Smartphone': 'Yes', 'Touchscreen Type': 'Capacitive Multi-touch', 'SIM Size': 'Nano SIM + Nano SIM', 'User Interface': 'Funtouch OS 9.0', 'Removable Battery': 'No', 'SMS': 'Yes', 'Graphics PPI': '268 PPI', 'SIM Access': 'Dual Standby', 'Sensors': 'Accelerometer, Ambient Light Sensor, Proximity Sensor, E-compass, Fingerprint Sensor, Virtual Gyroscope', 'Other Features': 'Wi-Fi Version: 2.4G + 5G, Face Access 2.0, Game Mode 6.0, Dual Engine Fast Charging (9V/2A), Dual 4G, Eye Protection Mode, Material Handset: Plastic, 12nm AI Octa Core Processor, Smart Split 3.0', 'Important Apps': 'Social Media Apps: Facebook, WhatsApp, Line, Google Services: Play Store, Google, Gmail, YouTube, Google Drive, Play Music, Play Movies & TV, Google Duo, Google Photos, Others: WPS Office, Amazon, NewsPoint, PhonePe, App Clone: Facebook, WhatsApp', 'GPS Type': 'BeiDou, GLONASS, Galileo', 'FM Radio': 'Yes', 'Audio Formats': 'WAV, MP3, AMR, MIDI, APE, FLAC, Vorbis', 'Video Formats': 'MP4, 3GP, AVI, TS, MKV, FLV', 'Battery Capacity': '5000 mAh', 'Width': '76.77 mm', 'Height': '159.43 mm', 'Depth': '8.92 mm', 'Weight': '190.5 g', 'Warranty Summary': 'Brand Warranty of 1 Year Available for Mobile and 6 Months for Accessories'}",13990
"POCO X2 (Phoenix Red, 128 GB)  (6 GB RAM)",4.6,"25,935 Ratings","3,308 Reviews","{'In The Box': 'Handset, USB Type C Data Cable, SIM Ejector Tool, User Guide, 27W Fast Charger', 'Model Number': 'MZB8742IN', 'Model Name': 'X2', 'Color': 'Phoenix Red', 'Browse Type': 'Smartphones', 'SIM Type': 'Dual Sim', 'Hybrid Sim Slot': 'Yes', 'Touchscreen': 'Yes', 'OTG Compatible': 'Yes', 'Quick Charging': 'Yes', 'Sound Enhancements': '1217 Super Linear Speaker, Dual Mic Microphone', 'SAR Value': 'Head - 1.080 W/kg, Body - 0.620 W/kg', 'Display Size': '16.94 cm (6.67 inch)', 'Resolution': '2400 x 1080 Pixels', 'Resolution Type': 'Full HD+', 'GPU': 'Adreno 618', 'Other Display Features': 'Corning Gorilla Glass 5, 120Hz Display Refresh Rate, 20:9 Aspect Ratio, Screen Mirror/cast', 'Operating System': 'Android 10', 'Processor Type': 'Qualcomm Snapdragon 730G', 'Processor Core': 'Octa Core', 'Primary Clock Speed': '2.2 GHz', 'Operating Frequency': '4G: FDD - B1/B3/B5/B8, TDD - B40/B41, 3G: B1/B2/B5/B8, 2G: B2/B3/B5/B8', 'Internal Storage': '128 GB', 'RAM': '6 GB', 'Expandable Storage': '512 GB', 'Supported Memory Card Type': 'microSD', 'Memory Card Slot Type': 'Hybrid Slot', 'Primary Camera Available': 'Yes', 'Primary Camera': '64MP + 8MP + 2MP + 2MP', 'Primary Camera Features': 'Quad Rear Camera, Wide 64MP + Macro 2MP + Ultra 8MP + Depth 2MP, 64MP Ultra Clear Mode, Super Night Mode, AI Scene Detection, Ultra Wide Angle, Distortion Correction, Pro Mode, Portrait Mode, Panorama Mode, Slow Motion Capture', 'Secondary Camera Available': 'Yes', 'Secondary Camera': '20MP + 2MP Dual Front Camera', 'Secondary Camera Features': 'Dual In-display Camera, 20MP: 0.8micrometer, 2MP: 1.75micrometer, Gesture Camera, Front HDR, Short Video', 'Flash': 'Rear Flash', 'Frame Rate': 'Front: 720p at 30 fps, 1080p at 30 fps, Rear: 1080p at 60 fps, 4k at 30 fps', 'Dual Camera Lens': 'Primary Camera', 'Network Type': '4G VOLTE, 4G, 3G, 2G', 'Supported Networks': '4G VoLTE, UMTS, GSM, 4G LTE, WCDMA', 'Internet Connectivity': '4G, 3G, Wi-Fi', 'Bluetooth Support': 'Yes', 'Bluetooth Version': 'v5.0', 'Wi-Fi': 'Yes', 'Wi-Fi Version': '802.11 a/b/g/n/ac', 'Wi-Fi Hotspot': 'Yes', 'USB Connectivity': 'Yes', 'Audio Jack': '3.5mm', 'Map Support': 'Google Maps', 'GPS Support': 'Yes', 'SIM Size': 'Nano SIM', 'User Interface': 'MIUI 11', 'Removable Battery': 'No', 'Graphics PPI': '395 PPI', 'Sensors': 'Fingerprint Scanner', 'Other Features': 'Face Unlock, Dual App Support, USB Type C, Kryo 4 Architecture, Fingerprint Scanner Position: Side, Quick Charging Version: Supports Upto 27W', 'Battery Capacity': '4500 mAh', 'Width': '76.6 mm', 'Height': '165.3 mm', 'Depth': '8.79 mm', 'Weight': '208 g', 'Warranty Summary': 'Brand Warranty of 1 Year Available for Mobile and 6 Months for Accessories'}",16999
"OPPO A9 2020 (Space Purple, 128 GB)  (8 GB RAM)",4.3,"4,235 Ratings",360 Reviews,"{'In The Box': 'Handset, Adapter, Headset, Micro USB Cable, Important Info. Booklet with Warranty Card, Quick Start Guide, Sim Card Tool, Protective Film, Pre-applied, Case', 'Model Number': 'CPH1937', 'Model Name': 'A9 2020', 'Color': 'Space Purple', 'Browse Type': 'Smartphones', 'SIM Type': 'Dual Sim', 'Hybrid Sim Slot': 'No', 'Touchscreen': 'Yes', 'OTG Compatible': 'Yes', 'Sound Enhancements': 'Dolby Atmos and Dual Stereo Speakers', 'Display Size': '16.51 cm (6.5 inch)', 'Resolution': '1600 x 720 Pixels', 'GPU': 'Adreno 610', 'Display Type': 'TFT-LCD', 'Display Colors': '16M', 'Other Display Features': 'Touch Panel Technology: In-cell, Narrow Frame - Upper Border: 2.44mm, Left and Right Border: 1.98mm, Lower Border: 6.6mm, Screen Ratio: 89.0%, Screen Contrast: 1500:1, Color Saturation: Typical 71%, Maximum Brightness: 480nits, Touch Panel Glass Type: GG3+, TYPE-C USB 2.0', 'Operating System': 'Android Pie 9', 'Processor Type': 'Qualcomm SM6125', 'Processor Core': 'Octa Core', 'Primary Clock Speed': '1.8 GHz', 'Secondary Clock Speed': '2 GHz', 'Internal Storage': '128 GB', 'RAM': '8 GB', 'Memory Card Slot Type': 'Dedicated Slot', 'Primary Camera Available': 'Yes', 'Primary Camera': '48MP + 8MP + 2MP + 2MP', 'Primary Camera Features': 'Ultra Wide Quad Camera, Sensor Type: 48MP CMOS/S5KGM1SP/OV48B, 8MP COMS/Hi846/OV8856, 2MP CMOS/OV02A1B/GC02M0, 2MP CMOS/GC02M0/OV02A1B, Maximum Zoom Multiples: 10X, Aperture: 48MP (f/1.8) + 8MP (f/2.25) + 2MP (f/2.4) + 2MP (f/2.4), Focal Length: 48MP (4.71mm) + 8MP (1.66mm) + 2MP (1.77mm) + 2MP (f1.77mm), Lens Number: 48MP (6P) + 8MP (5P) + 2MP (3P) + 2MP (3P)', 'Secondary Camera Available': 'Yes', 'Secondary Camera': '16MP Front Camera', 'Secondary Camera Features': 'Sensor Sizes/Pixel Data - 1/3.1inch, 1.0micrometer, Sensor Type: S5K3P9SP04, Wide Angle of Front: 79Degree, Aperture: F2.0, Focal Length: 3.42mm, Lens Number: 5P', 'Flash': 'Rear LED Flash', 'Frame Rate': 'Front Camera Video: 1080P/720P at 30 fps', 'Dual Camera Lens': 'Primary Camera', 'Network Type': '4G VOLTE, 4G, 3G, 2G', 'Supported Networks': '4G VoLTE, UMTS, GSM, 4G LTE, WCDMA, CDMA', 'Internet Connectivity': '4G, 3G, Wi-Fi, EDGE, GPRS', '3G Speed': 'HSPA+', 'GPRS': 'Yes', 'Micro USB Port': 'Yes', 'Micro USB Version': '2', 'Bluetooth Support': 'Yes', 'Bluetooth Version': 'v5.0', 'Wi-Fi': 'Yes', 'Wi-Fi Version': '802.11a/b/g/n/ac', 'USB Connectivity': 'Yes', 'EDGE': 'Yes', 'Audio Jack': '3.5mm', 'Smartphone': 'Yes', 'Touchscreen Type': 'Capacitive Screen, Multi-touch', 'SIM Size': 'Dual Nano SIM', 'User Interface': 'ColorOS 6.0.1', 'Removable Battery': 'No', 'Graphics PPI': '269 PPI', 'Ringtones Format': 'MP3/AMR/APE/OGG/FLAC/WAV/MIDI/WMA', 'Other Features': 'Face Recognition, Split Screen (Specific Apps), Clone Apps, Night Shield, Sensor Hub, Game Acceleration (Specific Apps), CPU Technology - 11nm, ROM Technology: UFS 2.1, Energy Density - 696 Wh/L, Charge Speed/Power - 5V 2A, 10W, WLAN 2.4G, WLAN 5.1G, WLAN 5.8G, WLAN Display, Game Boost 2.0, 4G+, 64 bits Processor, Video Stability, Ultra Night Mode 2.0, Reverse Charging', 'FM Radio': 'Yes', 'Audio Formats': 'MP3/AAC/APE/AMR/WAV/MID/OGG/FLAC/WMA', 'Video Formats': 'AVI/3GP/MP4/WMV/MKV/MOV/ASF/FLV', 'Battery Capacity': '5000 mAh', 'Width': '75.6 mm', 'Height': '163.6 mm', 'Depth': '9.1 mm', 'Weight': '195 g', 'Warranty Summary': 'Brand Warranty of 1 Year Available for Mobile and 6 Months for Accessories'}",17490
