Name,Stars,Ratings,Reviews,Specifications,Price
"OPPO F15 (Unicorn White, 128 GB)  (8 GB RAM)",4.4,"4,430 Ratings",460 Reviews,"{'In The Box': 'Handset, Headset, USB Cable, Adapter, SIM Card Pin, Protective Case, Quick Guide, Warranty Card', 'Model Number': 'CPH2001', 'Model Name': 'F15', 'Color': 'Unicorn White', 'Browse Type': 'Smartphones', 'SIM Type': 'Dual Sim', 'Hybrid Sim Slot': 'No', 'Touchscreen': 'Yes', 'OTG Compatible': 'Yes', 'Sound Enhancements': 'Dirac Audio, Dual Mic Noise Suppression', 'SAR Value': 'Head: 1.20 W/kg, Body: 0.55 W/kg', 'Display Size': '16.26 cm (6.4 inch)', 'Resolution': '2400 x 1080 Pixels', 'Resolution Type': 'Full HD+', 'GPU': 'ARM Mali G72 MP3 900 MHz', 'Display Type': 'AMOLED', 'Other Display Features': 'Screen Proportion: 20:9, Upper Frame: 2.32mm, Left and Right Frame: 1.67mm, Lower Frame: 5.2mm, Screen Ratio: 90.8%, Color Gamut: 100% NTSC, 104% NTSC DCI - P3, Color Contrast: 1000000:1, Color Saturation: Typical Value 100%, Maximum Screen Brightness: Typical Value 430nit, Corning Gorilla Glass 5, Multi-touch: 10, Oleophobic Layer, Oleophobic Layer on Film, Screen Refresh Rate: 60Hz, Touch Sampling Rate: 135Hz, TUV Rheinland Eye Comfort Certification, No Stroboscopic Eye Protection', 'Operating System': 'Android Pie 9', 'Processor Type': 'Helio P70', 'Processor Core': 'Octa Core', 'Primary Clock Speed': '2.1 GHz', 'Secondary Clock Speed': '2 GHz', 'Operating Frequency': 'GSM: 850/900/1800/1900 MHz, WCDMA: B1/B5/B8, FDD-LTE: B1/B3/B5/B8, TD-LTE: B38/B40/B41', 'Internal Storage': '128 GB', 'RAM': '8 GB', 'Expandable Storage': '256 GB', 'Supported Memory Card Type': 'microSD', 'Memory Card Slot Type': 'Dedicated Slot', 'Primary Camera Available': 'Yes', 'Primary Camera': '48MP + 8MP + 2MP + 2MP', 'Primary Camera Features': '48MP AI Quad Cam, Sensor Sizes/Pixel Size: Main 1/2.25inch, 0.8micrometer, Secondary Wide Angle: 1/4inch, 1.12 micrometer, 2M 1/5inch, 1.75micrometer, Sensor Type: CMOS, Zoom Mode: Main - 10X Digital Zoom, Wide Angle - 2X Digital Zoom, Aperture: Main - f/1.79, Wide Angle - f/2.25, Portrait and Mono - f/2.4, Focal Length: Main - 4.71mm, Wide Angle - 1.66mm, Portrait and Mono - 1.77mm, Wide Angle: Main - 79Degree, Wide Angle - 119 Degree, Portrait and Mono - 88.8Degree, Consecutive Shooting: Yes (20 Photos), Macro Lens: Back 3CM Macro Camera, EIS Stabilization, Lens Glass Material: GG5, Corning Gorilla Glass 5, Photo Size: 8000 x 6000 (FHD+ Mode), 4000 x 3000 (Standard Mode), Ultra Clear Mode 48MP, Photo, Video, Professional Mode, Panorama, Portrait, Night Scene, Time-lapse Photography, Slow Motion, Macro, Video Stabilization, AI Scene Recognition, Full Light for Shooting Video, MP4 Video Format, Anti-shake Video, Ultra Night Mode 2.0', 'Secondary Camera Available': 'Yes', 'Secondary Camera': '16MP Front Camera', 'Secondary Camera Features': 'Camera Structure: Water-drop, Sensor Type: CMOS (4-in-1 Pixel Technology), Sensor Size/Pixel Size: 1/3.1inch, 1.0micrometer, Focal Length: 3.54mm, Wide Angle of Front Lens: 77Degree, Flashlight Aperture: f/2.0, Lens Structure: 5P, Focusing Type: Focus, Lens Glass Material: GG5, Corning Gorilla Glass 5, Photo Size: 4608 x 3456, MP4 Video Format', 'Frame Rate': 'Rear Camera: Slow-motion Video - 1080p at 120fps, 720p at 240fps, Rear Camera: 1080P at 30fps, 720P at 30fps, Front Camera: 1080P/720P at 30fps, Rear Camera Default: 1080P at 30fps, Front Camera Default: 720P at 30fps fps', 'Dual Camera Lens': 'Primary Camera', 'Video Call Support': 'Yes', 'Call Records': 'Yes', 'Network Type': '4G VOLTE, 4G, 3G, 2G', 'Supported Networks': '4G VoLTE, 4G LTE, UMTS, WCDMA, CDMA, GSM', 'Internet Connectivity': '4G, 3G, Wi-Fi, EDGE, GPRS', '3G Speed': 'HSPA+', 'GPRS': 'Yes', 'Bluetooth Support': 'Yes', 'Bluetooth Version': 'v4.2', 'Wi-Fi': 'Yes', 'Wi-Fi Version': '802.11a/b/g/n/ac', 'Wi-Fi Hotspot': 'Yes', 'EDGE': 'Yes', 'Audio Jack': '3.5mm', 'Map Support': 'Google Maps', 'GPS Support': 'Yes', 'Touchscreen Type': 'Multi-touch Capacitive Screen', 'SIM Size': 'Dual Nano SIM', 'User Interface': 'ColorOS 6.1.2', 'Graphics PPI': '408 PPI', 'Sensors': 'In-screen Fingerprint, Magnetic Induction Sensor, Light Sensor, Proximity Sensor, G - Sensor/Acceleration Sensor, Gyroscope, Pedometer', 'Ringtones Format': 'MP3, AMR, APE, OGG, FLAC, WAV, MIDI, WMA', 'Other Features': ""Split Screen,Apps with Game Boost (Popular Games), Google Lens, Data Backup, Oshare (Indian Phone Number's Recognition), Apps Lock, Office Tools: Office Suite, Firewall: Support Call/Message Firewall, Files Zip/Unzip, File Encryption, 64bit Processor, Baseband Structure: 4 (Cortex A73) + 4 (Cortex A53), 12nm Processor, ROM Technology: UFS2.1, VoLTE, 4G Data Rate: 75Mbps (Carrier Model 150mbps), Downlink: 150Mbps (Carrrier Model 300Mbps), WLAN: 2.4G, 5.1G, 5.8G WLAN Display, USB 2.0, VOOC Flash Charge 3.0, Reverse Charging, Standard Charge Power: 20W, Type-C USB Jack, Pin Number (USB): 14, Face Recognition, Single Channel,Eye Protection Mode, Clone App, Banner Call, Game Boost, Kids Space, Text Input, Support HD, Webpage Video Play, World Time, Lock Screen Clock, OPPO Share, E-compass, E-book, Screen Recording, Background Freeze, Caller Avatar, Call Background, Contact Grouping, Group Customization, Import/Export Messages, Number of Ram Channels: 2, Fingerprint Reset password, Sleek Design, Flashlight"", 'Important Apps': 'Bulit-in Browser: Chrome, Opera, OPPO Browsers', 'GPS Type': 'A-GPS, GLONASS, BeiDou', 'FM Radio': 'No', 'Audio Formats': 'AAC, APE, FLAC, AMR, MID, MP3, OGG, WAV, WMA, MKA', 'Video Formats': 'MP4, 3GP, ASF, AVI, FLV, M2TS, MKV, MPG, TS, WEBM, WMV', 'Battery Capacity': '4000 mAh', 'Width': '73.3 mm', 'Height': '160.2 mm', 'Depth': '7.9 mm', 'Weight': '172 g', 'Warranty Summary': 'Brand Warranty of 1 Year Available for Mobile Including Battery and 6 Months for Accessories'}",19990
"OPPO A83 (Champagne, 16 GB)  (2 GB RAM)",4.2,299 Ratings,30 Reviews,"{'In The Box': 'Handset, Charger, Protective Case, USB Cable, SIM Ejector Tool, Quick Guide, Safety Guide', 'Model Number': 'CPH1827', 'Model Name': 'A83', 'Color': 'Champagne', 'Browse Type': 'Smartphones', 'SIM Type': 'Dual Sim', 'Hybrid Sim Slot': 'No', 'Touchscreen': 'Yes', 'OTG Compatible': 'Yes', 'Display Size': '14.48 cm (5.7 inch)', 'Resolution': '1440 x 720 Pixels', 'Resolution Type': 'HD', 'Display Type': 'TFT', 'Other Display Features': '83.9% (Display Area AA Peripheral Edge Size/Front Glass Area)', 'Operating System': 'Android Nougat 7.1', 'Processor Type': 'MT6763T', 'Processor Core': 'Octa Core', 'Primary Clock Speed': '2.5 GHz', 'Operating Frequency': 'GSM: 850/900/1800/1900, WCDMA: B1/5/8, 4G FDD: B1/3/5/8, TDD: B38/40/41 (2535 - 2655 MHz)', 'Internal Storage': '16 GB', 'RAM': '2 GB', 'Expandable Storage': '256 GB', 'Supported Memory Card Type': 'microSD', 'Memory Card Slot Type': 'Dedicated Slot', 'Primary Camera Available': 'Yes', 'Primary Camera': '13MP Rear Camera', 'Primary Camera Features': '5P Lens, F2.2 Aperture, Auto Focus, 1.12 micrometer, Wide Angle: 81Degree, Focal Length: 3.462mm, Photo Features: Ordinary Camera, Video, Professional Mode, Time-lapse Photography, Panorama, Sensor Size/Pixel Size: 1/3.06 inch, Macro Lens: Rear Macro 8cm', 'Secondary Camera Available': 'Yes', 'Secondary Camera': '8MP Front Camera', 'Secondary Camera Features': 'F2.2 Aperture, Photo Management, AI Beauty, Sensor Size/Pixel Size: 1/4 inch, Photo Features: Blur, Beauty, Filters, Panorama, HDR, Wide Angle: Front 85Degree, 4P Lens', 'Flash': 'Rear Single Flash', 'Video Recording': 'Yes', 'Video Recording Resolution': '1920 x 1080 pixels', 'Frame Rate': '30 fps', 'Network Type': '3G, 4G VOLTE, 4G, 2G', 'Supported Networks': 'GSM, WCDMA, 4G VoLTE, 4G LTE', 'Internet Connectivity': '4G, 3G, Wi-Fi', '3G': 'Yes', 'Bluetooth Support': 'Yes', 'Bluetooth Version': '4.2', 'Wi-Fi': 'Yes', 'Wi-Fi Version': 'IEEE 802.11a/b/g/n (2.4G/5G Dual-band)', 'Map Support': 'Google Maps', 'GPS Support': 'Yes', 'Smartphone': 'Yes', 'User Interface': 'ColorOS 3.2', 'Graphics PPI': '282 PPI', 'Sensors': 'Geomagnetic Induction, Light Sensor, Distance Sensor, Gravity Sensor', 'Other Features': 'Flashlight Function, Graphic Format Support: JPEG/PNG/GIF/BMP, Connect and Share, Support Download: E-book, Game, 4G + 3G SIM Type, Face Unlock', 'GPS Type': 'A-GPS', 'FM Radio': 'No', 'Audio Formats': 'MP3, AAC, APE, AMR, WAV, MID, OGG, FLAC, WMA', 'Video Formats': 'AVI, 3GP, MP4, WMV, MKV, MOV, ASF, FLV', 'Battery Capacity': '3180 mAh', 'Talk Time': '28 hrs', 'Width': '73.1 mm', 'Height': '150.5 mm', 'Depth': '7.7 mm', 'Weight': '143 g', 'Warranty Summary': 'Brand Warranty of 1 Year Available for Mobile and 6 Months for Accessories'}",8990
"Samsung Galaxy S9 (Coral Blue, 64 GB)  (4 GB RAM)",4.4,"15,548 Ratings","1,281 Reviews","{'In The Box': 'Handset, Travel Adapter, Data Cable, Stereo Headset, Ejection Pin, Case, USB Connector, User Manual', 'Model Number': 'SM-G960FZBDINS', 'Model Name': 'Galaxy S9', 'Color': 'Coral Blue', 'Browse Type': 'Smartphones', 'SIM Type': 'Dual Sim', 'Hybrid Sim Slot': 'Yes', 'Touchscreen': 'Yes', 'OTG Compatible': 'Yes', 'Display Size': '14.73 cm (5.8 inch)', 'Resolution': '2960 x 1440 Pixels', 'Resolution Type': 'Quad HD+', 'GPU': 'ARM Heimdall MP18', 'Display Type': 'Super AMOLED', 'Display Colors': '16M', 'Operating System': 'Android Oreo 8', 'Processor Type': 'Exynos 9810', 'Processor Core': 'Octa Core', 'Primary Clock Speed': '2.7 GHz', 'Secondary Clock Speed': '1.7 GHz', 'Internal Storage': '64 GB', 'RAM': '4 GB', 'Expandable Storage': '400 GB', 'Supported Memory Card Type': 'microSD', 'Memory Card Slot Type': 'Hybrid Slot', 'Primary Camera Available': 'Yes', 'Primary Camera': '12MP Rear Camera', 'Primary Camera Features': 'Auto, Food, Hyperlapse, Panorama, Pro, Selective Focus, Slow Motion, Sports, Stickers, Super slow-mo', 'Optical Zoom': 'No', 'Secondary Camera Available': 'Yes', 'Secondary Camera': '8MP Front Camera', 'Secondary Camera Features': 'Selfie, Wide Selfie', 'Flash': 'Rear Flash', 'HD Recording': 'Yes', 'Full HD Recording': 'Yes', 'Video Recording': 'Yes', 'Video Recording Resolution': '2160p', 'Digital Zoom': 'Yes', 'Frame Rate': 'HD Resolution at 960 fps', 'Network Type': '3G, 4G, 2G', 'Supported Networks': 'GSM, WCDMA, 4G LTE, UMTS', 'Internet Connectivity': '4G, 3G, Wi-Fi', '3G': 'Yes', 'Bluetooth Support': 'Yes', 'Bluetooth Version': '5', 'Wi-Fi': 'Yes', 'NFC': 'Yes', 'Audio Jack': '3.5 mm', 'Smartphone': 'Yes', 'SIM Size': 'Nano SIM', 'Removable Battery': 'No', 'Graphics PPI': '570 PPI', 'Audio Formats': 'MP3, M4A, 3GA, AAC, OGG, OGA, WAV, WMA, AMR, AWB, FLAC, MID, MIDI, XMF, MXMF, IMY, RTTTL, RTX, OTA, DFF, DSF, APE', 'Video Formats': 'MP4, M4V, 3GP, 3G2, WMV, ASF, AVI, FLV, MKV, WEBM', 'Battery Capacity': '3000 mAh', 'Width': '68.7 mm', 'Height': '147.7 mm', 'Depth': '8.5 mm', 'Weight': '163 g', 'Warranty Summary': 'Brand Warranty of 1 Year Available for Mobile and 6 Months for Accessories'}",26999
"Ismart Extreme (Sea Green, 32 GB)  (2 GB RAM)",3.5,12 Ratings,1 Reviews,"{'In The Box': 'Handset,Headset,Charger,Warrenty card,User Guide', 'Model Number': 'I1', 'Model Name': 'Extreme', 'Color': 'Sea Green', 'Browse Type': 'Smartphones', 'SIM Type': 'Dual Sim', 'Hybrid Sim Slot': 'No', 'Touchscreen': 'Yes', 'OTG Compatible': 'Yes', 'Quick Charging': 'Yes', 'Display Size': '15.9 cm (6.26 inch)', 'Resolution': '1920 x 1080$$pixel', 'Resolution Type': 'Full HD', 'Display Type': 'IPS', 'HD Game Support': 'Yes', 'Display Colors': '16 M', 'Operating System': 'Android Oreo 8.1', 'Processor Type': 'Snapdragon', 'Processor Core': 'Quad Core', 'Primary Clock Speed': '1.3 GHz', 'Internal Storage': '32 GB', 'RAM': '2 GB', 'Supported Memory Card Type': 'SD', 'Memory Card Slot Type': 'Dedicated Slot', 'Hot SWAP Support': 'Yes', 'Call Log Memory': 'Yes', 'Primary Camera Available': 'Yes', 'Primary Camera': '8MP Rear Camera', 'Primary Camera Features': '8 Megapixel Camera', 'Optical Zoom': 'Yes', 'Secondary Camera Available': 'Yes', 'Secondary Camera': '5MP Front Camera', 'Secondary Camera Features': '5 Megapixel', 'Flash': 'Yes', 'HD Recording': 'Yes', 'Full HD Recording': 'Yes', 'Video Recording': 'Yes', 'Video Recording Resolution': '1920 x 1080', 'Image Editor': 'Yes', 'Dual Camera Lens': 'Primary Camera', 'Call Wait/Hold': 'Yes', 'Conference Call': 'Yes', 'Hands Free': 'No', 'Video Call Support': 'Yes', 'Call Divert': 'Yes', 'Phone Book': 'Yes', 'Call Timer': 'Yes', 'Speaker Phone': 'Yes', 'Speed Dialing': 'Yes', 'Call Records': 'Yes', 'Logs': 'Yes', 'Network Type': '4G VOLTE', 'Supported Networks': '4G VoLTE, GSM', 'Internet Connectivity': '4G Volte', '3G': 'Yes', 'GPRS': 'Yes', 'WAP': 'No', 'Pre-installed Browser': 'Chrome', 'Micro USB Port': 'Yes', 'Mini USB Port': 'No', 'Bluetooth Support': 'Yes', 'Bluetooth Version': '4.2', 'Wi-Fi': 'Yes', 'Wi-Fi Hotspot': 'Yes', 'NFC': 'No', 'USB Tethering': 'Yes', 'TV Out': 'Yes', 'Infrared': 'Yes', 'USB Connectivity': 'Yes', 'EDGE': 'Yes', 'Audio Jack': '3.5', 'Map Support': 'Google', 'GPS Support': 'Yes', 'Smartphone': 'Yes', 'Touchscreen Type': 'IPS', 'SIM Size': 'Micro', 'Mobile Tracker': 'Yes', 'Keypad Type': 'Alphanumeric', 'User Interface': 'Yes', 'Social Networking Phone': 'Yes', 'Instant Message': 'Yes', 'Business Phone': 'Yes', 'Java Application': 'No', 'Removable Battery': 'No', 'JAVA Support': 'No', 'MMS': 'Yes', 'SMS': 'Yes', 'Keypad': 'No', 'Voice Input': 'Yes', 'User Memory': '25', 'SIM Access': '4G Volte', 'Sensors': 'Fingerprint sensor, Light Sensor, Proximity Sensor', 'Upgradable Operating System': 'No', 'Supported Languages': 'English, Hindi', 'Games': 'Yes', 'Series': 'I1', 'Browser': 'Chrome', 'Ringtones Format': 'Mp3', 'Important Apps': 'facebook', 'FM Radio': 'Yes', 'FM Radio Recording': 'Yes', 'DLNA Support': 'Yes', 'Audio Formats': 'Mp3', 'Music Player': 'Yes', 'Battery Capacity': '3000 mAh', 'Battery Type': 'Li-Ion', 'Talk Time': '10 hours', 'Dual Battery': 'Yes', 'Width': '78 mm', 'Height': '145 mm', 'Depth': '8.5 mm', 'Weight': '150 g', 'Warranty Summary': 'Six month warranty other than breakage. Customer need to send the product to nearest service center , in case, there is no service center nearby the product should be send to company back for repair.', 'Warranty Service Type': 'Domestic', 'Covered in Warranty': 'Mobile', 'Not Covered in Warranty': 'Acccessories', 'Domestic Warranty': '6 Months'}",4989
"Mi Mix 2 (Black, 128 GB)  (6 GB RAM)",4.4,"4,171 Ratings",802 Reviews,"{'In The Box': 'Handset, Handset Case, USB Cable, Adapter, SIM Tray Remover Pin, User Guide, Warranty Card', 'Model Number': 'MZB5778IN', 'Model Name': 'Mi Mix 2', 'Color': 'Black', 'Browse Type': 'Smartphones', 'SIM Type': 'Dual Sim', 'Hybrid Sim Slot': 'No', 'Touchscreen': 'Yes', 'OTG Compatible': 'Yes', 'Sound Enhancements': 'Speaker: One (Bottom Opening), Headphone Jack: USB Headphone, Microphones: 3 (Noise Cancellation)', 'SAR Value': 'Head - 0.880w/kg, Body - 0.850w/kg', 'Display Size': '15.21 cm (5.99 inch)', 'Resolution': '2160 x 1080 Pixels', 'Resolution Type': 'Full HD+', 'GPU': 'Adreno 540', 'Display Type': 'IPS', 'Other Display Features': 'Contrast Ratio: 1500:1, Resolution Type: Full HD+', 'Operating System': 'Android Nougat 7.1.1', 'Processor Type': 'Qualcomm Snapdragon 835 Octa Core 2.5 GHz', 'Processor Core': 'Octa Core', 'Primary Clock Speed': '2.5 GHz', 'Operating Frequency': '4G LTE TDD - B34, B38, B39, B40, B41 (2496 - 2690 MHz), LTE FDD - B1, B2, B3, B4, B5, B7, B8, B12, B13, B17, B18, B19, B20, B25, B26, B27 B28, B29, B30, WCDMA - B1, B2, B3, B4, B5, B6, B8, B9, B19, GSM - B2, B3, B5, B8', 'Internal Storage': '128 GB', 'RAM': '6 GB', 'Primary Camera Available': 'Yes', 'Primary Camera': '12MP Rear Camera', 'Primary Camera Features': 'Aperture: f/2.0, 1.25 microns Pixel Size, 4-axis, OIS, 6p Lens, PDAF', 'Secondary Camera Available': 'Yes', 'Secondary Camera': '5MP Front Camera', 'Secondary Camera Features': 'Aperture: f2.0, 1.12 microns Pixel Size, 4p Lens', 'Flash': 'Rear Dual Tone Flash', 'Video Recording': 'Yes', 'Network Type': '3G, 4G VOLTE, 2G', 'Supported Networks': 'GSM, WCDMA, 4G VoLTE, UMTS, 4G LTE', 'Internet Connectivity': '4G, 3G, Wi-Fi', '3G': 'Yes', 'Bluetooth Support': 'Yes', 'Bluetooth Version': '5', 'Wi-Fi': 'Yes', 'Wi-Fi Version': '802.11 a/b/g/n/ac', 'NFC': 'Yes', 'USB Connectivity': 'Yes', 'Map Support': 'Google Maps', 'GPS Support': 'Yes', 'Smartphone': 'Yes', 'SIM Size': 'Nano SIM and Nano SIM', 'SMS': 'Yes', 'Graphics PPI': '403 PPI', 'Sensors': 'Fingerprint Scanner, Ambient Light Sensor, Proximity Sensor, E-compass, Accelerometer, Gyroscope, Hall Sensor, Barometer', 'Other Features': '10 nm Architecture, UFS 2.0, Body: Metal Frame, Ceramic Body, USB: Type C', 'GPS Type': 'GLONASS, BeiDou', 'Battery Capacity': '3400 mAh', 'Width': '75.49 mm', 'Height': '151.86 mm', 'Depth': '7.7 mm', 'Weight': '185 g', 'Warranty Summary': 'Brand Warranty of 1 Year Available for Mobile and 6 Months for Accessories'}",29999
"Samsung Galaxy A50 (White, 64 GB)  (4 GB RAM)",4.3,"52,406 Ratings","4,987 Reviews","{'In The Box': 'Handset, Charger, Earphone, User Manual', 'Model Number': 'SM-A505FZWDINS', 'Model Name': 'Galaxy A50', 'Color': 'White', 'Browse Type': 'Smartphones', 'SIM Type': 'Dual Sim', 'Hybrid Sim Slot': 'No', 'Touchscreen': 'Yes', 'OTG Compatible': 'Yes', 'Quick Charging': 'Yes', 'Display Size': '16.26 cm (6.4 inch)', 'Resolution': '1080 x 2340 pixels', 'Resolution Type': 'Full HD+', 'Display Type': 'Super AMOLED', 'Operating System': 'Android Pie 9.0', 'Processor Type': 'Exynos 9610', 'Processor Core': 'Octa Core', 'Primary Clock Speed': '2.3 GHz', 'Secondary Clock Speed': '1.7 GHz', 'Internal Storage': '64 GB', 'RAM': '4 GB', 'Expandable Storage': '512 GB', 'Supported Memory Card Type': 'microSD', 'Memory Card Slot Type': 'Dedicated Slot', 'Primary Camera Available': 'Yes', 'Primary Camera': '25MP + 5MP + 8MP', 'Primary Camera Features': 'Aperture: F1.7 (25MP) + F2.2 (5MP) + F2.2 (8MP)', 'Secondary Camera Available': 'Yes', 'Secondary Camera': '25MP Front Camera', 'Secondary Camera Features': 'F2.0 Aperture', 'Image Editor': 'Yes', 'Dual Camera Lens': 'Primary Camera', 'Call Wait/Hold': 'Yes', 'Conference Call': 'Yes', 'Hands Free': 'Yes', 'Video Call Support': 'Yes', 'Call Divert': 'Yes', 'Phone Book': 'Yes', 'Call Timer': 'Yes', 'Speaker Phone': 'Yes', 'Speed Dialing': 'Yes', 'Network Type': '3G, 4G, 2G', 'Supported Networks': 'GSM, WCDMA, 4G LTE', 'Internet Connectivity': '4G, 3G, Wi-Fi, GPRS, WAP', '3G': 'Yes', 'GPRS': 'Yes', 'WAP': 'Yes', 'Bluetooth Support': 'Yes', 'Wi-Fi': 'Yes', 'Wi-Fi Hotspot': 'Yes', 'Smartphone': 'Yes', 'SIM Size': 'Nano SIM', 'Removable Battery': 'No', 'Sensors': 'Fingerprint Sensor', 'Other Features': 'Supported Network: 4G LTE-FDD', 'Battery Capacity': '4000 mAh', 'Width': '74.7 mm', 'Height': '158.5 mm', 'Depth': '7.7 mm', 'Weight': '166 g', 'Warranty Summary': 'Brand Warranty of 1 Year Available for Mobile and 6 Months for Accessories'}",14999
"OPPO A9 2020 (Marine Green, 128 GB)  (4 GB RAM)",4.4,"2,227 Ratings",212 Reviews,"{'In The Box': 'Handset, Adapter, Headset, Micro USB Cable, Important Info. Booklet with Warranty Card, Quick Start Guide, Sim Card Tool, Protective Film, Pre-applied, Case', 'Model Number': 'CPH1937', 'Model Name': 'A9 2020', 'Color': 'Marine Green', 'Browse Type': 'Smartphones', 'SIM Type': 'Dual Sim', 'Hybrid Sim Slot': 'No', 'Touchscreen': 'Yes', 'OTG Compatible': 'Yes', 'Sound Enhancements': 'Dolby Atmos and Dual Stereo Speakers', 'Display Size': '16.51 cm (6.5 inch)', 'Resolution': '1600 x 720 Pixels', 'GPU': 'Adreno 610', 'Display Type': 'TFT-LCD', 'Display Colors': '16M', 'Other Display Features': 'Touch Panel Technology: In-cell, Narrow Frame - Upper Border: 2.44mm, Left and Right Border: 1.98mm, Lower Border: 6.6mm, Screen Ratio: 89.0%, Screen Contrast: 1500:1, Color Saturation: Typical 71%, Maximum Brightness: 480nits, Touch Panel Glass Type: GG3+, TYPE-C USB 2.0', 'Operating System': 'Android Pie 9', 'Processor Type': 'Qualcomm SM6125', 'Processor Core': 'Octa Core', 'Primary Clock Speed': '1.8 GHz', 'Secondary Clock Speed': '2 GHz', 'Internal Storage': '128 GB', 'RAM': '4 GB', 'Memory Card Slot Type': 'Dedicated Slot', 'Primary Camera Available': 'Yes', 'Primary Camera': '48MP + 8MP + 2MP + 2MP', 'Primary Camera Features': 'Ultra Wide Quad Camera, Sensor Type: 48MP CMOS/S5KGM1SP/OV48B, 8MP COMS/Hi846/OV8856, 2MP CMOS/OV02A1B/GC02M0, 2MP CMOS/GC02M0/OV02A1B, Maximum Zoom Multiples: 10X, Aperture: 48MP (f/1.8) + 8MP (f/2.25) + 2MP (f/2.4) + 2MP (f/2.4), Focal Length: 48MP (4.71mm) + 8MP (1.66mm) + 2MP (1.77mm) + 2MP (f1.77mm), Lens Number: 48MP (6P) + 8MP (5P) + 2MP (3P) + 2MP (3P)', 'Secondary Camera Available': 'Yes', 'Secondary Camera': '16MP Front Camera', 'Secondary Camera Features': 'Sensor Sizes/Pixel Data - 1/3.1inch, 1.0micrometer, Sensor Type: S5K3P9SP04, Wide Angle of Front: 79Degree, Aperture: F2.0, Focal Length: 3.42mm, Lens Number: 5P', 'Flash': 'Rear LED Flash', 'Frame Rate': 'Front Camera Video: 1080P/720P at 30 fps', 'Dual Camera Lens': 'Primary Camera', 'Network Type': '4G VOLTE, 4G, 3G, 2G', 'Supported Networks': '4G VoLTE, UMTS, GSM, 4G LTE, WCDMA, CDMA', 'Internet Connectivity': '4G, 3G, Wi-Fi, EDGE, GPRS', '3G Speed': 'HSPA+', 'GPRS': 'Yes', 'Micro USB Port': 'Yes', 'Micro USB Version': '2', 'Bluetooth Support': 'Yes', 'Bluetooth Version': 'v5.0', 'Wi-Fi': 'Yes', 'Wi-Fi Version': '802.11a/b/g/n/ac', 'USB Connectivity': 'Yes', 'EDGE': 'Yes', 'Audio Jack': '3.5mm', 'Smartphone': 'Yes', 'Touchscreen Type': 'Capacitive Screen, Multi-touch', 'SIM Size': 'Dual Nano SIM', 'User Interface': 'ColorOS 6.0.1', 'Removable Battery': 'No', 'Graphics PPI': '269 PPI', 'Ringtones Format': 'MP3/AMR/APE/OGG/FLAC/WAV/MIDI/WMA', 'Other Features': 'Face Recognition, Split Screen (Specific Apps), Clone Apps, Night Shield, Sensor Hub, Game Acceleration (Specific Apps), CPU Technology - 11nm, ROM Technology: UFS 2.1, Energy Density - 696 Wh/L, Charge Speed/Power - 5V 2A, 10W, WLAN 2.4G, WLAN 5.1G, WLAN 5.8G, WLAN Display, Game Boost 2.0, 4G+, 64 bits Processor, Video Stability, Ultra Night Mode 2.0, Reverse Charging', 'FM Radio': 'Yes', 'Audio Formats': 'MP3/AAC/APE/AMR/WAV/MID/OGG/FLAC/WMA', 'Video Formats': 'AVI/3GP/MP4/WMV/MKV/MOV/ASF/FLV', 'Battery Capacity': '5000 mAh', 'Width': '75.6 mm', 'Height': '163.6 mm', 'Depth': '9.1 mm', 'Weight': '195 g', 'Warranty Summary': 'Brand Warranty of 1 Year Available for Mobile and 6 Months for Accessories'}",14990
"ITEL A46 (DARK WATER, 32 GB)  (2 GB RAM)",4.1,320 Ratings,37 Reviews,"{'In The Box': 'Mobile, Battery, Charger, User Manual', 'Model Number': 'A46', 'Model Name': 'A46', 'Color': 'DARK WATER', 'Browse Type': 'Smartphones', 'SIM Type': 'Dual Sim', 'Hybrid Sim Slot': 'No', 'Touchscreen': 'Yes', 'OTG Compatible': 'No', 'Additional Content': 'Mobile, Battery, Charger, User Manual', 'Display Size': '13.84 cm (5.45 inch)', 'Resolution': '720 X 1440$$pixel', 'Resolution Type': 'Full HD', 'Operating System': 'Android Pie 9', 'Processor Core': 'Octa Core', 'Primary Clock Speed': '1.6 GHz', 'Internal Storage': '32 GB', 'RAM': '2 GB', 'Memory Card Slot Type': 'Dedicated Slot', 'Primary Camera Available': 'Yes', 'Primary Camera': '8MP Rear Camera', 'Secondary Camera Available': 'Yes', 'Call Wait/Hold': 'Yes', 'Conference Call': 'Yes', 'Hands Free': 'Yes', 'Video Call Support': 'Yes', 'Call Divert': 'Yes', 'Speaker Phone': 'Yes', 'Network Type': '4G VOLTE, 3G', 'Supported Networks': '4G VoLTE, GSM', 'Smartphone': 'Yes', 'Touchscreen Type': 'HD IPS', 'Keypad Type': 'Alphanumeric', 'Social Networking Phone': 'Yes', 'Instant Message': 'Yes', 'Business Phone': 'Yes', 'Removable Battery': 'No', 'MMS': 'Yes', 'SMS': 'Yes', 'Voice Input': 'Yes', 'Predictive Text Input': 'Yes', 'Supported Languages': 'multi language support', 'Battery Capacity': '2400 mAh', 'Warranty Summary': '1 Year', 'Covered in Warranty': 'Manufacturing Defects only', 'Not Covered in Warranty': 'Water or physcial damage'}",4680
